13:30:01.282661 ARP, Request who-has 192.168.15.2 tell 192.168.15.128, length 46
13:30:01.283193 ARP, Reply 192.168.15.2 is-at 00:50:56:e8:23:fc (oui Unknown), length 46
13:30:01.286197 IP 192.168.15.128 > 8.8.8.8: ICMP echo request, id 13086, seq 1, length 64
13:30:01.341585 IP 8.8.8.8 > 192.168.15.128: ICMP echo reply, id 13086, seq 1, length 64
13:30:02.281165 IP 192.168.15.128 > 8.8.8.8: ICMP echo request, id 13086, seq 2, length 64
13:30:02.313201 IP 8.8.8.8 > 192.168.15.128: ICMP echo reply, id 13086, seq 2, length 64
13:30:03.290354 IP 192.168.15.128 > 8.8.8.8: ICMP echo request, id 13086, seq 3, length 64
13:30:03.317598 IP 192.168.15.130.netbios-ns > 192.168.15.2.netbios-ns: NBT UDP PACKET(137): QUERY; REQUEST; UNICAST
13:30:03.339508 IP 8.8.8.8 > 192.168.15.128: ICMP echo reply, id 13086, seq 3, length 64
13:30:04.299564 IP 192.168.15.128 > 8.8.8.8: ICMP echo request, id 13086, seq 4, length 64
13:30:04.336425 IP 8.8.8.8 > 192.168.15.128: ICMP echo reply, id 13086, seq 4, length 64
13:30:04.814698 IP 192.168.15.130.netbios-ns > 192.168.15.2.netbios-ns: NBT UDP PACKET(137): QUERY; REQUEST; UNICAST
13:30:05.309452 IP 192.168.15.128 > 8.8.8.8: ICMP echo request, id 13086, seq 5, length 64
13:30:05.448717 IP 8.8.8.8 > 192.168.15.128: ICMP echo reply, id 13086, seq 5, length 64
13:30:06.314070 IP 192.168.15.130.netbios-ns > 192.168.15.2.netbios-ns: NBT UDP PACKET(137): QUERY; REQUEST; UNICAST
13:30:06.318958 IP 192.168.15.128 > 8.8.8.8: ICMP echo request, id 13086, seq 6, length 64
13:30:06.457408 IP 8.8.8.8 > 192.168.15.128: ICMP echo reply, id 13086, seq 6, length 64
13:30:07.328167 IP 192.168.15.128 > 8.8.8.8: ICMP echo request, id 13086, seq 7, length 64
13:30:07.417845 IP 8.8.8.8 > 192.168.15.128: ICMP echo reply, id 13086, seq 7, length 64
13:30:07.845700 IP 192.168.15.130.netbios-ns > 192.168.15.255.netbios-ns: NBT UDP PACKET(137): QUERY; REQUEST; BROADCAST
13:30:07.853885 ARP, Request who-has 192.168.15.130 tell 192.168.15.128, length 46
13:30:07.854642 ARP, Reply 192.168.15.130 is-at 00:0c:29:66:2d:38 (oui Unknown), length 46
13:30:07.855303 IP 192.168.15.128.netbios-ns > 192.168.15.130.netbios-ns: NBT UDP PACKET(137): QUERY; POSITIVE; RESPONSE; UNICAST
13:30:07.856319 IP 192.168.15.130.1100 > 192.168.15.128.netbios-ssn: Flags [S], seq 3400006377, win 16384, options [mss 1460,nop,nop,sackOK], length 0
13:30:07.857022 IP 192.168.15.128.netbios-ssn > 192.168.15.130.1100: Flags [S.], seq 2078501094, ack 3400006378, win 5840, options [mss 1460,nop,nop,sackOK], length 0
13:30:07.857797 IP 192.168.15.130.1100 > 192.168.15.128.netbios-ssn: Flags [P.], seq 1:73, ack 1, win 17520, length 72 NBT Session Packet: Session Request
13:30:07.858431 IP 192.168.15.128.netbios-ssn > 192.168.15.130.1100: Flags [.], ack 73, win 5840, length 0
13:30:07.859856 IP 192.168.15.128.netbios-ssn > 192.168.15.130.1100: Flags [P.], seq 1:5, ack 73, win 5840, length 4 NBT Session Packet: Session Granted
13:30:07.861297 IP 192.168.15.130.1100 > 192.168.15.128.netbios-ssn: Flags [P.], seq 73:210, ack 5, win 17516, length 137 NBT Session Packet: Session Message
13:30:07.862217 IP 192.168.15.128.netbios-ssn > 192.168.15.130.1100: Flags [P.], seq 5:136, ack 210, win 6432, length 131 NBT Session Packet: Session Message
13:30:07.864885 IP 192.168.15.130.1100 > 192.168.15.128.netbios-ssn: Flags [P.], seq 210:436, ack 136, win 17385, length 226 NBT Session Packet: Session Message
13:30:07.866366 IP 192.168.15.128.netbios-ssn > 192.168.15.130.1100: Flags [P.], seq 136:510, ack 436, win 7504, length 374 NBT Session Packet: Session Message
13:30:07.867753 IP 192.168.15.130.1100 > 192.168.15.128.netbios-ssn: Flags [P.], seq 436:690, ack 510, win 17011, length 254 NBT Session Packet: Session Message
13:30:07.868804 IP 192.168.15.128.netbios-ssn > 192.168.15.130.1100: Flags [P.], seq 510:636, ack 690, win 8576, length 126 NBT Session Packet: Session Message
13:30:07.870769 IP 192.168.15.130.1100 > 192.168.15.128.netbios-ssn: Flags [P.], seq 690:788, ack 636, win 16885, length 98 NBT Session Packet: Session Message
13:30:07.871739 IP 192.168.15.128.netbios-ssn > 192.168.15.130.1100: Flags [P.], seq 636:688, ack 788, win 8576, length 52 NBT Session Packet: Session Message
13:30:07.872850 IP 192.168.15.130.1100 > 192.168.15.128.netbios-ssn: Flags [P.], seq 788:910, ack 688, win 16833, length 122 NBT Session Packet: Session Message
13:30:07.874218 IP 192.168.15.128.netbios-ssn > 192.168.15.130.1100: Flags [P.], seq 688:826, ack 910, win 8576, length 138 NBT Session Packet: Session Message
13:30:07.875656 IP 192.168.15.130.1100 > 192.168.15.128.netbios-ssn: Flags [P.], seq 910:953, ack 826, win 16695, length 43 NBT Session Packet: Session Message
13:30:07.876180 IP 192.168.15.128.netbios-ssn > 192.168.15.130.1100: Flags [P.], seq 826:869, ack 953, win 8576, length 43 NBT Session Packet: Session Message
13:30:07.877177 IP 192.168.15.130.1100 > 192.168.15.128.netbios-ssn: Flags [P.], seq 953:992, ack 869, win 16652, length 39 NBT Session Packet: Session Message
13:30:07.878073 IP 192.168.15.128.netbios-ssn > 192.168.15.130.1100: Flags [P.], seq 869:908, ack 992, win 8576, length 39 NBT Session Packet: Session Message
13:30:07.879604 IP 192.168.15.130.1100 > 192.168.15.128.netbios-ssn: Flags [F.], seq 992, ack 908, win 16613, length 0
13:30:07.884722 IP 192.168.15.128.netbios-ssn > 192.168.15.130.1100: Flags [F.], seq 908, ack 993, win 8576, length 0
13:30:07.885347 IP 192.168.15.130.1100 > 192.168.15.128.netbios-ssn: Flags [.], ack 909, win 16613, length 0
13:30:08.337923 IP 192.168.15.128 > 8.8.8.8: ICMP echo request, id 13086, seq 8, length 64
13:30:08.369281 IP 8.8.8.8 > 192.168.15.128: ICMP echo reply, id 13086, seq 8, length 64
13:30:09.347600 IP 192.168.15.128 > 8.8.8.8: ICMP echo request, id 13086, seq 9, length 64
13:30:09.380680 IP 8.8.8.8 > 192.168.15.128: ICMP echo reply, id 13086, seq 9, length 64
13:30:10.357710 IP 192.168.15.128 > 8.8.8.8: ICMP echo request, id 13086, seq 10, length 64
13:30:10.389429 IP 8.8.8.8 > 192.168.15.128: ICMP echo reply, id 13086, seq 10, length 64
13:30:11.367808 IP 192.168.15.128 > 8.8.8.8: ICMP echo request, id 13086, seq 11, length 64
13:30:11.401316 IP 8.8.8.8 > 192.168.15.128: ICMP echo reply, id 13086, seq 11, length 64
13:30:12.387031 IP 192.168.15.128 > 8.8.8.8: ICMP echo request, id 13086, seq 12, length 64
13:30:12.452681 IP 8.8.8.8 > 192.168.15.128: ICMP echo reply, id 13086, seq 12, length 64
13:30:13.406379 IP 192.168.15.128 > 8.8.8.8: ICMP echo request, id 13086, seq 13, length 64
13:30:13.571706 IP 8.8.8.8 > 192.168.15.128: ICMP echo reply, id 13086, seq 13, length 64
13:30:14.417043 IP 192.168.15.128 > 8.8.8.8: ICMP echo request, id 13086, seq 14, length 64
13:30:14.570996 IP 8.8.8.8 > 192.168.15.128: ICMP echo reply, id 13086, seq 14, length 64
13:30:15.426544 IP 192.168.15.128 > 8.8.8.8: ICMP echo request, id 13086, seq 15, length 64
13:30:15.569378 IP 8.8.8.8 > 192.168.15.128: ICMP echo reply, id 13086, seq 15, length 64
13:30:16.063804 ARP, Request who-has 192.168.15.128 (Broadcast) tell 192.168.15.129, length 46
13:30:16.064364 ARP, Reply 192.168.15.128 is-at 00:0c:29:a1:c5:30 (oui Unknown), length 46
13:30:16.265255 IP 192.168.15.129.40507 > 192.168.15.2.domain: 19045+ PTR? 128.15.168.192.in-addr.arpa. (45)
13:30:16.323969 IP 192.168.15.2.domain > 192.168.15.129.40507: 19045 NXDomain 0/0/0 (45)
13:30:16.325936 IP 192.168.15.129.50349 > 192.168.15.128.mysql: Flags [S], seq 897118110, win 1024, options [mss 1460], length 0
13:30:16.325962 IP 192.168.15.129.50349 > 192.168.15.128.3389: Flags [S], seq 897118110, win 1024, options [mss 1460], length 0
13:30:16.326118 IP 192.168.15.129.50349 > 192.168.15.128.telnet: Flags [S], seq 897118110, win 1024, options [mss 1460], length 0
13:30:16.326175 IP 192.168.15.129.50349 > 192.168.15.128.1025: Flags [S], seq 897118110, win 1024, options [mss 1460], length 0
13:30:16.326412 IP 192.168.15.129.50349 > 192.168.15.128.ftp: Flags [S], seq 897118110, win 1024, options [mss 1460], length 0
13:30:16.326616 IP 192.168.15.129.50349 > 192.168.15.128.1720: Flags [S], seq 897118110, win 1024, options [mss 1460], length 0
13:30:16.326785 IP 192.168.15.129.50349 > 192.168.15.128.pop3: Flags [S], seq 897118110, win 1024, options [mss 1460], length 0
13:30:16.326855 IP 192.168.15.129.50349 > 192.168.15.128.domain: Flags [S], seq 897118110, win 1024, options [mss 1460], length 0
13:30:16.326918 IP 192.168.15.129.50349 > 192.168.15.128.https: Flags [S], seq 897118110, win 1024, options [mss 1460], length 0
13:30:16.326975 IP 192.168.15.129.50349 > 192.168.15.128.1723: Flags [S], seq 897118110, win 1024, options [mss 1460], length 0
13:30:16.327080 IP 192.168.15.128.mysql > 192.168.15.129.50349: Flags [S.], seq 2206030914, ack 897118111, win 5840, options [mss 1460], length 0
13:30:16.327091 IP 192.168.15.128.ftp > 192.168.15.129.50349: Flags [S.], seq 2214360582, ack 897118111, win 5840, options [mss 1460], length 0
13:30:16.327095 IP 192.168.15.128.1720 > 192.168.15.129.50349: Flags [R.], seq 0, ack 897118111, win 0, length 0
13:30:16.327098 IP 192.168.15.128.pop3 > 192.168.15.129.50349: Flags [R.], seq 0, ack 897118111, win 0, length 0
13:30:16.327254 IP 192.168.15.128.domain > 192.168.15.129.50349: Flags [S.], seq 2212305096, ack 897118111, win 5840, options [mss 1460], length 0
13:30:16.327262 IP 192.168.15.128.https > 192.168.15.129.50349: Flags [R.], seq 0, ack 897118111, win 0, length 0
13:30:16.327427 IP 192.168.15.128.1723 > 192.168.15.129.50349: Flags [R.], seq 0, ack 897118111, win 0, length 0
13:30:16.327437 IP 192.168.15.128.3389 > 192.168.15.129.50349: Flags [R.], seq 0, ack 897118111, win 0, length 0
13:30:16.328011 IP 192.168.15.128.telnet > 192.168.15.129.50349: Flags [S.], seq 2210808652, ack 897118111, win 5840, options [mss 1460], length 0
13:30:16.328092 IP 192.168.15.128.1025 > 192.168.15.129.50349: Flags [R.], seq 0, ack 897118111, win 0, length 0
13:30:16.328163 IP 192.168.15.129.50349 > 192.168.15.128.mysql: Flags [R], seq 897118111, win 0, length 0
13:30:16.328297 IP 192.168.15.129.50349 > 192.168.15.128.ftp: Flags [R], seq 897118111, win 0, length 0
13:30:16.328378 IP 192.168.15.129.50349 > 192.168.15.128.telnet: Flags [R], seq 897118111, win 0, length 0
13:30:16.329116 IP 192.168.15.129.50349 > 192.168.15.128.domain: Flags [R], seq 897118111, win 0, length 0
13:30:16.435546 IP 192.168.15.128 > 8.8.8.8: ICMP echo request, id 13086, seq 16, length 64
13:30:16.467970 IP 8.8.8.8 > 192.168.15.128: ICMP echo reply, id 13086, seq 16, length 64
13:30:17.429320 IP 192.168.15.129.50350 > 192.168.15.128.3389: Flags [S], seq 897183647, win 1024, options [mss 1460], length 0
13:30:17.429482 IP 192.168.15.129.50349 > 192.168.15.128.loc-srv: Flags [S], seq 897118110, win 1024, options [mss 1460], length 0
13:30:17.429558 IP 192.168.15.129.50349 > 192.168.15.128.rtsp: Flags [S], seq 897118110, win 1024, options [mss 1460], length 0
13:30:17.429615 IP 192.168.15.129.50349 > 192.168.15.128.sunrpc: Flags [S], seq 897118110, win 1024, options [mss 1460], length 0
13:30:17.429684 IP 192.168.15.129.50349 > 192.168.15.128.ssh: Flags [S], seq 897118110, win 1024, options [mss 1460], length 0
13:30:17.429967 IP 192.168.15.128.3389 > 192.168.15.129.50350: Flags [R.], seq 0, ack 897183648, win 0, length 0
13:30:17.430098 IP 192.168.15.128.loc-srv > 192.168.15.129.50349: Flags [R.], seq 0, ack 897118111, win 0, length 0
13:30:17.430162 IP 192.168.15.128.rtsp > 192.168.15.129.50349: Flags [R.], seq 0, ack 897118111, win 0, length 0
13:30:17.430215 IP 192.168.15.128.sunrpc > 192.168.15.129.50349: Flags [S.], seq 2221884572, ack 897118111, win 5840, options [mss 1460], length 0
13:30:17.430315 IP 192.168.15.129.50349 > 192.168.15.128.auth: Flags [S], seq 897118110, win 1024, options [mss 1460], length 0
13:30:17.430373 IP 192.168.15.129.50349 > 192.168.15.128.microsoft-ds: Flags [S], seq 897118110, win 1024, options [mss 1460], length 0
13:30:17.430461 IP 192.168.15.128.ssh > 192.168.15.129.50349: Flags [S.], seq 2231667668, ack 897118111, win 5840, options [mss 1460], length 0
13:30:17.430556 IP 192.168.15.129.50349 > 192.168.15.128.sunrpc: Flags [R], seq 897118111, win 0, length 0
13:30:17.430648 IP 192.168.15.128.auth > 192.168.15.129.50349: Flags [R.], seq 0, ack 897118111, win 0, length 0
13:30:17.430759 IP 192.168.15.128.microsoft-ds > 192.168.15.129.50349: Flags [S.], seq 2224727683, ack 897118111, win 5840, options [mss 1460], length 0
13:30:17.430848 IP 192.168.15.129.50349 > 192.168.15.128.ssh: Flags [R], seq 897118111, win 0, length 0
13:30:17.431049 IP 192.168.15.129.50349 > 192.168.15.128.microsoft-ds: Flags [R], seq 897118111, win 0, length 0
13:30:17.431294 IP 192.168.15.129.50349 > 192.168.15.128.imap2: Flags [S], seq 897118110, win 1024, options [mss 1460], length 0
13:30:17.431520 IP 192.168.15.129.50349 > 192.168.15.128.smtp: Flags [S], seq 897118110, win 1024, options [mss 1460], length 0
13:30:17.431613 IP 192.168.15.128.imap2 > 192.168.15.129.50349: Flags [R.], seq 0, ack 897118111, win 0, length 0
13:30:17.431728 IP 192.168.15.129.50349 > 192.168.15.128.smux: Flags [S], seq 897118110, win 1024, options [mss 1460], length 0
13:30:17.431804 IP 192.168.15.128.smtp > 192.168.15.129.50349: Flags [S.], seq 2230714142, ack 897118111, win 5840, options [mss 1460], length 0
13:30:17.432168 IP 192.168.15.128.smux > 192.168.15.129.50349: Flags [R.], seq 0, ack 897118111, win 0, length 0
13:30:17.432281 IP 192.168.15.129.50349 > 192.168.15.128.smtp: Flags [R], seq 897118111, win 0, length 0
13:30:17.432362 IP 192.168.15.129.50349 > 192.168.15.128.http-alt: Flags [S], seq 897118110, win 1024, options [mss 1460], length 0
13:30:17.432417 IP 192.168.15.129.50349 > 192.168.15.128.imaps: Flags [S], seq 897118110, win 1024, options [mss 1460], length 0
13:30:17.432479 IP 192.168.15.129.50349 > 192.168.15.128.netbios-ssn: Flags [S], seq 897118110, win 1024, options [mss 1460], length 0
13:30:17.432861 IP 192.168.15.128.http-alt > 192.168.15.129.50349: Flags [R.], seq 0, ack 897118111, win 0, length 0
13:30:17.432962 IP 192.168.15.128.imaps > 192.168.15.129.50349: Flags [R.], seq 0, ack 897118111, win 0, length 0
13:30:17.433021 IP 192.168.15.128.netbios-ssn > 192.168.15.129.50349: Flags [S.], seq 2221838291, ack 897118111, win 5840, options [mss 1460], length 0
13:30:17.433173 IP 192.168.15.129.50349 > 192.168.15.128.http: Flags [S], seq 897118110, win 1024, options [mss 1460], length 0
13:30:17.433232 IP 192.168.15.129.50349 > 192.168.15.128.8888: Flags [S], seq 897118110, win 1024, options [mss 1460], length 0
13:30:17.433285 IP 192.168.15.129.50349 > 192.168.15.128.pop3s: Flags [S], seq 897118110, win 1024, options [mss 1460], length 0
13:30:17.433342 IP 192.168.15.129.50349 > 192.168.15.128.netbios-ssn: Flags [R], seq 897118111, win 0, length 0
13:30:17.433796 IP 192.168.15.128.http > 192.168.15.129.50349: Flags [S.], seq 2230658974, ack 897118111, win 5840, options [mss 1460], length 0
13:30:17.433891 IP 192.168.15.128.8888 > 192.168.15.129.50349: Flags [R.], seq 0, ack 897118111, win 0, length 0
13:30:17.433948 IP 192.168.15.128.pop3s > 192.168.15.129.50349: Flags [R.], seq 0, ack 897118111, win 0, length 0
13:30:17.434040 IP 192.168.15.129.50349 > 192.168.15.128.5900: Flags [S], seq 897118110, win 1024, options [mss 1460], length 0
13:30:17.434386 IP 192.168.15.129.50349 > 192.168.15.128.submission: Flags [S], seq 897118110, win 1024, options [mss 1460], length 0
13:30:17.434459 IP 192.168.15.129.50349 > 192.168.15.128.3000: Flags [S], seq 897118110, win 1024, options [mss 1460], length 0
13:30:17.434514 IP 192.168.15.129.50349 > 192.168.15.128.8000: Flags [S], seq 897118110, win 1024, options [mss 1460], length 0
13:30:17.434585 IP 192.168.15.129.50349 > 192.168.15.128.http: Flags [R], seq 897118111, win 0, length 0
13:30:17.434691 IP 192.168.15.128.5900 > 192.168.15.129.50349: Flags [S.], seq 2220925118, ack 897118111, win 5840, options [mss 1460], length 0
13:30:17.434796 IP 192.168.15.129.50349 > 192.168.15.128.kshell: Flags [S], seq 897118110, win 1024, options [mss 1460], length 0
13:30:17.434890 IP 192.168.15.128.submission > 192.168.15.129.50349: Flags [R.], seq 0, ack 897118111, win 0, length 0
13:30:17.434947 IP 192.168.15.128.3000 > 192.168.15.129.50349: Flags [R.], seq 0, ack 897118111, win 0, length 0
13:30:17.435001 IP 192.168.15.128.8000 > 192.168.15.129.50349: Flags [R.], seq 0, ack 897118111, win 0, length 0
13:30:17.435117 IP 192.168.15.128.kshell > 192.168.15.129.50349: Flags [R.], seq 0, ack 897118111, win 0, length 0
13:30:17.435211 IP 192.168.15.129.50349 > 192.168.15.128.5900: Flags [R], seq 897118111, win 0, length 0
13:30:17.437640 IP 192.168.15.129.50349 > 192.168.15.128.32768: Flags [S], seq 897118110, win 1024, options [mss 1460], length 0
13:30:17.437749 IP 192.168.15.129.50349 > 192.168.15.128.ftps: Flags [S], seq 897118110, win 1024, options [mss 1460], length 0
13:30:17.437831 IP 192.168.15.129.50349 > 192.168.15.128.81: Flags [S], seq 897118110, win 1024, options [mss 1460], length 0
13:30:17.437892 IP 192.168.15.129.50349 > 192.168.15.128.printer: Flags [S], seq 897118110, win 1024, options [mss 1460], length 0
13:30:17.437946 IP 192.168.15.129.50349 > 192.168.15.128.rsync: Flags [S], seq 897118110, win 1024, options [mss 1460], length 0
13:30:17.438003 IP 192.168.15.129.50349 > 192.168.15.128.9999: Flags [S], seq 897118110, win 1024, options [mss 1460], length 0
13:30:17.438167 IP 192.168.15.128.32768 > 192.168.15.129.50349: Flags [R.], seq 0, ack 897118111, win 0, length 0
13:30:17.438300 IP 192.168.15.128.ftps > 192.168.15.129.50349: Flags [R.], seq 0, ack 897118111, win 0, length 0
13:30:17.438381 IP 192.168.15.128.81 > 192.168.15.129.50349: Flags [R.], seq 0, ack 897118111, win 0, length 0
13:30:17.438435 IP 192.168.15.128.printer > 192.168.15.129.50349: Flags [R.], seq 0, ack 897118111, win 0, length 0
13:30:17.438563 IP 192.168.15.128.rsync > 192.168.15.129.50349: Flags [R.], seq 0, ack 897118111, win 0, length 0
13:30:17.438621 IP 192.168.15.128.9999 > 192.168.15.129.50349: Flags [R.], seq 0, ack 897118111, win 0, length 0
13:30:17.439050 IP 192.168.15.129.50349 > 192.168.15.128.5357: Flags [S], seq 897118110, win 1024, options [mss 1460], length 0
13:30:17.439237 IP 192.168.15.129.50349 > 192.168.15.128.3986: Flags [S], seq 897118110, win 1024, options [mss 1460], length 0
13:30:17.439652 IP 192.168.15.128.5357 > 192.168.15.129.50349: Flags [R.], seq 0, ack 897118111, win 0, length 0
13:30:17.439767 IP 192.168.15.128.3986 > 192.168.15.129.50349: Flags [R.], seq 0, ack 897118111, win 0, length 0
13:30:17.445861 IP 192.168.15.128 > 8.8.8.8: ICMP echo request, id 13086, seq 17, length 64
13:30:17.481836 IP 8.8.8.8 > 192.168.15.128: ICMP echo reply, id 13086, seq 17, length 64
13:30:17.529981 IP 192.168.15.129.50349 > 192.168.15.128.snpp: Flags [S], seq 897118110, win 1024, options [mss 1460], length 0
13:30:17.530156 IP 192.168.15.129.50349 > 192.168.15.128.49154: Flags [S], seq 897118110, win 1024, options [mss 1460], length 0
13:30:17.530524 IP 192.168.15.128.snpp > 192.168.15.129.50349: Flags [R.], seq 0, ack 897118111, win 0, length 0
13:30:17.530641 IP 192.168.15.128.49154 > 192.168.15.129.50349: Flags [R.], seq 0, ack 897118111, win 0, length 0
13:30:17.530902 IP 192.168.15.129.50349 > 192.168.15.128.time: Flags [S], seq 897118110, win 1024, options [mss 1460], length 0
13:30:17.531189 IP 192.168.15.129.50349 > 192.168.15.128.svrloc: Flags [S], seq 897118110, win 1024, options [mss 1460], length 0
13:30:17.531313 IP 192.168.15.128.time > 192.168.15.129.50349: Flags [R.], seq 0, ack 897118111, win 0, length 0
13:30:17.531413 IP 192.168.15.129.50349 > 192.168.15.128.9100: Flags [S], seq 897118110, win 1024, options [mss 1460], length 0
13:30:17.531507 IP 192.168.15.128.svrloc > 192.168.15.129.50349: Flags [R.], seq 0, ack 897118111, win 0, length 0
13:30:17.531835 IP 192.168.15.128.9100 > 192.168.15.129.50349: Flags [R.], seq 0, ack 897118111, win 0, length 0
13:30:17.531947 IP 192.168.15.129.50349 > 192.168.15.128.x11: Flags [S], seq 897118110, win 1024, options [mss 1460], length 0
13:30:17.532029 IP 192.168.15.129.50349 > 192.168.15.128.7070: Flags [S], seq 897118110, win 1024, options [mss 1460], length 0
13:30:17.532106 IP 192.168.15.129.50349 > 192.168.15.128.2717: Flags [S], seq 897118110, win 1024, options [mss 1460], length 0
13:30:17.532202 IP 192.168.15.129.50349 > 192.168.15.128.1026: Flags [S], seq 897118110, win 1024, options [mss 1460], length 0
13:30:17.532583 IP 192.168.15.128.x11 > 192.168.15.129.50349: Flags [S.], seq 2226529371, ack 897118111, win 5840, options [mss 1460], length 0
13:30:17.532667 IP 192.168.15.128.7070 > 192.168.15.129.50349: Flags [R.], seq 0, ack 897118111, win 0, length 0
13:30:17.532771 IP 192.168.15.128.2717 > 192.168.15.129.50349: Flags [R.], seq 0, ack 897118111, win 0, length 0
13:30:17.532840 IP 192.168.15.128.1026 > 192.168.15.129.50349: Flags [R.], seq 0, ack 897118111, win 0, length 0
13:30:17.532937 IP 192.168.15.129.50349 > 192.168.15.128.8008: Flags [S], seq 897118110, win 1024, options [mss 1460], length 0
13:30:17.533112 IP 192.168.15.129.50349 > 192.168.15.128.x11: Flags [R], seq 897118111, win 0, length 0
13:30:17.533373 IP 192.168.15.128.8008 > 192.168.15.129.50349: Flags [R.], seq 0, ack 897118111, win 0, length 0
13:30:17.533788 IP 192.168.15.129.50349 > 192.168.15.128.afpovertcp: Flags [S], seq 897118110, win 1024, options [mss 1460], length 0
13:30:17.533895 IP 192.168.15.129.50349 > 192.168.15.128.49156: Flags [S], seq 897118110, win 1024, options [mss 1460], length 0
13:30:17.533952 IP 192.168.15.129.50349 > 192.168.15.128.klogin: Flags [S], seq 897118110, win 1024, options [mss 1460], length 0
13:30:17.534310 IP 192.168.15.128.afpovertcp > 192.168.15.129.50349: Flags [R.], seq 0, ack 897118111, win 0, length 0
13:30:17.534486 IP 192.168.15.128.49156 > 192.168.15.129.50349: Flags [R.], seq 0, ack 897118111, win 0, length 0
13:30:17.534555 IP 192.168.15.128.klogin > 192.168.15.129.50349: Flags [R.], seq 0, ack 897118111, win 0, length 0
13:30:17.534804 IP 192.168.15.129.50349 > 192.168.15.128.49152: Flags [S], seq 897118110, win 1024, options [mss 1460], length 0
13:30:17.534887 IP 192.168.15.129.50349 > 192.168.15.128.646: Flags [S], seq 897118110, win 1024, options [mss 1460], length 0
13:30:17.535229 IP 192.168.15.128.49152 > 192.168.15.129.50349: Flags [R.], seq 0, ack 897118111, win 0, length 0
13:30:17.535356 IP 192.168.15.128.646 > 192.168.15.129.50349: Flags [R.], seq 0, ack 897118111, win 0, length 0
13:30:17.535428 IP 192.168.15.129.50349 > 192.168.15.128.1900: Flags [S], seq 897118110, win 1024, options [mss 1460], length 0
13:30:17.535644 IP 192.168.15.129.50349 > 192.168.15.128.2001: Flags [S], seq 897118110, win 1024, options [mss 1460], length 0
13:30:17.535758 IP 192.168.15.128.1900 > 192.168.15.129.50349: Flags [R.], seq 0, ack 897118111, win 0, length 0
13:30:17.536263 IP 192.168.15.128.2001 > 192.168.15.129.50349: Flags [R.], seq 0, ack 897118111, win 0, length 0
13:30:17.536440 IP 192.168.15.129.50349 > 192.168.15.128.3128: Flags [S], seq 897118110, win 1024, options [mss 1460], length 0
13:30:17.536663 IP 192.168.15.129.50349 > 192.168.15.128.echo: Flags [S], seq 897118110, win 1024, options [mss 1460], length 0
13:30:17.537142 IP 192.168.15.128.3128 > 192.168.15.129.50349: Flags [R.], seq 0, ack 897118111, win 0, length 0
13:30:17.537220 IP 192.168.15.128.echo > 192.168.15.129.50349: Flags [R.], seq 0, ack 897118111, win 0, length 0
13:30:17.537301 IP 192.168.15.129.50349 > 192.168.15.128.ldap: Flags [S], seq 897118110, win 1024, options [mss 1460], length 0
13:30:17.537747 IP 192.168.15.128.ldap > 192.168.15.129.50349: Flags [R.], seq 0, ack 897118111, win 0, length 0
13:30:17.630844 IP 192.168.15.129.50350 > 192.168.15.128.time: Flags [S], seq 897183647, win 1024, options [mss 1460], length 0
13:30:17.631017 IP 192.168.15.129.50350 > 192.168.15.128.49154: Flags [S], seq 897183647, win 1024, options [mss 1460], length 0
13:30:17.631076 IP 192.168.15.129.50350 > 192.168.15.128.snpp: Flags [S], seq 897183647, win 1024, options [mss 1460], length 0
13:30:17.631489 IP 192.168.15.128.time > 192.168.15.129.50350: Flags [R.], seq 0, ack 897183648, win 0, length 0
13:30:17.631614 IP 192.168.15.128.49154 > 192.168.15.129.50350: Flags [R.], seq 0, ack 897183648, win 0, length 0
13:30:17.631672 IP 192.168.15.128.snpp > 192.168.15.129.50350: Flags [R.], seq 0, ack 897183648, win 0, length 0
13:30:17.633815 IP 192.168.15.129.50350 > 192.168.15.128.8008: Flags [S], seq 897183647, win 1024, options [mss 1460], length 0
13:30:17.633946 IP 192.168.15.129.50350 > 192.168.15.128.1026: Flags [S], seq 897183647, win 1024, options [mss 1460], length 0
13:30:17.634005 IP 192.168.15.129.50350 > 192.168.15.128.2717: Flags [S], seq 897183647, win 1024, options [mss 1460], length 0
13:30:17.634197 IP 192.168.15.129.50350 > 192.168.15.128.7070: Flags [S], seq 897183647, win 1024, options [mss 1460], length 0
13:30:17.634381 IP 192.168.15.129.50350 > 192.168.15.128.x11: Flags [S], seq 897183647, win 1024, options [mss 1460], length 0
13:30:17.634451 IP 192.168.15.129.50350 > 192.168.15.128.9100: Flags [S], seq 897183647, win 1024, options [mss 1460], length 0
13:30:17.634513 IP 192.168.15.129.50350 > 192.168.15.128.svrloc: Flags [S], seq 897183647, win 1024, options [mss 1460], length 0
13:30:17.634622 IP 192.168.15.128.8008 > 192.168.15.129.50350: Flags [R.], seq 0, ack 897183648, win 0, length 0
13:30:17.634683 IP 192.168.15.128.1026 > 192.168.15.129.50350: Flags [R.], seq 0, ack 897183648, win 0, length 0
13:30:17.634734 IP 192.168.15.128.2717 > 192.168.15.129.50350: Flags [R.], seq 0, ack 897183648, win 0, length 0
13:30:17.634848 IP 192.168.15.128.7070 > 192.168.15.129.50350: Flags [R.], seq 0, ack 897183648, win 0, length 0
13:30:17.634975 IP 192.168.15.128.x11 > 192.168.15.129.50350: Flags [S.], seq 2235908239, ack 897183648, win 5840, options [mss 1460], length 0
13:30:17.635043 IP 192.168.15.128.9100 > 192.168.15.129.50350: Flags [R.], seq 0, ack 897183648, win 0, length 0
13:30:17.635096 IP 192.168.15.128.svrloc > 192.168.15.129.50350: Flags [R.], seq 0, ack 897183648, win 0, length 0
13:30:17.635384 IP 192.168.15.129.50350 > 192.168.15.128.x11: Flags [R], seq 897183648, win 0, length 0
13:30:17.638186 IP 192.168.15.129.50350 > 192.168.15.128.ldap: Flags [S], seq 897183647, win 1024, options [mss 1460], length 0
13:30:17.638311 IP 192.168.15.129.50350 > 192.168.15.128.echo: Flags [S], seq 897183647, win 1024, options [mss 1460], length 0
13:30:17.638385 IP 192.168.15.129.50350 > 192.168.15.128.3128: Flags [S], seq 897183647, win 1024, options [mss 1460], length 0
13:30:17.638448 IP 192.168.15.129.50350 > 192.168.15.128.2001: Flags [S], seq 897183647, win 1024, options [mss 1460], length 0
13:30:17.638563 IP 192.168.15.129.50350 > 192.168.15.128.1900: Flags [S], seq 897183647, win 1024, options [mss 1460], length 0
13:30:17.638713 IP 192.168.15.129.50350 > 192.168.15.128.646: Flags [S], seq 897183647, win 1024, options [mss 1460], length 0
13:30:17.638791 IP 192.168.15.129.50350 > 192.168.15.128.49152: Flags [S], seq 897183647, win 1024, options [mss 1460], length 0
13:30:17.638846 IP 192.168.15.129.50350 > 192.168.15.128.klogin: Flags [S], seq 897183647, win 1024, options [mss 1460], length 0
13:30:17.638901 IP 192.168.15.129.50350 > 192.168.15.128.49156: Flags [S], seq 897183647, win 1024, options [mss 1460], length 0
13:30:17.638952 IP 192.168.15.129.50350 > 192.168.15.128.afpovertcp: Flags [S], seq 897183647, win 1024, options [mss 1460], length 0
13:30:17.639065 IP 192.168.15.128.ldap > 192.168.15.129.50350: Flags [R.], seq 0, ack 897183648, win 0, length 0
13:30:17.639312 IP 192.168.15.128.echo > 192.168.15.129.50350: Flags [R.], seq 0, ack 897183648, win 0, length 0
13:30:17.639399 IP 192.168.15.128.3128 > 192.168.15.129.50350: Flags [R.], seq 0, ack 897183648, win 0, length 0
13:30:17.639726 IP 192.168.15.128.2001 > 192.168.15.129.50350: Flags [R.], seq 0, ack 897183648, win 0, length 0
13:30:17.639852 IP 192.168.15.128.1900 > 192.168.15.129.50350: Flags [R.], seq 0, ack 897183648, win 0, length 0
13:30:17.639909 IP 192.168.15.128.646 > 192.168.15.129.50350: Flags [R.], seq 0, ack 897183648, win 0, length 0
13:30:17.639968 IP 192.168.15.128.49152 > 192.168.15.129.50350: Flags [R.], seq 0, ack 897183648, win 0, length 0
13:30:17.640026 IP 192.168.15.128.klogin > 192.168.15.129.50350: Flags [R.], seq 0, ack 897183648, win 0, length 0
13:30:17.640090 IP 192.168.15.128.49156 > 192.168.15.129.50350: Flags [R.], seq 0, ack 897183648, win 0, length 0
13:30:17.640177 IP 192.168.15.128.afpovertcp > 192.168.15.129.50350: Flags [R.], seq 0, ack 897183648, win 0, length 0
13:30:17.731289 IP 192.168.15.129.50349 > 192.168.15.128.postgresql: Flags [S], seq 897118110, win 1024, options [mss 1460], length 0
13:30:17.731416 IP 192.168.15.129.50349 > 192.168.15.128.ipp: Flags [S], seq 897118110, win 1024, options [mss 1460], length 0
13:30:17.731476 IP 192.168.15.129.50349 > 192.168.15.128.1110: Flags [S], seq 897118110, win 1024, options [mss 1460], length 0
13:30:17.731533 IP 192.168.15.129.50349 > 192.168.15.128.5009: Flags [S], seq 897118110, win 1024, options [mss 1460], length 0
13:30:17.731648 IP 192.168.15.129.50349 > 192.168.15.128.nrpe: Flags [S], seq 897118110, win 1024, options [mss 1460], length 0
13:30:17.731848 IP 192.168.15.129.50349 > 192.168.15.128.144: Flags [S], seq 897118110, win 1024, options [mss 1460], length 0
13:30:17.732028 IP 192.168.15.129.50349 > 192.168.15.128.aol: Flags [S], seq 897118110, win 1024, options [mss 1460], length 0
13:30:17.732146 IP 192.168.15.129.50349 > 192.168.15.128.bgp: Flags [S], seq 897118110, win 1024, options [mss 1460], length 0
13:30:17.732217 IP 192.168.15.129.50349 > 192.168.15.128.nfs: Flags [S], seq 897118110, win 1024, options [mss 1460], length 0
13:30:17.732392 IP 192.168.15.129.50349 > 192.168.15.128.6646: Flags [S], seq 897118110, win 1024, options [mss 1460], length 0
13:30:17.732465 IP 192.168.15.129.50349 > 192.168.15.128.1029: Flags [S], seq 897118110, win 1024, options [mss 1460], length 0
13:30:17.732527 IP 192.168.15.129.50349 > 192.168.15.128.1028: Flags [S], seq 897118110, win 1024, options [mss 1460], length 0
13:30:17.732581 IP 192.168.15.129.50349 > 192.168.15.128.cisco-sccp: Flags [S], seq 897118110, win 1024, options [mss 1460], length 0
13:30:17.732639 IP 192.168.15.129.50349 > 192.168.15.128.tproxy: Flags [S], seq 897118110, win 1024, options [mss 1460], length 0
13:30:17.732749 IP 192.168.15.128.postgresql > 192.168.15.129.50349: Flags [S.], seq 2235938745, ack 897118111, win 5840, options [mss 1460], length 0
13:30:17.732813 IP 192.168.15.128.ipp > 192.168.15.129.50349: Flags [R.], seq 0, ack 897118111, win 0, length 0
13:30:17.732866 IP 192.168.15.128.1110 > 192.168.15.129.50349: Flags [R.], seq 0, ack 897118111, win 0, length 0
13:30:17.732973 IP 192.168.15.128.5009 > 192.168.15.129.50349: Flags [R.], seq 0, ack 897118111, win 0, length 0
13:30:17.733188 IP 192.168.15.128.nrpe > 192.168.15.129.50349: Flags [R.], seq 0, ack 897118111, win 0, length 0
13:30:17.733312 IP 192.168.15.128.144 > 192.168.15.129.50349: Flags [R.], seq 0, ack 897118111, win 0, length 0
13:30:17.733387 IP 192.168.15.128.aol > 192.168.15.129.50349: Flags [R.], seq 0, ack 897118111, win 0, length 0
13:30:17.733441 IP 192.168.15.128.bgp > 192.168.15.129.50349: Flags [R.], seq 0, ack 897118111, win 0, length 0
13:30:17.733504 IP 192.168.15.128.nfs > 192.168.15.129.50349: Flags [S.], seq 2239947104, ack 897118111, win 5840, options [mss 1460], length 0
13:30:17.733557 IP 192.168.15.128.6646 > 192.168.15.129.50349: Flags [R.], seq 0, ack 897118111, win 0, length 0
13:30:17.733613 IP 192.168.15.128.1029 > 192.168.15.129.50349: Flags [R.], seq 0, ack 897118111, win 0, length 0
13:30:17.733677 IP 192.168.15.128.1028 > 192.168.15.129.50349: Flags [R.], seq 0, ack 897118111, win 0, length 0
13:30:17.733737 IP 192.168.15.128.cisco-sccp > 192.168.15.129.50349: Flags [R.], seq 0, ack 897118111, win 0, length 0
13:30:17.733790 IP 192.168.15.128.tproxy > 192.168.15.129.50349: Flags [R.], seq 0, ack 897118111, win 0, length 0
13:30:17.733889 IP 192.168.15.129.50349 > 192.168.15.128.postgresql: Flags [R], seq 897118111, win 0, length 0
13:30:17.733949 IP 192.168.15.129.50349 > 192.168.15.128.nfs: Flags [R], seq 897118111, win 0, length 0
13:30:17.831586 IP 192.168.15.129.50350 > 192.168.15.128.1110: Flags [S], seq 897183647, win 1024, options [mss 1460], length 0
13:30:17.831715 IP 192.168.15.129.50350 > 192.168.15.128.ipp: Flags [S], seq 897183647, win 1024, options [mss 1460], length 0
13:30:17.831777 IP 192.168.15.129.50350 > 192.168.15.128.postgresql: Flags [S], seq 897183647, win 1024, options [mss 1460], length 0
13:30:17.832116 IP 192.168.15.128.1110 > 192.168.15.129.50350: Flags [R.], seq 0, ack 897183648, win 0, length 0
13:30:17.832238 IP 192.168.15.128.ipp > 192.168.15.129.50350: Flags [R.], seq 0, ack 897183648, win 0, length 0
13:30:17.832301 IP 192.168.15.128.postgresql > 192.168.15.129.50350: Flags [S.], seq 2226187085, ack 897183648, win 5840, options [mss 1460], length 0
13:30:17.832554 IP 192.168.15.129.50350 > 192.168.15.128.postgresql: Flags [R], seq 897183648, win 0, length 0
13:30:17.834396 IP 192.168.15.129.50350 > 192.168.15.128.tproxy: Flags [S], seq 897183647, win 1024, options [mss 1460], length 0
13:30:17.834503 IP 192.168.15.129.50350 > 192.168.15.128.cisco-sccp: Flags [S], seq 897183647, win 1024, options [mss 1460], length 0
13:30:17.834565 IP 192.168.15.129.50350 > 192.168.15.128.1028: Flags [S], seq 897183647, win 1024, options [mss 1460], length 0
13:30:17.834618 IP 192.168.15.129.50350 > 192.168.15.128.1029: Flags [S], seq 897183647, win 1024, options [mss 1460], length 0
13:30:17.835086 IP 192.168.15.128.tproxy > 192.168.15.129.50350: Flags [R.], seq 0, ack 897183648, win 0, length 0
13:30:17.835212 IP 192.168.15.128.cisco-sccp > 192.168.15.129.50350: Flags [R.], seq 0, ack 897183648, win 0, length 0
13:30:17.835293 IP 192.168.15.128.1028 > 192.168.15.129.50350: Flags [R.], seq 0, ack 897183648, win 0, length 0
13:30:17.835354 IP 192.168.15.128.1029 > 192.168.15.129.50350: Flags [R.], seq 0, ack 897183648, win 0, length 0
13:30:17.835453 IP 192.168.15.129.50350 > 192.168.15.128.6646: Flags [S], seq 897183647, win 1024, options [mss 1460], length 0
13:30:17.835513 IP 192.168.15.129.50350 > 192.168.15.128.nfs: Flags [S], seq 897183647, win 1024, options [mss 1460], length 0
13:30:17.835566 IP 192.168.15.129.50350 > 192.168.15.128.bgp: Flags [S], seq 897183647, win 1024, options [mss 1460], length 0
13:30:17.835623 IP 192.168.15.129.50350 > 192.168.15.128.aol: Flags [S], seq 897183647, win 1024, options [mss 1460], length 0
13:30:17.835674 IP 192.168.15.129.50350 > 192.168.15.128.144: Flags [S], seq 897183647, win 1024, options [mss 1460], length 0
13:30:17.835732 IP 192.168.15.129.50350 > 192.168.15.128.nrpe: Flags [S], seq 897183647, win 1024, options [mss 1460], length 0
13:30:17.835792 IP 192.168.15.129.50350 > 192.168.15.128.5009: Flags [S], seq 897183647, win 1024, options [mss 1460], length 0
13:30:17.835886 IP 192.168.15.128.6646 > 192.168.15.129.50350: Flags [R.], seq 0, ack 897183648, win 0, length 0
13:30:17.836272 IP 192.168.15.128.nfs > 192.168.15.129.50350: Flags [S.], seq 2234046586, ack 897183648, win 5840, options [mss 1460], length 0
13:30:17.836355 IP 192.168.15.128.bgp > 192.168.15.129.50350: Flags [R.], seq 0, ack 897183648, win 0, length 0
13:30:17.836423 IP 192.168.15.128.aol > 192.168.15.129.50350: Flags [R.], seq 0, ack 897183648, win 0, length 0
13:30:17.836482 IP 192.168.15.128.144 > 192.168.15.129.50350: Flags [R.], seq 0, ack 897183648, win 0, length 0
13:30:17.836535 IP 192.168.15.128.nrpe > 192.168.15.129.50350: Flags [R.], seq 0, ack 897183648, win 0, length 0
13:30:17.836593 IP 192.168.15.128.5009 > 192.168.15.129.50350: Flags [R.], seq 0, ack 897183648, win 0, length 0
13:30:17.836691 IP 192.168.15.129.50350 > 192.168.15.128.nfs: Flags [R], seq 897183648, win 0, length 0
13:30:17.931967 IP 192.168.15.129.50349 > 192.168.15.128.webmin: Flags [S], seq 897118110, win 1024, options [mss 1460], length 0
13:30:17.932428 IP 192.168.15.128.webmin > 192.168.15.129.50349: Flags [R.], seq 0, ack 897118111, win 0, length 0
13:30:17.937917 IP 192.168.15.129.50349 > 192.168.15.128.ms-sql-s: Flags [S], seq 897118110, win 1024, options [mss 1460], length 0
13:30:17.938465 IP 192.168.15.128.ms-sql-s > 192.168.15.129.50349: Flags [R.], seq 0, ack 897118111, win 0, length 0
13:30:17.943951 IP 192.168.15.129.50349 > 192.168.15.128.login: Flags [S], seq 897118110, win 1024, options [mss 1460], length 0
13:30:17.944559 IP 192.168.15.128.login > 192.168.15.129.50349: Flags [S.], seq 2234725546, ack 897118111, win 5840, options [mss 1460], length 0
13:30:17.945096 IP 192.168.15.129.50349 > 192.168.15.128.login: Flags [R], seq 897118111, win 0, length 0
13:30:17.950139 IP 192.168.15.129.50349 > 192.168.15.128.1027: Flags [S], seq 897118110, win 1024, options [mss 1460], length 0
13:30:17.950718 IP 192.168.15.128.1027 > 192.168.15.129.50349: Flags [R.], seq 0, ack 897118111, win 0, length 0
13:30:17.955957 IP 192.168.15.129.50349 > 192.168.15.128.nntp: Flags [S], seq 897118110, win 1024, options [mss 1460], length 0
13:30:17.956486 IP 192.168.15.128.nntp > 192.168.15.129.50349: Flags [R.], seq 0, ack 897118111, win 0, length 0
13:30:17.962004 IP 192.168.15.129.50349 > 192.168.15.128.shell: Flags [S], seq 897118110, win 1024, options [mss 1460], length 0
13:30:17.962649 IP 192.168.15.128.shell > 192.168.15.129.50349: Flags [S.], seq 2229855233, ack 897118111, win 5840, options [mss 1460], length 0
13:30:17.963184 IP 192.168.15.129.50349 > 192.168.15.128.shell: Flags [R], seq 897118111, win 0, length 0
13:30:17.968007 IP 192.168.15.129.50349 > 192.168.15.128.radmin-port: Flags [S], seq 897118110, win 1024, options [mss 1460], length 0
13:30:17.968542 IP 192.168.15.128.radmin-port > 192.168.15.129.50349: Flags [R.], seq 0, ack 897118111, win 0, length 0
13:30:17.974084 IP 192.168.15.129.50349 > 192.168.15.128.iprop: Flags [S], seq 897118110, win 1024, options [mss 1460], length 0
13:30:17.974752 IP 192.168.15.128.iprop > 192.168.15.129.50349: Flags [S.], seq 2232438923, ack 897118111, win 5840, options [mss 1460], length 0
13:30:17.975331 IP 192.168.15.129.50349 > 192.168.15.128.iprop: Flags [R], seq 897118111, win 0, length 0
13:30:17.980215 IP 192.168.15.129.50349 > 192.168.15.128.5631: Flags [S], seq 897118110, win 1024, options [mss 1460], length 0
13:30:17.980806 IP 192.168.15.128.5631 > 192.168.15.129.50349: Flags [R.], seq 0, ack 897118111, win 0, length 0
13:30:17.986449 IP 192.168.15.129.50349 > 192.168.15.128.5101: Flags [S], seq 897118110, win 1024, options [mss 1460], length 0
13:30:17.987095 IP 192.168.15.128.5101 > 192.168.15.129.50349: Flags [R.], seq 0, ack 897118111, win 0, length 0
13:30:18.032628 IP 192.168.15.129.50350 > 192.168.15.128.webmin: Flags [S], seq 897183647, win 1024, options [mss 1460], length 0
13:30:18.033221 IP 192.168.15.128.webmin > 192.168.15.129.50350: Flags [R.], seq 0, ack 897183648, win 0, length 0
13:30:18.041139 IP 192.168.15.129.50350 > 192.168.15.128.ms-sql-s: Flags [S], seq 897183647, win 1024, options [mss 1460], length 0
13:30:18.041768 IP 192.168.15.128.ms-sql-s > 192.168.15.129.50350: Flags [R.], seq 0, ack 897183648, win 0, length 0
13:30:18.046941 IP 192.168.15.129.50350 > 192.168.15.128.login: Flags [S], seq 897183647, win 1024, options [mss 1460], length 0
13:30:18.047572 IP 192.168.15.128.login > 192.168.15.129.50350: Flags [S.], seq 2236235587, ack 897183648, win 5840, options [mss 1460], length 0
13:30:18.048126 IP 192.168.15.129.50350 > 192.168.15.128.login: Flags [R], seq 897183648, win 0, length 0
13:30:18.053444 IP 192.168.15.129.50350 > 192.168.15.128.1027: Flags [S], seq 897183647, win 1024, options [mss 1460], length 0
13:30:18.054165 IP 192.168.15.128.1027 > 192.168.15.129.50350: Flags [R.], seq 0, ack 897183648, win 0, length 0
13:30:18.058963 IP 192.168.15.129.50350 > 192.168.15.128.nntp: Flags [S], seq 897183647, win 1024, options [mss 1460], length 0
13:30:18.059568 IP 192.168.15.128.nntp > 192.168.15.129.50350: Flags [R.], seq 0, ack 897183648, win 0, length 0
13:30:18.064214 IP 192.168.15.129.50350 > 192.168.15.128.shell: Flags [S], seq 897183647, win 1024, options [mss 1460], length 0
13:30:18.064854 IP 192.168.15.128.shell > 192.168.15.129.50350: Flags [S.], seq 2243011735, ack 897183648, win 5840, options [mss 1460], length 0
13:30:18.065430 IP 192.168.15.129.50350 > 192.168.15.128.shell: Flags [R], seq 897183648, win 0, length 0
13:30:18.070322 IP 192.168.15.129.50350 > 192.168.15.128.radmin-port: Flags [S], seq 897183647, win 1024, options [mss 1460], length 0
13:30:18.070940 IP 192.168.15.128.radmin-port > 192.168.15.129.50350: Flags [R.], seq 0, ack 897183648, win 0, length 0
13:30:18.076135 IP 192.168.15.129.50350 > 192.168.15.128.iprop: Flags [S], seq 897183647, win 1024, options [mss 1460], length 0
13:30:18.076763 IP 192.168.15.128.iprop > 192.168.15.129.50350: Flags [S.], seq 2230879821, ack 897183648, win 5840, options [mss 1460], length 0
13:30:18.077332 IP 192.168.15.129.50350 > 192.168.15.128.iprop: Flags [R], seq 897183648, win 0, length 0
13:30:18.082370 IP 192.168.15.129.50350 > 192.168.15.128.5631: Flags [S], seq 897183647, win 1024, options [mss 1460], length 0
13:30:18.082993 IP 192.168.15.128.5631 > 192.168.15.129.50350: Flags [R.], seq 0, ack 897183648, win 0, length 0
13:30:18.087753 IP 192.168.15.129.50350 > 192.168.15.128.5101: Flags [S], seq 897183647, win 1024, options [mss 1460], length 0
13:30:18.088322 IP 192.168.15.128.5101 > 192.168.15.129.50350: Flags [R.], seq 0, ack 897183648, win 0, length 0
13:30:18.133061 IP 192.168.15.129.50349 > 192.168.15.128.daytime: Flags [S], seq 897118110, win 1024, options [mss 1460], length 0
13:30:18.133685 IP 192.168.15.128.daytime > 192.168.15.129.50349: Flags [R.], seq 0, ack 897118111, win 0, length 0
13:30:18.138594 IP 192.168.15.129.50349 > 192.168.15.128.urd: Flags [S], seq 897118110, win 1024, options [mss 1460], length 0
13:30:18.139198 IP 192.168.15.128.urd > 192.168.15.129.50349: Flags [R.], seq 0, ack 897118111, win 0, length 0
13:30:18.144880 IP 192.168.15.129.50349 > 192.168.15.128.26: Flags [S], seq 897118110, win 1024, options [mss 1460], length 0
13:30:18.145526 IP 192.168.15.128.26 > 192.168.15.129.50349: Flags [R.], seq 0, ack 897118111, win 0, length 0
13:30:18.150924 IP 192.168.15.129.50349 > 192.168.15.128.kerberos: Flags [S], seq 897118110, win 1024, options [mss 1460], length 0
13:30:18.151561 IP 192.168.15.128.kerberos > 192.168.15.129.50349: Flags [R.], seq 0, ack 897118111, win 0, length 0
13:30:18.156909 IP 192.168.15.129.50349 > 192.168.15.128.49155: Flags [S], seq 897118110, win 1024, options [mss 1460], length 0
13:30:18.157614 IP 192.168.15.128.49155 > 192.168.15.129.50349: Flags [R.], seq 0, ack 897118111, win 0, length 0
13:30:18.162958 IP 192.168.15.129.50349 > 192.168.15.128.x11-1: Flags [S], seq 897118110, win 1024, options [mss 1460], length 0
13:30:18.163610 IP 192.168.15.128.x11-1 > 192.168.15.129.50349: Flags [R.], seq 0, ack 897118111, win 0, length 0
13:30:18.168765 IP 192.168.15.129.50349 > 192.168.15.128.sip: Flags [S], seq 897118110, win 1024, options [mss 1460], length 0
13:30:18.169394 IP 192.168.15.128.sip > 192.168.15.129.50349: Flags [R.], seq 0, ack 897118111, win 0, length 0
13:30:18.233733 IP 192.168.15.129.50350 > 192.168.15.128.daytime: Flags [S], seq 897183647, win 1024, options [mss 1460], length 0
13:30:18.234365 IP 192.168.15.128.daytime > 192.168.15.129.50350: Flags [R.], seq 0, ack 897183648, win 0, length 0
13:30:18.238912 IP 192.168.15.129.50350 > 192.168.15.128.urd: Flags [S], seq 897183647, win 1024, options [mss 1460], length 0
13:30:18.239591 IP 192.168.15.128.urd > 192.168.15.129.50350: Flags [R.], seq 0, ack 897183648, win 0, length 0
13:30:18.247782 IP 192.168.15.129.50350 > 192.168.15.128.26: Flags [S], seq 897183647, win 1024, options [mss 1460], length 0
13:30:18.248413 IP 192.168.15.128.26 > 192.168.15.129.50350: Flags [R.], seq 0, ack 897183648, win 0, length 0
13:30:18.253783 IP 192.168.15.129.50350 > 192.168.15.128.kerberos: Flags [S], seq 897183647, win 1024, options [mss 1460], length 0
13:30:18.254455 IP 192.168.15.128.kerberos > 192.168.15.129.50350: Flags [R.], seq 0, ack 897183648, win 0, length 0
13:30:18.259843 IP 192.168.15.129.50350 > 192.168.15.128.49155: Flags [S], seq 897183647, win 1024, options [mss 1460], length 0
13:30:18.260456 IP 192.168.15.128.49155 > 192.168.15.129.50350: Flags [R.], seq 0, ack 897183648, win 0, length 0
13:30:18.265773 IP 192.168.15.129.50350 > 192.168.15.128.x11-1: Flags [S], seq 897183647, win 1024, options [mss 1460], length 0
13:30:18.266421 IP 192.168.15.128.x11-1 > 192.168.15.129.50350: Flags [R.], seq 0, ack 897183648, win 0, length 0
13:30:18.271745 IP 192.168.15.129.50350 > 192.168.15.128.sip: Flags [S], seq 897183647, win 1024, options [mss 1460], length 0
13:30:18.272419 IP 192.168.15.128.sip > 192.168.15.129.50350: Flags [R.], seq 0, ack 897183648, win 0, length 0
13:30:18.334532 IP 192.168.15.129.50349 > 192.168.15.128.8009: Flags [S], seq 897118110, win 1024, options [mss 1460], length 0
13:30:18.335140 IP 192.168.15.128.8009 > 192.168.15.129.50349: Flags [S.], seq 2247545591, ack 897118111, win 5840, options [mss 1460], length 0
13:30:18.335728 IP 192.168.15.129.50349 > 192.168.15.128.8009: Flags [R], seq 897118111, win 0, length 0
13:30:18.345461 IP 192.168.15.129.50349 > 192.168.15.128.5000: Flags [S], seq 897118110, win 1024, options [mss 1460], length 0
13:30:18.346105 IP 192.168.15.128.5000 > 192.168.15.129.50349: Flags [R.], seq 0, ack 897118111, win 0, length 0
13:30:18.355756 IP 192.168.15.129.50349 > 192.168.15.128.finger: Flags [S], seq 897118110, win 1024, options [mss 1460], length 0
13:30:18.356360 IP 192.168.15.128.finger > 192.168.15.129.50349: Flags [R.], seq 0, ack 897118111, win 0, length 0
13:30:18.366637 IP 192.168.15.129.50349 > 192.168.15.128.49157: Flags [S], seq 897118110, win 1024, options [mss 1460], length 0
13:30:18.367224 IP 192.168.15.128.49157 > 192.168.15.129.50349: Flags [R.], seq 0, ack 897118111, win 0, length 0
13:30:18.377358 IP 192.168.15.129.50349 > 192.168.15.128.1755: Flags [S], seq 897118110, win 1024, options [mss 1460], length 0
13:30:18.377998 IP 192.168.15.128.1755 > 192.168.15.129.50349: Flags [R.], seq 0, ack 897118111, win 0, length 0
13:30:18.435885 IP 192.168.15.129.50350 > 192.168.15.128.8009: Flags [S], seq 897183647, win 1024, options [mss 1460], length 0
13:30:18.436528 IP 192.168.15.128.8009 > 192.168.15.129.50350: Flags [S.], seq 2241942984, ack 897183648, win 5840, options [mss 1460], length 0
13:30:18.437225 IP 192.168.15.129.50350 > 192.168.15.128.8009: Flags [R], seq 897183648, win 0, length 0
13:30:18.446894 IP 192.168.15.129.50350 > 192.168.15.128.5000: Flags [S], seq 897183647, win 1024, options [mss 1460], length 0
13:30:18.447541 IP 192.168.15.128.5000 > 192.168.15.129.50350: Flags [R.], seq 0, ack 897183648, win 0, length 0
13:30:18.457656 IP 192.168.15.129.50350 > 192.168.15.128.finger: Flags [S], seq 897183647, win 1024, options [mss 1460], length 0
13:30:18.458338 IP 192.168.15.128.finger > 192.168.15.129.50350: Flags [R.], seq 0, ack 897183648, win 0, length 0
13:30:18.465631 IP 192.168.15.128 > 8.8.8.8: ICMP echo request, id 13086, seq 18, length 64
13:30:18.468677 IP 192.168.15.129.50350 > 192.168.15.128.49157: Flags [S], seq 897183647, win 1024, options [mss 1460], length 0
13:30:18.469370 IP 192.168.15.128.49157 > 192.168.15.129.50350: Flags [R.], seq 0, ack 897183648, win 0, length 0
13:30:18.478889 IP 192.168.15.129.50350 > 192.168.15.128.1755: Flags [S], seq 897183647, win 1024, options [mss 1460], length 0
13:30:18.479533 IP 192.168.15.128.1755 > 192.168.15.129.50350: Flags [R.], seq 0, ack 897183648, win 0, length 0
13:30:18.502492 IP 8.8.8.8 > 192.168.15.128: ICMP echo reply, id 13086, seq 18, length 64
13:30:18.536335 IP 192.168.15.129.50349 > 192.168.15.128.49153: Flags [S], seq 897118110, win 1024, options [mss 1460], length 0
13:30:18.536888 IP 192.168.15.128.49153 > 192.168.15.129.50349: Flags [R.], seq 0, ack 897118111, win 0, length 0
13:30:18.546768 IP 192.168.15.129.50349 > 192.168.15.128.enbd-cstatd: Flags [S], seq 897118110, win 1024, options [mss 1460], length 0
13:30:18.547436 IP 192.168.15.128.enbd-cstatd > 192.168.15.129.50349: Flags [R.], seq 0, ack 897118111, win 0, length 0
13:30:18.558070 IP 192.168.15.129.50349 > 192.168.15.128.discard: Flags [S], seq 897118110, win 1024, options [mss 1460], length 0
13:30:18.558714 IP 192.168.15.128.discard > 192.168.15.129.50349: Flags [R.], seq 0, ack 897118111, win 0, length 0
13:30:18.569018 IP 192.168.15.129.50349 > 192.168.15.128.8443: Flags [S], seq 897118110, win 1024, options [mss 1460], length 0
13:30:18.569684 IP 192.168.15.128.8443 > 192.168.15.129.50349: Flags [R.], seq 0, ack 897118111, win 0, length 0
13:30:18.636889 IP 192.168.15.129.50350 > 192.168.15.128.49153: Flags [S], seq 897183647, win 1024, options [mss 1460], length 0
13:30:18.637511 IP 192.168.15.128.49153 > 192.168.15.129.50350: Flags [R.], seq 0, ack 897183648, win 0, length 0
13:30:18.647680 IP 192.168.15.129.50350 > 192.168.15.128.enbd-cstatd: Flags [S], seq 897183647, win 1024, options [mss 1460], length 0
13:30:18.648314 IP 192.168.15.128.enbd-cstatd > 192.168.15.129.50350: Flags [R.], seq 0, ack 897183648, win 0, length 0
13:30:18.658799 IP 192.168.15.129.50350 > 192.168.15.128.discard: Flags [S], seq 897183647, win 1024, options [mss 1460], length 0
13:30:18.659452 IP 192.168.15.128.discard > 192.168.15.129.50350: Flags [R.], seq 0, ack 897183648, win 0, length 0
13:30:18.669487 IP 192.168.15.129.50350 > 192.168.15.128.8443: Flags [S], seq 897183647, win 1024, options [mss 1460], length 0
13:30:18.670121 IP 192.168.15.128.8443 > 192.168.15.129.50350: Flags [R.], seq 0, ack 897183648, win 0, length 0
13:30:18.738036 IP 192.168.15.129.50349 > 192.168.15.128.poppassd: Flags [S], seq 897118110, win 1024, options [mss 1460], length 0
13:30:18.738669 IP 192.168.15.128.poppassd > 192.168.15.129.50349: Flags [R.], seq 0, ack 897118111, win 0, length 0
13:30:18.748835 IP 192.168.15.129.50349 > 192.168.15.128.5800: Flags [S], seq 897118110, win 1024, options [mss 1460], length 0
13:30:18.749477 IP 192.168.15.128.5800 > 192.168.15.129.50349: Flags [R.], seq 0, ack 897118111, win 0, length 0
13:30:18.839046 IP 192.168.15.129.50350 > 192.168.15.128.poppassd: Flags [S], seq 897183647, win 1024, options [mss 1460], length 0
13:30:18.839720 IP 192.168.15.128.poppassd > 192.168.15.129.50350: Flags [R.], seq 0, ack 897183648, win 0, length 0
13:30:18.850157 IP 192.168.15.129.50350 > 192.168.15.128.5800: Flags [S], seq 897183647, win 1024, options [mss 1460], length 0
13:30:18.850802 IP 192.168.15.128.5800 > 192.168.15.129.50350: Flags [R.], seq 0, ack 897183648, win 0, length 0
13:30:19.485186 IP 192.168.15.128 > 8.8.8.8: ICMP echo request, id 13086, seq 19, length 64
13:30:19.521265 IP 8.8.8.8 > 192.168.15.128: ICMP echo reply, id 13086, seq 19, length 64
13:30:20.505177 IP 192.168.15.128 > 8.8.8.8: ICMP echo request, id 13086, seq 20, length 64
13:30:20.548558 IP 8.8.8.8 > 192.168.15.128: ICMP echo reply, id 13086, seq 20, length 64
13:30:21.274384 ARP, Request who-has 192.168.15.2 tell 192.168.15.129, length 46
13:30:21.274908 ARP, Reply 192.168.15.2 is-at 00:50:56:e8:23:fc (oui Unknown), length 46
13:30:21.373363 ARP, Request who-has 192.168.15.129 tell 192.168.15.128, length 46
13:30:21.374216 ARP, Reply 192.168.15.129 is-at 00:0c:29:2d:be:bd (oui Unknown), length 46

