15:27:43.395657 IP 192.168.15.128 > 8.8.8.8: ICMP echo request, id 13086, seq 6823, length 64
15:27:43.428122 IP 8.8.8.8 > 192.168.15.128: ICMP echo reply, id 13086, seq 6823, length 64
15:27:44.405660 IP 192.168.15.128 > 8.8.8.8: ICMP echo request, id 13086, seq 6824, length 64
15:27:44.438862 IP 8.8.8.8 > 192.168.15.128: ICMP echo reply, id 13086, seq 6824, length 64
15:27:45.414593 IP 192.168.15.128 > 8.8.8.8: ICMP echo request, id 13086, seq 6825, length 64
15:27:45.451087 IP 8.8.8.8 > 192.168.15.128: ICMP echo reply, id 13086, seq 6825, length 64
15:27:46.424905 IP 192.168.15.128 > 8.8.8.8: ICMP echo request, id 13086, seq 6826, length 64
15:27:46.457008 IP 8.8.8.8 > 192.168.15.128: ICMP echo reply, id 13086, seq 6826, length 64
15:27:47.443782 IP 192.168.15.128 > 8.8.8.8: ICMP echo request, id 13086, seq 6827, length 64
15:27:47.544195 IP 8.8.8.8 > 192.168.15.128: ICMP echo reply, id 13086, seq 6827, length 64
15:27:48.453579 IP 192.168.15.128 > 8.8.8.8: ICMP echo request, id 13086, seq 6828, length 64
15:27:48.513135 IP 8.8.8.8 > 192.168.15.128: ICMP echo reply, id 13086, seq 6828, length 64
15:27:49.463249 IP 192.168.15.128 > 8.8.8.8: ICMP echo request, id 13086, seq 6829, length 64
15:27:49.501577 IP 8.8.8.8 > 192.168.15.128: ICMP echo reply, id 13086, seq 6829, length 64
15:27:50.473010 IP 192.168.15.128 > 8.8.8.8: ICMP echo request, id 13086, seq 6830, length 64
15:27:50.504892 IP 8.8.8.8 > 192.168.15.128: ICMP echo reply, id 13086, seq 6830, length 64
15:27:51.483300 IP 192.168.15.128 > 8.8.8.8: ICMP echo request, id 13086, seq 6831, length 64
15:27:51.515990 IP 8.8.8.8 > 192.168.15.128: ICMP echo reply, id 13086, seq 6831, length 64
15:27:52.502453 IP 192.168.15.128 > 8.8.8.8: ICMP echo request, id 13086, seq 6832, length 64
15:27:52.534387 IP 8.8.8.8 > 192.168.15.128: ICMP echo reply, id 13086, seq 6832, length 64
15:27:53.512052 IP 192.168.15.128 > 8.8.8.8: ICMP echo request, id 13086, seq 6833, length 64
15:27:53.544718 IP 8.8.8.8 > 192.168.15.128: ICMP echo reply, id 13086, seq 6833, length 64
15:27:54.521726 IP 192.168.15.128 > 8.8.8.8: ICMP echo request, id 13086, seq 6834, length 64
15:27:54.554805 IP 8.8.8.8 > 192.168.15.128: ICMP echo reply, id 13086, seq 6834, length 64
15:27:55.531382 IP 192.168.15.128 > 8.8.8.8: ICMP echo request, id 13086, seq 6835, length 64
15:27:55.616103 IP 8.8.8.8 > 192.168.15.128: ICMP echo reply, id 13086, seq 6835, length 64
15:27:56.541991 IP 192.168.15.128 > 8.8.8.8: ICMP echo request, id 13086, seq 6836, length 64
15:27:56.656356 IP 8.8.8.8 > 192.168.15.128: ICMP echo reply, id 13086, seq 6836, length 64
15:27:57.551735 IP 192.168.15.128 > 8.8.8.8: ICMP echo request, id 13086, seq 6837, length 64
15:27:57.623696 IP 8.8.8.8 > 192.168.15.128: ICMP echo reply, id 13086, seq 6837, length 64
15:27:58.560769 IP 192.168.15.128 > 8.8.8.8: ICMP echo request, id 13086, seq 6838, length 64
15:27:58.593051 IP 8.8.8.8 > 192.168.15.128: ICMP echo reply, id 13086, seq 6838, length 64
15:27:59.570869 IP 192.168.15.128 > 8.8.8.8: ICMP echo request, id 13086, seq 6839, length 64
15:27:59.603869 IP 8.8.8.8 > 192.168.15.128: ICMP echo reply, id 13086, seq 6839, length 64
15:28:00.579915 IP 192.168.15.128 > 8.8.8.8: ICMP echo request, id 13086, seq 6840, length 64
15:28:00.612015 IP 8.8.8.8 > 192.168.15.128: ICMP echo reply, id 13086, seq 6840, length 64
15:28:01.589931 IP 192.168.15.128 > 8.8.8.8: ICMP echo request, id 13086, seq 6841, length 64
15:28:01.633474 IP 8.8.8.8 > 192.168.15.128: ICMP echo reply, id 13086, seq 6841, length 64
15:28:02.599545 IP 192.168.15.128 > 8.8.8.8: ICMP echo request, id 13086, seq 6842, length 64
15:28:02.632649 IP 8.8.8.8 > 192.168.15.128: ICMP echo reply, id 13086, seq 6842, length 64
15:28:03.608838 IP 192.168.15.128 > 8.8.8.8: ICMP echo request, id 13086, seq 6843, length 64
15:28:03.752853 IP 8.8.8.8 > 192.168.15.128: ICMP echo reply, id 13086, seq 6843, length 64
15:28:04.618461 IP 192.168.15.128 > 8.8.8.8: ICMP echo request, id 13086, seq 6844, length 64
15:28:04.765182 IP 8.8.8.8 > 192.168.15.128: ICMP echo reply, id 13086, seq 6844, length 64
15:28:05.628098 IP 192.168.15.128 > 8.8.8.8: ICMP echo request, id 13086, seq 6845, length 64
15:28:05.763469 IP 8.8.8.8 > 192.168.15.128: ICMP echo reply, id 13086, seq 6845, length 64
15:28:06.637860 IP 192.168.15.128 > 8.8.8.8: ICMP echo request, id 13086, seq 6846, length 64
15:28:06.669850 IP 8.8.8.8 > 192.168.15.128: ICMP echo reply, id 13086, seq 6846, length 64
15:28:07.647456 IP 192.168.15.128 > 8.8.8.8: ICMP echo request, id 13086, seq 6847, length 64
15:28:07.678830 IP 8.8.8.8 > 192.168.15.128: ICMP echo reply, id 13086, seq 6847, length 64
15:28:08.657956 IP 192.168.15.128 > 8.8.8.8: ICMP echo request, id 13086, seq 6848, length 64
15:28:08.702106 IP 8.8.8.8 > 192.168.15.128: ICMP echo reply, id 13086, seq 6848, length 64
15:28:09.666769 IP 192.168.15.128 > 8.8.8.8: ICMP echo request, id 13086, seq 6849, length 64
15:28:09.698931 IP 8.8.8.8 > 192.168.15.128: ICMP echo reply, id 13086, seq 6849, length 64
15:28:10.677024 IP 192.168.15.128 > 8.8.8.8: ICMP echo request, id 13086, seq 6850, length 64
15:28:10.714474 IP 8.8.8.8 > 192.168.15.128: ICMP echo reply, id 13086, seq 6850, length 64
15:28:11.686291 IP 192.168.15.128 > 8.8.8.8: ICMP echo request, id 13086, seq 6851, length 64
15:28:11.718886 IP 8.8.8.8 > 192.168.15.128: ICMP echo reply, id 13086, seq 6851, length 64
15:28:12.696504 IP 192.168.15.128 > 8.8.8.8: ICMP echo request, id 13086, seq 6852, length 64
15:28:12.769524 IP 8.8.8.8 > 192.168.15.128: ICMP echo reply, id 13086, seq 6852, length 64
15:28:13.706185 IP 192.168.15.128 > 8.8.8.8: ICMP echo request, id 13086, seq 6853, length 64
15:28:13.738775 IP 8.8.8.8 > 192.168.15.128: ICMP echo reply, id 13086, seq 6853, length 64
15:28:14.716006 IP 192.168.15.128 > 8.8.8.8: ICMP echo request, id 13086, seq 6854, length 64
15:28:14.835675 IP 8.8.8.8 > 192.168.15.128: ICMP echo reply, id 13086, seq 6854, length 64
15:28:15.725805 IP 192.168.15.128 > 8.8.8.8: ICMP echo request, id 13086, seq 6855, length 64
15:28:15.757349 IP 8.8.8.8 > 192.168.15.128: ICMP echo reply, id 13086, seq 6855, length 64
15:28:16.745277 IP 192.168.15.128 > 8.8.8.8: ICMP echo request, id 13086, seq 6856, length 64
15:28:16.777731 IP 8.8.8.8 > 192.168.15.128: ICMP echo reply, id 13086, seq 6856, length 64
15:28:17.754406 IP 192.168.15.128 > 8.8.8.8: ICMP echo request, id 13086, seq 6857, length 64
15:28:17.790852 IP 8.8.8.8 > 192.168.15.128: ICMP echo reply, id 13086, seq 6857, length 64
15:28:18.764035 IP 192.168.15.128 > 8.8.8.8: ICMP echo request, id 13086, seq 6858, length 64
15:28:18.795546 IP 8.8.8.8 > 192.168.15.128: ICMP echo reply, id 13086, seq 6858, length 64
15:28:19.773920 IP 192.168.15.128 > 8.8.8.8: ICMP echo request, id 13086, seq 6859, length 64
15:28:19.806225 IP 8.8.8.8 > 192.168.15.128: ICMP echo reply, id 13086, seq 6859, length 64
15:28:20.783403 IP 192.168.15.128 > 8.8.8.8: ICMP echo request, id 13086, seq 6860, length 64
15:28:20.905970 IP 8.8.8.8 > 192.168.15.128: ICMP echo reply, id 13086, seq 6860, length 64
15:28:21.793067 IP 192.168.15.128 > 8.8.8.8: ICMP echo request, id 13086, seq 6861, length 64
15:28:21.883541 IP 8.8.8.8 > 192.168.15.128: ICMP echo reply, id 13086, seq 6861, length 64
15:28:22.803418 IP 192.168.15.128 > 8.8.8.8: ICMP echo request, id 13086, seq 6862, length 64
15:28:22.844437 IP 8.8.8.8 > 192.168.15.128: ICMP echo reply, id 13086, seq 6862, length 64
15:28:23.500076 IP 192.168.15.129.bootpc > 192.168.15.254.bootps: BOOTP/DHCP, Request from 00:0c:29:2d:be:bd (oui Unknown), length 300
15:28:23.500858 IP 192.168.15.254.bootps > 192.168.15.129.bootpc: BOOTP/DHCP, Reply, length 300
15:28:23.813276 IP 192.168.15.128 > 8.8.8.8: ICMP echo request, id 13086, seq 6863, length 64
15:28:23.845029 IP 8.8.8.8 > 192.168.15.128: ICMP echo reply, id 13086, seq 6863, length 64
15:28:24.822756 IP 192.168.15.128 > 8.8.8.8: ICMP echo request, id 13086, seq 6864, length 64
15:28:24.856081 IP 8.8.8.8 > 192.168.15.128: ICMP echo reply, id 13086, seq 6864, length 64
15:28:25.831773 IP 192.168.15.128 > 8.8.8.8: ICMP echo request, id 13086, seq 6865, length 64
15:28:25.865640 IP 8.8.8.8 > 192.168.15.128: ICMP echo reply, id 13086, seq 6865, length 64
15:28:26.841695 IP 192.168.15.128 > 8.8.8.8: ICMP echo request, id 13086, seq 6866, length 64
15:28:26.873584 IP 8.8.8.8 > 192.168.15.128: ICMP echo reply, id 13086, seq 6866, length 64
15:28:27.851092 IP 192.168.15.128 > 8.8.8.8: ICMP echo request, id 13086, seq 6867, length 64
15:28:27.883680 IP 8.8.8.8 > 192.168.15.128: ICMP echo reply, id 13086, seq 6867, length 64
15:28:28.516028 ARP, Request who-has 192.168.15.254 tell 192.168.15.129, length 46
15:28:28.516483 ARP, Reply 192.168.15.254 is-at 00:50:56:e8:90:7f (oui Unknown), length 46
15:28:28.861119 IP 192.168.15.128 > 8.8.8.8: ICMP echo request, id 13086, seq 6868, length 64
15:28:28.892588 IP 8.8.8.8 > 192.168.15.128: ICMP echo reply, id 13086, seq 6868, length 64
15:28:29.871271 IP 192.168.15.128 > 8.8.8.8: ICMP echo request, id 13086, seq 6869, length 64
15:28:29.991990 IP 8.8.8.8 > 192.168.15.128: ICMP echo reply, id 13086, seq 6869, length 64
15:28:30.880162 IP 192.168.15.128 > 8.8.8.8: ICMP echo request, id 13086, seq 6870, length 64
15:28:30.991223 IP 8.8.8.8 > 192.168.15.128: ICMP echo reply, id 13086, seq 6870, length 64
15:28:31.889790 IP 192.168.15.128 > 8.8.8.8: ICMP echo request, id 13086, seq 6871, length 64
15:28:31.937459 IP 8.8.8.8 > 192.168.15.128: ICMP echo reply, id 13086, seq 6871, length 64
15:28:32.900350 IP 192.168.15.128 > 8.8.8.8: ICMP echo request, id 13086, seq 6872, length 64
15:28:32.934565 IP 8.8.8.8 > 192.168.15.128: ICMP echo reply, id 13086, seq 6872, length 64
15:28:33.909275 IP 192.168.15.128 > 8.8.8.8: ICMP echo request, id 13086, seq 6873, length 64
15:28:33.954788 IP 8.8.8.8 > 192.168.15.128: ICMP echo reply, id 13086, seq 6873, length 64
15:28:34.919025 IP 192.168.15.128 > 8.8.8.8: ICMP echo request, id 13086, seq 6874, length 64
15:28:34.950340 IP 8.8.8.8 > 192.168.15.128: ICMP echo reply, id 13086, seq 6874, length 64
15:28:35.928449 IP 192.168.15.128 > 8.8.8.8: ICMP echo request, id 13086, seq 6875, length 64
15:28:35.964647 IP 8.8.8.8 > 192.168.15.128: ICMP echo reply, id 13086, seq 6875, length 64
15:28:36.939053 IP 192.168.15.128 > 8.8.8.8: ICMP echo request, id 13086, seq 6876, length 64
15:28:37.091092 IP 8.8.8.8 > 192.168.15.128: ICMP echo reply, id 13086, seq 6876, length 64
15:28:37.948277 IP 192.168.15.128 > 8.8.8.8: ICMP echo request, id 13086, seq 6877, length 64
15:28:37.999312 IP 8.8.8.8 > 192.168.15.128: ICMP echo reply, id 13086, seq 6877, length 64
15:28:38.957775 IP 192.168.15.128 > 8.8.8.8: ICMP echo request, id 13086, seq 6878, length 64
15:28:39.097525 IP 8.8.8.8 > 192.168.15.128: ICMP echo reply, id 13086, seq 6878, length 64
15:28:39.967093 IP 192.168.15.128 > 8.8.8.8: ICMP echo request, id 13086, seq 6879, length 64
15:28:40.000620 IP 8.8.8.8 > 192.168.15.128: ICMP echo reply, id 13086, seq 6879, length 64
15:28:40.977719 IP 192.168.15.128 > 8.8.8.8: ICMP echo request, id 13086, seq 6880, length 64
15:28:41.010775 IP 8.8.8.8 > 192.168.15.128: ICMP echo reply, id 13086, seq 6880, length 64
15:28:41.986678 IP 192.168.15.128 > 8.8.8.8: ICMP echo request, id 13086, seq 6881, length 64
15:28:42.022965 IP 8.8.8.8 > 192.168.15.128: ICMP echo reply, id 13086, seq 6881, length 64
15:28:42.996298 IP 192.168.15.128 > 8.8.8.8: ICMP echo request, id 13086, seq 6882, length 64
15:28:43.165196 IP 8.8.8.8 > 192.168.15.128: ICMP echo reply, id 13086, seq 6882, length 64
15:28:43.995723 IP 192.168.15.128 > 8.8.8.8: ICMP echo request, id 13086, seq 6883, length 64
15:28:44.027561 IP 8.8.8.8 > 192.168.15.128: ICMP echo reply, id 13086, seq 6883, length 64
15:28:45.015631 IP 192.168.15.128 > 8.8.8.8: ICMP echo request, id 13086, seq 6884, length 64
15:28:45.080437 IP 8.8.8.8 > 192.168.15.128: ICMP echo reply, id 13086, seq 6884, length 64
15:28:46.035266 IP 192.168.15.128 > 8.8.8.8: ICMP echo request, id 13086, seq 6885, length 64
15:28:46.133915 IP 8.8.8.8 > 192.168.15.128: ICMP echo reply, id 13086, seq 6885, length 64
15:28:47.055924 IP 192.168.15.128 > 8.8.8.8: ICMP echo request, id 13086, seq 6886, length 64
15:28:47.098964 IP 8.8.8.8 > 192.168.15.128: ICMP echo reply, id 13086, seq 6886, length 64
15:28:48.075548 IP 192.168.15.128 > 8.8.8.8: ICMP echo request, id 13086, seq 6887, length 64
15:28:48.111803 IP 8.8.8.8 > 192.168.15.128: ICMP echo reply, id 13086, seq 6887, length 64
15:28:48.354964 ARP, Request who-has 192.168.15.1 (Broadcast) tell 192.168.15.129, length 46
15:28:48.354984 ARP, Request who-has 192.168.15.2 (Broadcast) tell 192.168.15.129, length 46
15:28:48.354987 ARP, Request who-has 192.168.15.3 (Broadcast) tell 192.168.15.129, length 46
15:28:48.355068 ARP, Request who-has 192.168.15.4 (Broadcast) tell 192.168.15.129, length 46
15:28:48.355073 ARP, Request who-has 192.168.15.5 (Broadcast) tell 192.168.15.129, length 46
15:28:48.355074 ARP, Request who-has 192.168.15.6 (Broadcast) tell 192.168.15.129, length 46
15:28:48.355142 ARP, Request who-has 192.168.15.7 (Broadcast) tell 192.168.15.129, length 46
15:28:48.355296 ARP, Request who-has 192.168.15.8 (Broadcast) tell 192.168.15.129, length 46
15:28:48.355321 ARP, Request who-has 192.168.15.9 (Broadcast) tell 192.168.15.129, length 46
15:28:48.355395 ARP, Request who-has 192.168.15.10 (Broadcast) tell 192.168.15.129, length 46
15:28:48.355718 ARP, Reply 192.168.15.1 is-at 00:50:56:c0:00:08 (oui Unknown), length 46
15:28:48.356088 ARP, Reply 192.168.15.2 is-at 00:50:56:e8:23:fc (oui Unknown), length 46
15:28:48.559590 ARP, Request who-has 192.168.15.3 (Broadcast) tell 192.168.15.129, length 46
15:28:48.559976 ARP, Request who-has 192.168.15.4 (Broadcast) tell 192.168.15.129, length 46
15:28:48.560160 ARP, Request who-has 192.168.15.5 (Broadcast) tell 192.168.15.129, length 46
15:28:48.560355 ARP, Request who-has 192.168.15.6 (Broadcast) tell 192.168.15.129, length 46
15:28:48.560553 ARP, Request who-has 192.168.15.7 (Broadcast) tell 192.168.15.129, length 46
15:28:48.560828 ARP, Request who-has 192.168.15.8 (Broadcast) tell 192.168.15.129, length 46
15:28:48.561064 ARP, Request who-has 192.168.15.9 (Broadcast) tell 192.168.15.129, length 46
15:28:48.561243 ARP, Request who-has 192.168.15.10 (Broadcast) tell 192.168.15.129, length 46
15:28:48.561487 ARP, Request who-has 192.168.15.13 (Broadcast) tell 192.168.15.129, length 46
15:28:48.561522 ARP, Request who-has 192.168.15.14 (Broadcast) tell 192.168.15.129, length 46
15:28:48.561532 ARP, Request who-has 192.168.15.15 (Broadcast) tell 192.168.15.129, length 46
15:28:48.561541 ARP, Request who-has 192.168.15.16 (Broadcast) tell 192.168.15.129, length 46
15:28:48.660400 ARP, Request who-has 192.168.15.19 (Broadcast) tell 192.168.15.129, length 46
15:28:48.660438 ARP, Request who-has 192.168.15.20 (Broadcast) tell 192.168.15.129, length 46
15:28:48.660459 ARP, Request who-has 192.168.15.21 (Broadcast) tell 192.168.15.129, length 46
15:28:48.660824 ARP, Request who-has 192.168.15.22 (Broadcast) tell 192.168.15.129, length 46
15:28:48.766531 ARP, Request who-has 192.168.15.23 (Broadcast) tell 192.168.15.129, length 46
15:28:48.766563 ARP, Request who-has 192.168.15.24 (Broadcast) tell 192.168.15.129, length 46
15:28:48.766666 ARP, Request who-has 192.168.15.25 (Broadcast) tell 192.168.15.129, length 46
15:28:48.766676 ARP, Request who-has 192.168.15.13 (Broadcast) tell 192.168.15.129, length 46
15:28:48.766937 ARP, Request who-has 192.168.15.14 (Broadcast) tell 192.168.15.129, length 46
15:28:48.767141 ARP, Request who-has 192.168.15.15 (Broadcast) tell 192.168.15.129, length 46
15:28:48.767379 ARP, Request who-has 192.168.15.16 (Broadcast) tell 192.168.15.129, length 46
15:28:48.767601 ARP, Request who-has 192.168.15.28 (Broadcast) tell 192.168.15.129, length 46
15:28:48.767625 ARP, Request who-has 192.168.15.19 (Broadcast) tell 192.168.15.129, length 46
15:28:48.767900 ARP, Request who-has 192.168.15.20 (Broadcast) tell 192.168.15.129, length 46
15:28:48.767932 ARP, Request who-has 192.168.15.21 (Broadcast) tell 192.168.15.129, length 46
15:28:48.767941 ARP, Request who-has 192.168.15.22 (Broadcast) tell 192.168.15.129, length 46
15:28:48.767954 ARP, Request who-has 192.168.15.23 (Broadcast) tell 192.168.15.129, length 46
15:28:48.767958 ARP, Request who-has 192.168.15.24 (Broadcast) tell 192.168.15.129, length 46
15:28:48.767961 ARP, Request who-has 192.168.15.25 (Broadcast) tell 192.168.15.129, length 46
15:28:48.767968 ARP, Request who-has 192.168.15.28 (Broadcast) tell 192.168.15.129, length 46
15:28:48.767986 ARP, Request who-has 192.168.15.35 (Broadcast) tell 192.168.15.129, length 46
15:28:48.768127 ARP, Request who-has 192.168.15.36 (Broadcast) tell 192.168.15.129, length 46
15:28:48.768313 ARP, Request who-has 192.168.15.37 (Broadcast) tell 192.168.15.129, length 46
15:28:48.768326 ARP, Request who-has 192.168.15.38 (Broadcast) tell 192.168.15.129, length 46
15:28:48.862559 ARP, Request who-has 192.168.15.41 (Broadcast) tell 192.168.15.129, length 46
15:28:48.862609 ARP, Request who-has 192.168.15.42 (Broadcast) tell 192.168.15.129, length 46
15:28:48.862768 ARP, Request who-has 192.168.15.43 (Broadcast) tell 192.168.15.129, length 46
15:28:48.862791 ARP, Request who-has 192.168.15.44 (Broadcast) tell 192.168.15.129, length 46
15:28:48.862962 ARP, Request who-has 192.168.15.45 (Broadcast) tell 192.168.15.129, length 46
15:28:48.866579 ARP, Request who-has 192.168.15.48 (Broadcast) tell 192.168.15.129, length 46
15:28:48.866628 ARP, Request who-has 192.168.15.49 (Broadcast) tell 192.168.15.129, length 46
15:28:48.869480 ARP, Request who-has 192.168.15.35 (Broadcast) tell 192.168.15.129, length 46
15:28:48.869832 ARP, Request who-has 192.168.15.36 (Broadcast) tell 192.168.15.129, length 46
15:28:48.870121 ARP, Request who-has 192.168.15.37 (Broadcast) tell 192.168.15.129, length 46
15:28:48.870315 ARP, Request who-has 192.168.15.38 (Broadcast) tell 192.168.15.129, length 46
15:28:48.870489 ARP, Request who-has 192.168.15.52 (Broadcast) tell 192.168.15.129, length 46
15:28:48.963237 ARP, Request who-has 192.168.15.41 (Broadcast) tell 192.168.15.129, length 46
15:28:48.963492 ARP, Request who-has 192.168.15.42 (Broadcast) tell 192.168.15.129, length 46
15:28:48.963630 ARP, Request who-has 192.168.15.43 (Broadcast) tell 192.168.15.129, length 46
15:28:48.963746 ARP, Request who-has 192.168.15.44 (Broadcast) tell 192.168.15.129, length 46
15:28:48.963855 ARP, Request who-has 192.168.15.45 (Broadcast) tell 192.168.15.129, length 46
15:28:48.967238 ARP, Request who-has 192.168.15.48 (Broadcast) tell 192.168.15.129, length 46
15:28:48.967455 ARP, Request who-has 192.168.15.49 (Broadcast) tell 192.168.15.129, length 46
15:28:48.970395 ARP, Request who-has 192.168.15.59 (Broadcast) tell 192.168.15.129, length 46
15:28:48.970425 ARP, Request who-has 192.168.15.60 (Broadcast) tell 192.168.15.129, length 46
15:28:48.970428 ARP, Request who-has 192.168.15.61 (Broadcast) tell 192.168.15.129, length 46
15:28:48.970436 ARP, Request who-has 192.168.15.62 (Broadcast) tell 192.168.15.129, length 46
15:28:48.973285 ARP, Request who-has 192.168.15.52 (Broadcast) tell 192.168.15.129, length 46
15:28:49.064464 ARP, Request who-has 192.168.15.67 (Broadcast) tell 192.168.15.129, length 46
15:28:49.064501 ARP, Request who-has 192.168.15.68 (Broadcast) tell 192.168.15.129, length 46
15:28:49.064552 ARP, Request who-has 192.168.15.69 (Broadcast) tell 192.168.15.129, length 46
15:28:49.064769 ARP, Request who-has 192.168.15.70 (Broadcast) tell 192.168.15.129, length 46
15:28:49.064851 ARP, Request who-has 192.168.15.71 (Broadcast) tell 192.168.15.129, length 46
15:28:49.068233 ARP, Request who-has 192.168.15.74 (Broadcast) tell 192.168.15.129, length 46
15:28:49.068264 ARP, Request who-has 192.168.15.75 (Broadcast) tell 192.168.15.129, length 46
15:28:49.071505 ARP, Request who-has 192.168.15.59 (Broadcast) tell 192.168.15.129, length 46
15:28:49.071937 ARP, Request who-has 192.168.15.60 (Broadcast) tell 192.168.15.129, length 46
15:28:49.072128 ARP, Request who-has 192.168.15.61 (Broadcast) tell 192.168.15.129, length 46
15:28:49.072363 ARP, Request who-has 192.168.15.62 (Broadcast) tell 192.168.15.129, length 46
15:28:49.074677 ARP, Request who-has 192.168.15.80 (Broadcast) tell 192.168.15.129, length 46
15:28:49.094689 IP 192.168.15.128 > 8.8.8.8: ICMP echo request, id 13086, seq 6888, length 64
15:28:49.126742 IP 8.8.8.8 > 192.168.15.128: ICMP echo reply, id 13086, seq 6888, length 64
15:28:49.165014 ARP, Request who-has 192.168.15.67 (Broadcast) tell 192.168.15.129, length 46
15:28:49.165185 ARP, Request who-has 192.168.15.68 (Broadcast) tell 192.168.15.129, length 46
15:28:49.165410 ARP, Request who-has 192.168.15.69 (Broadcast) tell 192.168.15.129, length 46
15:28:49.165538 ARP, Request who-has 192.168.15.70 (Broadcast) tell 192.168.15.129, length 46
15:28:49.165922 ARP, Request who-has 192.168.15.71 (Broadcast) tell 192.168.15.129, length 46
15:28:49.168955 ARP, Request who-has 192.168.15.74 (Broadcast) tell 192.168.15.129, length 46
15:28:49.169143 ARP, Request who-has 192.168.15.75 (Broadcast) tell 192.168.15.129, length 46
15:28:49.171951 ARP, Request who-has 192.168.15.87 (Broadcast) tell 192.168.15.129, length 46
15:28:49.171995 ARP, Request who-has 192.168.15.88 (Broadcast) tell 192.168.15.129, length 46
15:28:49.172078 ARP, Request who-has 192.168.15.89 (Broadcast) tell 192.168.15.129, length 46
15:28:49.172307 ARP, Request who-has 192.168.15.90 (Broadcast) tell 192.168.15.129, length 46
15:28:49.174934 ARP, Request who-has 192.168.15.80 (Broadcast) tell 192.168.15.129, length 46
15:28:49.265575 ARP, Request who-has 192.168.15.95 (Broadcast) tell 192.168.15.129, length 46
15:28:49.265711 ARP, Request who-has 192.168.15.96 (Broadcast) tell 192.168.15.129, length 46
15:28:49.268561 ARP, Request who-has 192.168.15.99 (Broadcast) tell 192.168.15.129, length 46
15:28:49.268613 ARP, Request who-has 192.168.15.100 (Broadcast) tell 192.168.15.129, length 46
15:28:49.268619 ARP, Request who-has 192.168.15.101 (Broadcast) tell 192.168.15.129, length 46
15:28:49.271579 ARP, Request who-has 192.168.15.104 (Broadcast) tell 192.168.15.129, length 46
15:28:49.271616 ARP, Request who-has 192.168.15.105 (Broadcast) tell 192.168.15.129, length 46
15:28:49.274543 ARP, Request who-has 192.168.15.87 (Broadcast) tell 192.168.15.129, length 46
15:28:49.274956 ARP, Request who-has 192.168.15.88 (Broadcast) tell 192.168.15.129, length 46
15:28:49.277260 ARP, Request who-has 192.168.15.89 (Broadcast) tell 192.168.15.129, length 46
15:28:49.277539 ARP, Request who-has 192.168.15.90 (Broadcast) tell 192.168.15.129, length 46
15:28:49.280581 ARP, Request who-has 192.168.15.110 (Broadcast) tell 192.168.15.129, length 46
15:28:49.366302 ARP, Request who-has 192.168.15.95 (Broadcast) tell 192.168.15.129, length 46
15:28:49.366674 ARP, Request who-has 192.168.15.96 (Broadcast) tell 192.168.15.129, length 46
15:28:49.369297 ARP, Request who-has 192.168.15.99 (Broadcast) tell 192.168.15.129, length 46
15:28:49.369651 ARP, Request who-has 192.168.15.100 (Broadcast) tell 192.168.15.129, length 46
15:28:49.369850 ARP, Request who-has 192.168.15.101 (Broadcast) tell 192.168.15.129, length 46
15:28:49.372392 ARP, Request who-has 192.168.15.104 (Broadcast) tell 192.168.15.129, length 46
15:28:49.372757 ARP, Request who-has 192.168.15.105 (Broadcast) tell 192.168.15.129, length 46
15:28:49.376826 ARP, Request who-has 192.168.15.119 (Broadcast) tell 192.168.15.129, length 46
15:28:49.376876 ARP, Request who-has 192.168.15.120 (Broadcast) tell 192.168.15.129, length 46
15:28:49.380356 ARP, Request who-has 192.168.15.123 (Broadcast) tell 192.168.15.129, length 46
15:28:49.380407 ARP, Request who-has 192.168.15.124 (Broadcast) tell 192.168.15.129, length 46
15:28:49.383362 ARP, Request who-has 192.168.15.110 (Broadcast) tell 192.168.15.129, length 46
15:28:49.466639 ARP, Request who-has 192.168.15.130 (Broadcast) tell 192.168.15.129, length 46
15:28:49.469805 ARP, Request who-has 192.168.15.133 (Broadcast) tell 192.168.15.129, length 46
15:28:49.469854 ARP, Request who-has 192.168.15.134 (Broadcast) tell 192.168.15.129, length 46
15:28:49.469861 ARP, Request who-has 192.168.15.135 (Broadcast) tell 192.168.15.129, length 46
15:28:49.469907 ARP, Request who-has 192.168.15.136 (Broadcast) tell 192.168.15.129, length 46
15:28:49.473877 ARP, Request who-has 192.168.15.139 (Broadcast) tell 192.168.15.129, length 46
15:28:49.473921 ARP, Request who-has 192.168.15.140 (Broadcast) tell 192.168.15.129, length 46
15:28:49.477782 ARP, Request who-has 192.168.15.119 (Broadcast) tell 192.168.15.129, length 46
15:28:49.478107 ARP, Request who-has 192.168.15.120 (Broadcast) tell 192.168.15.129, length 46
15:28:49.480869 ARP, Request who-has 192.168.15.123 (Broadcast) tell 192.168.15.129, length 46
15:28:49.481249 ARP, Request who-has 192.168.15.124 (Broadcast) tell 192.168.15.129, length 46
15:28:49.483996 ARP, Request who-has 192.168.15.147 (Broadcast) tell 192.168.15.129, length 46
15:28:49.567743 ARP, Request who-has 192.168.15.130 (Broadcast) tell 192.168.15.129, length 46
15:28:49.570709 ARP, Request who-has 192.168.15.133 (Broadcast) tell 192.168.15.129, length 46
15:28:49.570862 ARP, Request who-has 192.168.15.134 (Broadcast) tell 192.168.15.129, length 46
15:28:49.571032 ARP, Request who-has 192.168.15.135 (Broadcast) tell 192.168.15.129, length 46
15:28:49.571129 ARP, Request who-has 192.168.15.136 (Broadcast) tell 192.168.15.129, length 46
15:28:49.574710 ARP, Request who-has 192.168.15.139 (Broadcast) tell 192.168.15.129, length 46
15:28:49.574859 ARP, Request who-has 192.168.15.140 (Broadcast) tell 192.168.15.129, length 46
15:28:49.578704 ARP, Request who-has 192.168.15.156 (Broadcast) tell 192.168.15.129, length 46
15:28:49.578721 ARP, Request who-has 192.168.15.157 (Broadcast) tell 192.168.15.129, length 46
15:28:49.581900 ARP, Request who-has 192.168.15.160 (Broadcast) tell 192.168.15.129, length 46
15:28:49.581918 ARP, Request who-has 192.168.15.161 (Broadcast) tell 192.168.15.129, length 46
15:28:49.584863 ARP, Request who-has 192.168.15.147 (Broadcast) tell 192.168.15.129, length 46
15:28:49.668467 ARP, Request who-has 192.168.15.2 (Broadcast) tell 192.168.15.129, length 46
15:28:49.668956 ARP, Reply 192.168.15.2 is-at 00:50:56:e8:23:fc (oui Unknown), length 46
15:28:49.671430 ARP, Request who-has 192.168.15.168 (Broadcast) tell 192.168.15.129, length 46
15:28:49.671484 ARP, Request who-has 192.168.15.169 (Broadcast) tell 192.168.15.129, length 46
15:28:49.671496 ARP, Request who-has 192.168.15.170 (Broadcast) tell 192.168.15.129, length 46
15:28:49.671541 ARP, Request who-has 192.168.15.171 (Broadcast) tell 192.168.15.129, length 46
15:28:49.675454 ARP, Request who-has 192.168.15.174 (Broadcast) tell 192.168.15.129, length 46
15:28:49.675501 ARP, Request who-has 192.168.15.175 (Broadcast) tell 192.168.15.129, length 46
15:28:49.679594 ARP, Request who-has 192.168.15.156 (Broadcast) tell 192.168.15.129, length 46
15:28:49.680014 ARP, Request who-has 192.168.15.157 (Broadcast) tell 192.168.15.129, length 46
15:28:49.682588 ARP, Request who-has 192.168.15.160 (Broadcast) tell 192.168.15.129, length 46
15:28:49.683036 ARP, Request who-has 192.168.15.161 (Broadcast) tell 192.168.15.129, length 46
15:28:49.685594 ARP, Request who-has 192.168.15.182 (Broadcast) tell 192.168.15.129, length 46
15:28:49.775210 ARP, Request who-has 192.168.15.168 (Broadcast) tell 192.168.15.129, length 46
15:28:49.775670 ARP, Request who-has 192.168.15.169 (Broadcast) tell 192.168.15.129, length 46
15:28:49.776022 ARP, Request who-has 192.168.15.170 (Broadcast) tell 192.168.15.129, length 46
15:28:49.776302 ARP, Request who-has 192.168.15.171 (Broadcast) tell 192.168.15.129, length 46
15:28:49.776643 ARP, Request who-has 192.168.15.185 (Broadcast) tell 192.168.15.129, length 46
15:28:49.776674 ARP, Request who-has 192.168.15.186 (Broadcast) tell 192.168.15.129, length 46
15:28:49.776679 ARP, Request who-has 192.168.15.187 (Broadcast) tell 192.168.15.129, length 46
15:28:49.776691 ARP, Request who-has 192.168.15.188 (Broadcast) tell 192.168.15.129, length 46
15:28:49.776695 ARP, Request who-has 192.168.15.189 (Broadcast) tell 192.168.15.129, length 46
15:28:49.776703 ARP, Request who-has 192.168.15.190 (Broadcast) tell 192.168.15.129, length 46
15:28:49.776708 ARP, Request who-has 192.168.15.191 (Broadcast) tell 192.168.15.129, length 46
15:28:49.776715 ARP, Request who-has 192.168.15.192 (Broadcast) tell 192.168.15.129, length 46
15:28:49.776719 ARP, Request who-has 192.168.15.193 (Broadcast) tell 192.168.15.129, length 46
15:28:49.776726 ARP, Request who-has 192.168.15.194 (Broadcast) tell 192.168.15.129, length 46
15:28:49.776730 ARP, Request who-has 192.168.15.195 (Broadcast) tell 192.168.15.129, length 46
15:28:49.776738 ARP, Request who-has 192.168.15.196 (Broadcast) tell 192.168.15.129, length 46
15:28:49.776751 ARP, Request who-has 192.168.15.197 (Broadcast) tell 192.168.15.129, length 46
15:28:49.776835 ARP, Request who-has 192.168.15.198 (Broadcast) tell 192.168.15.129, length 46
15:28:49.776845 ARP, Request who-has 192.168.15.199 (Broadcast) tell 192.168.15.129, length 46
15:28:49.776854 ARP, Request who-has 192.168.15.200 (Broadcast) tell 192.168.15.129, length 46
15:28:49.777057 ARP, Request who-has 192.168.15.201 (Broadcast) tell 192.168.15.129, length 46
15:28:49.777071 ARP, Request who-has 192.168.15.202 (Broadcast) tell 192.168.15.129, length 46
15:28:49.777131 ARP, Request who-has 192.168.15.203 (Broadcast) tell 192.168.15.129, length 46
15:28:49.777166 ARP, Request who-has 192.168.15.204 (Broadcast) tell 192.168.15.129, length 46
15:28:49.777358 ARP, Request who-has 192.168.15.205 (Broadcast) tell 192.168.15.129, length 46
15:28:49.777368 ARP, Request who-has 192.168.15.206 (Broadcast) tell 192.168.15.129, length 46
15:28:49.777524 ARP, Request who-has 192.168.15.207 (Broadcast) tell 192.168.15.129, length 46
15:28:49.777533 ARP, Request who-has 192.168.15.208 (Broadcast) tell 192.168.15.129, length 46
15:28:49.777684 ARP, Request who-has 192.168.15.209 (Broadcast) tell 192.168.15.129, length 46
15:28:49.777693 ARP, Request who-has 192.168.15.210 (Broadcast) tell 192.168.15.129, length 46
15:28:49.777895 ARP, Request who-has 192.168.15.211 (Broadcast) tell 192.168.15.129, length 46
15:28:49.777908 ARP, Request who-has 192.168.15.212 (Broadcast) tell 192.168.15.129, length 46
15:28:49.778032 ARP, Request who-has 192.168.15.213 (Broadcast) tell 192.168.15.129, length 46
15:28:49.778045 ARP, Request who-has 192.168.15.214 (Broadcast) tell 192.168.15.129, length 46
15:28:49.778217 ARP, Request who-has 192.168.15.215 (Broadcast) tell 192.168.15.129, length 46
15:28:49.778227 ARP, Request who-has 192.168.15.216 (Broadcast) tell 192.168.15.129, length 46
15:28:49.778354 ARP, Request who-has 192.168.15.217 (Broadcast) tell 192.168.15.129, length 46
15:28:49.778363 ARP, Request who-has 192.168.15.218 (Broadcast) tell 192.168.15.129, length 46
15:28:49.779178 ARP, Request who-has 192.168.15.219 (Broadcast) tell 192.168.15.129, length 46
15:28:49.779200 ARP, Request who-has 192.168.15.220 (Broadcast) tell 192.168.15.129, length 46
15:28:49.779205 ARP, Request who-has 192.168.15.221 (Broadcast) tell 192.168.15.129, length 46
15:28:49.779278 ARP, Request who-has 192.168.15.222 (Broadcast) tell 192.168.15.129, length 46
15:28:49.779286 ARP, Request who-has 192.168.15.223 (Broadcast) tell 192.168.15.129, length 46
15:28:49.779290 ARP, Request who-has 192.168.15.224 (Broadcast) tell 192.168.15.129, length 46
15:28:49.779299 ARP, Request who-has 192.168.15.225 (Broadcast) tell 192.168.15.129, length 46
15:28:49.779307 ARP, Request who-has 192.168.15.226 (Broadcast) tell 192.168.15.129, length 46
15:28:49.779315 ARP, Request who-has 192.168.15.227 (Broadcast) tell 192.168.15.129, length 46
15:28:49.779323 ARP, Request who-has 192.168.15.228 (Broadcast) tell 192.168.15.129, length 46
15:28:49.779326 ARP, Request who-has 192.168.15.229 (Broadcast) tell 192.168.15.129, length 46
15:28:49.779541 ARP, Request who-has 192.168.15.230 (Broadcast) tell 192.168.15.129, length 46
15:28:49.782378 ARP, Request who-has 192.168.15.174 (Broadcast) tell 192.168.15.129, length 46
15:28:49.782708 ARP, Request who-has 192.168.15.175 (Broadcast) tell 192.168.15.129, length 46
15:28:49.782945 ARP, Request who-has 192.168.15.233 (Broadcast) tell 192.168.15.129, length 46
15:28:49.783049 ARP, Request who-has 192.168.15.234 (Broadcast) tell 192.168.15.129, length 46
15:28:49.783066 ARP, Request who-has 192.168.15.235 (Broadcast) tell 192.168.15.129, length 46
15:28:49.783069 ARP, Request who-has 192.168.15.236 (Broadcast) tell 192.168.15.129, length 46
15:28:49.783077 ARP, Request who-has 192.168.15.237 (Broadcast) tell 192.168.15.129, length 46
15:28:49.783085 ARP, Request who-has 192.168.15.238 (Broadcast) tell 192.168.15.129, length 46
15:28:49.783218 ARP, Request who-has 192.168.15.239 (Broadcast) tell 192.168.15.129, length 46
15:28:49.783266 ARP, Request who-has 192.168.15.240 (Broadcast) tell 192.168.15.129, length 46
15:28:49.783744 ARP, Request who-has 192.168.15.241 (Broadcast) tell 192.168.15.129, length 46
15:28:49.783768 ARP, Request who-has 192.168.15.242 (Broadcast) tell 192.168.15.129, length 46
15:28:49.783776 ARP, Request who-has 192.168.15.243 (Broadcast) tell 192.168.15.129, length 46
15:28:49.783780 ARP, Request who-has 192.168.15.244 (Broadcast) tell 192.168.15.129, length 46
15:28:49.783788 ARP, Request who-has 192.168.15.245 (Broadcast) tell 192.168.15.129, length 46
15:28:49.783853 ARP, Request who-has 192.168.15.246 (Broadcast) tell 192.168.15.129, length 46
15:28:49.783862 ARP, Request who-has 192.168.15.247 (Broadcast) tell 192.168.15.129, length 46
15:28:49.784311 ARP, Request who-has 192.168.15.248 (Broadcast) tell 192.168.15.129, length 46
15:28:49.784332 ARP, Request who-has 192.168.15.249 (Broadcast) tell 192.168.15.129, length 46
15:28:49.784336 ARP, Request who-has 192.168.15.250 (Broadcast) tell 192.168.15.129, length 46
15:28:49.784344 ARP, Request who-has 192.168.15.251 (Broadcast) tell 192.168.15.129, length 46
15:28:49.784348 ARP, Request who-has 192.168.15.252 (Broadcast) tell 192.168.15.129, length 46
15:28:49.787305 ARP, Request who-has 192.168.15.182 (Broadcast) tell 192.168.15.129, length 46
15:28:49.787584 ARP, Request who-has 192.168.15.255 (Broadcast) tell 192.168.15.129, length 46
15:28:49.787602 ARP, Request who-has 192.168.15.0 (Broadcast) tell 192.168.15.129, length 46
15:28:49.875666 ARP, Request who-has 192.168.15.17 (Broadcast) tell 192.168.15.129, length 46
15:28:49.875801 ARP, Request who-has 192.168.15.18 (Broadcast) tell 192.168.15.129, length 46
15:28:49.875860 ARP, Request who-has 192.168.15.26 (Broadcast) tell 192.168.15.129, length 46
15:28:49.879064 ARP, Request who-has 192.168.15.185 (Broadcast) tell 192.168.15.129, length 46
15:28:49.879372 ARP, Request who-has 192.168.15.186 (Broadcast) tell 192.168.15.129, length 46
15:28:49.879619 ARP, Request who-has 192.168.15.187 (Broadcast) tell 192.168.15.129, length 46
15:28:49.879850 ARP, Request who-has 192.168.15.188 (Broadcast) tell 192.168.15.129, length 46
15:28:49.880024 ARP, Request who-has 192.168.15.189 (Broadcast) tell 192.168.15.129, length 46
15:28:49.880268 ARP, Request who-has 192.168.15.190 (Broadcast) tell 192.168.15.129, length 46
15:28:49.880503 ARP, Request who-has 192.168.15.191 (Broadcast) tell 192.168.15.129, length 46
15:28:49.880784 ARP, Request who-has 192.168.15.192 (Broadcast) tell 192.168.15.129, length 46
15:28:49.881039 ARP, Request who-has 192.168.15.193 (Broadcast) tell 192.168.15.129, length 46
15:28:49.881302 ARP, Request who-has 192.168.15.194 (Broadcast) tell 192.168.15.129, length 46
15:28:49.881592 ARP, Request who-has 192.168.15.195 (Broadcast) tell 192.168.15.129, length 46
15:28:49.881897 ARP, Request who-has 192.168.15.196 (Broadcast) tell 192.168.15.129, length 46
15:28:49.882158 ARP, Request who-has 192.168.15.197 (Broadcast) tell 192.168.15.129, length 46
15:28:49.882406 ARP, Request who-has 192.168.15.198 (Broadcast) tell 192.168.15.129, length 46
15:28:49.882597 ARP, Request who-has 192.168.15.199 (Broadcast) tell 192.168.15.129, length 46
15:28:49.882866 ARP, Request who-has 192.168.15.200 (Broadcast) tell 192.168.15.129, length 46
15:28:49.883060 ARP, Request who-has 192.168.15.201 (Broadcast) tell 192.168.15.129, length 46
15:28:49.883237 ARP, Request who-has 192.168.15.202 (Broadcast) tell 192.168.15.129, length 46
15:28:49.883406 ARP, Request who-has 192.168.15.203 (Broadcast) tell 192.168.15.129, length 46
15:28:49.883585 ARP, Request who-has 192.168.15.204 (Broadcast) tell 192.168.15.129, length 46
15:28:49.883864 ARP, Request who-has 192.168.15.205 (Broadcast) tell 192.168.15.129, length 46
15:28:49.884099 ARP, Request who-has 192.168.15.206 (Broadcast) tell 192.168.15.129, length 46
15:28:49.884298 ARP, Request who-has 192.168.15.207 (Broadcast) tell 192.168.15.129, length 46
15:28:49.884469 ARP, Request who-has 192.168.15.208 (Broadcast) tell 192.168.15.129, length 46
15:28:49.884673 ARP, Request who-has 192.168.15.209 (Broadcast) tell 192.168.15.129, length 46
15:28:49.884879 ARP, Request who-has 192.168.15.210 (Broadcast) tell 192.168.15.129, length 46
15:28:49.885048 ARP, Request who-has 192.168.15.211 (Broadcast) tell 192.168.15.129, length 46
15:28:49.885229 ARP, Request who-has 192.168.15.212 (Broadcast) tell 192.168.15.129, length 46
15:28:49.885394 ARP, Request who-has 192.168.15.213 (Broadcast) tell 192.168.15.129, length 46
15:28:49.885597 ARP, Request who-has 192.168.15.214 (Broadcast) tell 192.168.15.129, length 46
15:28:49.885807 ARP, Request who-has 192.168.15.215 (Broadcast) tell 192.168.15.129, length 46
15:28:49.885987 ARP, Request who-has 192.168.15.216 (Broadcast) tell 192.168.15.129, length 46
15:28:49.886165 ARP, Request who-has 192.168.15.217 (Broadcast) tell 192.168.15.129, length 46
15:28:49.886352 ARP, Request who-has 192.168.15.218 (Broadcast) tell 192.168.15.129, length 46
15:28:49.886521 ARP, Request who-has 192.168.15.219 (Broadcast) tell 192.168.15.129, length 46
15:28:49.886689 ARP, Request who-has 192.168.15.220 (Broadcast) tell 192.168.15.129, length 46
15:28:49.886935 ARP, Request who-has 192.168.15.221 (Broadcast) tell 192.168.15.129, length 46
15:28:49.887172 ARP, Request who-has 192.168.15.30 (Broadcast) tell 192.168.15.129, length 46
15:28:49.887403 ARP, Request who-has 192.168.15.222 (Broadcast) tell 192.168.15.129, length 46
15:28:49.887719 ARP, Request who-has 192.168.15.223 (Broadcast) tell 192.168.15.129, length 46
15:28:49.887954 ARP, Request who-has 192.168.15.224 (Broadcast) tell 192.168.15.129, length 46
15:28:49.888192 ARP, Request who-has 192.168.15.225 (Broadcast) tell 192.168.15.129, length 46
15:28:49.888392 ARP, Request who-has 192.168.15.226 (Broadcast) tell 192.168.15.129, length 46
15:28:49.888625 ARP, Request who-has 192.168.15.227 (Broadcast) tell 192.168.15.129, length 46
15:28:49.888893 ARP, Request who-has 192.168.15.228 (Broadcast) tell 192.168.15.129, length 46
15:28:49.889144 ARP, Request who-has 192.168.15.229 (Broadcast) tell 192.168.15.129, length 46
15:28:49.889427 ARP, Request who-has 192.168.15.230 (Broadcast) tell 192.168.15.129, length 46
15:28:49.889689 ARP, Request who-has 192.168.15.233 (Broadcast) tell 192.168.15.129, length 46
15:28:49.889973 ARP, Request who-has 192.168.15.234 (Broadcast) tell 192.168.15.129, length 46
15:28:49.890163 ARP, Request who-has 192.168.15.235 (Broadcast) tell 192.168.15.129, length 46
15:28:49.890334 ARP, Request who-has 192.168.15.236 (Broadcast) tell 192.168.15.129, length 46
15:28:49.890503 ARP, Request who-has 192.168.15.237 (Broadcast) tell 192.168.15.129, length 46
15:28:49.890671 ARP, Request who-has 192.168.15.238 (Broadcast) tell 192.168.15.129, length 46
15:28:49.890841 ARP, Request who-has 192.168.15.239 (Broadcast) tell 192.168.15.129, length 46
