13:31:29.232848 IP 192.168.15.128 > 8.8.8.8: ICMP echo request, id 13086, seq 88, length 64
13:31:29.367227 IP 8.8.8.8 > 192.168.15.128: ICMP echo reply, id 13086, seq 88, length 64
13:31:29.598282 ARP, Request who-has 192.168.15.2 tell 192.168.15.1, length 46
13:31:30.226535 ARP, Request who-has 192.168.15.2 tell 192.168.15.1, length 46
13:31:30.243269 IP 192.168.15.128 > 8.8.8.8: ICMP echo request, id 13086, seq 89, length 64
13:31:30.339860 IP 8.8.8.8 > 192.168.15.128: ICMP echo reply, id 13086, seq 89, length 64
13:31:31.227809 ARP, Request who-has 192.168.15.2 tell 192.168.15.1, length 46
13:31:31.252909 IP 192.168.15.128 > 8.8.8.8: ICMP echo request, id 13086, seq 90, length 64
13:31:31.289417 IP 8.8.8.8 > 192.168.15.128: ICMP echo reply, id 13086, seq 90, length 64
13:31:32.262180 IP 192.168.15.128 > 8.8.8.8: ICMP echo request, id 13086, seq 91, length 64
13:31:32.300858 IP 8.8.8.8 > 192.168.15.128: ICMP echo reply, id 13086, seq 91, length 64
13:31:33.271637 IP 192.168.15.128 > 8.8.8.8: ICMP echo request, id 13086, seq 92, length 64
13:31:33.314978 IP 8.8.8.8 > 192.168.15.128: ICMP echo reply, id 13086, seq 92, length 64
13:31:34.281755 IP 192.168.15.128 > 8.8.8.8: ICMP echo request, id 13086, seq 93, length 64
13:31:34.320584 IP 8.8.8.8 > 192.168.15.128: ICMP echo reply, id 13086, seq 93, length 64
13:31:35.301791 IP 192.168.15.128 > 8.8.8.8: ICMP echo request, id 13086, seq 94, length 64
13:31:35.337913 IP 8.8.8.8 > 192.168.15.128: ICMP echo reply, id 13086, seq 94, length 64
13:31:35.603687 ARP, Request who-has 192.168.15.2 tell 192.168.15.1, length 46
13:31:36.227556 ARP, Request who-has 192.168.15.2 tell 192.168.15.1, length 46
13:31:36.311280 IP 192.168.15.128 > 8.8.8.8: ICMP echo request, id 13086, seq 95, length 64
13:31:36.433598 ARP, Request who-has 192.168.15.128 (Broadcast) tell 192.168.15.129, length 46
13:31:36.434477 ARP, Reply 192.168.15.128 is-at 00:0c:29:a1:c5:30 (oui Unknown), length 46
13:31:36.437412 IP 8.8.8.8 > 192.168.15.128: ICMP echo reply, id 13086, seq 95, length 64
13:31:36.635461 IP 192.168.15.129.45356 > 192.168.15.2.domain: 32662+ PTR? 128.15.168.192.in-addr.arpa. (45)
13:31:36.639333 IP 192.168.15.2.domain > 192.168.15.129.45356: 32662 NXDomain 0/0/0 (45)
13:31:36.641245 IP 192.168.15.129.53608 > 192.168.15.128.pop3s: Flags [S], seq 2107215121, win 1024, options [mss 1460], length 0
13:31:36.641272 IP 192.168.15.129.53608 > 192.168.15.128.smux: Flags [S], seq 2107215121, win 1024, options [mss 1460], length 0
13:31:36.641380 IP 192.168.15.129.53608 > 192.168.15.128.smtp: Flags [S], seq 2107215121, win 1024, options [mss 1460], length 0
13:31:36.641389 IP 192.168.15.129.53608 > 192.168.15.128.rtsp: Flags [S], seq 2107215121, win 1024, options [mss 1460], length 0
13:31:36.641563 IP 192.168.15.129.53608 > 192.168.15.128.1025: Flags [S], seq 2107215121, win 1024, options [mss 1460], length 0
13:31:36.641573 IP 192.168.15.129.53608 > 192.168.15.128.ssh: Flags [S], seq 2107215121, win 1024, options [mss 1460], length 0
13:31:36.641897 IP 192.168.15.129.53608 > 192.168.15.128.3389: Flags [S], seq 2107215121, win 1024, options [mss 1460], length 0
13:31:36.642018 IP 192.168.15.129.53608 > 192.168.15.128.domain: Flags [S], seq 2107215121, win 1024, options [mss 1460], length 0
13:31:36.642096 IP 192.168.15.129.53608 > 192.168.15.128.mysql: Flags [S], seq 2107215121, win 1024, options [mss 1460], length 0
13:31:36.642152 IP 192.168.15.129.53608 > 192.168.15.128.microsoft-ds: Flags [S], seq 2107215121, win 1024, options [mss 1460], length 0
13:31:36.642251 IP 192.168.15.128.pop3s > 192.168.15.129.53608: Flags [R.], seq 0, ack 2107215122, win 0, length 0
13:31:36.642403 IP 192.168.15.128.3389 > 192.168.15.129.53608: Flags [R.], seq 0, ack 2107215122, win 0, length 0
13:31:36.642554 IP 192.168.15.128.domain > 192.168.15.129.53608: Flags [S.], seq 3469726150, ack 2107215122, win 5840, options [mss 1460], length 0
13:31:36.642746 IP 192.168.15.128.mysql > 192.168.15.129.53608: Flags [S.], seq 3470153291, ack 2107215122, win 5840, options [mss 1460], length 0
13:31:36.642754 IP 192.168.15.128.microsoft-ds > 192.168.15.129.53608: Flags [S.], seq 3471773365, ack 2107215122, win 5840, options [mss 1460], length 0
13:31:36.643012 IP 192.168.15.128.smux > 192.168.15.129.53608: Flags [R.], seq 0, ack 2107215122, win 0, length 0
13:31:36.643022 IP 192.168.15.128.smtp > 192.168.15.129.53608: Flags [S.], seq 3470398463, ack 2107215122, win 5840, options [mss 1460], length 0
13:31:36.643025 IP 192.168.15.128.rtsp > 192.168.15.129.53608: Flags [R.], seq 0, ack 2107215122, win 0, length 0
13:31:36.643270 IP 192.168.15.128.1025 > 192.168.15.129.53608: Flags [R.], seq 0, ack 2107215122, win 0, length 0
13:31:36.643610 IP 192.168.15.128.ssh > 192.168.15.129.53608: Flags [S.], seq 3463242776, ack 2107215122, win 5840, options [mss 1460], length 0
13:31:36.643770 IP 192.168.15.129.53608 > 192.168.15.128.domain: Flags [R], seq 2107215122, win 0, length 0
13:31:36.643848 IP 192.168.15.129.53608 > 192.168.15.128.ssh: Flags [R], seq 2107215122, win 0, length 0
13:31:36.644337 IP 192.168.15.129.53608 > 192.168.15.128.mysql: Flags [R], seq 2107215122, win 0, length 0
13:31:36.644470 IP 192.168.15.129.53608 > 192.168.15.128.microsoft-ds: Flags [R], seq 2107215122, win 0, length 0
13:31:36.645133 IP 192.168.15.129.53608 > 192.168.15.128.smtp: Flags [R], seq 2107215122, win 0, length 0
13:31:37.226511 ARP, Request who-has 192.168.15.2 tell 192.168.15.1, length 46
13:31:37.320841 IP 192.168.15.128 > 8.8.8.8: ICMP echo request, id 13086, seq 96, length 64
13:31:37.354703 IP 8.8.8.8 > 192.168.15.128: ICMP echo reply, id 13086, seq 96, length 64
13:31:37.743780 IP 192.168.15.129.53609 > 192.168.15.128.rtsp: Flags [S], seq 2107149584, win 1024, options [mss 1460], length 0
13:31:37.743914 IP 192.168.15.129.53609 > 192.168.15.128.smtp: Flags [S], seq 2107149584, win 1024, options [mss 1460], length 0
13:31:37.744008 IP 192.168.15.129.53609 > 192.168.15.128.smux: Flags [S], seq 2107149584, win 1024, options [mss 1460], length 0
13:31:37.744073 IP 192.168.15.129.53608 > 192.168.15.128.imap2: Flags [S], seq 2107215121, win 1024, options [mss 1460], length 0
13:31:37.744333 IP 192.168.15.128.rtsp > 192.168.15.129.53609: Flags [R.], seq 0, ack 2107149585, win 0, length 0
13:31:37.744398 IP 192.168.15.128.smtp > 192.168.15.129.53609: Flags [S.], seq 3491391839, ack 2107149585, win 5840, options [mss 1460], length 0
13:31:37.744496 IP 192.168.15.129.53608 > 192.168.15.128.256: Flags [S], seq 2107215121, win 1024, options [mss 1460], length 0
13:31:37.744553 IP 192.168.15.129.53608 > 192.168.15.128.sunrpc: Flags [S], seq 2107215121, win 1024, options [mss 1460], length 0
13:31:37.744652 IP 192.168.15.128.smux > 192.168.15.129.53609: Flags [R.], seq 0, ack 2107149585, win 0, length 0
13:31:37.744709 IP 192.168.15.128.imap2 > 192.168.15.129.53608: Flags [R.], seq 0, ack 2107215122, win 0, length 0
13:31:37.744762 IP 192.168.15.128.256 > 192.168.15.129.53608: Flags [R.], seq 0, ack 2107215122, win 0, length 0
13:31:37.744865 IP 192.168.15.129.53609 > 192.168.15.128.smtp: Flags [R], seq 2107149585, win 0, length 0
13:31:37.744956 IP 192.168.15.128.sunrpc > 192.168.15.129.53608: Flags [S.], seq 3489471822, ack 2107215122, win 5840, options [mss 1460], length 0
13:31:37.745082 IP 192.168.15.129.53608 > 192.168.15.128.http-alt: Flags [S], seq 2107215121, win 1024, options [mss 1460], length 0
13:31:37.745483 IP 192.168.15.128.http-alt > 192.168.15.129.53608: Flags [R.], seq 0, ack 2107215122, win 0, length 0
13:31:37.745596 IP 192.168.15.129.53608 > 192.168.15.128.sunrpc: Flags [R], seq 2107215122, win 0, length 0
13:31:37.745679 IP 192.168.15.129.53608 > 192.168.15.128.ftp: Flags [S], seq 2107215121, win 1024, options [mss 1460], length 0
13:31:37.745739 IP 192.168.15.129.53608 > 192.168.15.128.1723: Flags [S], seq 2107215121, win 1024, options [mss 1460], length 0
13:31:37.745795 IP 192.168.15.129.53608 > 192.168.15.128.8888: Flags [S], seq 2107215121, win 1024, options [mss 1460], length 0
13:31:37.745852 IP 192.168.15.129.53608 > 192.168.15.128.http: Flags [S], seq 2107215121, win 1024, options [mss 1460], length 0
13:31:37.745971 IP 192.168.15.128.ftp > 192.168.15.129.53608: Flags [S.], seq 3483229495, ack 2107215122, win 5840, options [mss 1460], length 0
13:31:37.746175 IP 192.168.15.128.1723 > 192.168.15.129.53608: Flags [R.], seq 0, ack 2107215122, win 0, length 0
13:31:37.746272 IP 192.168.15.128.8888 > 192.168.15.129.53608: Flags [R.], seq 0, ack 2107215122, win 0, length 0
13:31:37.746342 IP 192.168.15.128.http > 192.168.15.129.53608: Flags [S.], seq 3479451023, ack 2107215122, win 5840, options [mss 1460], length 0
13:31:37.746588 IP 192.168.15.129.53608 > 192.168.15.128.submission: Flags [S], seq 2107215121, win 1024, options [mss 1460], length 0
13:31:37.746674 IP 192.168.15.129.53608 > 192.168.15.128.ftp: Flags [R], seq 2107215122, win 0, length 0
13:31:37.746728 IP 192.168.15.129.53608 > 192.168.15.128.http: Flags [R], seq 2107215122, win 0, length 0
13:31:37.746839 IP 192.168.15.129.53608 > 192.168.15.128.telnet: Flags [S], seq 2107215121, win 1024, options [mss 1460], length 0
13:31:37.747027 IP 192.168.15.128.submission > 192.168.15.129.53608: Flags [R.], seq 0, ack 2107215122, win 0, length 0
13:31:37.747200 IP 192.168.15.128.telnet > 192.168.15.129.53608: Flags [S.], seq 3493324938, ack 2107215122, win 5840, options [mss 1460], length 0
13:31:37.747588 IP 192.168.15.129.53608 > 192.168.15.128.auth: Flags [S], seq 2107215121, win 1024, options [mss 1460], length 0
13:31:37.747699 IP 192.168.15.129.53608 > 192.168.15.128.telnet: Flags [R], seq 2107215122, win 0, length 0
13:31:37.747755 IP 192.168.15.129.53608 > 192.168.15.128.loc-srv: Flags [S], seq 2107215121, win 1024, options [mss 1460], length 0
13:31:37.747812 IP 192.168.15.129.53608 > 192.168.15.128.netbios-ssn: Flags [S], seq 2107215121, win 1024, options [mss 1460], length 0
13:31:37.747864 IP 192.168.15.129.53608 > 192.168.15.128.imaps: Flags [S], seq 2107215121, win 1024, options [mss 1460], length 0
13:31:37.748121 IP 192.168.15.128.auth > 192.168.15.129.53608: Flags [R.], seq 0, ack 2107215122, win 0, length 0
13:31:37.748194 IP 192.168.15.128.loc-srv > 192.168.15.129.53608: Flags [R.], seq 0, ack 2107215122, win 0, length 0
13:31:37.748253 IP 192.168.15.128.netbios-ssn > 192.168.15.129.53608: Flags [S.], seq 3490534919, ack 2107215122, win 5840, options [mss 1460], length 0
13:31:37.748362 IP 192.168.15.129.53608 > 192.168.15.128.1720: Flags [S], seq 2107215121, win 1024, options [mss 1460], length 0
13:31:37.748418 IP 192.168.15.129.53608 > 192.168.15.128.pop3: Flags [S], seq 2107215121, win 1024, options [mss 1460], length 0
13:31:37.748519 IP 192.168.15.128.imaps > 192.168.15.129.53608: Flags [R.], seq 0, ack 2107215122, win 0, length 0
13:31:37.748617 IP 192.168.15.129.53608 > 192.168.15.128.netbios-ssn: Flags [R], seq 2107215122, win 0, length 0
13:31:37.748718 IP 192.168.15.128.1720 > 192.168.15.129.53608: Flags [R.], seq 0, ack 2107215122, win 0, length 0
13:31:37.748845 IP 192.168.15.128.pop3 > 192.168.15.129.53608: Flags [R.], seq 0, ack 2107215122, win 0, length 0
13:31:37.748909 IP 192.168.15.129.53608 > 192.168.15.128.5900: Flags [S], seq 2107215121, win 1024, options [mss 1460], length 0
13:31:37.749308 IP 192.168.15.128.5900 > 192.168.15.129.53608: Flags [S.], seq 3489339889, ack 2107215122, win 5840, options [mss 1460], length 0
13:31:37.749435 IP 192.168.15.129.53608 > 192.168.15.128.https: Flags [S], seq 2107215121, win 1024, options [mss 1460], length 0
13:31:37.749518 IP 192.168.15.129.53608 > 192.168.15.128.6565: Flags [S], seq 2107215121, win 1024, options [mss 1460], length 0
13:31:37.749572 IP 192.168.15.129.53608 > 192.168.15.128.3851: Flags [S], seq 2107215121, win 1024, options [mss 1460], length 0
13:31:37.749629 IP 192.168.15.129.53608 > 192.168.15.128.1024: Flags [S], seq 2107215121, win 1024, options [mss 1460], length 0
13:31:37.749682 IP 192.168.15.129.53608 > 192.168.15.128.32771: Flags [S], seq 2107215121, win 1024, options [mss 1460], length 0
13:31:37.749787 IP 192.168.15.128.https > 192.168.15.129.53608: Flags [R.], seq 0, ack 2107215122, win 0, length 0
13:31:37.749874 IP 192.168.15.129.53608 > 192.168.15.128.5900: Flags [R], seq 2107215122, win 0, length 0
13:31:37.749975 IP 192.168.15.128.6565 > 192.168.15.129.53608: Flags [R.], seq 0, ack 2107215122, win 0, length 0
13:31:37.750072 IP 192.168.15.128.3851 > 192.168.15.129.53608: Flags [R.], seq 0, ack 2107215122, win 0, length 0
13:31:37.750132 IP 192.168.15.128.1024 > 192.168.15.129.53608: Flags [R.], seq 0, ack 2107215122, win 0, length 0
13:31:37.750250 IP 192.168.15.128.32771 > 192.168.15.129.53608: Flags [R.], seq 0, ack 2107215122, win 0, length 0
13:31:37.750713 IP 192.168.15.129.53608 > 192.168.15.128.15742: Flags [S], seq 2107215121, win 1024, options [mss 1460], length 0
13:31:37.750823 IP 192.168.15.129.53608 > 192.168.15.128.55600: Flags [S], seq 2107215121, win 1024, options [mss 1460], length 0
13:31:37.750886 IP 192.168.15.129.53608 > 192.168.15.128.tacacs: Flags [S], seq 2107215121, win 1024, options [mss 1460], length 0
13:31:37.750945 IP 192.168.15.129.53608 > 192.168.15.128.54328: Flags [S], seq 2107215121, win 1024, options [mss 1460], length 0
13:31:37.751265 IP 192.168.15.128.15742 > 192.168.15.129.53608: Flags [R.], seq 0, ack 2107215122, win 0, length 0
13:31:37.751422 IP 192.168.15.128.55600 > 192.168.15.129.53608: Flags [R.], seq 0, ack 2107215122, win 0, length 0
13:31:37.751529 IP 192.168.15.128.tacacs > 192.168.15.129.53608: Flags [R.], seq 0, ack 2107215122, win 0, length 0
13:31:37.751585 IP 192.168.15.128.54328 > 192.168.15.129.53608: Flags [R.], seq 0, ack 2107215122, win 0, length 0
13:31:37.751685 IP 192.168.15.129.53608 > 192.168.15.128.524: Flags [S], seq 2107215121, win 1024, options [mss 1460], length 0
13:31:37.751743 IP 192.168.15.129.53608 > 192.168.15.128.1594: Flags [S], seq 2107215121, win 1024, options [mss 1460], length 0
13:31:37.751863 IP 192.168.15.129.53608 > 192.168.15.128.49999: Flags [S], seq 2107215121, win 1024, options [mss 1460], length 0
13:31:37.752130 IP 192.168.15.128.524 > 192.168.15.129.53608: Flags [R.], seq 0, ack 2107215122, win 0, length 0
13:31:37.752209 IP 192.168.15.128.1594 > 192.168.15.129.53608: Flags [R.], seq 0, ack 2107215122, win 0, length 0
13:31:37.752262 IP 192.168.15.128.49999 > 192.168.15.129.53608: Flags [R.], seq 0, ack 2107215122, win 0, length 0
13:31:37.752348 IP 192.168.15.129.53608 > 192.168.15.128.7777: Flags [S], seq 2107215121, win 1024, options [mss 1460], length 0
13:31:37.752854 IP 192.168.15.128.7777 > 192.168.15.129.53608: Flags [R.], seq 0, ack 2107215122, win 0, length 0
13:31:37.755761 IP 192.168.15.129.53608 > 192.168.15.128.6101: Flags [S], seq 2107215121, win 1024, options [mss 1460], length 0
13:31:37.755895 IP 192.168.15.129.53608 > 192.168.15.128.1322: Flags [S], seq 2107215121, win 1024, options [mss 1460], length 0
13:31:37.756071 IP 192.168.15.129.53608 > 192.168.15.128.isakmp: Flags [S], seq 2107215121, win 1024, options [mss 1460], length 0
13:31:37.756153 IP 192.168.15.129.53608 > 192.168.15.128.5225: Flags [S], seq 2107215121, win 1024, options [mss 1460], length 0
13:31:37.756227 IP 192.168.15.129.53608 > 192.168.15.128.shell: Flags [S], seq 2107215121, win 1024, options [mss 1460], length 0
13:31:37.756339 IP 192.168.15.128.6101 > 192.168.15.129.53608: Flags [R.], seq 0, ack 2107215122, win 0, length 0
13:31:37.756400 IP 192.168.15.128.1322 > 192.168.15.129.53608: Flags [R.], seq 0, ack 2107215122, win 0, length 0
13:31:37.756453 IP 192.168.15.128.isakmp > 192.168.15.129.53608: Flags [R.], seq 0, ack 2107215122, win 0, length 0
13:31:37.756554 IP 192.168.15.128.5225 > 192.168.15.129.53608: Flags [R.], seq 0, ack 2107215122, win 0, length 0
13:31:37.756737 IP 192.168.15.128.shell > 192.168.15.129.53608: Flags [S.], seq 3494797165, ack 2107215122, win 5840, options [mss 1460], length 0
13:31:37.757241 IP 192.168.15.129.53608 > 192.168.15.128.shell: Flags [R], seq 2107215122, win 0, length 0
13:31:37.844587 IP 192.168.15.129.53608 > 192.168.15.128.nrpe: Flags [S], seq 2107215121, win 1024, options [mss 1460], length 0
13:31:37.844735 IP 192.168.15.129.53608 > 192.168.15.128.3301: Flags [S], seq 2107215121, win 1024, options [mss 1460], length 0
13:31:37.845291 IP 192.168.15.128.nrpe > 192.168.15.129.53608: Flags [R.], seq 0, ack 2107215122, win 0, length 0
13:31:37.845422 IP 192.168.15.128.3301 > 192.168.15.129.53608: Flags [R.], seq 0, ack 2107215122, win 0, length 0
13:31:37.845637 IP 192.168.15.129.53608 > 192.168.15.128.30: Flags [S], seq 2107215121, win 1024, options [mss 1460], length 0
13:31:37.845934 IP 192.168.15.129.53608 > 192.168.15.128.1717: Flags [S], seq 2107215121, win 1024, options [mss 1460], length 0
13:31:37.846019 IP 192.168.15.129.53608 > 192.168.15.128.4129: Flags [S], seq 2107215121, win 1024, options [mss 1460], length 0
13:31:37.846122 IP 192.168.15.128.30 > 192.168.15.129.53608: Flags [R.], seq 0, ack 2107215122, win 0, length 0
13:31:37.846254 IP 192.168.15.128.1717 > 192.168.15.129.53608: Flags [R.], seq 0, ack 2107215122, win 0, length 0
13:31:37.846312 IP 192.168.15.128.4129 > 192.168.15.129.53608: Flags [R.], seq 0, ack 2107215122, win 0, length 0
13:31:37.846590 IP 192.168.15.129.53608 > 192.168.15.128.30000: Flags [S], seq 2107215121, win 1024, options [mss 1460], length 0
13:31:37.846713 IP 192.168.15.129.53608 > 192.168.15.128.3030: Flags [S], seq 2107215121, win 1024, options [mss 1460], length 0
13:31:37.846775 IP 192.168.15.129.53608 > 192.168.15.128.9099: Flags [S], seq 2107215121, win 1024, options [mss 1460], length 0
13:31:37.847080 IP 192.168.15.128.30000 > 192.168.15.129.53608: Flags [R.], seq 0, ack 2107215122, win 0, length 0
13:31:37.847170 IP 192.168.15.128.3030 > 192.168.15.129.53608: Flags [R.], seq 0, ack 2107215122, win 0, length 0
13:31:37.847228 IP 192.168.15.128.9099 > 192.168.15.129.53608: Flags [R.], seq 0, ack 2107215122, win 0, length 0
13:31:37.847590 IP 192.168.15.129.53608 > 192.168.15.128.705: Flags [S], seq 2107215121, win 1024, options [mss 1460], length 0
13:31:37.847720 IP 192.168.15.129.53608 > 192.168.15.128.3945: Flags [S], seq 2107215121, win 1024, options [mss 1460], length 0
13:31:37.847779 IP 192.168.15.129.53608 > 192.168.15.128.5907: Flags [S], seq 2107215121, win 1024, options [mss 1460], length 0
13:31:37.848108 IP 192.168.15.128.705 > 192.168.15.129.53608: Flags [R.], seq 0, ack 2107215122, win 0, length 0
13:31:37.848186 IP 192.168.15.128.3945 > 192.168.15.129.53608: Flags [R.], seq 0, ack 2107215122, win 0, length 0
13:31:37.848240 IP 192.168.15.128.5907 > 192.168.15.129.53608: Flags [R.], seq 0, ack 2107215122, win 0, length 0
13:31:37.848328 IP 192.168.15.129.53608 > 192.168.15.128.bgpd: Flags [S], seq 2107215121, win 1024, options [mss 1460], length 0
13:31:37.848385 IP 192.168.15.129.53608 > 192.168.15.128.55056: Flags [S], seq 2107215121, win 1024, options [mss 1460], length 0
13:31:37.848443 IP 192.168.15.129.53608 > 192.168.15.128.9091: Flags [S], seq 2107215121, win 1024, options [mss 1460], length 0
13:31:37.848500 IP 192.168.15.129.53608 > 192.168.15.128.593: Flags [S], seq 2107215121, win 1024, options [mss 1460], length 0
13:31:37.848842 IP 192.168.15.128.bgpd > 192.168.15.129.53608: Flags [R.], seq 0, ack 2107215122, win 0, length 0
13:31:37.848916 IP 192.168.15.128.55056 > 192.168.15.129.53608: Flags [R.], seq 0, ack 2107215122, win 0, length 0
13:31:37.848970 IP 192.168.15.128.9091 > 192.168.15.129.53608: Flags [R.], seq 0, ack 2107215122, win 0, length 0
13:31:37.849022 IP 192.168.15.128.593 > 192.168.15.129.53608: Flags [R.], seq 0, ack 2107215122, win 0, length 0
13:31:37.849108 IP 192.168.15.129.53608 > 192.168.15.128.49165: Flags [S], seq 2107215121, win 1024, options [mss 1460], length 0
13:31:37.849165 IP 192.168.15.129.53608 > 192.168.15.128.bacula-fd: Flags [S], seq 2107215121, win 1024, options [mss 1460], length 0
13:31:37.849218 IP 192.168.15.129.53608 > 192.168.15.128.2033: Flags [S], seq 2107215121, win 1024, options [mss 1460], length 0
13:31:37.849275 IP 192.168.15.129.53608 > 192.168.15.128.902: Flags [S], seq 2107215121, win 1024, options [mss 1460], length 0
13:31:37.849644 IP 192.168.15.128.49165 > 192.168.15.129.53608: Flags [R.], seq 0, ack 2107215122, win 0, length 0
13:31:37.849799 IP 192.168.15.128.bacula-fd > 192.168.15.129.53608: Flags [R.], seq 0, ack 2107215122, win 0, length 0
13:31:37.849855 IP 192.168.15.128.2033 > 192.168.15.129.53608: Flags [R.], seq 0, ack 2107215122, win 0, length 0
13:31:37.849907 IP 192.168.15.128.902 > 192.168.15.129.53608: Flags [R.], seq 0, ack 2107215122, win 0, length 0
13:31:37.849999 IP 192.168.15.129.53608 > 192.168.15.128.2179: Flags [S], seq 2107215121, win 1024, options [mss 1460], length 0
13:31:37.850056 IP 192.168.15.129.53608 > 192.168.15.128.16993: Flags [S], seq 2107215121, win 1024, options [mss 1460], length 0
13:31:37.850114 IP 192.168.15.129.53608 > 192.168.15.128.32775: Flags [S], seq 2107215121, win 1024, options [mss 1460], length 0
13:31:37.850171 IP 192.168.15.129.53608 > 192.168.15.128.5950: Flags [S], seq 2107215121, win 1024, options [mss 1460], length 0
13:31:37.850390 IP 192.168.15.128.2179 > 192.168.15.129.53608: Flags [R.], seq 0, ack 2107215122, win 0, length 0
13:31:37.850485 IP 192.168.15.129.53608 > 192.168.15.128.1058: Flags [S], seq 2107215121, win 1024, options [mss 1460], length 0
13:31:37.850588 IP 192.168.15.128.16993 > 192.168.15.129.53608: Flags [R.], seq 0, ack 2107215122, win 0, length 0
13:31:37.850648 IP 192.168.15.128.32775 > 192.168.15.129.53608: Flags [R.], seq 0, ack 2107215122, win 0, length 0
13:31:37.850820 IP 192.168.15.128.5950 > 192.168.15.129.53608: Flags [R.], seq 0, ack 2107215122, win 0, length 0
13:31:37.850987 IP 192.168.15.128.1058 > 192.168.15.129.53608: Flags [R.], seq 0, ack 2107215122, win 0, length 0
13:31:37.851425 IP 192.168.15.129.53608 > 192.168.15.128.5962: Flags [S], seq 2107215121, win 1024, options [mss 1460], length 0
13:31:37.851538 IP 192.168.15.129.53608 > 192.168.15.128.8100: Flags [S], seq 2107215121, win 1024, options [mss 1460], length 0
13:31:37.852054 IP 192.168.15.128.5962 > 192.168.15.129.53608: Flags [R.], seq 0, ack 2107215122, win 0, length 0
13:31:37.852167 IP 192.168.15.128.8100 > 192.168.15.129.53608: Flags [R.], seq 0, ack 2107215122, win 0, length 0
13:31:37.945934 IP 192.168.15.129.53609 > 192.168.15.128.30: Flags [S], seq 2107149584, win 1024, options [mss 1460], length 0
13:31:37.946076 IP 192.168.15.129.53609 > 192.168.15.128.3301: Flags [S], seq 2107149584, win 1024, options [mss 1460], length 0
13:31:37.946167 IP 192.168.15.129.53609 > 192.168.15.128.nrpe: Flags [S], seq 2107149584, win 1024, options [mss 1460], length 0
13:31:37.946614 IP 192.168.15.128.30 > 192.168.15.129.53609: Flags [R.], seq 0, ack 2107149585, win 0, length 0
13:31:37.946738 IP 192.168.15.128.3301 > 192.168.15.129.53609: Flags [R.], seq 0, ack 2107149585, win 0, length 0
13:31:37.946795 IP 192.168.15.128.nrpe > 192.168.15.129.53609: Flags [R.], seq 0, ack 2107149585, win 0, length 0
13:31:37.948844 IP 192.168.15.129.53609 > 192.168.15.128.593: Flags [S], seq 2107149584, win 1024, options [mss 1460], length 0
13:31:37.948982 IP 192.168.15.129.53609 > 192.168.15.128.9091: Flags [S], seq 2107149584, win 1024, options [mss 1460], length 0
13:31:37.949129 IP 192.168.15.129.53609 > 192.168.15.128.55056: Flags [S], seq 2107149584, win 1024, options [mss 1460], length 0
13:31:37.949319 IP 192.168.15.129.53609 > 192.168.15.128.bgpd: Flags [S], seq 2107149584, win 1024, options [mss 1460], length 0
13:31:37.949476 IP 192.168.15.129.53609 > 192.168.15.128.5907: Flags [S], seq 2107149584, win 1024, options [mss 1460], length 0
13:31:37.949651 IP 192.168.15.129.53609 > 192.168.15.128.3945: Flags [S], seq 2107149584, win 1024, options [mss 1460], length 0
13:31:37.949809 IP 192.168.15.129.53609 > 192.168.15.128.705: Flags [S], seq 2107149584, win 1024, options [mss 1460], length 0
13:31:37.949929 IP 192.168.15.129.53609 > 192.168.15.128.9099: Flags [S], seq 2107149584, win 1024, options [mss 1460], length 0
13:31:37.949998 IP 192.168.15.129.53609 > 192.168.15.128.3030: Flags [S], seq 2107149584, win 1024, options [mss 1460], length 0
13:31:37.950052 IP 192.168.15.129.53609 > 192.168.15.128.30000: Flags [S], seq 2107149584, win 1024, options [mss 1460], length 0
13:31:37.950107 IP 192.168.15.129.53609 > 192.168.15.128.4129: Flags [S], seq 2107149584, win 1024, options [mss 1460], length 0
13:31:37.950164 IP 192.168.15.129.53609 > 192.168.15.128.1717: Flags [S], seq 2107149584, win 1024, options [mss 1460], length 0
13:31:37.950284 IP 192.168.15.128.593 > 192.168.15.129.53609: Flags [R.], seq 0, ack 2107149585, win 0, length 0
13:31:37.950345 IP 192.168.15.128.9091 > 192.168.15.129.53609: Flags [R.], seq 0, ack 2107149585, win 0, length 0
13:31:37.950410 IP 192.168.15.128.55056 > 192.168.15.129.53609: Flags [R.], seq 0, ack 2107149585, win 0, length 0
13:31:37.950467 IP 192.168.15.128.bgpd > 192.168.15.129.53609: Flags [R.], seq 0, ack 2107149585, win 0, length 0
13:31:37.950538 IP 192.168.15.128.5907 > 192.168.15.129.53609: Flags [R.], seq 0, ack 2107149585, win 0, length 0
13:31:37.950589 IP 192.168.15.128.3945 > 192.168.15.129.53609: Flags [R.], seq 0, ack 2107149585, win 0, length 0
13:31:37.950645 IP 192.168.15.128.705 > 192.168.15.129.53609: Flags [R.], seq 0, ack 2107149585, win 0, length 0
13:31:37.950699 IP 192.168.15.128.9099 > 192.168.15.129.53609: Flags [R.], seq 0, ack 2107149585, win 0, length 0
13:31:37.950756 IP 192.168.15.128.3030 > 192.168.15.129.53609: Flags [R.], seq 0, ack 2107149585, win 0, length 0
13:31:37.950808 IP 192.168.15.128.30000 > 192.168.15.129.53609: Flags [R.], seq 0, ack 2107149585, win 0, length 0
13:31:37.950867 IP 192.168.15.128.4129 > 192.168.15.129.53609: Flags [R.], seq 0, ack 2107149585, win 0, length 0
13:31:37.950920 IP 192.168.15.128.1717 > 192.168.15.129.53609: Flags [R.], seq 0, ack 2107149585, win 0, length 0
13:31:37.952867 IP 192.168.15.129.53609 > 192.168.15.128.8100: Flags [S], seq 2107149584, win 1024, options [mss 1460], length 0
13:31:37.953002 IP 192.168.15.129.53609 > 192.168.15.128.5962: Flags [S], seq 2107149584, win 1024, options [mss 1460], length 0
13:31:37.953123 IP 192.168.15.129.53609 > 192.168.15.128.1058: Flags [S], seq 2107149584, win 1024, options [mss 1460], length 0
13:31:37.953268 IP 192.168.15.129.53609 > 192.168.15.128.5950: Flags [S], seq 2107149584, win 1024, options [mss 1460], length 0
13:31:37.953350 IP 192.168.15.129.53609 > 192.168.15.128.32775: Flags [S], seq 2107149584, win 1024, options [mss 1460], length 0
13:31:37.953411 IP 192.168.15.129.53609 > 192.168.15.128.16993: Flags [S], seq 2107149584, win 1024, options [mss 1460], length 0
13:31:37.953473 IP 192.168.15.129.53609 > 192.168.15.128.2179: Flags [S], seq 2107149584, win 1024, options [mss 1460], length 0
13:31:37.953529 IP 192.168.15.129.53609 > 192.168.15.128.902: Flags [S], seq 2107149584, win 1024, options [mss 1460], length 0
13:31:37.953583 IP 192.168.15.129.53609 > 192.168.15.128.2033: Flags [S], seq 2107149584, win 1024, options [mss 1460], length 0
13:31:37.953640 IP 192.168.15.129.53609 > 192.168.15.128.bacula-fd: Flags [S], seq 2107149584, win 1024, options [mss 1460], length 0
13:31:37.953776 IP 192.168.15.129.53609 > 192.168.15.128.49165: Flags [S], seq 2107149584, win 1024, options [mss 1460], length 0
13:31:37.954096 IP 192.168.15.128.8100 > 192.168.15.129.53609: Flags [R.], seq 0, ack 2107149585, win 0, length 0
13:31:37.954223 IP 192.168.15.128.5962 > 192.168.15.129.53609: Flags [R.], seq 0, ack 2107149585, win 0, length 0
13:31:37.954286 IP 192.168.15.128.1058 > 192.168.15.129.53609: Flags [R.], seq 0, ack 2107149585, win 0, length 0
13:31:37.954548 IP 192.168.15.128.5950 > 192.168.15.129.53609: Flags [R.], seq 0, ack 2107149585, win 0, length 0
13:31:37.954638 IP 192.168.15.128.32775 > 192.168.15.129.53609: Flags [R.], seq 0, ack 2107149585, win 0, length 0
13:31:37.954723 IP 192.168.15.128.16993 > 192.168.15.129.53609: Flags [R.], seq 0, ack 2107149585, win 0, length 0
13:31:37.954776 IP 192.168.15.128.2179 > 192.168.15.129.53609: Flags [R.], seq 0, ack 2107149585, win 0, length 0
13:31:37.954985 IP 192.168.15.128.902 > 192.168.15.129.53609: Flags [R.], seq 0, ack 2107149585, win 0, length 0
13:31:37.955080 IP 192.168.15.128.2033 > 192.168.15.129.53609: Flags [R.], seq 0, ack 2107149585, win 0, length 0
13:31:37.955209 IP 192.168.15.128.bacula-fd > 192.168.15.129.53609: Flags [R.], seq 0, ack 2107149585, win 0, length 0
13:31:37.955287 IP 192.168.15.128.49165 > 192.168.15.129.53609: Flags [R.], seq 0, ack 2107149585, win 0, length 0
13:31:38.047319 IP 192.168.15.129.53608 > 192.168.15.128.nntps: Flags [S], seq 2107215121, win 1024, options [mss 1460], length 0
13:31:38.047510 IP 192.168.15.129.53608 > 192.168.15.128.19350: Flags [S], seq 2107215121, win 1024, options [mss 1460], length 0
13:31:38.047568 IP 192.168.15.129.53608 > 192.168.15.128.10617: Flags [S], seq 2107215121, win 1024, options [mss 1460], length 0
13:31:38.047628 IP 192.168.15.129.53608 > 192.168.15.128.1801: Flags [S], seq 2107215121, win 1024, options [mss 1460], length 0
13:31:38.047750 IP 192.168.15.129.53608 > 192.168.15.128.4125: Flags [S], seq 2107215121, win 1024, options [mss 1460], length 0
13:31:38.047846 IP 192.168.15.128.nntps > 192.168.15.129.53608: Flags [R.], seq 0, ack 2107215122, win 0, length 0
13:31:38.047938 IP 192.168.15.129.53608 > 192.168.15.128.49155: Flags [S], seq 2107215121, win 1024, options [mss 1460], length 0
13:31:38.048046 IP 192.168.15.129.53608 > 192.168.15.128.2007: Flags [S], seq 2107215121, win 1024, options [mss 1460], length 0
13:31:38.048157 IP 192.168.15.129.53608 > 192.168.15.128.1000: Flags [S], seq 2107215121, win 1024, options [mss 1460], length 0
13:31:38.048273 IP 192.168.15.129.53608 > 192.168.15.128.5959: Flags [S], seq 2107215121, win 1024, options [mss 1460], length 0
13:31:38.048332 IP 192.168.15.129.53608 > 192.168.15.128.64680: Flags [S], seq 2107215121, win 1024, options [mss 1460], length 0
13:31:38.048419 IP 192.168.15.128.19350 > 192.168.15.129.53608: Flags [R.], seq 0, ack 2107215122, win 0, length 0
13:31:38.048507 IP 192.168.15.129.53608 > 192.168.15.128.51103: Flags [S], seq 2107215121, win 1024, options [mss 1460], length 0
13:31:38.048561 IP 192.168.15.129.53608 > 192.168.15.128.16001: Flags [S], seq 2107215121, win 1024, options [mss 1460], length 0
13:31:38.048921 IP 192.168.15.129.53608 > 192.168.15.128.1037: Flags [S], seq 2107215121, win 1024, options [mss 1460], length 0
13:31:38.048999 IP 192.168.15.129.53608 > 192.168.15.128.54045: Flags [S], seq 2107215121, win 1024, options [mss 1460], length 0
13:31:38.049074 IP 192.168.15.129.53608 > 192.168.15.128.666: Flags [S], seq 2107215121, win 1024, options [mss 1460], length 0
13:31:38.049171 IP 192.168.15.128.10617 > 192.168.15.129.53608: Flags [R.], seq 0, ack 2107215122, win 0, length 0
13:31:38.049228 IP 192.168.15.128.1801 > 192.168.15.129.53608: Flags [R.], seq 0, ack 2107215122, win 0, length 0
13:31:38.049290 IP 192.168.15.128.4125 > 192.168.15.129.53608: Flags [R.], seq 0, ack 2107215122, win 0, length 0
13:31:38.049378 IP 192.168.15.129.53608 > 192.168.15.128.7911: Flags [S], seq 2107215121, win 1024, options [mss 1460], length 0
13:31:38.049486 IP 192.168.15.128.49155 > 192.168.15.129.53608: Flags [R.], seq 0, ack 2107215122, win 0, length 0
13:31:38.049581 IP 192.168.15.129.53608 > 192.168.15.128.5902: Flags [S], seq 2107215121, win 1024, options [mss 1460], length 0
13:31:38.049642 IP 192.168.15.129.53608 > 192.168.15.128.3546: Flags [S], seq 2107215121, win 1024, options [mss 1460], length 0
13:31:38.050049 IP 192.168.15.128.2007 > 192.168.15.129.53608: Flags [R.], seq 0, ack 2107215122, win 0, length 0
13:31:38.050160 IP 192.168.15.128.1000 > 192.168.15.129.53608: Flags [R.], seq 0, ack 2107215122, win 0, length 0
13:31:38.050276 IP 192.168.15.128.5959 > 192.168.15.129.53608: Flags [R.], seq 0, ack 2107215122, win 0, length 0
13:31:38.050365 IP 192.168.15.128.64680 > 192.168.15.129.53608: Flags [R.], seq 0, ack 2107215122, win 0, length 0
13:31:38.050434 IP 192.168.15.128.51103 > 192.168.15.129.53608: Flags [R.], seq 0, ack 2107215122, win 0, length 0
13:31:38.050494 IP 192.168.15.128.16001 > 192.168.15.129.53608: Flags [R.], seq 0, ack 2107215122, win 0, length 0
13:31:38.050546 IP 192.168.15.128.1037 > 192.168.15.129.53608: Flags [R.], seq 0, ack 2107215122, win 0, length 0
13:31:38.050635 IP 192.168.15.128.54045 > 192.168.15.129.53608: Flags [R.], seq 0, ack 2107215122, win 0, length 0
13:31:38.050695 IP 192.168.15.128.666 > 192.168.15.129.53608: Flags [R.], seq 0, ack 2107215122, win 0, length 0
13:31:38.050753 IP 192.168.15.128.7911 > 192.168.15.129.53608: Flags [R.], seq 0, ack 2107215122, win 0, length 0
13:31:38.050884 IP 192.168.15.128.5902 > 192.168.15.129.53608: Flags [R.], seq 0, ack 2107215122, win 0, length 0
13:31:38.050944 IP 192.168.15.128.3546 > 192.168.15.129.53608: Flags [R.], seq 0, ack 2107215122, win 0, length 0
13:31:38.148505 IP 192.168.15.129.53609 > 192.168.15.128.5959: Flags [S], seq 2107149584, win 1024, options [mss 1460], length 0
13:31:38.148613 IP 192.168.15.129.53609 > 192.168.15.128.1000: Flags [S], seq 2107149584, win 1024, options [mss 1460], length 0
13:31:38.148665 IP 192.168.15.129.53609 > 192.168.15.128.2007: Flags [S], seq 2107149584, win 1024, options [mss 1460], length 0
13:31:38.148719 IP 192.168.15.129.53609 > 192.168.15.128.49155: Flags [S], seq 2107149584, win 1024, options [mss 1460], length 0
13:31:38.148767 IP 192.168.15.129.53609 > 192.168.15.128.4125: Flags [S], seq 2107149584, win 1024, options [mss 1460], length 0
13:31:38.148815 IP 192.168.15.129.53609 > 192.168.15.128.1801: Flags [S], seq 2107149584, win 1024, options [mss 1460], length 0
13:31:38.148859 IP 192.168.15.129.53609 > 192.168.15.128.10617: Flags [S], seq 2107149584, win 1024, options [mss 1460], length 0
13:31:38.148959 IP 192.168.15.129.53609 > 192.168.15.128.19350: Flags [S], seq 2107149584, win 1024, options [mss 1460], length 0
13:31:38.149039 IP 192.168.15.129.53609 > 192.168.15.128.nntps: Flags [S], seq 2107149584, win 1024, options [mss 1460], length 0
13:31:38.149299 IP 192.168.15.128.5959 > 192.168.15.129.53609: Flags [R.], seq 0, ack 2107149585, win 0, length 0
13:31:38.149386 IP 192.168.15.128.1000 > 192.168.15.129.53609: Flags [R.], seq 0, ack 2107149585, win 0, length 0
13:31:38.149436 IP 192.168.15.128.2007 > 192.168.15.129.53609: Flags [R.], seq 0, ack 2107149585, win 0, length 0
13:31:38.149485 IP 192.168.15.128.49155 > 192.168.15.129.53609: Flags [R.], seq 0, ack 2107149585, win 0, length 0
13:31:38.149537 IP 192.168.15.128.4125 > 192.168.15.129.53609: Flags [R.], seq 0, ack 2107149585, win 0, length 0
13:31:38.149648 IP 192.168.15.128.1801 > 192.168.15.129.53609: Flags [R.], seq 0, ack 2107149585, win 0, length 0
13:31:38.149697 IP 192.168.15.128.10617 > 192.168.15.129.53609: Flags [R.], seq 0, ack 2107149585, win 0, length 0
13:31:38.149740 IP 192.168.15.128.19350 > 192.168.15.129.53609: Flags [R.], seq 0, ack 2107149585, win 0, length 0
13:31:38.149844 IP 192.168.15.128.nntps > 192.168.15.129.53609: Flags [R.], seq 0, ack 2107149585, win 0, length 0
13:31:38.152416 IP 192.168.15.129.53609 > 192.168.15.128.3546: Flags [S], seq 2107149584, win 1024, options [mss 1460], length 0
13:31:38.152547 IP 192.168.15.129.53609 > 192.168.15.128.5902: Flags [S], seq 2107149584, win 1024, options [mss 1460], length 0
13:31:38.152612 IP 192.168.15.129.53609 > 192.168.15.128.7911: Flags [S], seq 2107149584, win 1024, options [mss 1460], length 0
13:31:38.152662 IP 192.168.15.129.53609 > 192.168.15.128.666: Flags [S], seq 2107149584, win 1024, options [mss 1460], length 0
13:31:38.152710 IP 192.168.15.129.53609 > 192.168.15.128.54045: Flags [S], seq 2107149584, win 1024, options [mss 1460], length 0
13:31:38.152758 IP 192.168.15.129.53609 > 192.168.15.128.1037: Flags [S], seq 2107149584, win 1024, options [mss 1460], length 0
13:31:38.152806 IP 192.168.15.129.53609 > 192.168.15.128.16001: Flags [S], seq 2107149584, win 1024, options [mss 1460], length 0
13:31:38.152853 IP 192.168.15.129.53609 > 192.168.15.128.51103: Flags [S], seq 2107149584, win 1024, options [mss 1460], length 0
13:31:38.152962 IP 192.168.15.129.53609 > 192.168.15.128.64680: Flags [S], seq 2107149584, win 1024, options [mss 1460], length 0
13:31:38.153223 IP 192.168.15.128.3546 > 192.168.15.129.53609: Flags [R.], seq 0, ack 2107149585, win 0, length 0
13:31:38.153310 IP 192.168.15.128.5902 > 192.168.15.129.53609: Flags [R.], seq 0, ack 2107149585, win 0, length 0
13:31:38.153359 IP 192.168.15.128.7911 > 192.168.15.129.53609: Flags [R.], seq 0, ack 2107149585, win 0, length 0
13:31:38.153562 IP 192.168.15.128.666 > 192.168.15.129.53609: Flags [R.], seq 0, ack 2107149585, win 0, length 0
13:31:38.153635 IP 192.168.15.128.54045 > 192.168.15.129.53609: Flags [R.], seq 0, ack 2107149585, win 0, length 0
13:31:38.153968 IP 192.168.15.128.1037 > 192.168.15.129.53609: Flags [R.], seq 0, ack 2107149585, win 0, length 0
13:31:38.154086 IP 192.168.15.128.16001 > 192.168.15.129.53609: Flags [R.], seq 0, ack 2107149585, win 0, length 0
13:31:38.154136 IP 192.168.15.128.51103 > 192.168.15.129.53609: Flags [R.], seq 0, ack 2107149585, win 0, length 0
13:31:38.154179 IP 192.168.15.128.64680 > 192.168.15.129.53609: Flags [R.], seq 0, ack 2107149585, win 0, length 0
13:31:38.249552 IP 192.168.15.129.53608 > 192.168.15.128.16018: Flags [S], seq 2107215121, win 1024, options [mss 1460], length 0
13:31:38.250234 IP 192.168.15.128.16018 > 192.168.15.129.53608: Flags [R.], seq 0, ack 2107215122, win 0, length 0
13:31:38.255335 IP 192.168.15.129.53608 > 192.168.15.128.10003: Flags [S], seq 2107215121, win 1024, options [mss 1460], length 0
13:31:38.255967 IP 192.168.15.128.10003 > 192.168.15.129.53608: Flags [R.], seq 0, ack 2107215122, win 0, length 0
13:31:38.261371 IP 192.168.15.129.53608 > 192.168.15.128.19315: Flags [S], seq 2107215121, win 1024, options [mss 1460], length 0
13:31:38.262036 IP 192.168.15.128.19315 > 192.168.15.129.53608: Flags [R.], seq 0, ack 2107215122, win 0, length 0
13:31:38.267365 IP 192.168.15.129.53608 > 192.168.15.128.49157: Flags [S], seq 2107215121, win 1024, options [mss 1460], length 0
13:31:38.268052 IP 192.168.15.128.49157 > 192.168.15.129.53608: Flags [R.], seq 0, ack 2107215122, win 0, length 0
13:31:38.273580 IP 192.168.15.129.53608 > 192.168.15.128.5555: Flags [S], seq 2107215121, win 1024, options [mss 1460], length 0
13:31:38.274274 IP 192.168.15.128.5555 > 192.168.15.129.53608: Flags [R.], seq 0, ack 2107215122, win 0, length 0
13:31:38.279652 IP 192.168.15.129.53608 > 192.168.15.128.2909: Flags [S], seq 2107215121, win 1024, options [mss 1460], length 0
13:31:38.280289 IP 192.168.15.128.2909 > 192.168.15.129.53608: Flags [R.], seq 0, ack 2107215122, win 0, length 0
13:31:38.284960 IP 192.168.15.129.53608 > 192.168.15.128.1721: Flags [S], seq 2107215121, win 1024, options [mss 1460], length 0
13:31:38.285566 IP 192.168.15.128.1721 > 192.168.15.129.53608: Flags [R.], seq 0, ack 2107215122, win 0, length 0
13:31:38.290719 IP 192.168.15.129.53608 > 192.168.15.128.1556: Flags [S], seq 2107215121, win 1024, options [mss 1460], length 0
13:31:38.291321 IP 192.168.15.128.1556 > 192.168.15.129.53608: Flags [R.], seq 0, ack 2107215122, win 0, length 0
13:31:38.296861 IP 192.168.15.129.53608 > 192.168.15.128.49400: Flags [S], seq 2107215121, win 1024, options [mss 1460], length 0
13:31:38.297458 IP 192.168.15.128.49400 > 192.168.15.129.53608: Flags [R.], seq 0, ack 2107215122, win 0, length 0
13:31:38.303298 IP 192.168.15.129.53608 > 192.168.15.128.1010: Flags [S], seq 2107215121, win 1024, options [mss 1460], length 0
13:31:38.303901 IP 192.168.15.128.1010 > 192.168.15.129.53608: Flags [R.], seq 0, ack 2107215122, win 0, length 0
