17:49:04.119075 ARP, Request who-has 192.168.15.254 tell 192.168.15.130, length 46
17:49:04.120570 ARP, Reply 192.168.15.254 is-at 00:50:56:e8:90:7f (oui Unknown), length 46
17:49:04.121506 IP 192.168.15.130.bootpc > 192.168.15.254.bootps: BOOTP/DHCP, Request from 00:0c:29:66:2d:38 (oui Unknown), length 314
17:49:04.122073 IP 192.168.15.254.bootps > 192.168.15.130.bootpc: BOOTP/DHCP, Reply, length 300
17:49:04.130315 IP 192.168.15.130.netbios-ns > 192.168.15.2.netbios-ns: NBT UDP PACKET(137): REFRESH(8); REQUEST; UNICAST
17:49:05.616941 IP 192.168.15.130.netbios-ns > 192.168.15.2.netbios-ns: NBT UDP PACKET(137): REFRESH(8); REQUEST; UNICAST
17:49:07.117272 IP 192.168.15.130.netbios-ns > 192.168.15.2.netbios-ns: NBT UDP PACKET(137): REFRESH(8); REQUEST; UNICAST
17:49:10.682450 ARP, Request who-has 192.168.15.128 (Broadcast) tell 192.168.15.129, length 46
17:49:10.682928 ARP, Reply 192.168.15.128 is-at 00:0c:29:a1:c5:30 (oui Unknown), length 46
17:49:10.884213 IP 192.168.15.129.47242 > 192.168.15.2.domain: 3860+ PTR? 128.15.168.192.in-addr.arpa. (45)
17:49:10.890423 IP 192.168.15.2.domain > 192.168.15.129.47242: 3860 NXDomain 0/0/0 (45)
17:49:10.892558 IP 192.168.15.129.43316 > 192.168.15.128.1025: Flags [S], seq 1699905014, win 1024, options [mss 1460], length 0
17:49:10.892593 IP 192.168.15.129.43316 > 192.168.15.128.auth: Flags [S], seq 1699905014, win 1024, options [mss 1460], length 0
17:49:10.892647 IP 192.168.15.129.43316 > 192.168.15.128.3389: Flags [S], seq 1699905014, win 1024, options [mss 1460], length 0
17:49:10.892758 IP 192.168.15.129.43316 > 192.168.15.128.ssh: Flags [S], seq 1699905014, win 1024, options [mss 1460], length 0
17:49:10.892871 IP 192.168.15.129.43316 > 192.168.15.128.http-alt: Flags [S], seq 1699905014, win 1024, options [mss 1460], length 0
17:49:10.893125 IP 192.168.15.129.43316 > 192.168.15.128.netbios-ssn: Flags [S], seq 1699905014, win 1024, options [mss 1460], length 0
17:49:10.893201 IP 192.168.15.129.43316 > 192.168.15.128.telnet: Flags [S], seq 1699905014, win 1024, options [mss 1460], length 0
17:49:10.893258 IP 192.168.15.129.43316 > 192.168.15.128.smux: Flags [S], seq 1699905014, win 1024, options [mss 1460], length 0
17:49:10.893441 IP 192.168.15.129.43316 > 192.168.15.128.ftp: Flags [S], seq 1699905014, win 1024, options [mss 1460], length 0
17:49:10.893513 IP 192.168.15.129.43316 > 192.168.15.128.imaps: Flags [S], seq 1699905014, win 1024, options [mss 1460], length 0
17:49:10.893609 IP 192.168.15.128.1025 > 192.168.15.129.43316: Flags [R.], seq 0, ack 1699905015, win 0, length 0
17:49:10.893907 IP 192.168.15.128.netbios-ssn > 192.168.15.129.43316: Flags [S.], seq 634163645, ack 1699905015, win 5840, options [mss 1460], length 0
17:49:10.893917 IP 192.168.15.128.telnet > 192.168.15.129.43316: Flags [S.], seq 644344047, ack 1699905015, win 5840, options [mss 1460], length 0
17:49:10.893921 IP 192.168.15.128.smux > 192.168.15.129.43316: Flags [R.], seq 0, ack 1699905015, win 0, length 0
17:49:10.894156 IP 192.168.15.128.ftp > 192.168.15.129.43316: Flags [S.], seq 628662258, ack 1699905015, win 5840, options [mss 1460], length 0
17:49:10.894164 IP 192.168.15.128.imaps > 192.168.15.129.43316: Flags [R.], seq 0, ack 1699905015, win 0, length 0
17:49:10.894410 IP 192.168.15.128.auth > 192.168.15.129.43316: Flags [R.], seq 0, ack 1699905015, win 0, length 0
17:49:10.894493 IP 192.168.15.128.3389 > 192.168.15.129.43316: Flags [R.], seq 0, ack 1699905015, win 0, length 0
17:49:10.894502 IP 192.168.15.128.ssh > 192.168.15.129.43316: Flags [S.], seq 632884414, ack 1699905015, win 5840, options [mss 1460], length 0
17:49:10.894505 IP 192.168.15.128.http-alt > 192.168.15.129.43316: Flags [R.], seq 0, ack 1699905015, win 0, length 0
17:49:10.895958 IP 192.168.15.129.43316 > 192.168.15.128.netbios-ssn: Flags [R], seq 1699905015, win 0, length 0
17:49:10.896068 IP 192.168.15.129.43316 > 192.168.15.128.telnet: Flags [R], seq 1699905015, win 0, length 0
17:49:10.896132 IP 192.168.15.129.43316 > 192.168.15.128.ftp: Flags [R], seq 1699905015, win 0, length 0
17:49:10.896294 IP 192.168.15.129.43316 > 192.168.15.128.ssh: Flags [R], seq 1699905015, win 0, length 0
17:49:11.995017 IP 192.168.15.129.43316 > 192.168.15.128.https: Flags [S], seq 1699905014, win 1024, options [mss 1460], length 0
17:49:11.995147 IP 192.168.15.129.43316 > 192.168.15.128.imap2: Flags [S], seq 1699905014, win 1024, options [mss 1460], length 0
17:49:11.995243 IP 192.168.15.129.43316 > 192.168.15.128.1720: Flags [S], seq 1699905014, win 1024, options [mss 1460], length 0
17:49:11.995402 IP 192.168.15.129.43316 > 192.168.15.128.submission: Flags [S], seq 1699905014, win 1024, options [mss 1460], length 0
17:49:11.995468 IP 192.168.15.129.43316 > 192.168.15.128.mysql: Flags [S], seq 1699905014, win 1024, options [mss 1460], length 0
17:49:11.995602 IP 192.168.15.128.https > 192.168.15.129.43316: Flags [R.], seq 0, ack 1699905015, win 0, length 0
17:49:11.995729 IP 192.168.15.128.imap2 > 192.168.15.129.43316: Flags [R.], seq 0, ack 1699905015, win 0, length 0
17:49:11.995783 IP 192.168.15.128.1720 > 192.168.15.129.43316: Flags [R.], seq 0, ack 1699905015, win 0, length 0
17:49:11.995843 IP 192.168.15.128.submission > 192.168.15.129.43316: Flags [R.], seq 0, ack 1699905015, win 0, length 0
17:49:11.995935 IP 192.168.15.129.43316 > 192.168.15.128.pop3s: Flags [S], seq 1699905014, win 1024, options [mss 1460], length 0
17:49:11.996027 IP 192.168.15.128.mysql > 192.168.15.129.43316: Flags [S.], seq 647871716, ack 1699905015, win 5840, options [mss 1460], length 0
17:49:11.996447 IP 192.168.15.128.pop3s > 192.168.15.129.43316: Flags [R.], seq 0, ack 1699905015, win 0, length 0
17:49:11.996554 IP 192.168.15.129.43316 > 192.168.15.128.1723: Flags [S], seq 1699905014, win 1024, options [mss 1460], length 0
17:49:11.996634 IP 192.168.15.129.43316 > 192.168.15.128.mysql: Flags [R], seq 1699905015, win 0, length 0
17:49:11.996758 IP 192.168.15.129.43316 > 192.168.15.128.domain: Flags [S], seq 1699905014, win 1024, options [mss 1460], length 0
17:49:11.996953 IP 192.168.15.128.1723 > 192.168.15.129.43316: Flags [R.], seq 0, ack 1699905015, win 0, length 0
17:49:11.997097 IP 192.168.15.129.43316 > 192.168.15.128.sunrpc: Flags [S], seq 1699905014, win 1024, options [mss 1460], length 0
17:49:11.997165 IP 192.168.15.128.domain > 192.168.15.129.43316: Flags [S.], seq 649539445, ack 1699905015, win 5840, options [mss 1460], length 0
17:49:11.997618 IP 192.168.15.128.sunrpc > 192.168.15.129.43316: Flags [S.], seq 648377763, ack 1699905015, win 5840, options [mss 1460], length 0
17:49:11.997747 IP 192.168.15.129.43316 > 192.168.15.128.domain: Flags [R], seq 1699905015, win 0, length 0
17:49:11.997827 IP 192.168.15.129.43316 > 192.168.15.128.microsoft-ds: Flags [S], seq 1699905014, win 1024, options [mss 1460], length 0
17:49:11.997888 IP 192.168.15.129.43316 > 192.168.15.128.8888: Flags [S], seq 1699905014, win 1024, options [mss 1460], length 0
17:49:11.997945 IP 192.168.15.129.43316 > 192.168.15.128.sunrpc: Flags [R], seq 1699905015, win 0, length 0
17:49:11.998079 IP 192.168.15.129.43316 > 192.168.15.128.5900: Flags [S], seq 1699905014, win 1024, options [mss 1460], length 0
17:49:11.998170 IP 192.168.15.128.microsoft-ds > 192.168.15.129.43316: Flags [S.], seq 652162773, ack 1699905015, win 5840, options [mss 1460], length 0
17:49:11.998239 IP 192.168.15.128.8888 > 192.168.15.129.43316: Flags [R.], seq 0, ack 1699905015, win 0, length 0
17:49:11.998442 IP 192.168.15.128.5900 > 192.168.15.129.43316: Flags [S.], seq 659104328, ack 1699905015, win 5840, options [mss 1460], length 0
17:49:11.998628 IP 192.168.15.129.43316 > 192.168.15.128.microsoft-ds: Flags [R], seq 1699905015, win 0, length 0
17:49:11.998756 IP 192.168.15.129.43316 > 192.168.15.128.5900: Flags [R], seq 1699905015, win 0, length 0
17:49:11.999180 IP 192.168.15.129.43316 > 192.168.15.128.smtp: Flags [S], seq 1699905014, win 1024, options [mss 1460], length 0
17:49:11.999298 IP 192.168.15.129.43316 > 192.168.15.128.loc-srv: Flags [S], seq 1699905014, win 1024, options [mss 1460], length 0
17:49:11.999360 IP 192.168.15.129.43316 > 192.168.15.128.rtsp: Flags [S], seq 1699905014, win 1024, options [mss 1460], length 0
17:49:11.999671 IP 192.168.15.128.smtp > 192.168.15.129.43316: Flags [S.], seq 658968057, ack 1699905015, win 5840, options [mss 1460], length 0
17:49:11.999737 IP 192.168.15.128.loc-srv > 192.168.15.129.43316: Flags [R.], seq 0, ack 1699905015, win 0, length 0
17:49:11.999789 IP 192.168.15.128.rtsp > 192.168.15.129.43316: Flags [R.], seq 0, ack 1699905015, win 0, length 0
17:49:11.999884 IP 192.168.15.129.43316 > 192.168.15.128.http: Flags [S], seq 1699905014, win 1024, options [mss 1460], length 0
17:49:11.999941 IP 192.168.15.129.43316 > 192.168.15.128.pop3: Flags [S], seq 1699905014, win 1024, options [mss 1460], length 0
17:49:12.000067 IP 192.168.15.129.43316 > 192.168.15.128.smtp: Flags [R], seq 1699905015, win 0, length 0
17:49:12.000329 IP 192.168.15.129.43316 > 192.168.15.128.49153: Flags [S], seq 1699905014, win 1024, options [mss 1460], length 0
17:49:12.000401 IP 192.168.15.128.http > 192.168.15.129.43316: Flags [S.], seq 649551326, ack 1699905015, win 5840, options [mss 1460], length 0
17:49:12.000492 IP 192.168.15.128.pop3 > 192.168.15.129.43316: Flags [R.], seq 0, ack 1699905015, win 0, length 0
17:49:12.000576 IP 192.168.15.129.43316 > 192.168.15.128.5357: Flags [S], seq 1699905014, win 1024, options [mss 1460], length 0
17:49:12.000695 IP 192.168.15.128.49153 > 192.168.15.129.43316: Flags [R.], seq 0, ack 1699905015, win 0, length 0
17:49:12.000817 IP 192.168.15.128.5357 > 192.168.15.129.43316: Flags [R.], seq 0, ack 1699905015, win 0, length 0
17:49:12.001044 IP 192.168.15.129.43316 > 192.168.15.128.http: Flags [R], seq 1699905015, win 0, length 0
17:49:12.001174 IP 192.168.15.129.43316 > 192.168.15.128.26: Flags [S], seq 1699905014, win 1024, options [mss 1460], length 0
17:49:12.001532 IP 192.168.15.128.26 > 192.168.15.129.43316: Flags [R.], seq 0, ack 1699905015, win 0, length 0
17:49:12.001646 IP 192.168.15.129.43316 > 192.168.15.128.enbd-cstatd: Flags [S], seq 1699905014, win 1024, options [mss 1460], length 0
17:49:12.001727 IP 192.168.15.129.43316 > 192.168.15.128.1755: Flags [S], seq 1699905014, win 1024, options [mss 1460], length 0
17:49:12.001781 IP 192.168.15.129.43316 > 192.168.15.128.sip: Flags [S], seq 1699905014, win 1024, options [mss 1460], length 0
17:49:12.002051 IP 192.168.15.128.enbd-cstatd > 192.168.15.129.43316: Flags [R.], seq 0, ack 1699905015, win 0, length 0
17:49:12.002133 IP 192.168.15.128.1755 > 192.168.15.129.43316: Flags [R.], seq 0, ack 1699905015, win 0, length 0
17:49:12.002201 IP 192.168.15.128.sip > 192.168.15.129.43316: Flags [R.], seq 0, ack 1699905015, win 0, length 0
17:49:12.002298 IP 192.168.15.129.43316 > 192.168.15.128.discard: Flags [S], seq 1699905014, win 1024, options [mss 1460], length 0
17:49:12.002454 IP 192.168.15.129.43316 > 192.168.15.128.49157: Flags [S], seq 1699905014, win 1024, options [mss 1460], length 0
17:49:12.002850 IP 192.168.15.128.discard > 192.168.15.129.43316: Flags [R.], seq 0, ack 1699905015, win 0, length 0
17:49:12.002935 IP 192.168.15.128.49157 > 192.168.15.129.43316: Flags [R.], seq 0, ack 1699905015, win 0, length 0
17:49:12.003017 IP 192.168.15.129.43316 > 192.168.15.128.ftps: Flags [S], seq 1699905014, win 1024, options [mss 1460], length 0
17:49:12.003095 IP 192.168.15.129.43316 > 192.168.15.128.bgp: Flags [S], seq 1699905014, win 1024, options [mss 1460], length 0
17:49:12.003623 IP 192.168.15.128.ftps > 192.168.15.129.43316: Flags [R.], seq 0, ack 1699905015, win 0, length 0
17:49:12.003792 IP 192.168.15.128.bgp > 192.168.15.129.43316: Flags [R.], seq 0, ack 1699905015, win 0, length 0
17:49:12.004416 IP 192.168.15.129.43316 > 192.168.15.128.iprop: Flags [S], seq 1699905014, win 1024, options [mss 1460], length 0
17:49:12.004815 IP 192.168.15.128.iprop > 192.168.15.129.43316: Flags [S.], seq 656035426, ack 1699905015, win 5840, options [mss 1460], length 0
17:49:12.004932 IP 192.168.15.129.43316 > 192.168.15.128.5631: Flags [S], seq 1699905014, win 1024, options [mss 1460], length 0
17:49:12.005495 IP 192.168.15.128.5631 > 192.168.15.129.43316: Flags [R.], seq 0, ack 1699905015, win 0, length 0
17:49:12.005987 IP 192.168.15.129.43316 > 192.168.15.128.iprop: Flags [R], seq 1699905015, win 0, length 0
17:49:12.006942 IP 192.168.15.129.43316 > 192.168.15.128.kshell: Flags [S], seq 1699905014, win 1024, options [mss 1460], length 0
17:49:12.007049 IP 192.168.15.129.43316 > 192.168.15.128.144: Flags [S], seq 1699905014, win 1024, options [mss 1460], length 0
17:49:12.007467 IP 192.168.15.128.kshell > 192.168.15.129.43316: Flags [R.], seq 0, ack 1699905015, win 0, length 0
17:49:12.007573 IP 192.168.15.128.144 > 192.168.15.129.43316: Flags [R.], seq 0, ack 1699905015, win 0, length 0
17:49:12.008006 IP 192.168.15.129.43316 > 192.168.15.128.time: Flags [S], seq 1699905014, win 1024, options [mss 1460], length 0
17:49:12.008161 IP 192.168.15.129.43316 > 192.168.15.128.login: Flags [S], seq 1699905014, win 1024, options [mss 1460], length 0
17:49:12.008393 IP 192.168.15.129.43316 > 192.168.15.128.ldap: Flags [S], seq 1699905014, win 1024, options [mss 1460], length 0
17:49:12.008725 IP 192.168.15.128.time > 192.168.15.129.43316: Flags [R.], seq 0, ack 1699905015, win 0, length 0
17:49:12.008912 IP 192.168.15.128.login > 192.168.15.129.43316: Flags [S.], seq 655704277, ack 1699905015, win 5840, options [mss 1460], length 0
17:49:12.008975 IP 192.168.15.128.ldap > 192.168.15.129.43316: Flags [R.], seq 0, ack 1699905015, win 0, length 0
17:49:12.009225 IP 192.168.15.129.43316 > 192.168.15.128.daytime: Flags [S], seq 1699905014, win 1024, options [mss 1460], length 0
17:49:12.009699 IP 192.168.15.128.daytime > 192.168.15.129.43316: Flags [R.], seq 0, ack 1699905015, win 0, length 0
17:49:12.009790 IP 192.168.15.129.43316 > 192.168.15.128.login: Flags [R], seq 1699905015, win 0, length 0
17:49:12.010387 IP 192.168.15.129.43316 > 192.168.15.128.9100: Flags [S], seq 1699905014, win 1024, options [mss 1460], length 0
17:49:12.010486 IP 192.168.15.129.43316 > 192.168.15.128.postgresql: Flags [S], seq 1699905014, win 1024, options [mss 1460], length 0
17:49:12.010768 IP 192.168.15.128.9100 > 192.168.15.129.43316: Flags [R.], seq 0, ack 1699905015, win 0, length 0
17:49:12.010859 IP 192.168.15.128.postgresql > 192.168.15.129.43316: Flags [S.], seq 647100780, ack 1699905015, win 5840, options [mss 1460], length 0
17:49:12.011381 IP 192.168.15.129.43316 > 192.168.15.128.postgresql: Flags [R], seq 1699905015, win 0, length 0
17:49:12.011740 IP 192.168.15.129.43316 > 192.168.15.128.3000: Flags [S], seq 1699905014, win 1024, options [mss 1460], length 0
17:49:12.011875 IP 192.168.15.129.43316 > 192.168.15.128.printer: Flags [S], seq 1699905014, win 1024, options [mss 1460], length 0
17:49:12.012206 IP 192.168.15.128.3000 > 192.168.15.129.43316: Flags [R.], seq 0, ack 1699905015, win 0, length 0
17:49:12.012325 IP 192.168.15.128.printer > 192.168.15.129.43316: Flags [R.], seq 0, ack 1699905015, win 0, length 0
17:49:12.012826 IP 192.168.15.129.43316 > 192.168.15.128.49156: Flags [S], seq 1699905014, win 1024, options [mss 1460], length 0
17:49:12.012925 IP 192.168.15.129.43316 > 192.168.15.128.646: Flags [S], seq 1699905014, win 1024, options [mss 1460], length 0
17:49:12.013052 IP 192.168.15.129.43316 > 192.168.15.128.webmin: Flags [S], seq 1699905014, win 1024, options [mss 1460], length 0
17:49:12.013242 IP 192.168.15.128.49156 > 192.168.15.129.43316: Flags [R.], seq 0, ack 1699905015, win 0, length 0
17:49:12.013391 IP 192.168.15.128.646 > 192.168.15.129.43316: Flags [R.], seq 0, ack 1699905015, win 0, length 0
17:49:12.013470 IP 192.168.15.128.webmin > 192.168.15.129.43316: Flags [R.], seq 0, ack 1699905015, win 0, length 0
17:49:12.014105 IP 192.168.15.129.43316 > 192.168.15.128.urd: Flags [S], seq 1699905014, win 1024, options [mss 1460], length 0
17:49:12.014207 IP 192.168.15.129.43316 > 192.168.15.128.1029: Flags [S], seq 1699905014, win 1024, options [mss 1460], length 0
17:49:12.014309 IP 192.168.15.129.43316 > 192.168.15.128.1900: Flags [S], seq 1699905014, win 1024, options [mss 1460], length 0
17:49:12.014470 IP 192.168.15.128.urd > 192.168.15.129.43316: Flags [R.], seq 0, ack 1699905015, win 0, length 0
17:49:12.014739 IP 192.168.15.128.1029 > 192.168.15.129.43316: Flags [R.], seq 0, ack 1699905015, win 0, length 0
17:49:12.014814 IP 192.168.15.128.1900 > 192.168.15.129.43316: Flags [R.], seq 0, ack 1699905015, win 0, length 0
17:49:12.015325 IP 192.168.15.129.43316 > 192.168.15.128.ms-sql-s: Flags [S], seq 1699905014, win 1024, options [mss 1460], length 0
17:49:12.015762 IP 192.168.15.128.ms-sql-s > 192.168.15.129.43316: Flags [R.], seq 0, ack 1699905015, win 0, length 0
17:49:12.016743 IP 192.168.15.129.43316 > 192.168.15.128.5101: Flags [S], seq 1699905014, win 1024, options [mss 1460], length 0
17:49:12.017144 IP 192.168.15.128.5101 > 192.168.15.129.43316: Flags [R.], seq 0, ack 1699905015, win 0, length 0
17:49:12.017436 IP 192.168.15.129.43316 > 192.168.15.128.svrloc: Flags [S], seq 1699905014, win 1024, options [mss 1460], length 0
17:49:12.017831 IP 192.168.15.128.svrloc > 192.168.15.129.43316: Flags [R.], seq 0, ack 1699905015, win 0, length 0
17:49:12.018379 IP 192.168.15.129.43316 > 192.168.15.128.shell: Flags [S], seq 1699905014, win 1024, options [mss 1460], length 0
17:49:12.018879 IP 192.168.15.128.shell > 192.168.15.129.43316: Flags [S.], seq 659135778, ack 1699905015, win 5840, options [mss 1460], length 0
17:49:12.019113 IP 192.168.15.129.43316 > 192.168.15.128.x11: Flags [S], seq 1699905014, win 1024, options [mss 1460], length 0
17:49:12.019226 IP 192.168.15.129.43316 > 192.168.15.128.shell: Flags [R], seq 1699905015, win 0, length 0
17:49:12.019535 IP 192.168.15.128.x11 > 192.168.15.129.43316: Flags [S.], seq 655563874, ack 1699905015, win 5840, options [mss 1460], length 0
17:49:12.019922 IP 192.168.15.129.43316 > 192.168.15.128.x11: Flags [R], seq 1699905015, win 0, length 0
17:49:12.022859 IP 192.168.15.129.43316 > 192.168.15.128.49155: Flags [S], seq 1699905014, win 1024, options [mss 1460], length 0
17:49:12.022971 IP 192.168.15.129.43316 > 192.168.15.128.9999: Flags [S], seq 1699905014, win 1024, options [mss 1460], length 0
17:49:12.023362 IP 192.168.15.128.49155 > 192.168.15.129.43316: Flags [R.], seq 0, ack 1699905015, win 0, length 0
17:49:12.023676 IP 192.168.15.128.9999 > 192.168.15.129.43316: Flags [R.], seq 0, ack 1699905015, win 0, length 0
17:49:12.023756 IP 192.168.15.129.43316 > 192.168.15.128.poppassd: Flags [S], seq 1699905014, win 1024, options [mss 1460], length 0
17:49:12.024042 IP 192.168.15.129.43316 > 192.168.15.128.49154: Flags [S], seq 1699905014, win 1024, options [mss 1460], length 0
17:49:12.024192 IP 192.168.15.128.poppassd > 192.168.15.129.43316: Flags [R.], seq 0, ack 1699905015, win 0, length 0
17:49:12.024500 IP 192.168.15.128.49154 > 192.168.15.129.43316: Flags [R.], seq 0, ack 1699905015, win 0, length 0
17:49:12.024806 IP 192.168.15.129.43316 > 192.168.15.128.snpp: Flags [S], seq 1699905014, win 1024, options [mss 1460], length 0
17:49:12.024987 IP 192.168.15.128.snpp > 192.168.15.129.43316: Flags [R.], seq 0, ack 1699905015, win 0, length 0
17:49:12.025130 IP 192.168.15.129.43316 > 192.168.15.128.49152: Flags [S], seq 1699905014, win 1024, options [mss 1460], length 0
17:49:12.025305 IP 192.168.15.128.49152 > 192.168.15.129.43316: Flags [R.], seq 0, ack 1699905015, win 0, length 0
17:49:12.025512 IP 192.168.15.129.43316 > 192.168.15.128.3986: Flags [S], seq 1699905014, win 1024, options [mss 1460], length 0
17:49:12.025707 IP 192.168.15.128.3986 > 192.168.15.129.43316: Flags [R.], seq 0, ack 1699905015, win 0, length 0
17:49:12.025746 IP 192.168.15.129.43316 > 192.168.15.128.finger: Flags [S], seq 1699905014, win 1024, options [mss 1460], length 0
17:49:12.025909 IP 192.168.15.128.finger > 192.168.15.129.43316: Flags [R.], seq 0, ack 1699905015, win 0, length 0
17:49:12.025974 IP 192.168.15.129.43316 > 192.168.15.128.1110: Flags [S], seq 1699905014, win 1024, options [mss 1460], length 0
17:49:12.026134 IP 192.168.15.128.1110 > 192.168.15.129.43316: Flags [R.], seq 0, ack 1699905015, win 0, length 0
17:49:12.026169 IP 192.168.15.129.43316 > 192.168.15.128.radmin-port: Flags [S], seq 1699905014, win 1024, options [mss 1460], length 0
17:49:12.026239 IP 192.168.15.129.43316 > 192.168.15.128.aol: Flags [S], seq 1699905014, win 1024, options [mss 1460], length 0
17:49:12.026384 IP 192.168.15.128.radmin-port > 192.168.15.129.43316: Flags [R.], seq 0, ack 1699905015, win 0, length 0
17:49:12.026412 IP 192.168.15.128.aol > 192.168.15.129.43316: Flags [R.], seq 0, ack 1699905015, win 0, length 0
17:49:12.026559 IP 192.168.15.129.43316 > 192.168.15.128.1026: Flags [S], seq 1699905014, win 1024, options [mss 1460], length 0
17:49:12.026732 IP 192.168.15.128.1026 > 192.168.15.129.43316: Flags [R.], seq 0, ack 1699905015, win 0, length 0
17:49:12.026942 IP 192.168.15.129.43316 > 192.168.15.128.nfs: Flags [S], seq 1699905014, win 1024, options [mss 1460], length 0
17:49:12.026987 IP 192.168.15.129.43316 > 192.168.15.128.klogin: Flags [S], seq 1699905014, win 1024, options [mss 1460], length 0
17:49:12.027155 IP 192.168.15.128.nfs > 192.168.15.129.43316: Flags [S.], seq 647409152, ack 1699905015, win 5840, options [mss 1460], length 0
17:49:12.027202 IP 192.168.15.128.klogin > 192.168.15.129.43316: Flags [R.], seq 0, ack 1699905015, win 0, length 0
17:49:12.027313 IP 192.168.15.129.43316 > 192.168.15.128.nfs: Flags [R], seq 1699905015, win 0, length 0
17:49:12.027450 IP 192.168.15.129.43316 > 192.168.15.128.8000: Flags [S], seq 1699905014, win 1024, options [mss 1460], length 0
17:49:12.027608 IP 192.168.15.128.8000 > 192.168.15.129.43316: Flags [R.], seq 0, ack 1699905015, win 0, length 0
17:49:12.027751 IP 192.168.15.129.43316 > 192.168.15.128.echo: Flags [S], seq 1699905014, win 1024, options [mss 1460], length 0
17:49:12.027907 IP 192.168.15.128.echo > 192.168.15.129.43316: Flags [R.], seq 0, ack 1699905015, win 0, length 0
17:49:12.028185 IP 192.168.15.129.43316 > 192.168.15.128.8009: Flags [S], seq 1699905014, win 1024, options [mss 1460], length 0
17:49:12.028385 IP 192.168.15.128.8009 > 192.168.15.129.43316: Flags [S.], seq 658061019, ack 1699905015, win 5840, options [mss 1460], length 0
17:49:12.028527 IP 192.168.15.129.43316 > 192.168.15.128.1028: Flags [S], seq 1699905014, win 1024, options [mss 1460], length 0
17:49:12.028572 IP 192.168.15.129.43316 > 192.168.15.128.8009: Flags [R], seq 1699905015, win 0, length 0
17:49:12.028702 IP 192.168.15.128.1028 > 192.168.15.129.43316: Flags [R.], seq 0, ack 1699905015, win 0, length 0
17:49:12.028903 IP 192.168.15.129.43316 > 192.168.15.128.x11-1: Flags [S], seq 1699905014, win 1024, options [mss 1460], length 0
17:49:12.028993 IP 192.168.15.129.43316 > 192.168.15.128.2717: Flags [S], seq 1699905014, win 1024, options [mss 1460], length 0
17:49:12.029062 IP 192.168.15.128.x11-1 > 192.168.15.129.43316: Flags [R.], seq 0, ack 1699905015, win 0, length 0
17:49:12.029128 IP 192.168.15.128.2717 > 192.168.15.129.43316: Flags [R.], seq 0, ack 1699905015, win 0, length 0
17:49:12.029540 IP 192.168.15.129.43316 > 192.168.15.128.7070: Flags [S], seq 1699905014, win 1024, options [mss 1460], length 0
17:49:12.029586 IP 192.168.15.129.43316 > 192.168.15.128.afpovertcp: Flags [S], seq 1699905014, win 1024, options [mss 1460], length 0
17:49:12.029701 IP 192.168.15.128.7070 > 192.168.15.129.43316: Flags [R.], seq 0, ack 1699905015, win 0, length 0
17:49:12.129243 IP 192.168.15.128.afpovertcp > 192.168.15.129.43316: Flags [R.], seq 0, ack 1699905015, win 0, length 0
17:49:12.129313 IP 192.168.15.129.43316 > 192.168.15.128.tproxy: Flags [S], seq 1699905014, win 1024, options [mss 1460], length 0
17:49:12.129335 IP 192.168.15.129.43316 > 192.168.15.128.2001: Flags [S], seq 1699905014, win 1024, options [mss 1460], length 0
17:49:12.129352 IP 192.168.15.129.43316 > 192.168.15.128.6646: Flags [S], seq 1699905014, win 1024, options [mss 1460], length 0
17:49:12.129370 IP 192.168.15.129.43316 > 192.168.15.128.nrpe: Flags [S], seq 1699905014, win 1024, options [mss 1460], length 0
17:49:12.129388 IP 192.168.15.129.43316 > 192.168.15.128.8008: Flags [S], seq 1699905014, win 1024, options [mss 1460], length 0
17:49:12.129407 IP 192.168.15.129.43316 > 192.168.15.128.ipp: Flags [S], seq 1699905014, win 1024, options [mss 1460], length 0
17:49:12.129425 IP 192.168.15.129.43316 > 192.168.15.128.cisco-sccp: Flags [S], seq 1699905014, win 1024, options [mss 1460], length 0
17:49:12.129442 IP 192.168.15.129.43316 > 192.168.15.128.kerberos: Flags [S], seq 1699905014, win 1024, options [mss 1460], length 0
17:49:12.129493 IP 192.168.15.129.43316 > 192.168.15.128.5000: Flags [S], seq 1699905014, win 1024, options [mss 1460], length 0
17:49:12.129514 IP 192.168.15.129.43316 > 192.168.15.128.5009: Flags [S], seq 1699905014, win 1024, options [mss 1460], length 0
17:49:12.129532 IP 192.168.15.129.43316 > 192.168.15.128.32768: Flags [S], seq 1699905014, win 1024, options [mss 1460], length 0
17:49:12.129554 IP 192.168.15.129.43316 > 192.168.15.128.nntp: Flags [S], seq 1699905014, win 1024, options [mss 1460], length 0
17:49:12.129572 IP 192.168.15.129.43316 > 192.168.15.128.1027: Flags [S], seq 1699905014, win 1024, options [mss 1460], length 0
17:49:12.129593 IP 192.168.15.129.43316 > 192.168.15.128.5800: Flags [S], seq 1699905014, win 1024, options [mss 1460], length 0
17:49:12.129611 IP 192.168.15.129.43316 > 192.168.15.128.rsync: Flags [S], seq 1699905014, win 1024, options [mss 1460], length 0
17:49:12.129631 IP 192.168.15.129.43316 > 192.168.15.128.81: Flags [S], seq 1699905014, win 1024, options [mss 1460], length 0
17:49:12.129652 IP 192.168.15.129.43316 > 192.168.15.128.8443: Flags [S], seq 1699905014, win 1024, options [mss 1460], length 0
17:49:12.129694 IP 192.168.15.129.43316 > 192.168.15.128.3128: Flags [S], seq 1699905014, win 1024, options [mss 1460], length 0
17:49:12.129735 IP 192.168.15.128.tproxy > 192.168.15.129.43316: Flags [R.], seq 0, ack 1699905015, win 0, length 0
17:49:12.129754 IP 192.168.15.128.2001 > 192.168.15.129.43316: Flags [R.], seq 0, ack 1699905015, win 0, length 0
17:49:12.129772 IP 192.168.15.128.6646 > 192.168.15.129.43316: Flags [R.], seq 0, ack 1699905015, win 0, length 0
17:49:12.129797 IP 192.168.15.128.nrpe > 192.168.15.129.43316: Flags [R.], seq 0, ack 1699905015, win 0, length 0
17:49:12.129821 IP 192.168.15.128.8008 > 192.168.15.129.43316: Flags [R.], seq 0, ack 1699905015, win 0, length 0
17:49:12.129841 IP 192.168.15.128.ipp > 192.168.15.129.43316: Flags [R.], seq 0, ack 1699905015, win 0, length 0
17:49:12.129860 IP 192.168.15.128.cisco-sccp > 192.168.15.129.43316: Flags [R.], seq 0, ack 1699905015, win 0, length 0
17:49:12.129916 IP 192.168.15.128.kerberos > 192.168.15.129.43316: Flags [R.], seq 0, ack 1699905015, win 0, length 0
17:49:12.129965 IP 192.168.15.128.5000 > 192.168.15.129.43316: Flags [R.], seq 0, ack 1699905015, win 0, length 0
17:49:12.130035 IP 192.168.15.128.5009 > 192.168.15.129.43316: Flags [R.], seq 0, ack 1699905015, win 0, length 0
17:49:12.130062 IP 192.168.15.128.32768 > 192.168.15.129.43316: Flags [R.], seq 0, ack 1699905015, win 0, length 0
17:49:12.130082 IP 192.168.15.128.nntp > 192.168.15.129.43316: Flags [R.], seq 0, ack 1699905015, win 0, length 0
17:49:12.130101 IP 192.168.15.128.1027 > 192.168.15.129.43316: Flags [R.], seq 0, ack 1699905015, win 0, length 0
17:49:12.130118 IP 192.168.15.128.5800 > 192.168.15.129.43316: Flags [R.], seq 0, ack 1699905015, win 0, length 0
17:49:12.130135 IP 192.168.15.128.rsync > 192.168.15.129.43316: Flags [R.], seq 0, ack 1699905015, win 0, length 0
17:49:12.130153 IP 192.168.15.128.81 > 192.168.15.129.43316: Flags [R.], seq 0, ack 1699905015, win 0, length 0
17:49:12.130174 IP 192.168.15.128.8443 > 192.168.15.129.43316: Flags [R.], seq 0, ack 1699905015, win 0, length 0
17:49:12.130193 IP 192.168.15.128.3128 > 192.168.15.129.43316: Flags [R.], seq 0, ack 1699905015, win 0, length 0
17:49:12.132447 IP 192.168.15.129.43317 > 192.168.15.128.3128: Flags [S], seq 1699970551, win 1024, options [mss 1460], length 0
17:49:12.132488 IP 192.168.15.129.43317 > 192.168.15.128.8443: Flags [S], seq 1699970551, win 1024, options [mss 1460], length 0
17:49:12.132508 IP 192.168.15.129.43317 > 192.168.15.128.81: Flags [S], seq 1699970551, win 1024, options [mss 1460], length 0
17:49:12.132525 IP 192.168.15.129.43317 > 192.168.15.128.rsync: Flags [S], seq 1699970551, win 1024, options [mss 1460], length 0
17:49:12.132545 IP 192.168.15.129.43317 > 192.168.15.128.5800: Flags [S], seq 1699970551, win 1024, options [mss 1460], length 0
17:49:12.132562 IP 192.168.15.129.43317 > 192.168.15.128.1027: Flags [S], seq 1699970551, win 1024, options [mss 1460], length 0
17:49:12.132581 IP 192.168.15.129.43317 > 192.168.15.128.nntp: Flags [S], seq 1699970551, win 1024, options [mss 1460], length 0
17:49:12.132619 IP 192.168.15.129.43317 > 192.168.15.128.32768: Flags [S], seq 1699970551, win 1024, options [mss 1460], length 0
17:49:12.132656 IP 192.168.15.128.3128 > 192.168.15.129.43317: Flags [R.], seq 0, ack 1699970552, win 0, length 0
17:49:12.132720 IP 192.168.15.128.8443 > 192.168.15.129.43317: Flags [R.], seq 0, ack 1699970552, win 0, length 0
17:49:12.132741 IP 192.168.15.128.81 > 192.168.15.129.43317: Flags [R.], seq 0, ack 1699970552, win 0, length 0
17:49:12.132760 IP 192.168.15.128.rsync > 192.168.15.129.43317: Flags [R.], seq 0, ack 1699970552, win 0, length 0
17:49:12.132777 IP 192.168.15.128.5800 > 192.168.15.129.43317: Flags [R.], seq 0, ack 1699970552, win 0, length 0
17:49:12.132817 IP 192.168.15.128.1027 > 192.168.15.129.43317: Flags [R.], seq 0, ack 1699970552, win 0, length 0
17:49:12.132880 IP 192.168.15.128.nntp > 192.168.15.129.43317: Flags [R.], seq 0, ack 1699970552, win 0, length 0
17:49:12.132909 IP 192.168.15.128.32768 > 192.168.15.129.43317: Flags [R.], seq 0, ack 1699970552, win 0, length 0
17:49:12.132934 IP 192.168.15.129.43317 > 192.168.15.128.5009: Flags [S], seq 1699970551, win 1024, options [mss 1460], length 0
17:49:12.133031 IP 192.168.15.129.43317 > 192.168.15.128.5000: Flags [S], seq 1699970551, win 1024, options [mss 1460], length 0
17:49:12.133093 IP 192.168.15.129.43317 > 192.168.15.128.kerberos: Flags [S], seq 1699970551, win 1024, options [mss 1460], length 0
17:49:12.133113 IP 192.168.15.129.43317 > 192.168.15.128.cisco-sccp: Flags [S], seq 1699970551, win 1024, options [mss 1460], length 0
17:49:12.133132 IP 192.168.15.129.43317 > 192.168.15.128.ipp: Flags [S], seq 1699970551, win 1024, options [mss 1460], length 0
17:49:12.133150 IP 192.168.15.129.43317 > 192.168.15.128.8008: Flags [S], seq 1699970551, win 1024, options [mss 1460], length 0
17:49:12.133169 IP 192.168.15.129.43317 > 192.168.15.128.nrpe: Flags [S], seq 1699970551, win 1024, options [mss 1460], length 0
17:49:12.133203 IP 192.168.15.128.5009 > 192.168.15.129.43317: Flags [R.], seq 0, ack 1699970552, win 0, length 0
17:49:12.133225 IP 192.168.15.128.5000 > 192.168.15.129.43317: Flags [R.], seq 0, ack 1699970552, win 0, length 0
17:49:12.133253 IP 192.168.15.129.43317 > 192.168.15.128.6646: Flags [S], seq 1699970551, win 1024, options [mss 1460], length 0
17:49:12.133287 IP 192.168.15.128.kerberos > 192.168.15.129.43317: Flags [R.], seq 0, ack 1699970552, win 0, length 0
17:49:12.133329 IP 192.168.15.128.cisco-sccp > 192.168.15.129.43317: Flags [R.], seq 0, ack 1699970552, win 0, length 0
17:49:12.133349 IP 192.168.15.128.ipp > 192.168.15.129.43317: Flags [R.], seq 0, ack 1699970552, win 0, length 0
17:49:12.133394 IP 192.168.15.128.8008 > 192.168.15.129.43317: Flags [R.], seq 0, ack 1699970552, win 0, length 0
17:49:12.133413 IP 192.168.15.128.nrpe > 192.168.15.129.43317: Flags [R.], seq 0, ack 1699970552, win 0, length 0
17:49:12.133431 IP 192.168.15.128.6646 > 192.168.15.129.43317: Flags [R.], seq 0, ack 1699970552, win 0, length 0
17:49:12.133516 IP 192.168.15.129.43317 > 192.168.15.128.2001: Flags [S], seq 1699970551, win 1024, options [mss 1460], length 0
17:49:12.133553 IP 192.168.15.129.43317 > 192.168.15.128.tproxy: Flags [S], seq 1699970551, win 1024, options [mss 1460], length 0
17:49:12.133571 IP 192.168.15.129.43317 > 192.168.15.128.afpovertcp: Flags [S], seq 1699970551, win 1024, options [mss 1460], length 0
17:49:12.133746 IP 192.168.15.128.2001 > 192.168.15.129.43317: Flags [R.], seq 0, ack 1699970552, win 0, length 0
17:49:12.133779 IP 192.168.15.128.tproxy > 192.168.15.129.43317: Flags [R.], seq 0, ack 1699970552, win 0, length 0
17:49:12.133798 IP 192.168.15.128.afpovertcp > 192.168.15.129.43317: Flags [R.], seq 0, ack 1699970552, win 0, length 0
17:49:15.897748 ARP, Request who-has 192.168.15.2 tell 192.168.15.129, length 46
17:49:15.898324 ARP, Reply 192.168.15.2 is-at 00:50:56:e8:23:fc (oui Unknown), length 46
17:49:15.935728 ARP, Request who-has 192.168.15.129 tell 192.168.15.128, length 46
17:49:15.936526 ARP, Reply 192.168.15.129 is-at 00:0c:29:2d:be:bd (oui Unknown), length 46
17:50:07.228066 ARP, Request who-has 192.168.15.2 tell 192.168.15.1, length 46
17:50:08.332990 ARP, Request who-has 192.168.15.2 tell 192.168.15.1, length 46
17:50:09.228148 ARP, Request who-has 192.168.15.2 tell 192.168.15.1, length 46
17:50:10.228091 ARP, Request who-has 192.168.15.2 tell 192.168.15.1, length 46
17:50:15.835555 ARP, Request who-has 192.168.15.2 tell 192.168.15.1, length 46
17:50:16.727822 ARP, Request who-has 192.168.15.2 tell 192.168.15.1, length 46
17:50:17.728725 ARP, Request who-has 192.168.15.2 tell 192.168.15.1, length 46
17:50:18.837027 ARP, Request who-has 192.168.15.2 tell 192.168.15.1, length 46
17:50:19.728241 ARP, Request who-has 192.168.15.2 tell 192.168.15.1, length 46
17:50:20.728533 ARP, Request who-has 192.168.15.2 tell 192.168.15.1, length 46
17:50:24.839384 ARP, Request who-has 192.168.15.2 tell 192.168.15.1, length 46
17:50:25.728724 ARP, Request who-has 192.168.15.2 tell 192.168.15.1, length 46
17:50:26.728659 ARP, Request who-has 192.168.15.2 tell 192.168.15.1, length 46
17:50:27.839930 ARP, Request who-has 192.168.15.2 tell 192.168.15.1, length 46
17:50:28.728688 ARP, Request who-has 192.168.15.2 tell 192.168.15.1, length 46
17:50:29.727864 ARP, Request who-has 192.168.15.2 tell 192.168.15.1, length 46
17:50:29.986352 IP6 fe80::f927:acb3:aacd:2901.59886 > ff02::c.3702: UDP, length 656
17:50:29.987027 IP 192.168.15.1.59885 > 239.255.255.250.3702: UDP, length 656
17:50:30.139370 IP6 fe80::f927:acb3:aacd:2901.59886 > ff02::c.3702: UDP, length 656
17:50:30.153330 IP 192.168.15.1.59885 > 239.255.255.250.3702: UDP, length 656
17:50:30.443471 IP6 fe80::f927:acb3:aacd:2901.59886 > ff02::c.3702: UDP, length 656
17:50:30.486126 IP 192.168.15.1.59885 > 239.255.255.250.3702: UDP, length 656
17:50:31.052253 IP6 fe80::f927:acb3:aacd:2901.59886 > ff02::c.3702: UDP, length 656
17:50:31.150377 IP 192.168.15.1.59885 > 239.255.255.250.3702: UDP, length 656
17:50:32.268600 IP6 fe80::f927:acb3:aacd:2901.59886 > ff02::c.3702: UDP, length 656
17:50:32.478798 IP 192.168.15.1.59885 > 239.255.255.250.3702: UDP, length 656
17:50:34.268958 IP6 fe80::f927:acb3:aacd:2901.59886 > ff02::c.3702: UDP, length 656
17:50:34.478982 IP 192.168.15.1.59885 > 239.255.255.250.3702: UDP, length 656
17:50:36.269665 IP6 fe80::f927:acb3:aacd:2901.59886 > ff02::c.3702: UDP, length 656
17:50:36.480133 IP 192.168.15.1.59885 > 239.255.255.250.3702: UDP, length 656
17:51:04.117459 IP 192.168.15.130.netbios-ns > 192.168.15.2.netbios-ns: NBT UDP PACKET(137): REFRESH(8); REQUEST; UNICAST
17:51:05.616710 IP 192.168.15.130.netbios-ns > 192.168.15.2.netbios-ns: NBT UDP PACKET(137): REFRESH(8); REQUEST; UNICAST
17:51:07.116714 IP 192.168.15.130.netbios-ns > 192.168.15.2.netbios-ns: NBT UDP PACKET(137): REFRESH(8); REQUEST; UNICAST
17:51:07.917591 IP 192.168.15.129.bootpc > 192.168.15.254.bootps: BOOTP/DHCP, Request from 00:0c:29:2d:be:bd (oui Unknown), length 300
17:51:07.918337 IP 192.168.15.254.bootps > 192.168.15.129.bootpc: BOOTP/DHCP, Reply, length 300
17:51:12.921727 ARP, Request who-has 192.168.15.254 tell 192.168.15.129, length 46
17:51:12.922278 ARP, Reply 192.168.15.254 is-at 00:50:56:e8:90:7f (oui Unknown), length 46
17:52:07.228464 ARP, Request who-has 192.168.15.2 tell 192.168.15.1, length 46
17:52:08.332486 ARP, Request who-has 192.168.15.2 tell 192.168.15.1, length 46
17:52:09.228844 ARP, Request who-has 192.168.15.2 tell 192.168.15.1, length 46
17:52:10.228653 ARP, Request who-has 192.168.15.2 tell 192.168.15.1, length 46
17:52:15.837394 ARP, Request who-has 192.168.15.2 tell 192.168.15.1, length 46
17:52:16.728110 ARP, Request who-has 192.168.15.2 tell 192.168.15.1, length 46
17:52:17.728622 ARP, Request who-has 192.168.15.2 tell 192.168.15.1, length 46
17:52:18.839321 ARP, Request who-has 192.168.15.2 tell 192.168.15.1, length 46
17:52:19.728116 ARP, Request who-has 192.168.15.2 tell 192.168.15.1, length 46
17:52:20.728136 ARP, Request who-has 192.168.15.2 tell 192.168.15.1, length 46
17:52:24.842908 ARP, Request who-has 192.168.15.2 tell 192.168.15.1, length 46
17:52:25.727935 ARP, Request who-has 192.168.15.2 tell 192.168.15.1, length 46
17:52:26.728784 ARP, Request who-has 192.168.15.2 tell 192.168.15.1, length 46
17:52:27.843858 ARP, Request who-has 192.168.15.2 tell 192.168.15.1, length 46
17:52:28.727968 ARP, Request who-has 192.168.15.2 tell 192.168.15.1, length 46
17:52:29.728594 ARP, Request who-has 192.168.15.2 tell 192.168.15.1, length 46
17:53:04.117104 IP 192.168.15.130.netbios-ns > 192.168.15.2.netbios-ns: NBT UDP PACKET(137): REFRESH(8); REQUEST; UNICAST
17:53:05.617833 IP 192.168.15.130.netbios-ns > 192.168.15.2.netbios-ns: NBT UDP PACKET(137): REFRESH(8); REQUEST; UNICAST
17:53:07.117353 IP 192.168.15.130.netbios-ns > 192.168.15.2.netbios-ns: NBT UDP PACKET(137): REFRESH(8); REQUEST; UNICAST
17:53:59.523392 IP 192.168.15.130.netbios-dgm > 192.168.15.255.netbios-dgm: NBT UDP PACKET(138)
17:54:07.227920 ARP, Request who-has 192.168.15.2 tell 192.168.15.1, length 46
17:54:08.331297 ARP, Request who-has 192.168.15.2 tell 192.168.15.1, length 46
17:54:09.228034 ARP, Request who-has 192.168.15.2 tell 192.168.15.1, length 46
17:54:10.228447 ARP, Request who-has 192.168.15.2 tell 192.168.15.1, length 46
17:54:15.833940 ARP, Request who-has 192.168.15.2 tell 192.168.15.1, length 46
17:54:16.728182 ARP, Request who-has 192.168.15.2 tell 192.168.15.1, length 46
17:54:17.728050 ARP, Request who-has 192.168.15.2 tell 192.168.15.1, length 46
17:54:18.835042 ARP, Request who-has 192.168.15.2 tell 192.168.15.1, length 46
17:54:19.727930 ARP, Request who-has 192.168.15.2 tell 192.168.15.1, length 46
17:54:20.727929 ARP, Request who-has 192.168.15.2 tell 192.168.15.1, length 46
17:54:24.836149 ARP, Request who-has 192.168.15.2 tell 192.168.15.1, length 46
17:54:25.727912 ARP, Request who-has 192.168.15.2 tell 192.168.15.1, length 46
17:54:26.728477 ARP, Request who-has 192.168.15.2 tell 192.168.15.1, length 46
17:54:27.839044 ARP, Request who-has 192.168.15.2 tell 192.168.15.1, length 46
17:54:28.728694 ARP, Request who-has 192.168.15.2 tell 192.168.15.1, length 46
17:54:29.727928 ARP, Request who-has 192.168.15.2 tell 192.168.15.1, length 46
17:55:04.117867 IP 192.168.15.130.netbios-ns > 192.168.15.2.netbios-ns: NBT UDP PACKET(137): REFRESH(8); REQUEST; UNICAST
17:55:05.617174 IP 192.168.15.130.netbios-ns > 192.168.15.2.netbios-ns: NBT UDP PACKET(137): REFRESH(8); REQUEST; UNICAST
17:55:07.117322 IP 192.168.15.130.netbios-ns > 192.168.15.2.netbios-ns: NBT UDP PACKET(137): REFRESH(8); REQUEST; UNICAST
17:55:40.712300 ARP, Request who-has 192.168.15.128 (Broadcast) tell 192.168.15.129, length 46
17:55:40.712751 ARP, Reply 192.168.15.128 is-at 00:0c:29:a1:c5:30 (oui Unknown), length 46
17:55:40.913880 IP 192.168.15.129.43287 > 192.168.15.2.domain: 5253+ PTR? 128.15.168.192.in-addr.arpa. (45)
