13:32:11.709613 IP 192.168.15.128 > 8.8.8.8: ICMP echo request, id 13086, seq 130, length 64
13:32:11.746931 IP 8.8.8.8 > 192.168.15.128: ICMP echo reply, id 13086, seq 130, length 64
13:32:12.227209 ARP, Request who-has 192.168.15.2 tell 192.168.15.1, length 46
13:32:12.548048 ARP, Request who-has 192.168.15.254 tell 192.168.15.128, length 46
13:32:12.548734 ARP, Reply 192.168.15.254 is-at 00:50:56:e8:90:7f (oui Unknown), length 46
13:32:12.549341 IP 192.168.15.128.bootpc > 192.168.15.254.bootps: BOOTP/DHCP, Request from 00:0c:29:a1:c5:30 (oui Unknown), length 300
13:32:12.549848 IP 192.168.15.254.bootps > 192.168.15.128.bootpc: BOOTP/DHCP, Reply, length 300
13:32:12.719920 IP 192.168.15.128 > 8.8.8.8: ICMP echo request, id 13086, seq 131, length 64
13:32:12.757685 IP 8.8.8.8 > 192.168.15.128: ICMP echo reply, id 13086, seq 131, length 64
13:32:13.446226 ARP, Request who-has 192.168.15.2 tell 192.168.15.1, length 46
13:32:13.729613 IP 192.168.15.128 > 8.8.8.8: ICMP echo request, id 13086, seq 132, length 64
13:32:13.764803 IP 8.8.8.8 > 192.168.15.128: ICMP echo reply, id 13086, seq 132, length 64
13:32:14.226602 ARP, Request who-has 192.168.15.2 tell 192.168.15.1, length 46
13:32:14.749024 IP 192.168.15.128 > 8.8.8.8: ICMP echo request, id 13086, seq 133, length 64
13:32:14.793418 IP 8.8.8.8 > 192.168.15.128: ICMP echo reply, id 13086, seq 133, length 64
13:32:14.968130 IP 192.168.15.1.netbios-ns > 192.168.15.255.netbios-ns: NBT UDP PACKET(137): QUERY; REQUEST; BROADCAST
13:32:15.227364 ARP, Request who-has 192.168.15.2 tell 192.168.15.1, length 46
13:32:15.718440 IP 192.168.15.1.netbios-ns > 192.168.15.255.netbios-ns: NBT UDP PACKET(137): QUERY; REQUEST; BROADCAST
13:32:15.758870 IP 192.168.15.128 > 8.8.8.8: ICMP echo request, id 13086, seq 134, length 64
13:32:15.795412 IP 8.8.8.8 > 192.168.15.128: ICMP echo reply, id 13086, seq 134, length 64
13:32:16.469228 IP 192.168.15.1.netbios-ns > 192.168.15.255.netbios-ns: NBT UDP PACKET(137): QUERY; REQUEST; BROADCAST
13:32:16.769083 IP 192.168.15.128 > 8.8.8.8: ICMP echo request, id 13086, seq 135, length 64
13:32:16.807159 IP 8.8.8.8 > 192.168.15.128: ICMP echo reply, id 13086, seq 135, length 64
13:32:17.503381 ARP, Request who-has 192.168.15.128 (Broadcast) tell 192.168.15.129, length 46
13:32:17.503909 ARP, Reply 192.168.15.128 is-at 00:0c:29:a1:c5:30 (oui Unknown), length 46
13:32:17.704919 IP 192.168.15.129.55667 > 192.168.15.2.domain: 4625+ PTR? 128.15.168.192.in-addr.arpa. (45)
13:32:17.709706 IP 192.168.15.2.domain > 192.168.15.129.55667: 4625 NXDomain 0/0/0 (45)
13:32:17.711477 IP 192.168.15.129.46886 > 192.168.15.128.3389: Flags [S], seq 815793233, win 1024, options [mss 1460], length 0
13:32:17.711500 IP 192.168.15.129.46886 > 192.168.15.128.imaps: Flags [S], seq 815793233, win 1024, options [mss 1460], length 0
13:32:17.711632 IP 192.168.15.129.46886 > 192.168.15.128.telnet: Flags [S], seq 815793233, win 1024, options [mss 1460], length 0
13:32:17.711673 IP 192.168.15.129.46886 > 192.168.15.128.5900: Flags [S], seq 815793233, win 1024, options [mss 1460], length 0
13:32:17.711873 IP 192.168.15.129.46886 > 192.168.15.128.imap2: Flags [S], seq 815793233, win 1024, options [mss 1460], length 0
13:32:17.712036 IP 192.168.15.129.46886 > 192.168.15.128.pop3s: Flags [S], seq 815793233, win 1024, options [mss 1460], length 0
13:32:17.712241 IP 192.168.15.129.46886 > 192.168.15.128.http: Flags [S], seq 815793233, win 1024, options [mss 1460], length 0
13:32:17.712312 IP 192.168.15.129.46886 > 192.168.15.128.loc-srv: Flags [S], seq 815793233, win 1024, options [mss 1460], length 0
13:32:17.712371 IP 192.168.15.129.46886 > 192.168.15.128.rtsp: Flags [S], seq 815793233, win 1024, options [mss 1460], length 0
13:32:17.712426 IP 192.168.15.129.46886 > 192.168.15.128.ftp: Flags [S], seq 815793233, win 1024, options [mss 1460], length 0
13:32:17.712527 IP 192.168.15.128.3389 > 192.168.15.129.46886: Flags [R.], seq 0, ack 815793234, win 0, length 0
13:32:17.712541 IP 192.168.15.128.imap2 > 192.168.15.129.46886: Flags [R.], seq 0, ack 815793234, win 0, length 0
13:32:17.712545 IP 192.168.15.128.pop3s > 192.168.15.129.46886: Flags [R.], seq 0, ack 815793234, win 0, length 0
13:32:17.712548 IP 192.168.15.128.http > 192.168.15.129.46886: Flags [S.], seq 4111283523, ack 815793234, win 5840, options [mss 1460], length 0
13:32:17.712702 IP 192.168.15.128.loc-srv > 192.168.15.129.46886: Flags [R.], seq 0, ack 815793234, win 0, length 0
13:32:17.712710 IP 192.168.15.128.rtsp > 192.168.15.129.46886: Flags [R.], seq 0, ack 815793234, win 0, length 0
13:32:17.712906 IP 192.168.15.128.ftp > 192.168.15.129.46886: Flags [S.], seq 4106411592, ack 815793234, win 5840, options [mss 1460], length 0
13:32:17.712915 IP 192.168.15.128.imaps > 192.168.15.129.46886: Flags [R.], seq 0, ack 815793234, win 0, length 0
13:32:17.713501 IP 192.168.15.128.telnet > 192.168.15.129.46886: Flags [S.], seq 4102929193, ack 815793234, win 5840, options [mss 1460], length 0
13:32:17.713583 IP 192.168.15.128.5900 > 192.168.15.129.46886: Flags [S.], seq 4104573593, ack 815793234, win 5840, options [mss 1460], length 0
13:32:17.714059 IP 192.168.15.129.46886 > 192.168.15.128.telnet: Flags [R], seq 815793234, win 0, length 0
13:32:17.714134 IP 192.168.15.129.46886 > 192.168.15.128.5900: Flags [R], seq 815793234, win 0, length 0
13:32:17.714187 IP 192.168.15.129.46886 > 192.168.15.128.http: Flags [R], seq 815793234, win 0, length 0
13:32:17.714870 IP 192.168.15.129.46886 > 192.168.15.128.ftp: Flags [R], seq 815793234, win 0, length 0
13:32:17.778080 IP 192.168.15.128 > 8.8.8.8: ICMP echo request, id 13086, seq 136, length 64
13:32:17.876144 IP 8.8.8.8 > 192.168.15.128: ICMP echo reply, id 13086, seq 136, length 64
13:32:18.788463 IP 192.168.15.128 > 8.8.8.8: ICMP echo request, id 13086, seq 137, length 64
13:32:18.813827 IP 192.168.15.129.46887 > 192.168.15.128.imaps: Flags [S], seq 815858768, win 1024, options [mss 1460], length 0
13:32:18.813957 IP 192.168.15.129.46886 > 192.168.15.128.http-alt: Flags [S], seq 815793233, win 1024, options [mss 1460], length 0
13:32:18.814059 IP 192.168.15.129.46886 > 192.168.15.128.pop3: Flags [S], seq 815793233, win 1024, options [mss 1460], length 0
13:32:18.814235 IP 192.168.15.129.46886 > 192.168.15.128.submission: Flags [S], seq 815793233, win 1024, options [mss 1460], length 0
13:32:18.814346 IP 192.168.15.128.imaps > 192.168.15.129.46887: Flags [R.], seq 0, ack 815858769, win 0, length 0
13:32:18.814427 IP 192.168.15.128.http-alt > 192.168.15.129.46886: Flags [R.], seq 0, ack 815793234, win 0, length 0
13:32:18.814536 IP 192.168.15.128.pop3 > 192.168.15.129.46886: Flags [R.], seq 0, ack 815793234, win 0, length 0
13:32:18.814666 IP 192.168.15.128.submission > 192.168.15.129.46886: Flags [R.], seq 0, ack 815793234, win 0, length 0
13:32:18.814902 IP 192.168.15.129.46886 > 192.168.15.128.smtp: Flags [S], seq 815793233, win 1024, options [mss 1460], length 0
13:32:18.814984 IP 192.168.15.129.46886 > 192.168.15.128.8888: Flags [S], seq 815793233, win 1024, options [mss 1460], length 0
13:32:18.815152 IP 192.168.15.129.46886 > 192.168.15.128.microsoft-ds: Flags [S], seq 815793233, win 1024, options [mss 1460], length 0
13:32:18.815304 IP 192.168.15.129.46886 > 192.168.15.128.ssh: Flags [S], seq 815793233, win 1024, options [mss 1460], length 0
13:32:18.815385 IP 192.168.15.128.smtp > 192.168.15.129.46886: Flags [S.], seq 4118823103, ack 815793234, win 5840, options [mss 1460], length 0
13:32:18.815550 IP 192.168.15.129.46886 > 192.168.15.128.1025: Flags [S], seq 815793233, win 1024, options [mss 1460], length 0
13:32:18.815626 IP 192.168.15.128.8888 > 192.168.15.129.46886: Flags [R.], seq 0, ack 815793234, win 0, length 0
13:32:18.815707 IP 192.168.15.128.microsoft-ds > 192.168.15.129.46886: Flags [S.], seq 4115403487, ack 815793234, win 5840, options [mss 1460], length 0
13:32:18.815773 IP 192.168.15.128.ssh > 192.168.15.129.46886: Flags [S.], seq 4128755515, ack 815793234, win 5840, options [mss 1460], length 0
13:32:18.815830 IP 192.168.15.128.1025 > 192.168.15.129.46886: Flags [R.], seq 0, ack 815793234, win 0, length 0
13:32:18.815957 IP 192.168.15.129.46886 > 192.168.15.128.smtp: Flags [R], seq 815793234, win 0, length 0
13:32:18.816063 IP 192.168.15.129.46886 > 192.168.15.128.microsoft-ds: Flags [R], seq 815793234, win 0, length 0
13:32:18.816585 IP 192.168.15.129.46886 > 192.168.15.128.ssh: Flags [R], seq 815793234, win 0, length 0
13:32:18.816716 IP 192.168.15.129.46886 > 192.168.15.128.https: Flags [S], seq 815793233, win 1024, options [mss 1460], length 0
13:32:18.816779 IP 192.168.15.129.46886 > 192.168.15.128.netbios-ssn: Flags [S], seq 815793233, win 1024, options [mss 1460], length 0
13:32:18.816900 IP 192.168.15.129.46886 > 192.168.15.128.mysql: Flags [S], seq 815793233, win 1024, options [mss 1460], length 0
13:32:18.817054 IP 192.168.15.128.https > 192.168.15.129.46886: Flags [R.], seq 0, ack 815793234, win 0, length 0
13:32:18.817230 IP 192.168.15.128.netbios-ssn > 192.168.15.129.46886: Flags [S.], seq 4122107422, ack 815793234, win 5840, options [mss 1460], length 0
13:32:18.817326 IP 192.168.15.128.mysql > 192.168.15.129.46886: Flags [S.], seq 4121576318, ack 815793234, win 5840, options [mss 1460], length 0
13:32:18.817413 IP 192.168.15.129.46886 > 192.168.15.128.auth: Flags [S], seq 815793233, win 1024, options [mss 1460], length 0
13:32:18.817543 IP 192.168.15.129.46886 > 192.168.15.128.netbios-ssn: Flags [R], seq 815793234, win 0, length 0
13:32:18.817740 IP 192.168.15.128.auth > 192.168.15.129.46886: Flags [R.], seq 0, ack 815793234, win 0, length 0
13:32:18.817815 IP 192.168.15.129.46886 > 192.168.15.128.mysql: Flags [R], seq 815793234, win 0, length 0
13:32:18.817995 IP 192.168.15.129.46886 > 192.168.15.128.1723: Flags [S], seq 815793233, win 1024, options [mss 1460], length 0
13:32:18.818360 IP 192.168.15.129.46886 > 192.168.15.128.smux: Flags [S], seq 815793233, win 1024, options [mss 1460], length 0
13:32:18.818488 IP 192.168.15.129.46886 > 192.168.15.128.1720: Flags [S], seq 815793233, win 1024, options [mss 1460], length 0
13:32:18.818543 IP 192.168.15.129.46886 > 192.168.15.128.256: Flags [S], seq 815793233, win 1024, options [mss 1460], length 0
13:32:18.818600 IP 192.168.15.129.46886 > 192.168.15.128.domain: Flags [S], seq 815793233, win 1024, options [mss 1460], length 0
13:32:18.818691 IP 192.168.15.128.1723 > 192.168.15.129.46886: Flags [R.], seq 0, ack 815793234, win 0, length 0
13:32:18.818791 IP 192.168.15.129.46886 > 192.168.15.128.sunrpc: Flags [S], seq 815793233, win 1024, options [mss 1460], length 0
13:32:18.818979 IP 192.168.15.128.smux > 192.168.15.129.46886: Flags [R.], seq 0, ack 815793234, win 0, length 0
13:32:18.819079 IP 192.168.15.128.1720 > 192.168.15.129.46886: Flags [R.], seq 0, ack 815793234, win 0, length 0
13:32:18.819148 IP 192.168.15.128.256 > 192.168.15.129.46886: Flags [R.], seq 0, ack 815793234, win 0, length 0
13:32:18.819206 IP 192.168.15.128.domain > 192.168.15.129.46886: Flags [S.], seq 4124847874, ack 815793234, win 5840, options [mss 1460], length 0
13:32:18.819258 IP 192.168.15.128.sunrpc > 192.168.15.129.46886: Flags [S.], seq 4123069635, ack 815793234, win 5840, options [mss 1460], length 0
13:32:18.819495 IP 192.168.15.129.46886 > 192.168.15.128.domain: Flags [R], seq 815793234, win 0, length 0
13:32:18.819580 IP 192.168.15.129.46886 > 192.168.15.128.sunrpc: Flags [R], seq 815793234, win 0, length 0
13:32:18.819708 IP 192.168.15.129.46886 > 192.168.15.128.5989: Flags [S], seq 815793233, win 1024, options [mss 1460], length 0
13:32:18.819957 IP 192.168.15.129.46886 > 192.168.15.128.6969: Flags [S], seq 815793233, win 1024, options [mss 1460], length 0
13:32:18.820148 IP 192.168.15.128.5989 > 192.168.15.129.46886: Flags [R.], seq 0, ack 815793234, win 0, length 0
13:32:18.820286 IP 192.168.15.129.46886 > 192.168.15.128.27715: Flags [S], seq 815793233, win 1024, options [mss 1460], length 0
13:32:18.820390 IP 192.168.15.128.6969 > 192.168.15.129.46886: Flags [R.], seq 0, ack 815793234, win 0, length 0
13:32:18.820563 IP 192.168.15.128.27715 > 192.168.15.129.46886: Flags [R.], seq 0, ack 815793234, win 0, length 0
13:32:18.820891 IP 192.168.15.129.46886 > 192.168.15.128.1062: Flags [S], seq 815793233, win 1024, options [mss 1460], length 0
13:32:18.821002 IP 192.168.15.129.46886 > 192.168.15.128.1687: Flags [S], seq 815793233, win 1024, options [mss 1460], length 0
13:32:18.821100 IP 192.168.15.129.46886 > 192.168.15.128.1947: Flags [S], seq 815793233, win 1024, options [mss 1460], length 0
13:32:18.821152 IP 192.168.15.129.46886 > 192.168.15.128.15660: Flags [S], seq 815793233, win 1024, options [mss 1460], length 0
13:32:18.821282 IP 192.168.15.129.46886 > 192.168.15.128.3998: Flags [S], seq 815793233, win 1024, options [mss 1460], length 0
13:32:18.821363 IP 192.168.15.128.1062 > 192.168.15.129.46886: Flags [R.], seq 0, ack 815793234, win 0, length 0
13:32:18.821570 IP 192.168.15.128.1687 > 192.168.15.129.46886: Flags [R.], seq 0, ack 815793234, win 0, length 0
13:32:18.821681 IP 192.168.15.128.1947 > 192.168.15.129.46886: Flags [R.], seq 0, ack 815793234, win 0, length 0
13:32:18.821736 IP 192.168.15.128.15660 > 192.168.15.129.46886: Flags [R.], seq 0, ack 815793234, win 0, length 0
13:32:18.821793 IP 192.168.15.128.3998 > 192.168.15.129.46886: Flags [R.], seq 0, ack 815793234, win 0, length 0
13:32:18.821874 IP 192.168.15.129.46886 > 192.168.15.128.2144: Flags [S], seq 815793233, win 1024, options [mss 1460], length 0
13:32:18.822070 IP 192.168.15.129.46886 > 192.168.15.128.6580: Flags [S], seq 815793233, win 1024, options [mss 1460], length 0
13:32:18.822243 IP 192.168.15.128.2144 > 192.168.15.129.46886: Flags [R.], seq 0, ack 815793234, win 0, length 0
13:32:18.822328 IP 192.168.15.128.6580 > 192.168.15.129.46886: Flags [R.], seq 0, ack 815793234, win 0, length 0
13:32:18.822537 IP 192.168.15.129.46886 > 192.168.15.128.416: Flags [S], seq 815793233, win 1024, options [mss 1460], length 0
13:32:18.822668 IP 192.168.15.129.46886 > 192.168.15.128.6059: Flags [S], seq 815793233, win 1024, options [mss 1460], length 0
13:32:18.822743 IP 192.168.15.129.46886 > 192.168.15.128.8402: Flags [S], seq 815793233, win 1024, options [mss 1460], length 0
13:32:18.823127 IP 192.168.15.128.416 > 192.168.15.129.46886: Flags [R.], seq 0, ack 815793234, win 0, length 0
13:32:18.823228 IP 192.168.15.128.6059 > 192.168.15.129.46886: Flags [R.], seq 0, ack 815793234, win 0, length 0
13:32:18.823286 IP 192.168.15.128.8402 > 192.168.15.129.46886: Flags [R.], seq 0, ack 815793234, win 0, length 0
13:32:18.823380 IP 192.168.15.129.46886 > 192.168.15.128.3914: Flags [S], seq 815793233, win 1024, options [mss 1460], length 0
13:32:18.823437 IP 192.168.15.129.46886 > 192.168.15.128.5054: Flags [S], seq 815793233, win 1024, options [mss 1460], length 0
13:32:18.823489 IP 192.168.15.129.46886 > 192.168.15.128.1070: Flags [S], seq 815793233, win 1024, options [mss 1460], length 0
13:32:18.823546 IP 192.168.15.129.46886 > 192.168.15.128.ingreslock: Flags [S], seq 815793233, win 1024, options [mss 1460], length 0
13:32:18.823597 IP 192.168.15.129.46886 > 192.168.15.128.kerberos-adm: Flags [S], seq 815793233, win 1024, options [mss 1460], length 0
13:32:18.823653 IP 192.168.15.129.46886 > 192.168.15.128.3005: Flags [S], seq 815793233, win 1024, options [mss 1460], length 0
13:32:18.823705 IP 192.168.15.129.46886 > 192.168.15.128.9968: Flags [S], seq 815793233, win 1024, options [mss 1460], length 0
13:32:18.823796 IP 192.168.15.128.3914 > 192.168.15.129.46886: Flags [R.], seq 0, ack 815793234, win 0, length 0
13:32:18.823933 IP 192.168.15.128.5054 > 192.168.15.129.46886: Flags [R.], seq 0, ack 815793234, win 0, length 0
13:32:18.824083 IP 192.168.15.128.1070 > 192.168.15.129.46886: Flags [R.], seq 0, ack 815793234, win 0, length 0
13:32:18.824170 IP 192.168.15.129.46886 > 192.168.15.128.proofd: Flags [S], seq 815793233, win 1024, options [mss 1460], length 0
13:32:18.824269 IP 192.168.15.128.ingreslock > 192.168.15.129.46886: Flags [S.], seq 4127689490, ack 815793234, win 5840, options [mss 1460], length 0
13:32:18.824326 IP 192.168.15.128.kerberos-adm > 192.168.15.129.46886: Flags [R.], seq 0, ack 815793234, win 0, length 0
13:32:18.824386 IP 192.168.15.128.3005 > 192.168.15.129.46886: Flags [R.], seq 0, ack 815793234, win 0, length 0
13:32:18.824443 IP 192.168.15.128.9968 > 192.168.15.129.46886: Flags [R.], seq 0, ack 815793234, win 0, length 0
13:32:18.824559 IP 192.168.15.128.proofd > 192.168.15.129.46886: Flags [R.], seq 0, ack 815793234, win 0, length 0
13:32:18.824633 IP 192.168.15.129.46886 > 192.168.15.128.ingreslock: Flags [R], seq 815793234, win 0, length 0
13:32:18.824892 IP 192.168.15.129.46886 > 192.168.15.128.5859: Flags [S], seq 815793233, win 1024, options [mss 1460], length 0
13:32:18.824974 IP 192.168.15.129.46886 > 192.168.15.128.2160: Flags [S], seq 815793233, win 1024, options [mss 1460], length 0
13:32:18.825033 IP 192.168.15.129.46886 > 192.168.15.128.1761: Flags [S], seq 815793233, win 1024, options [mss 1460], length 0
13:32:18.825399 IP 192.168.15.128.5859 > 192.168.15.129.46886: Flags [R.], seq 0, ack 815793234, win 0, length 0
13:32:18.825485 IP 192.168.15.128.2160 > 192.168.15.129.46886: Flags [R.], seq 0, ack 815793234, win 0, length 0
13:32:18.825540 IP 192.168.15.128.1761 > 192.168.15.129.46886: Flags [R.], seq 0, ack 815793234, win 0, length 0
13:32:18.825631 IP 192.168.15.129.46886 > 192.168.15.128.1805: Flags [S], seq 815793233, win 1024, options [mss 1460], length 0
13:32:18.826157 IP 192.168.15.128.1805 > 192.168.15.129.46886: Flags [R.], seq 0, ack 815793234, win 0, length 0
13:32:18.828808 IP 192.168.15.129.46886 > 192.168.15.128.x11-1: Flags [S], seq 815793233, win 1024, options [mss 1460], length 0
13:32:18.828936 IP 192.168.15.129.46886 > 192.168.15.128.4003: Flags [S], seq 815793233, win 1024, options [mss 1460], length 0
13:32:18.829433 IP 192.168.15.128.x11-1 > 192.168.15.129.46886: Flags [R.], seq 0, ack 815793234, win 0, length 0
13:32:18.829555 IP 192.168.15.128.4003 > 192.168.15.129.46886: Flags [R.], seq 0, ack 815793234, win 0, length 0
13:32:18.914489 IP 192.168.15.129.46886 > 192.168.15.128.2967: Flags [S], seq 815793233, win 1024, options [mss 1460], length 0
13:32:18.914645 IP 192.168.15.129.46886 > 192.168.15.128.711: Flags [S], seq 815793233, win 1024, options [mss 1460], length 0
13:32:18.914708 IP 192.168.15.129.46886 > 192.168.15.128.3333: Flags [S], seq 815793233, win 1024, options [mss 1460], length 0
13:32:18.914766 IP 192.168.15.129.46886 > 192.168.15.128.1501: Flags [S], seq 815793233, win 1024, options [mss 1460], length 0
13:32:18.915149 IP 192.168.15.128.2967 > 192.168.15.129.46886: Flags [R.], seq 0, ack 815793234, win 0, length 0
13:32:18.915265 IP 192.168.15.128.711 > 192.168.15.129.46886: Flags [R.], seq 0, ack 815793234, win 0, length 0
13:32:18.915331 IP 192.168.15.128.3333 > 192.168.15.129.46886: Flags [R.], seq 0, ack 815793234, win 0, length 0
13:32:18.915391 IP 192.168.15.128.1501 > 192.168.15.129.46886: Flags [R.], seq 0, ack 815793234, win 0, length 0
13:32:18.915777 IP 192.168.15.129.46886 > 192.168.15.128.1840: Flags [S], seq 815793233, win 1024, options [mss 1460], length 0
13:32:18.915885 IP 192.168.15.129.46886 > 192.168.15.128.8009: Flags [S], seq 815793233, win 1024, options [mss 1460], length 0
13:32:18.915942 IP 192.168.15.129.46886 > 192.168.15.128.100: Flags [S], seq 815793233, win 1024, options [mss 1460], length 0
13:32:18.915998 IP 192.168.15.129.46886 > 192.168.15.128.5087: Flags [S], seq 815793233, win 1024, options [mss 1460], length 0
13:32:18.916243 IP 192.168.15.128.1840 > 192.168.15.129.46886: Flags [R.], seq 0, ack 815793234, win 0, length 0
13:32:18.916330 IP 192.168.15.129.46886 > 192.168.15.128.81: Flags [S], seq 815793233, win 1024, options [mss 1460], length 0
13:32:18.916492 IP 192.168.15.129.46886 > 192.168.15.128.1310: Flags [S], seq 815793233, win 1024, options [mss 1460], length 0
13:32:18.916588 IP 192.168.15.128.8009 > 192.168.15.129.46886: Flags [S.], seq 4129129219, ack 815793234, win 5840, options [mss 1460], length 0
13:32:18.916646 IP 192.168.15.128.100 > 192.168.15.129.46886: Flags [R.], seq 0, ack 815793234, win 0, length 0
13:32:18.916697 IP 192.168.15.128.5087 > 192.168.15.129.46886: Flags [R.], seq 0, ack 815793234, win 0, length 0
13:32:18.916755 IP 192.168.15.128.81 > 192.168.15.129.46886: Flags [R.], seq 0, ack 815793234, win 0, length 0
13:32:18.916808 IP 192.168.15.128.1310 > 192.168.15.129.46886: Flags [R.], seq 0, ack 815793234, win 0, length 0
13:32:18.916896 IP 192.168.15.129.46886 > 192.168.15.128.snpp: Flags [S], seq 815793233, win 1024, options [mss 1460], length 0
13:32:18.917299 IP 192.168.15.128.snpp > 192.168.15.129.46886: Flags [R.], seq 0, ack 815793234, win 0, length 0
13:32:18.917416 IP 192.168.15.129.46886 > 192.168.15.128.8009: Flags [R], seq 815793234, win 0, length 0
13:32:18.917503 IP 192.168.15.129.46886 > 192.168.15.128.rmiregistry: Flags [S], seq 815793233, win 1024, options [mss 1460], length 0
13:32:18.917565 IP 192.168.15.129.46886 > 192.168.15.128.49160: Flags [S], seq 815793233, win 1024, options [mss 1460], length 0
13:32:18.917623 IP 192.168.15.129.46886 > 192.168.15.128.9944: Flags [S], seq 815793233, win 1024, options [mss 1460], length 0
13:32:18.917778 IP 192.168.15.129.46886 > 192.168.15.128.1234: Flags [S], seq 815793233, win 1024, options [mss 1460], length 0
13:32:18.917913 IP 192.168.15.128.rmiregistry > 192.168.15.129.46886: Flags [S.], seq 4124608472, ack 815793234, win 5840, options [mss 1460], length 0
13:32:18.918009 IP 192.168.15.129.46886 > 192.168.15.128.2046: Flags [S], seq 815793233, win 1024, options [mss 1460], length 0
13:32:18.918107 IP 192.168.15.128.49160 > 192.168.15.129.46886: Flags [R.], seq 0, ack 815793234, win 0, length 0
13:32:18.918165 IP 192.168.15.128.9944 > 192.168.15.129.46886: Flags [R.], seq 0, ack 815793234, win 0, length 0
13:32:18.918217 IP 192.168.15.128.1234 > 192.168.15.129.46886: Flags [R.], seq 0, ack 815793234, win 0, length 0
13:32:18.918291 IP 192.168.15.128.2046 > 192.168.15.129.46886: Flags [R.], seq 0, ack 815793234, win 0, length 0
13:32:18.918520 IP 192.168.15.129.46886 > 192.168.15.128.rmiregistry: Flags [R], seq 815793234, win 0, length 0
13:32:18.918929 IP 192.168.15.129.46886 > 192.168.15.128.9593: Flags [S], seq 815793233, win 1024, options [mss 1460], length 0
13:32:18.919037 IP 192.168.15.129.46886 > 192.168.15.128.2038: Flags [S], seq 815793233, win 1024, options [mss 1460], length 0
13:32:18.919094 IP 192.168.15.129.46886 > 192.168.15.128.2107: Flags [S], seq 815793233, win 1024, options [mss 1460], length 0
13:32:18.919152 IP 192.168.15.129.46886 > 192.168.15.128.4848: Flags [S], seq 815793233, win 1024, options [mss 1460], length 0
13:32:18.919205 IP 192.168.15.129.46886 > 192.168.15.128.8383: Flags [S], seq 815793233, win 1024, options [mss 1460], length 0
13:32:18.919358 IP 192.168.15.128.9593 > 192.168.15.129.46886: Flags [R.], seq 0, ack 815793234, win 0, length 0
13:32:18.919493 IP 192.168.15.128.2038 > 192.168.15.129.46886: Flags [R.], seq 0, ack 815793234, win 0, length 0
13:32:18.919589 IP 192.168.15.129.46886 > 192.168.15.128.1594: Flags [S], seq 815793233, win 1024, options [mss 1460], length 0
13:32:18.919697 IP 192.168.15.128.2107 > 192.168.15.129.46886: Flags [R.], seq 0, ack 815793234, win 0, length 0
13:32:18.919754 IP 192.168.15.128.4848 > 192.168.15.129.46886: Flags [R.], seq 0, ack 815793234, win 0, length 0
13:32:18.919806 IP 192.168.15.128.8383 > 192.168.15.129.46886: Flags [R.], seq 0, ack 815793234, win 0, length 0
13:32:18.919858 IP 192.168.15.128.1594 > 192.168.15.129.46886: Flags [R.], seq 0, ack 815793234, win 0, length 0
13:32:18.919940 IP 192.168.15.129.46886 > 192.168.15.128.6792: Flags [S], seq 815793233, win 1024, options [mss 1460], length 0
13:32:18.920176 IP 192.168.15.129.46886 > 192.168.15.128.49176: Flags [S], seq 815793233, win 1024, options [mss 1460], length 0
13:32:18.920268 IP 192.168.15.129.46886 > 192.168.15.128.32775: Flags [S], seq 815793233, win 1024, options [mss 1460], length 0
13:32:18.920361 IP 192.168.15.128.6792 > 192.168.15.129.46886: Flags [R.], seq 0, ack 815793234, win 0, length 0
13:32:18.920457 IP 192.168.15.128.49176 > 192.168.15.129.46886: Flags [R.], seq 0, ack 815793234, win 0, length 0
13:32:18.920895 IP 192.168.15.128.32775 > 192.168.15.129.46886: Flags [R.], seq 0, ack 815793234, win 0, length 0
13:32:18.921010 IP 192.168.15.129.46886 > 192.168.15.128.xmpp-client: Flags [S], seq 815793233, win 1024, options [mss 1460], length 0
13:32:18.921094 IP 192.168.15.129.46886 > 192.168.15.128.1187: Flags [S], seq 815793233, win 1024, options [mss 1460], length 0
13:32:18.921185 IP 192.168.15.129.46886 > 192.168.15.128.14238: Flags [S], seq 815793233, win 1024, options [mss 1460], length 0
13:32:18.921598 IP 192.168.15.128.xmpp-client > 192.168.15.129.46886: Flags [R.], seq 0, ack 815793234, win 0, length 0
13:32:18.921699 IP 192.168.15.128.1187 > 192.168.15.129.46886: Flags [R.], seq 0, ack 815793234, win 0, length 0
13:32:18.921763 IP 192.168.15.128.14238 > 192.168.15.129.46886: Flags [R.], seq 0, ack 815793234, win 0, length 0
13:32:18.921857 IP 192.168.15.129.46886 > 192.168.15.128.3013: Flags [S], seq 815793233, win 1024, options [mss 1460], length 0
13:32:18.921914 IP 192.168.15.129.46886 > 192.168.15.128.svrloc: Flags [S], seq 815793233, win 1024, options [mss 1460], length 0
13:32:18.921966 IP 192.168.15.129.46886 > 192.168.15.128.4343: Flags [S], seq 815793233, win 1024, options [mss 1460], length 0
13:32:18.922396 IP 192.168.15.128.3013 > 192.168.15.129.46886: Flags [R.], seq 0, ack 815793234, win 0, length 0
13:32:18.922540 IP 192.168.15.128.svrloc > 192.168.15.129.46886: Flags [R.], seq 0, ack 815793234, win 0, length 0
13:32:18.922601 IP 192.168.15.128.4343 > 192.168.15.129.46886: Flags [R.], seq 0, ack 815793234, win 0, length 0
13:32:18.927402 IP 8.8.8.8 > 192.168.15.128: ICMP echo reply, id 13086, seq 137, length 64
13:32:19.015151 IP 192.168.15.129.46887 > 192.168.15.128.1501: Flags [S], seq 815858768, win 1024, options [mss 1460], length 0
13:32:19.015282 IP 192.168.15.129.46887 > 192.168.15.128.3333: Flags [S], seq 815858768, win 1024, options [mss 1460], length 0
13:32:19.015342 IP 192.168.15.129.46887 > 192.168.15.128.711: Flags [S], seq 815858768, win 1024, options [mss 1460], length 0
13:32:19.015442 IP 192.168.15.129.46887 > 192.168.15.128.2967: Flags [S], seq 815858768, win 1024, options [mss 1460], length 0
13:32:19.015847 IP 192.168.15.128.1501 > 192.168.15.129.46887: Flags [R.], seq 0, ack 815858769, win 0, length 0
13:32:19.015966 IP 192.168.15.128.3333 > 192.168.15.129.46887: Flags [R.], seq 0, ack 815858769, win 0, length 0
13:32:19.016027 IP 192.168.15.128.711 > 192.168.15.129.46887: Flags [R.], seq 0, ack 815858769, win 0, length 0
13:32:19.016083 IP 192.168.15.128.2967 > 192.168.15.129.46887: Flags [R.], seq 0, ack 815858769, win 0, length 0
13:32:19.018224 IP 192.168.15.129.46887 > 192.168.15.128.2046: Flags [S], seq 815858768, win 1024, options [mss 1460], length 0
13:32:19.018357 IP 192.168.15.129.46887 > 192.168.15.128.1234: Flags [S], seq 815858768, win 1024, options [mss 1460], length 0
13:32:19.018536 IP 192.168.15.129.46887 > 192.168.15.128.9944: Flags [S], seq 815858768, win 1024, options [mss 1460], length 0
13:32:19.018711 IP 192.168.15.129.46887 > 192.168.15.128.49160: Flags [S], seq 815858768, win 1024, options [mss 1460], length 0
13:32:19.018807 IP 192.168.15.129.46887 > 192.168.15.128.rmiregistry: Flags [S], seq 815858768, win 1024, options [mss 1460], length 0
13:32:19.018882 IP 192.168.15.129.46887 > 192.168.15.128.snpp: Flags [S], seq 815858768, win 1024, options [mss 1460], length 0
13:32:19.018941 IP 192.168.15.129.46887 > 192.168.15.128.1310: Flags [S], seq 815858768, win 1024, options [mss 1460], length 0
13:32:19.018994 IP 192.168.15.129.46887 > 192.168.15.128.81: Flags [S], seq 815858768, win 1024, options [mss 1460], length 0
13:32:19.019054 IP 192.168.15.129.46887 > 192.168.15.128.5087: Flags [S], seq 815858768, win 1024, options [mss 1460], length 0
13:32:19.019112 IP 192.168.15.129.46887 > 192.168.15.128.100: Flags [S], seq 815858768, win 1024, options [mss 1460], length 0
13:32:19.019170 IP 192.168.15.129.46887 > 192.168.15.128.8009: Flags [S], seq 815858768, win 1024, options [mss 1460], length 0
13:32:19.019225 IP 192.168.15.129.46887 > 192.168.15.128.1840: Flags [S], seq 815858768, win 1024, options [mss 1460], length 0
13:32:19.019337 IP 192.168.15.128.2046 > 192.168.15.129.46887: Flags [R.], seq 0, ack 815858769, win 0, length 0
13:32:19.019398 IP 192.168.15.128.1234 > 192.168.15.129.46887: Flags [R.], seq 0, ack 815858769, win 0, length 0
13:32:19.019473 IP 192.168.15.128.9944 > 192.168.15.129.46887: Flags [R.], seq 0, ack 815858769, win 0, length 0
13:32:19.019533 IP 192.168.15.128.49160 > 192.168.15.129.46887: Flags [R.], seq 0, ack 815858769, win 0, length 0
13:32:19.019625 IP 192.168.15.128.rmiregistry > 192.168.15.129.46887: Flags [S.], seq 4119176283, ack 815858769, win 5840, options [mss 1460], length 0
13:32:19.019871 IP 192.168.15.128.snpp > 192.168.15.129.46887: Flags [R.], seq 0, ack 815858769, win 0, length 0
13:32:19.019988 IP 192.168.15.128.1310 > 192.168.15.129.46887: Flags [R.], seq 0, ack 815858769, win 0, length 0
13:32:19.020047 IP 192.168.15.128.81 > 192.168.15.129.46887: Flags [R.], seq 0, ack 815858769, win 0, length 0
13:32:19.020146 IP 192.168.15.129.46887 > 192.168.15.128.rmiregistry: Flags [R], seq 815858769, win 0, length 0
13:32:19.020238 IP 192.168.15.128.5087 > 192.168.15.129.46887: Flags [R.], seq 0, ack 815858769, win 0, length 0
13:32:19.020484 IP 192.168.15.128.100 > 192.168.15.129.46887: Flags [R.], seq 0, ack 815858769, win 0, length 0
13:32:19.020571 IP 192.168.15.128.8009 > 192.168.15.129.46887: Flags [S.], seq 4132111006, ack 815858769, win 5840, options [mss 1460], length 0
13:32:19.020631 IP 192.168.15.128.1840 > 192.168.15.129.46887: Flags [R.], seq 0, ack 815858769, win 0, length 0
13:32:19.020967 IP 192.168.15.129.46887 > 192.168.15.128.8009: Flags [R], seq 815858769, win 0, length 0
13:32:19.021969 IP 192.168.15.129.46887 > 192.168.15.128.svrloc: Flags [S], seq 815858768, win 1024, options [mss 1460], length 0
13:32:19.022136 IP 192.168.15.129.46887 > 192.168.15.128.3013: Flags [S], seq 815858768, win 1024, options [mss 1460], length 0
13:32:19.022200 IP 192.168.15.129.46887 > 192.168.15.128.14238: Flags [S], seq 815858768, win 1024, options [mss 1460], length 0
13:32:19.022263 IP 192.168.15.129.46887 > 192.168.15.128.1187: Flags [S], seq 815858768, win 1024, options [mss 1460], length 0
13:32:19.022408 IP 192.168.15.129.46887 > 192.168.15.128.xmpp-client: Flags [S], seq 815858768, win 1024, options [mss 1460], length 0
13:32:19.022485 IP 192.168.15.129.46887 > 192.168.15.128.32775: Flags [S], seq 815858768, win 1024, options [mss 1460], length 0
13:32:19.022672 IP 192.168.15.129.46887 > 192.168.15.128.49176: Flags [S], seq 815858768, win 1024, options [mss 1460], length 0
13:32:19.022738 IP 192.168.15.129.46887 > 192.168.15.128.6792: Flags [S], seq 815858768, win 1024, options [mss 1460], length 0
13:32:19.022797 IP 192.168.15.129.46887 > 192.168.15.128.1594: Flags [S], seq 815858768, win 1024, options [mss 1460], length 0
13:32:19.022920 IP 192.168.15.129.46887 > 192.168.15.128.8383: Flags [S], seq 815858768, win 1024, options [mss 1460], length 0
13:32:19.022989 IP 192.168.15.129.46887 > 192.168.15.128.4848: Flags [S], seq 815858768, win 1024, options [mss 1460], length 0
13:32:19.023042 IP 192.168.15.129.46887 > 192.168.15.128.2107: Flags [S], seq 815858768, win 1024, options [mss 1460], length 0
13:32:19.023129 IP 192.168.15.128.svrloc > 192.168.15.129.46887: Flags [R.], seq 0, ack 815858769, win 0, length 0
13:32:19.023226 IP 192.168.15.129.46887 > 192.168.15.128.2038: Flags [S], seq 815858768, win 1024, options [mss 1460], length 0
13:32:19.023630 IP 192.168.15.128.3013 > 192.168.15.129.46887: Flags [R.], seq 0, ack 815858769, win 0, length 0
13:32:19.023700 IP 192.168.15.128.14238 > 192.168.15.129.46887: Flags [R.], seq 0, ack 815858769, win 0, length 0
13:32:19.023753 IP 192.168.15.128.1187 > 192.168.15.129.46887: Flags [R.], seq 0, ack 815858769, win 0, length 0
13:32:19.023841 IP 192.168.15.129.46887 > 192.168.15.128.9593: Flags [S], seq 815858768, win 1024, options [mss 1460], length 0
13:32:19.023942 IP 192.168.15.128.xmpp-client > 192.168.15.129.46887: Flags [R.], seq 0, ack 815858769, win 0, length 0
13:32:19.024132 IP 192.168.15.128.32775 > 192.168.15.129.46887: Flags [R.], seq 0, ack 815858769, win 0, length 0
13:32:19.024217 IP 192.168.15.128.49176 > 192.168.15.129.46887: Flags [R.], seq 0, ack 815858769, win 0, length 0
13:32:19.024275 IP 192.168.15.128.6792 > 192.168.15.129.46887: Flags [R.], seq 0, ack 815858769, win 0, length 0
13:32:19.024327 IP 192.168.15.128.1594 > 192.168.15.129.46887: Flags [R.], seq 0, ack 815858769, win 0, length 0
13:32:19.024481 IP 192.168.15.128.8383 > 192.168.15.129.46887: Flags [R.], seq 0, ack 815858769, win 0, length 0
13:32:19.024541 IP 192.168.15.128.4848 > 192.168.15.129.46887: Flags [R.], seq 0, ack 815858769, win 0, length 0
13:32:19.024614 IP 192.168.15.128.2107 > 192.168.15.129.46887: Flags [R.], seq 0, ack 815858769, win 0, length 0
13:32:19.024680 IP 192.168.15.128.2038 > 192.168.15.129.46887: Flags [R.], seq 0, ack 815858769, win 0, length 0
13:32:19.024809 IP 192.168.15.128.9593 > 192.168.15.129.46887: Flags [R.], seq 0, ack 815858769, win 0, length 0
13:32:19.027207 IP 192.168.15.129.46887 > 192.168.15.128.4343: Flags [S], seq 815858768, win 1024, options [mss 1460], length 0
13:32:19.027812 IP 192.168.15.128.4343 > 192.168.15.129.46887: Flags [R.], seq 0, ack 815858769, win 0, length 0
13:32:19.116388 IP 192.168.15.129.46886 > 192.168.15.128.2702: Flags [S], seq 815793233, win 1024, options [mss 1460], length 0
13:32:19.116517 IP 192.168.15.129.46886 > 192.168.15.128.2718: Flags [S], seq 815793233, win 1024, options [mss 1460], length 0
13:32:19.116574 IP 192.168.15.129.46886 > 192.168.15.128.50389: Flags [S], seq 815793233, win 1024, options [mss 1460], length 0
13:32:19.116631 IP 192.168.15.129.46886 > 192.168.15.128.5080: Flags [S], seq 815793233, win 1024, options [mss 1460], length 0
13:32:19.116686 IP 192.168.15.129.46886 > 192.168.15.128.9100: Flags [S], seq 815793233, win 1024, options [mss 1460], length 0
13:32:19.116892 IP 192.168.15.129.46886 > 192.168.15.128.49157: Flags [S], seq 815793233, win 1024, options [mss 1460], length 0
13:32:19.116994 IP 192.168.15.128.2702 > 192.168.15.129.46886: Flags [R.], seq 0, ack 815793234, win 0, length 0
13:32:19.117077 IP 192.168.15.128.2718 > 192.168.15.129.46886: Flags [R.], seq 0, ack 815793234, win 0, length 0
13:32:19.117196 IP 192.168.15.128.50389 > 192.168.15.129.46886: Flags [R.], seq 0, ack 815793234, win 0, length 0
13:32:19.117353 IP 192.168.15.128.5080 > 192.168.15.129.46886: Flags [R.], seq 0, ack 815793234, win 0, length 0
13:32:19.117411 IP 192.168.15.128.9100 > 192.168.15.129.46886: Flags [R.], seq 0, ack 815793234, win 0, length 0
13:32:19.117463 IP 192.168.15.128.49157 > 192.168.15.129.46886: Flags [R.], seq 0, ack 815793234, win 0, length 0
13:32:19.117704 IP 192.168.15.129.46886 > 192.168.15.128.lotusnote: Flags [S], seq 815793233, win 1024, options [mss 1460], length 0
13:32:19.117786 IP 192.168.15.129.46886 > 192.168.15.128.2383: Flags [S], seq 815793233, win 1024, options [mss 1460], length 0
13:32:19.117897 IP 192.168.15.129.46886 > 192.168.15.128.27000: Flags [S], seq 815793233, win 1024, options [mss 1460], length 0
13:32:19.118150 IP 192.168.15.128.lotusnote > 192.168.15.129.46886: Flags [R.], seq 0, ack 815793234, win 0, length 0
13:32:19.118326 IP 192.168.15.128.2383 > 192.168.15.129.46886: Flags [R.], seq 0, ack 815793234, win 0, length 0
13:32:19.118388 IP 192.168.15.128.27000 > 192.168.15.129.46886: Flags [R.], seq 0, ack 815793234, win 0, length 0
13:32:19.118474 IP 192.168.15.129.46886 > 192.168.15.128.amandaidx: Flags [S], seq 815793233, win 1024, options [mss 1460], length 0
13:32:19.118833 IP 192.168.15.128.amandaidx > 192.168.15.129.46886: Flags [R.], seq 0, ack 815793234, win 0, length 0
13:32:19.118936 IP 192.168.15.129.46886 > 192.168.15.128.radius: Flags [S], seq 815793233, win 1024, options [mss 1460], length 0
13:32:19.119016 IP 192.168.15.129.46886 > 192.168.15.128.1088: Flags [S], seq 815793233, win 1024, options [mss 1460], length 0
13:32:19.119070 IP 192.168.15.129.46886 > 192.168.15.128.55600: Flags [S], seq 815793233, win 1024, options [mss 1460], length 0
13:32:19.119341 IP 192.168.15.128.radius > 192.168.15.129.46886: Flags [R.], seq 0, ack 815793234, win 0, length 0
13:32:19.119442 IP 192.168.15.128.1088 > 192.168.15.129.46886: Flags [R.], seq 0, ack 815793234, win 0, length 0
13:32:19.119496 IP 192.168.15.128.55600 > 192.168.15.129.46886: Flags [R.], seq 0, ack 815793234, win 0, length 0
13:32:19.119578 IP 192.168.15.129.46886 > 192.168.15.128.1076: Flags [S], seq 815793233, win 1024, options [mss 1460], length 0
13:32:19.119804 IP 192.168.15.129.46886 > 192.168.15.128.32778: Flags [S], seq 815793233, win 1024, options [mss 1460], length 0
13:32:19.119926 IP 192.168.15.128.1076 > 192.168.15.129.46886: Flags [R.], seq 0, ack 815793234, win 0, length 0
13:32:19.120027 IP 192.168.15.129.46886 > 192.168.15.128.9415: Flags [S], seq 815793233, win 1024, options [mss 1460], length 0
13:32:19.120119 IP 192.168.15.128.32778 > 192.168.15.129.46886: Flags [R.], seq 0, ack 815793234, win 0, length 0
13:32:19.120236 IP 192.168.15.129.46886 > 192.168.15.128.4321: Flags [S], seq 815793233, win 1024, options [mss 1460], length 0
13:32:19.120473 IP 192.168.15.128.9415 > 192.168.15.129.46886: Flags [R.], seq 0, ack 815793234, win 0, length 0
13:32:19.120592 IP 192.168.15.128.4321 > 192.168.15.129.46886: Flags [R.], seq 0, ack 815793234, win 0, length 0
13:32:19.120989 IP 192.168.15.129.46886 > 192.168.15.128.6510: Flags [S], seq 815793233, win 1024, options [mss 1460], length 0
13:32:19.121100 IP 192.168.15.129.46886 > 192.168.15.128.8649: Flags [S], seq 815793233, win 1024, options [mss 1460], length 0
13:32:19.121162 IP 192.168.15.129.46886 > 192.168.15.128.nameserver: Flags [S], seq 815793233, win 1024, options [mss 1460], length 0
13:32:19.121220 IP 192.168.15.129.46886 > 192.168.15.128.5009: Flags [S], seq 815793233, win 1024, options [mss 1460], length 0
13:32:19.121614 IP 192.168.15.128.6510 > 192.168.15.129.46886: Flags [R.], seq 0, ack 815793234, win 0, length 0
13:32:19.121731 IP 192.168.15.128.8649 > 192.168.15.129.46886: Flags [R.], seq 0, ack 815793234, win 0, length 0
13:32:19.121789 IP 192.168.15.128.nameserver > 192.168.15.129.46886: Flags [R.], seq 0, ack 815793234, win 0, length 0
13:32:19.121844 IP 192.168.15.128.5009 > 192.168.15.129.46886: Flags [R.], seq 0, ack 815793234, win 0, length 0
13:32:19.216725 IP 192.168.15.129.46887 > 192.168.15.128.2718: Flags [S], seq 815858768, win 1024, options [mss 1460], length 0
13:32:19.216856 IP 192.168.15.129.46887 > 192.168.15.128.2702: Flags [S], seq 815858768, win 1024, options [mss 1460], length 0
13:32:19.217413 IP 192.168.15.128.2718 > 192.168.15.129.46887: Flags [R.], seq 0, ack 815858769, win 0, length 0
13:32:19.217534 IP 192.168.15.128.2702 > 192.168.15.129.46887: Flags [R.], seq 0, ack 815858769, win 0, length 0
13:32:19.219803 IP 192.168.15.129.46887 > 192.168.15.128.1076: Flags [S], seq 815858768, win 1024, options [mss 1460], length 0
13:32:19.219928 IP 192.168.15.129.46887 > 192.168.15.128.55600: Flags [S], seq 815858768, win 1024, options [mss 1460], length 0
13:32:19.219989 IP 192.168.15.129.46887 > 192.168.15.128.1088: Flags [S], seq 815858768, win 1024, options [mss 1460], length 0
13:32:19.220049 IP 192.168.15.129.46887 > 192.168.15.128.radius: Flags [S], seq 815858768, win 1024, options [mss 1460], length 0
