13:18:28.726812 ARP, Request who-has 192.168.15.2 tell 192.168.15.1, length 46
13:18:30.042951 ARP, Request who-has 192.168.15.2 tell 192.168.15.1, length 46
13:18:30.727157 ARP, Request who-has 192.168.15.2 tell 192.168.15.1, length 46
13:18:31.726685 ARP, Request who-has 192.168.15.2 tell 192.168.15.1, length 46
13:18:37.547856 ARP, Request who-has 192.168.15.2 tell 192.168.15.1, length 46
13:18:38.227006 ARP, Request who-has 192.168.15.2 tell 192.168.15.1, length 46
13:18:39.226567 ARP, Request who-has 192.168.15.2 tell 192.168.15.1, length 46
13:18:40.549046 ARP, Request who-has 192.168.15.2 tell 192.168.15.1, length 46
13:18:41.226564 ARP, Request who-has 192.168.15.2 tell 192.168.15.1, length 46
13:18:42.226502 ARP, Request who-has 192.168.15.2 tell 192.168.15.1, length 46
13:18:46.551597 ARP, Request who-has 192.168.15.2 tell 192.168.15.1, length 46
13:18:47.226898 ARP, Request who-has 192.168.15.2 tell 192.168.15.1, length 46
13:18:48.227215 ARP, Request who-has 192.168.15.2 tell 192.168.15.1, length 46
13:18:49.551999 ARP, Request who-has 192.168.15.2 tell 192.168.15.1, length 46
13:18:50.226940 ARP, Request who-has 192.168.15.2 tell 192.168.15.1, length 46
13:18:51.226629 ARP, Request who-has 192.168.15.2 tell 192.168.15.1, length 46
13:19:02.220341 IP 192.168.15.130.netbios-ns > 192.168.15.2.netbios-ns: NBT UDP PACKET(137): REFRESH(8); REQUEST; UNICAST
13:19:03.720500 IP 192.168.15.130.netbios-ns > 192.168.15.2.netbios-ns: NBT UDP PACKET(137): REFRESH(8); REQUEST; UNICAST
13:19:05.220609 IP 192.168.15.130.netbios-ns > 192.168.15.2.netbios-ns: NBT UDP PACKET(137): REFRESH(8); REQUEST; UNICAST
13:20:28.727137 ARP, Request who-has 192.168.15.2 tell 192.168.15.1, length 46
13:20:30.047457 ARP, Request who-has 192.168.15.2 tell 192.168.15.1, length 46
13:20:30.726487 ARP, Request who-has 192.168.15.2 tell 192.168.15.1, length 46
13:20:31.726913 ARP, Request who-has 192.168.15.2 tell 192.168.15.1, length 46
13:20:37.550387 ARP, Request who-has 192.168.15.2 tell 192.168.15.1, length 46
13:20:38.227401 ARP, Request who-has 192.168.15.2 tell 192.168.15.1, length 46
13:20:39.227010 ARP, Request who-has 192.168.15.2 tell 192.168.15.1, length 46
13:20:40.550837 ARP, Request who-has 192.168.15.2 tell 192.168.15.1, length 46
13:20:41.227160 ARP, Request who-has 192.168.15.2 tell 192.168.15.1, length 46
13:20:42.226719 ARP, Request who-has 192.168.15.2 tell 192.168.15.1, length 46
13:20:46.552841 ARP, Request who-has 192.168.15.2 tell 192.168.15.1, length 46
13:20:47.095426 ARP, Request who-has 192.168.15.128 (Broadcast) tell 192.168.15.129, length 46
13:20:47.096281 ARP, Reply 192.168.15.128 is-at 00:0c:29:a1:c5:30 (oui Unknown), length 46
13:20:47.227196 ARP, Request who-has 192.168.15.2 tell 192.168.15.1, length 46
13:20:47.297117 IP 192.168.15.129.38058 > 192.168.15.2.domain: 7544+ PTR? 128.15.168.192.in-addr.arpa. (45)
13:20:47.311303 IP 192.168.15.2.domain > 192.168.15.129.38058: 7544 NXDomain 0/0/0 (45)
13:20:47.313340 ARP, Request who-has 192.168.15.128 tell 192.168.15.129, length 46
13:20:47.313998 ARP, Reply 192.168.15.128 is-at 00:0c:29:a1:c5:30 (oui Unknown), length 46
13:20:47.314601 IP 192.168.15.129.38159 > 192.168.15.128.http: Flags [S], seq 3053123927, win 1024, options [mss 1460], length 0
13:20:47.314628 IP 192.168.15.129.38159 > 192.168.15.128.loc-srv: Flags [S], seq 3053123927, win 1024, options [mss 1460], length 0
13:20:47.314638 IP 192.168.15.129.38159 > 192.168.15.128.microsoft-ds: Flags [S], seq 3053123927, win 1024, options [mss 1460], length 0
13:20:47.314642 IP 192.168.15.129.38159 > 192.168.15.128.1723: Flags [S], seq 3053123927, win 1024, options [mss 1460], length 0
13:20:47.314751 IP 192.168.15.129.38159 > 192.168.15.128.ftp: Flags [S], seq 3053123927, win 1024, options [mss 1460], length 0
13:20:47.314757 IP 192.168.15.129.38159 > 192.168.15.128.netbios-ssn: Flags [S], seq 3053123927, win 1024, options [mss 1460], length 0
13:20:47.314765 IP 192.168.15.129.38159 > 192.168.15.128.pop3s: Flags [S], seq 3053123927, win 1024, options [mss 1460], length 0
13:20:47.314817 IP 192.168.15.129.38159 > 192.168.15.128.domain: Flags [S], seq 3053123927, win 1024, options [mss 1460], length 0
13:20:47.314979 IP 192.168.15.129.38159 > 192.168.15.128.3389: Flags [S], seq 3053123927, win 1024, options [mss 1460], length 0
13:20:47.314989 IP 192.168.15.129.38159 > 192.168.15.128.submission: Flags [S], seq 3053123927, win 1024, options [mss 1460], length 0
13:20:47.315797 IP 192.168.15.128.http > 192.168.15.129.38159: Flags [S.], seq 1970476158, ack 3053123928, win 5840, options [mss 1460], length 0
13:20:47.315926 IP 192.168.15.128.loc-srv > 192.168.15.129.38159: Flags [R.], seq 0, ack 3053123928, win 0, length 0
13:20:47.316047 IP 192.168.15.128.microsoft-ds > 192.168.15.129.38159: Flags [S.], seq 1957274610, ack 3053123928, win 5840, options [mss 1460], length 0
13:20:47.316167 IP 192.168.15.128.1723 > 192.168.15.129.38159: Flags [R.], seq 0, ack 3053123928, win 0, length 0
13:20:47.316286 IP 192.168.15.128.ftp > 192.168.15.129.38159: Flags [S.], seq 1971173543, ack 3053123928, win 5840, options [mss 1460], length 0
13:20:47.316604 IP 192.168.15.128.netbios-ssn > 192.168.15.129.38159: Flags [S.], seq 1971072866, ack 3053123928, win 5840, options [mss 1460], length 0
13:20:47.316673 IP 192.168.15.128.pop3s > 192.168.15.129.38159: Flags [R.], seq 0, ack 3053123928, win 0, length 0
13:20:47.316732 IP 192.168.15.128.domain > 192.168.15.129.38159: Flags [S.], seq 1963578283, ack 3053123928, win 5840, options [mss 1460], length 0
13:20:47.316790 IP 192.168.15.128.3389 > 192.168.15.129.38159: Flags [R.], seq 0, ack 3053123928, win 0, length 0
13:20:47.316926 IP 192.168.15.129.38159 > 192.168.15.128.http: Flags [R], seq 3053123928, win 0, length 0
13:20:47.317060 IP 192.168.15.129.38159 > 192.168.15.128.netbios-ssn: Flags [R], seq 3053123928, win 0, length 0
13:20:47.317143 IP 192.168.15.129.38159 > 192.168.15.128.domain: Flags [R], seq 3053123928, win 0, length 0
13:20:47.317247 IP 192.168.15.128.submission > 192.168.15.129.38159: Flags [R.], seq 0, ack 3053123928, win 0, length 0
13:20:47.317834 IP 192.168.15.129.38159 > 192.168.15.128.microsoft-ds: Flags [R], seq 3053123928, win 0, length 0
13:20:47.320172 IP 192.168.15.129.38159 > 192.168.15.128.ftp: Flags [R], seq 3053123928, win 0, length 0
13:20:48.226599 ARP, Request who-has 192.168.15.2 tell 192.168.15.1, length 46
13:20:48.415685 IP 192.168.15.129.38160 > 192.168.15.128.submission: Flags [S], seq 3053189462, win 1024, options [mss 1460], length 0
13:20:48.416054 IP 192.168.15.129.38160 > 192.168.15.128.3389: Flags [S], seq 3053189462, win 1024, options [mss 1460], length 0
13:20:48.416126 IP 192.168.15.129.38160 > 192.168.15.128.domain: Flags [S], seq 3053189462, win 1024, options [mss 1460], length 0
13:20:48.416180 IP 192.168.15.129.38160 > 192.168.15.128.pop3s: Flags [S], seq 3053189462, win 1024, options [mss 1460], length 0
13:20:48.416258 IP 192.168.15.129.38160 > 192.168.15.128.netbios-ssn: Flags [S], seq 3053189462, win 1024, options [mss 1460], length 0
13:20:48.416311 IP 192.168.15.129.38160 > 192.168.15.128.ftp: Flags [S], seq 3053189462, win 1024, options [mss 1460], length 0
13:20:48.416987 IP 192.168.15.128.submission > 192.168.15.129.38160: Flags [R.], seq 0, ack 3053189463, win 0, length 0
13:20:48.417246 IP 192.168.15.128.3389 > 192.168.15.129.38160: Flags [R.], seq 0, ack 3053189463, win 0, length 0
13:20:48.417389 IP 192.168.15.128.domain > 192.168.15.129.38160: Flags [S.], seq 1974267711, ack 3053189463, win 5840, options [mss 1460], length 0
13:20:48.417546 IP 192.168.15.128.pop3s > 192.168.15.129.38160: Flags [R.], seq 0, ack 3053189463, win 0, length 0
13:20:48.417623 IP 192.168.15.128.netbios-ssn > 192.168.15.129.38160: Flags [S.], seq 1977281400, ack 3053189463, win 5840, options [mss 1460], length 0
13:20:48.417685 IP 192.168.15.128.ftp > 192.168.15.129.38160: Flags [S.], seq 1973202684, ack 3053189463, win 5840, options [mss 1460], length 0
13:20:48.417871 IP 192.168.15.129.38160 > 192.168.15.128.1723: Flags [S], seq 3053189462, win 1024, options [mss 1460], length 0
13:20:48.418160 IP 192.168.15.129.38160 > 192.168.15.128.microsoft-ds: Flags [S], seq 3053189462, win 1024, options [mss 1460], length 0
13:20:48.418452 IP 192.168.15.129.38160 > 192.168.15.128.loc-srv: Flags [S], seq 3053189462, win 1024, options [mss 1460], length 0
13:20:48.418627 IP 192.168.15.129.38159 > 192.168.15.128.sunrpc: Flags [S], seq 3053123927, win 1024, options [mss 1460], length 0
13:20:48.418706 IP 192.168.15.129.38159 > 192.168.15.128.1720: Flags [S], seq 3053123927, win 1024, options [mss 1460], length 0
13:20:48.418848 IP 192.168.15.129.38159 > 192.168.15.128.rtsp: Flags [S], seq 3053123927, win 1024, options [mss 1460], length 0
13:20:48.418918 IP 192.168.15.129.38159 > 192.168.15.128.mysql: Flags [S], seq 3053123927, win 1024, options [mss 1460], length 0
13:20:48.418983 IP 192.168.15.129.38159 > 192.168.15.128.telnet: Flags [S], seq 3053123927, win 1024, options [mss 1460], length 0
13:20:48.419041 IP 192.168.15.129.38159 > 192.168.15.128.5900: Flags [S], seq 3053123927, win 1024, options [mss 1460], length 0
13:20:48.419109 IP 192.168.15.129.38160 > 192.168.15.128.domain: Flags [R], seq 3053189463, win 0, length 0
13:20:48.419173 IP 192.168.15.129.38159 > 192.168.15.128.auth: Flags [S], seq 3053123927, win 1024, options [mss 1460], length 0
13:20:48.419246 IP 192.168.15.129.38160 > 192.168.15.128.netbios-ssn: Flags [R], seq 3053189463, win 0, length 0
13:20:48.419307 IP 192.168.15.129.38160 > 192.168.15.128.ftp: Flags [R], seq 3053189463, win 0, length 0
13:20:48.419373 IP 192.168.15.129.38159 > 192.168.15.128.ssh: Flags [S], seq 3053123927, win 1024, options [mss 1460], length 0
13:20:48.419435 IP 192.168.15.129.38159 > 192.168.15.128.imap2: Flags [S], seq 3053123927, win 1024, options [mss 1460], length 0
13:20:48.419504 IP 192.168.15.129.38159 > 192.168.15.128.smtp: Flags [S], seq 3053123927, win 1024, options [mss 1460], length 0
13:20:48.419571 IP 192.168.15.129.38159 > 192.168.15.128.8888: Flags [S], seq 3053123927, win 1024, options [mss 1460], length 0
13:20:48.419635 IP 192.168.15.129.38159 > 192.168.15.128.imaps: Flags [S], seq 3053123927, win 1024, options [mss 1460], length 0
13:20:48.419752 IP 192.168.15.128.1723 > 192.168.15.129.38160: Flags [R.], seq 0, ack 3053189463, win 0, length 0
13:20:48.419811 IP 192.168.15.128.microsoft-ds > 192.168.15.129.38160: Flags [S.], seq 1974260546, ack 3053189463, win 5840, options [mss 1460], length 0
13:20:48.419877 IP 192.168.15.128.loc-srv > 192.168.15.129.38160: Flags [R.], seq 0, ack 3053189463, win 0, length 0
13:20:48.419934 IP 192.168.15.128.sunrpc > 192.168.15.129.38159: Flags [S.], seq 1983542200, ack 3053123928, win 5840, options [mss 1460], length 0
13:20:48.419996 IP 192.168.15.128.1720 > 192.168.15.129.38159: Flags [R.], seq 0, ack 3053123928, win 0, length 0
13:20:48.420063 IP 192.168.15.128.rtsp > 192.168.15.129.38159: Flags [R.], seq 0, ack 3053123928, win 0, length 0
13:20:48.420122 IP 192.168.15.128.mysql > 192.168.15.129.38159: Flags [S.], seq 1974614678, ack 3053123928, win 5840, options [mss 1460], length 0
13:20:48.420179 IP 192.168.15.128.telnet > 192.168.15.129.38159: Flags [S.], seq 1985896577, ack 3053123928, win 5840, options [mss 1460], length 0
13:20:48.420273 IP 192.168.15.128.5900 > 192.168.15.129.38159: Flags [S.], seq 1986702835, ack 3053123928, win 5840, options [mss 1460], length 0
13:20:48.420328 IP 192.168.15.128.auth > 192.168.15.129.38159: Flags [R.], seq 0, ack 3053123928, win 0, length 0
13:20:48.420390 IP 192.168.15.128.ssh > 192.168.15.129.38159: Flags [S.], seq 1974568008, ack 3053123928, win 5840, options [mss 1460], length 0
13:20:48.420445 IP 192.168.15.128.imap2 > 192.168.15.129.38159: Flags [R.], seq 0, ack 3053123928, win 0, length 0
13:20:48.420503 IP 192.168.15.128.smtp > 192.168.15.129.38159: Flags [S.], seq 1976027218, ack 3053123928, win 5840, options [mss 1460], length 0
13:20:48.420563 IP 192.168.15.128.8888 > 192.168.15.129.38159: Flags [R.], seq 0, ack 3053123928, win 0, length 0
13:20:48.420633 IP 192.168.15.128.imaps > 192.168.15.129.38159: Flags [R.], seq 0, ack 3053123928, win 0, length 0
13:20:48.420734 IP 192.168.15.129.38160 > 192.168.15.128.microsoft-ds: Flags [R], seq 3053189463, win 0, length 0
13:20:48.420972 IP 192.168.15.129.38159 > 192.168.15.128.sunrpc: Flags [R], seq 3053123928, win 0, length 0
13:20:48.421063 IP 192.168.15.129.38159 > 192.168.15.128.mysql: Flags [R], seq 3053123928, win 0, length 0
13:20:48.421120 IP 192.168.15.129.38159 > 192.168.15.128.telnet: Flags [R], seq 3053123928, win 0, length 0
13:20:48.421183 IP 192.168.15.129.38159 > 192.168.15.128.5900: Flags [R], seq 3053123928, win 0, length 0
13:20:48.421601 IP 192.168.15.129.38159 > 192.168.15.128.ssh: Flags [R], seq 3053123928, win 0, length 0
13:20:48.421721 IP 192.168.15.129.38159 > 192.168.15.128.smtp: Flags [R], seq 3053123928, win 0, length 0
13:20:48.421787 IP 192.168.15.129.38159 > 192.168.15.128.https: Flags [S], seq 3053123927, win 1024, options [mss 1460], length 0
13:20:48.421928 IP 192.168.15.129.38159 > 192.168.15.128.smux: Flags [S], seq 3053123927, win 1024, options [mss 1460], length 0
13:20:48.422038 IP 192.168.15.128.https > 192.168.15.129.38159: Flags [R.], seq 0, ack 3053123928, win 0, length 0
13:20:48.422549 IP 192.168.15.128.smux > 192.168.15.129.38159: Flags [R.], seq 0, ack 3053123928, win 0, length 0
13:20:48.423631 IP 192.168.15.129.38159 > 192.168.15.128.http-alt: Flags [S], seq 3053123927, win 1024, options [mss 1460], length 0
13:20:48.423744 IP 192.168.15.129.38159 > 192.168.15.128.256: Flags [S], seq 3053123927, win 1024, options [mss 1460], length 0
13:20:48.423836 IP 192.168.15.129.38159 > 192.168.15.128.1025: Flags [S], seq 3053123927, win 1024, options [mss 1460], length 0
13:20:48.423930 IP 192.168.15.129.38159 > 192.168.15.128.pop3: Flags [S], seq 3053123927, win 1024, options [mss 1460], length 0
13:20:48.423988 IP 192.168.15.129.38159 > 192.168.15.128.1048: Flags [S], seq 3053123927, win 1024, options [mss 1460], length 0
13:20:48.424117 IP 192.168.15.129.38159 > 192.168.15.128.51103: Flags [S], seq 3053123927, win 1024, options [mss 1460], length 0
13:20:48.424338 IP 192.168.15.129.38159 > 192.168.15.128.1971: Flags [S], seq 3053123927, win 1024, options [mss 1460], length 0
13:20:48.424430 IP 192.168.15.129.38159 > 192.168.15.128.32778: Flags [S], seq 3053123927, win 1024, options [mss 1460], length 0
13:20:48.424497 IP 192.168.15.129.38159 > 192.168.15.128.49165: Flags [S], seq 3053123927, win 1024, options [mss 1460], length 0
13:20:48.424550 IP 192.168.15.129.38159 > 192.168.15.128.1718: Flags [S], seq 3053123927, win 1024, options [mss 1460], length 0
13:20:48.424612 IP 192.168.15.129.38159 > 192.168.15.128.9040: Flags [S], seq 3053123927, win 1024, options [mss 1460], length 0
13:20:48.424676 IP 192.168.15.129.38159 > 192.168.15.128.17988: Flags [S], seq 3053123927, win 1024, options [mss 1460], length 0
13:20:48.424737 IP 192.168.15.129.38159 > 192.168.15.128.5730: Flags [S], seq 3053123927, win 1024, options [mss 1460], length 0
13:20:48.424795 IP 192.168.15.129.38159 > 192.168.15.128.23502: Flags [S], seq 3053123927, win 1024, options [mss 1460], length 0
13:20:48.424855 IP 192.168.15.129.38159 > 192.168.15.128.911: Flags [S], seq 3053123927, win 1024, options [mss 1460], length 0
13:20:48.424980 IP 192.168.15.128.http-alt > 192.168.15.129.38159: Flags [R.], seq 0, ack 3053123928, win 0, length 0
13:20:48.425055 IP 192.168.15.128.256 > 192.168.15.129.38159: Flags [R.], seq 0, ack 3053123928, win 0, length 0
13:20:48.425140 IP 192.168.15.129.38159 > 192.168.15.128.1122: Flags [S], seq 3053123927, win 1024, options [mss 1460], length 0
13:20:48.425204 IP 192.168.15.129.38159 > 192.168.15.128.aol: Flags [S], seq 3053123927, win 1024, options [mss 1460], length 0
13:20:48.425297 IP 192.168.15.129.38159 > 192.168.15.128.2126: Flags [S], seq 3053123927, win 1024, options [mss 1460], length 0
13:20:48.425392 IP 192.168.15.128.1025 > 192.168.15.129.38159: Flags [R.], seq 0, ack 3053123928, win 0, length 0
13:20:48.425493 IP 192.168.15.129.38159 > 192.168.15.128.1131: Flags [S], seq 3053123927, win 1024, options [mss 1460], length 0
13:20:48.425556 IP 192.168.15.129.38159 > 192.168.15.128.6100: Flags [S], seq 3053123927, win 1024, options [mss 1460], length 0
13:20:48.425609 IP 192.168.15.129.38159 > 192.168.15.128.9500: Flags [S], seq 3053123927, win 1024, options [mss 1460], length 0
13:20:48.425744 IP 192.168.15.129.38159 > 192.168.15.128.5962: Flags [S], seq 3053123927, win 1024, options [mss 1460], length 0
13:20:48.425822 IP 192.168.15.128.pop3 > 192.168.15.129.38159: Flags [R.], seq 0, ack 3053123928, win 0, length 0
13:20:48.426179 IP 192.168.15.129.38159 > 192.168.15.128.843: Flags [S], seq 3053123927, win 1024, options [mss 1460], length 0
13:20:48.426360 IP 192.168.15.129.38159 > 192.168.15.128.ospfd: Flags [S], seq 3053123927, win 1024, options [mss 1460], length 0
13:20:48.426441 IP 192.168.15.129.38159 > 192.168.15.128.3889: Flags [S], seq 3053123927, win 1024, options [mss 1460], length 0
13:20:48.426508 IP 192.168.15.129.38159 > 192.168.15.128.18040: Flags [S], seq 3053123927, win 1024, options [mss 1460], length 0
13:20:48.426615 IP 192.168.15.128.1048 > 192.168.15.129.38159: Flags [R.], seq 0, ack 3053123928, win 0, length 0
13:20:48.426674 IP 192.168.15.128.51103 > 192.168.15.129.38159: Flags [R.], seq 0, ack 3053123928, win 0, length 0
13:20:48.426787 IP 192.168.15.128.1971 > 192.168.15.129.38159: Flags [R.], seq 0, ack 3053123928, win 0, length 0
13:20:48.426943 IP 192.168.15.128.32778 > 192.168.15.129.38159: Flags [R.], seq 0, ack 3053123928, win 0, length 0
13:20:48.427069 IP 192.168.15.128.49165 > 192.168.15.129.38159: Flags [R.], seq 0, ack 3053123928, win 0, length 0
13:20:48.427147 IP 192.168.15.128.1718 > 192.168.15.129.38159: Flags [R.], seq 0, ack 3053123928, win 0, length 0
13:20:48.427208 IP 192.168.15.128.9040 > 192.168.15.129.38159: Flags [R.], seq 0, ack 3053123928, win 0, length 0
13:20:48.427292 IP 192.168.15.128.17988 > 192.168.15.129.38159: Flags [R.], seq 0, ack 3053123928, win 0, length 0
13:20:48.427362 IP 192.168.15.128.5730 > 192.168.15.129.38159: Flags [R.], seq 0, ack 3053123928, win 0, length 0
13:20:48.427426 IP 192.168.15.128.23502 > 192.168.15.129.38159: Flags [R.], seq 0, ack 3053123928, win 0, length 0
13:20:48.427483 IP 192.168.15.128.911 > 192.168.15.129.38159: Flags [R.], seq 0, ack 3053123928, win 0, length 0
13:20:48.427541 IP 192.168.15.128.1122 > 192.168.15.129.38159: Flags [R.], seq 0, ack 3053123928, win 0, length 0
13:20:48.427656 IP 192.168.15.128.aol > 192.168.15.129.38159: Flags [R.], seq 0, ack 3053123928, win 0, length 0
13:20:48.428135 IP 192.168.15.128.2126 > 192.168.15.129.38159: Flags [R.], seq 0, ack 3053123928, win 0, length 0
13:20:48.428206 IP 192.168.15.128.1131 > 192.168.15.129.38159: Flags [R.], seq 0, ack 3053123928, win 0, length 0
13:20:48.428271 IP 192.168.15.128.6100 > 192.168.15.129.38159: Flags [R.], seq 0, ack 3053123928, win 0, length 0
13:20:48.428336 IP 192.168.15.128.9500 > 192.168.15.129.38159: Flags [R.], seq 0, ack 3053123928, win 0, length 0
13:20:48.428399 IP 192.168.15.128.5962 > 192.168.15.129.38159: Flags [R.], seq 0, ack 3053123928, win 0, length 0
13:20:48.428482 IP 192.168.15.128.843 > 192.168.15.129.38159: Flags [R.], seq 0, ack 3053123928, win 0, length 0
13:20:48.428747 IP 192.168.15.128.ospfd > 192.168.15.129.38159: Flags [R.], seq 0, ack 3053123928, win 0, length 0
13:20:48.428840 IP 192.168.15.128.3889 > 192.168.15.129.38159: Flags [R.], seq 0, ack 3053123928, win 0, length 0
13:20:48.428905 IP 192.168.15.128.18040 > 192.168.15.129.38159: Flags [R.], seq 0, ack 3053123928, win 0, length 0
13:20:48.516636 IP 192.168.15.129.38159 > 192.168.15.128.1296: Flags [S], seq 3053123927, win 1024, options [mss 1460], length 0
13:20:48.516769 IP 192.168.15.129.38159 > 192.168.15.128.nut: Flags [S], seq 3053123927, win 1024, options [mss 1460], length 0
13:20:48.516835 IP 192.168.15.129.38159 > 192.168.15.128.omirr: Flags [S], seq 3053123927, win 1024, options [mss 1460], length 0
13:20:48.516898 IP 192.168.15.129.38159 > 192.168.15.128.4045: Flags [S], seq 3053123927, win 1024, options [mss 1460], length 0
13:20:48.517212 IP 192.168.15.128.1296 > 192.168.15.129.38159: Flags [R.], seq 0, ack 3053123928, win 0, length 0
13:20:48.517310 IP 192.168.15.128.nut > 192.168.15.129.38159: Flags [R.], seq 0, ack 3053123928, win 0, length 0
13:20:48.517364 IP 192.168.15.128.omirr > 192.168.15.129.38159: Flags [R.], seq 0, ack 3053123928, win 0, length 0
13:20:48.517426 IP 192.168.15.128.4045 > 192.168.15.129.38159: Flags [R.], seq 0, ack 3053123928, win 0, length 0
13:20:48.517985 IP 192.168.15.129.38159 > 192.168.15.128.1078: Flags [S], seq 3053123927, win 1024, options [mss 1460], length 0
13:20:48.518104 IP 192.168.15.129.38159 > 192.168.15.128.socks: Flags [S], seq 3053123927, win 1024, options [mss 1460], length 0
13:20:48.518512 IP 192.168.15.128.1078 > 192.168.15.129.38159: Flags [R.], seq 0, ack 3053123928, win 0, length 0
13:20:48.518608 IP 192.168.15.128.socks > 192.168.15.129.38159: Flags [R.], seq 0, ack 3053123928, win 0, length 0
13:20:48.518704 IP 192.168.15.129.38159 > 192.168.15.128.5987: Flags [S], seq 3053123927, win 1024, options [mss 1460], length 0
13:20:48.518786 IP 192.168.15.129.38159 > 192.168.15.128.2035: Flags [S], seq 3053123927, win 1024, options [mss 1460], length 0
13:20:48.519139 IP 192.168.15.128.5987 > 192.168.15.129.38159: Flags [R.], seq 0, ack 3053123928, win 0, length 0
13:20:48.519262 IP 192.168.15.128.2035 > 192.168.15.129.38159: Flags [R.], seq 0, ack 3053123928, win 0, length 0
13:20:48.519774 IP 192.168.15.129.38159 > 192.168.15.128.2065: Flags [S], seq 3053123927, win 1024, options [mss 1460], length 0
13:20:48.519927 IP 192.168.15.129.38159 > 192.168.15.128.8083: Flags [S], seq 3053123927, win 1024, options [mss 1460], length 0
13:20:48.520159 IP 192.168.15.128.2065 > 192.168.15.129.38159: Flags [R.], seq 0, ack 3053123928, win 0, length 0
13:20:48.520315 IP 192.168.15.128.8083 > 192.168.15.129.38159: Flags [R.], seq 0, ack 3053123928, win 0, length 0
13:20:48.520452 IP 192.168.15.129.38159 > 192.168.15.128.8093: Flags [S], seq 3053123927, win 1024, options [mss 1460], length 0
13:20:48.520515 IP 192.168.15.129.38159 > 192.168.15.128.30: Flags [S], seq 3053123927, win 1024, options [mss 1460], length 0
13:20:48.520670 IP 192.168.15.129.38159 > 192.168.15.128.57797: Flags [S], seq 3053123927, win 1024, options [mss 1460], length 0
13:20:48.520776 IP 192.168.15.128.8093 > 192.168.15.129.38159: Flags [R.], seq 0, ack 3053123928, win 0, length 0
13:20:48.521152 IP 192.168.15.128.30 > 192.168.15.129.38159: Flags [R.], seq 0, ack 3053123928, win 0, length 0
13:20:48.521265 IP 192.168.15.128.57797 > 192.168.15.129.38159: Flags [R.], seq 0, ack 3053123928, win 0, length 0
13:20:48.521559 IP 192.168.15.129.38159 > 192.168.15.128.customs: Flags [S], seq 3053123927, win 1024, options [mss 1460], length 0
13:20:48.521665 IP 192.168.15.129.38159 > 192.168.15.128.2200: Flags [S], seq 3053123927, win 1024, options [mss 1460], length 0
13:20:48.521726 IP 192.168.15.129.38159 > 192.168.15.128.6901: Flags [S], seq 3053123927, win 1024, options [mss 1460], length 0
13:20:48.522019 IP 192.168.15.128.customs > 192.168.15.129.38159: Flags [R.], seq 0, ack 3053123928, win 0, length 0
13:20:48.522114 IP 192.168.15.128.2200 > 192.168.15.129.38159: Flags [R.], seq 0, ack 3053123928, win 0, length 0
13:20:48.522173 IP 192.168.15.128.6901 > 192.168.15.129.38159: Flags [R.], seq 0, ack 3053123928, win 0, length 0
13:20:48.522565 IP 192.168.15.129.38159 > 192.168.15.128.sip: Flags [S], seq 3053123927, win 1024, options [mss 1460], length 0
13:20:48.522665 IP 192.168.15.129.38159 > 192.168.15.128.7435: Flags [S], seq 3053123927, win 1024, options [mss 1460], length 0
13:20:48.522733 IP 192.168.15.129.38159 > 192.168.15.128.5631: Flags [S], seq 3053123927, win 1024, options [mss 1460], length 0
13:20:48.522785 IP 192.168.15.129.38159 > 192.168.15.128.9003: Flags [S], seq 3053123927, win 1024, options [mss 1460], length 0
13:20:48.522921 IP 192.168.15.128.sip > 192.168.15.129.38159: Flags [R.], seq 0, ack 3053123928, win 0, length 0
13:20:48.523116 IP 192.168.15.128.7435 > 192.168.15.129.38159: Flags [R.], seq 0, ack 3053123928, win 0, length 0
13:20:48.523264 IP 192.168.15.128.5631 > 192.168.15.129.38159: Flags [R.], seq 0, ack 3053123928, win 0, length 0
13:20:48.523332 IP 192.168.15.128.9003 > 192.168.15.129.38159: Flags [R.], seq 0, ack 3053123928, win 0, length 0
13:20:48.523428 IP 192.168.15.129.38159 > 192.168.15.128.125: Flags [S], seq 3053123927, win 1024, options [mss 1460], length 0
13:20:48.523831 IP 192.168.15.128.125 > 192.168.15.129.38159: Flags [R.], seq 0, ack 3053123928, win 0, length 0
13:20:48.524239 IP 192.168.15.129.38159 > 192.168.15.128.41511: Flags [S], seq 3053123927, win 1024, options [mss 1460], length 0
13:20:48.524358 IP 192.168.15.129.38159 > 192.168.15.128.4445: Flags [S], seq 3053123927, win 1024, options [mss 1460], length 0
13:20:48.524420 IP 192.168.15.129.38159 > 192.168.15.128.5902: Flags [S], seq 3053123927, win 1024, options [mss 1460], length 0
13:20:48.524731 IP 192.168.15.128.41511 > 192.168.15.129.38159: Flags [R.], seq 0, ack 3053123928, win 0, length 0
13:20:48.524814 IP 192.168.15.128.4445 > 192.168.15.129.38159: Flags [R.], seq 0, ack 3053123928, win 0, length 0
13:20:48.524867 IP 192.168.15.128.5902 > 192.168.15.129.38159: Flags [R.], seq 0, ack 3053123928, win 0, length 0
13:20:48.524961 IP 192.168.15.129.38159 > 192.168.15.128.1108: Flags [S], seq 3053123927, win 1024, options [mss 1460], length 0
13:20:48.525027 IP 192.168.15.129.38159 > 192.168.15.128.6666: Flags [S], seq 3053123927, win 1024, options [mss 1460], length 0
13:20:48.525239 IP 192.168.15.129.38159 > 192.168.15.128.6789: Flags [S], seq 3053123927, win 1024, options [mss 1460], length 0
13:20:48.525391 IP 192.168.15.129.38159 > 192.168.15.128.bpcd: Flags [S], seq 3053123927, win 1024, options [mss 1460], length 0
13:20:48.525556 IP 192.168.15.129.38159 > 192.168.15.128.5915: Flags [S], seq 3053123927, win 1024, options [mss 1460], length 0
13:20:48.525680 IP 192.168.15.128.1108 > 192.168.15.129.38159: Flags [R.], seq 0, ack 3053123928, win 0, length 0
13:20:48.525745 IP 192.168.15.128.6666 > 192.168.15.129.38159: Flags [R.], seq 0, ack 3053123928, win 0, length 0
13:20:48.525798 IP 192.168.15.128.6789 > 192.168.15.129.38159: Flags [R.], seq 0, ack 3053123928, win 0, length 0
13:20:48.525860 IP 192.168.15.128.bpcd > 192.168.15.129.38159: Flags [R.], seq 0, ack 3053123928, win 0, length 0
13:20:48.525917 IP 192.168.15.128.5915 > 192.168.15.129.38159: Flags [R.], seq 0, ack 3053123928, win 0, length 0
13:20:48.526348 IP 192.168.15.129.38159 > 192.168.15.128.5911: Flags [S], seq 3053123927, win 1024, options [mss 1460], length 0
13:20:48.526459 IP 192.168.15.129.38159 > 192.168.15.128.1121: Flags [S], seq 3053123927, win 1024, options [mss 1460], length 0
13:20:48.526528 IP 192.168.15.129.38159 > 192.168.15.128.1100: Flags [S], seq 3053123927, win 1024, options [mss 1460], length 0
13:20:48.526653 IP 192.168.15.129.38159 > 192.168.15.128.12000: Flags [S], seq 3053123927, win 1024, options [mss 1460], length 0
13:20:48.526815 IP 192.168.15.128.5911 > 192.168.15.129.38159: Flags [R.], seq 0, ack 3053123928, win 0, length 0
13:20:48.527082 IP 192.168.15.128.1121 > 192.168.15.129.38159: Flags [R.], seq 0, ack 3053123928, win 0, length 0
13:20:48.527223 IP 192.168.15.128.1100 > 192.168.15.129.38159: Flags [R.], seq 0, ack 3053123928, win 0, length 0
13:20:48.527298 IP 192.168.15.128.12000 > 192.168.15.129.38159: Flags [R.], seq 0, ack 3053123928, win 0, length 0
13:20:48.617555 IP 192.168.15.129.38160 > 192.168.15.128.1078: Flags [S], seq 3053189462, win 1024, options [mss 1460], length 0
13:20:48.617650 IP 192.168.15.129.38160 > 192.168.15.128.4045: Flags [S], seq 3053189462, win 1024, options [mss 1460], length 0
13:20:48.617702 IP 192.168.15.129.38160 > 192.168.15.128.omirr: Flags [S], seq 3053189462, win 1024, options [mss 1460], length 0
13:20:48.617746 IP 192.168.15.129.38160 > 192.168.15.128.nut: Flags [S], seq 3053189462, win 1024, options [mss 1460], length 0
13:20:48.617790 IP 192.168.15.129.38160 > 192.168.15.128.1296: Flags [S], seq 3053189462, win 1024, options [mss 1460], length 0
13:20:48.618046 IP 192.168.15.128.1078 > 192.168.15.129.38160: Flags [R.], seq 0, ack 3053189463, win 0, length 0
13:20:48.618164 IP 192.168.15.128.4045 > 192.168.15.129.38160: Flags [R.], seq 0, ack 3053189463, win 0, length 0
13:20:48.618215 IP 192.168.15.128.omirr > 192.168.15.129.38160: Flags [R.], seq 0, ack 3053189463, win 0, length 0
13:20:48.618262 IP 192.168.15.128.nut > 192.168.15.129.38160: Flags [R.], seq 0, ack 3053189463, win 0, length 0
13:20:48.618425 IP 192.168.15.128.1296 > 192.168.15.129.38160: Flags [R.], seq 0, ack 3053189463, win 0, length 0
13:20:48.620472 IP 192.168.15.129.38160 > 192.168.15.128.30: Flags [S], seq 3053189462, win 1024, options [mss 1460], length 0
13:20:48.620568 IP 192.168.15.129.38160 > 192.168.15.128.8093: Flags [S], seq 3053189462, win 1024, options [mss 1460], length 0
13:20:48.620673 IP 192.168.15.129.38160 > 192.168.15.128.8083: Flags [S], seq 3053189462, win 1024, options [mss 1460], length 0
13:20:48.620726 IP 192.168.15.129.38160 > 192.168.15.128.2065: Flags [S], seq 3053189462, win 1024, options [mss 1460], length 0
13:20:48.620786 IP 192.168.15.129.38160 > 192.168.15.128.2035: Flags [S], seq 3053189462, win 1024, options [mss 1460], length 0
13:20:48.620974 IP 192.168.15.128.30 > 192.168.15.129.38160: Flags [R.], seq 0, ack 3053189463, win 0, length 0
13:20:48.621030 IP 192.168.15.128.8093 > 192.168.15.129.38160: Flags [R.], seq 0, ack 3053189463, win 0, length 0
13:20:48.621094 IP 192.168.15.129.38160 > 192.168.15.128.5987: Flags [S], seq 3053189462, win 1024, options [mss 1460], length 0
13:20:48.621164 IP 192.168.15.129.38160 > 192.168.15.128.socks: Flags [S], seq 3053189462, win 1024, options [mss 1460], length 0
13:20:48.621236 IP 192.168.15.128.8083 > 192.168.15.129.38160: Flags [R.], seq 0, ack 3053189463, win 0, length 0
13:20:48.621357 IP 192.168.15.128.2065 > 192.168.15.129.38160: Flags [R.], seq 0, ack 3053189463, win 0, length 0
13:20:48.621455 IP 192.168.15.128.2035 > 192.168.15.129.38160: Flags [R.], seq 0, ack 3053189463, win 0, length 0
13:20:48.621589 IP 192.168.15.128.5987 > 192.168.15.129.38160: Flags [R.], seq 0, ack 3053189463, win 0, length 0
13:20:48.621659 IP 192.168.15.128.socks > 192.168.15.129.38160: Flags [R.], seq 0, ack 3053189463, win 0, length 0
13:20:48.623541 IP 192.168.15.129.38160 > 192.168.15.128.125: Flags [S], seq 3053189462, win 1024, options [mss 1460], length 0
13:20:48.623633 IP 192.168.15.129.38160 > 192.168.15.128.9003: Flags [S], seq 3053189462, win 1024, options [mss 1460], length 0
13:20:48.623680 IP 192.168.15.129.38160 > 192.168.15.128.5631: Flags [S], seq 3053189462, win 1024, options [mss 1460], length 0
13:20:48.623729 IP 192.168.15.129.38160 > 192.168.15.128.7435: Flags [S], seq 3053189462, win 1024, options [mss 1460], length 0
13:20:48.623773 IP 192.168.15.129.38160 > 192.168.15.128.sip: Flags [S], seq 3053189462, win 1024, options [mss 1460], length 0
13:20:48.623889 IP 192.168.15.128.125 > 192.168.15.129.38160: Flags [R.], seq 0, ack 3053189463, win 0, length 0
13:20:48.623962 IP 192.168.15.129.38160 > 192.168.15.128.6901: Flags [S], seq 3053189462, win 1024, options [mss 1460], length 0
13:20:48.624027 IP 192.168.15.129.38160 > 192.168.15.128.2200: Flags [S], seq 3053189462, win 1024, options [mss 1460], length 0
13:20:48.624103 IP 192.168.15.128.9003 > 192.168.15.129.38160: Flags [R.], seq 0, ack 3053189463, win 0, length 0
13:20:48.624181 IP 192.168.15.128.5631 > 192.168.15.129.38160: Flags [R.], seq 0, ack 3053189463, win 0, length 0
13:20:48.624226 IP 192.168.15.128.7435 > 192.168.15.129.38160: Flags [R.], seq 0, ack 3053189463, win 0, length 0
13:20:48.624322 IP 192.168.15.128.sip > 192.168.15.129.38160: Flags [R.], seq 0, ack 3053189463, win 0, length 0
13:20:48.624459 IP 192.168.15.128.6901 > 192.168.15.129.38160: Flags [R.], seq 0, ack 3053189463, win 0, length 0
13:20:48.624542 IP 192.168.15.129.38160 > 192.168.15.128.customs: Flags [S], seq 3053189462, win 1024, options [mss 1460], length 0
13:20:48.624664 IP 192.168.15.129.38160 > 192.168.15.128.57797: Flags [S], seq 3053189462, win 1024, options [mss 1460], length 0
13:20:48.624747 IP 192.168.15.128.2200 > 192.168.15.129.38160: Flags [R.], seq 0, ack 3053189463, win 0, length 0
13:20:48.624920 IP 192.168.15.128.customs > 192.168.15.129.38160: Flags [R.], seq 0, ack 3053189463, win 0, length 0
13:20:48.624993 IP 192.168.15.128.57797 > 192.168.15.129.38160: Flags [R.], seq 0, ack 3053189463, win 0, length 0
13:20:48.627645 IP 192.168.15.129.38160 > 192.168.15.128.12000: Flags [S], seq 3053189462, win 1024, options [mss 1460], length 0
13:20:48.627745 IP 192.168.15.129.38160 > 192.168.15.128.1100: Flags [S], seq 3053189462, win 1024, options [mss 1460], length 0
13:20:48.627806 IP 192.168.15.129.38160 > 192.168.15.128.1121: Flags [S], seq 3053189462, win 1024, options [mss 1460], length 0
13:20:48.627863 IP 192.168.15.129.38160 > 192.168.15.128.5911: Flags [S], seq 3053189462, win 1024, options [mss 1460], length 0
13:20:48.628089 IP 192.168.15.128.12000 > 192.168.15.129.38160: Flags [R.], seq 0, ack 3053189463, win 0, length 0
13:20:48.628233 IP 192.168.15.128.1100 > 192.168.15.129.38160: Flags [R.], seq 0, ack 3053189463, win 0, length 0
13:20:48.628284 IP 192.168.15.128.1121 > 192.168.15.129.38160: Flags [R.], seq 0, ack 3053189463, win 0, length 0
13:20:48.628362 IP 192.168.15.128.5911 > 192.168.15.129.38160: Flags [R.], seq 0, ack 3053189463, win 0, length 0
13:20:48.628554 IP 192.168.15.129.38160 > 192.168.15.128.5915: Flags [S], seq 3053189462, win 1024, options [mss 1460], length 0
13:20:48.628958 IP 192.168.15.128.5915 > 192.168.15.129.38160: Flags [R.], seq 0, ack 3053189463, win 0, length 0
13:20:48.629049 IP 192.168.15.129.38160 > 192.168.15.128.bpcd: Flags [S], seq 3053189462, win 1024, options [mss 1460], length 0
13:20:48.629186 IP 192.168.15.129.38160 > 192.168.15.128.6789: Flags [S], seq 3053189462, win 1024, options [mss 1460], length 0
13:20:48.629259 IP 192.168.15.129.38160 > 192.168.15.128.6666: Flags [S], seq 3053189462, win 1024, options [mss 1460], length 0
13:20:48.629309 IP 192.168.15.129.38160 > 192.168.15.128.1108: Flags [S], seq 3053189462, win 1024, options [mss 1460], length 0
13:20:48.629360 IP 192.168.15.129.38160 > 192.168.15.128.5902: Flags [S], seq 3053189462, win 1024, options [mss 1460], length 0
13:20:48.629499 IP 192.168.15.129.38160 > 192.168.15.128.4445: Flags [S], seq 3053189462, win 1024, options [mss 1460], length 0
13:20:48.629566 IP 192.168.15.129.38160 > 192.168.15.128.41511: Flags [S], seq 3053189462, win 1024, options [mss 1460], length 0
13:20:48.629806 IP 192.168.15.128.bpcd > 192.168.15.129.38160: Flags [R.], seq 0, ack 3053189463, win 0, length 0
13:20:48.629886 IP 192.168.15.128.6789 > 192.168.15.129.38160: Flags [R.], seq 0, ack 3053189463, win 0, length 0
13:20:48.629936 IP 192.168.15.128.6666 > 192.168.15.129.38160: Flags [R.], seq 0, ack 3053189463, win 0, length 0
13:20:48.630226 IP 192.168.15.128.1108 > 192.168.15.129.38160: Flags [R.], seq 0, ack 3053189463, win 0, length 0
13:20:48.630482 IP 192.168.15.128.5902 > 192.168.15.129.38160: Flags [R.], seq 0, ack 3053189463, win 0, length 0
13:20:48.630604 IP 192.168.15.128.4445 > 192.168.15.129.38160: Flags [R.], seq 0, ack 3053189463, win 0, length 0
13:20:48.630672 IP 192.168.15.128.41511 > 192.168.15.129.38160: Flags [R.], seq 0, ack 3053189463, win 0, length 0
13:20:48.718494 IP 192.168.15.129.38159 > 192.168.15.128.1126: Flags [S], seq 3053123927, win 1024, options [mss 1460], length 0
13:20:48.719157 IP 192.168.15.128.1126 > 192.168.15.129.38159: Flags [R.], seq 0, ack 3053123928, win 0, length 0
13:20:48.723992 IP 192.168.15.129.38159 > 192.168.15.128.8652: Flags [S], seq 3053123927, win 1024, options [mss 1460], length 0
13:20:48.724584 IP 192.168.15.128.8652 > 192.168.15.129.38159: Flags [R.], seq 0, ack 3053123928, win 0, length 0
13:20:48.729337 IP 192.168.15.129.38159 > 192.168.15.128.1183: Flags [S], seq 3053123927, win 1024, options [mss 1460], length 0
13:20:48.729933 IP 192.168.15.128.1183 > 192.168.15.129.38159: Flags [R.], seq 0, ack 3053123928, win 0, length 0
13:20:48.735214 IP 192.168.15.129.38159 > 192.168.15.128.6156: Flags [S], seq 3053123927, win 1024, options [mss 1460], length 0
13:20:48.735971 IP 192.168.15.128.6156 > 192.168.15.129.38159: Flags [R.], seq 0, ack 3053123928, win 0, length 0
13:20:48.741212 IP 192.168.15.129.38159 > 192.168.15.128.ftp-data: Flags [S], seq 3053123927, win 1024, options [mss 1460], length 0
13:20:48.741884 IP 192.168.15.128.ftp-data > 192.168.15.129.38159: Flags [R.], seq 0, ack 3053123928, win 0, length 0
13:20:48.747083 IP 192.168.15.129.38159 > 192.168.15.128.1311: Flags [S], seq 3053123927, win 1024, options [mss 1460], length 0
13:20:48.747659 IP 192.168.15.128.1311 > 192.168.15.129.38159: Flags [R.], seq 0, ack 3053123928, win 0, length 0
13:20:48.752277 IP 192.168.15.129.38159 > 192.168.15.128.6699: Flags [S], seq 3053123927, win 1024, options [mss 1460], length 0
13:20:48.752935 IP 192.168.15.128.6699 > 192.168.15.129.38159: Flags [R.], seq 0, ack 3053123928, win 0, length 0
13:20:48.758262 IP 192.168.15.129.38159 > 192.168.15.128.4242: Flags [S], seq 3053123927, win 1024, options [mss 1460], length 0
13:20:48.758952 IP 192.168.15.128.4242 > 192.168.15.129.38159: Flags [R.], seq 0, ack 3053123928, win 0, length 0
13:20:48.764309 IP 192.168.15.129.38159 > 192.168.15.128.nntp: Flags [S], seq 3053123927, win 1024, options [mss 1460], length 0
13:20:48.764950 IP 192.168.15.128.nntp > 192.168.15.129.38159: Flags [R.], seq 0, ack 3053123928, win 0, length 0
13:20:48.770537 IP 192.168.15.129.38159 > 192.168.15.128.49157: Flags [S], seq 3053123927, win 1024, options [mss 1460], length 0
13:20:48.771212 IP 192.168.15.128.49157 > 192.168.15.129.38159: Flags [R.], seq 0, ack 3053123928, win 0, length 0
13:20:48.776913 IP 192.168.15.129.38159 > 192.168.15.128.tproxy: Flags [S], seq 3053123927, win 1024, options [mss 1460], length 0
13:20:48.777520 IP 192.168.15.128.tproxy > 192.168.15.129.38159: Flags [R.], seq 0, ack 3053123928, win 0, length 0
13:20:48.782791 IP 192.168.15.129.38159 > 192.168.15.128.9080: Flags [S], seq 3053123927, win 1024, options [mss 1460], length 0
13:20:48.783469 IP 192.168.15.128.9080 > 192.168.15.129.38159: Flags [R.], seq 0, ack 3053123928, win 0, length 0
13:20:48.788839 IP 192.168.15.129.38159 > 192.168.15.128.1102: Flags [S], seq 3053123927, win 1024, options [mss 1460], length 0
13:20:48.789512 IP 192.168.15.128.1102 > 192.168.15.129.38159: Flags [R.], seq 0, ack 3053123928, win 0, length 0
13:20:48.794662 IP 192.168.15.129.38159 > 192.168.15.128.1026: Flags [S], seq 3053123927, win 1024, options [mss 1460], length 0
13:20:48.795287 IP 192.168.15.128.1026 > 192.168.15.129.38159: Flags [R.], seq 0, ack 3053123928, win 0, length 0
13:20:48.800612 IP 192.168.15.129.38159 > 192.168.15.128.7019: Flags [S], seq 3053123927, win 1024, options [mss 1460], length 0
13:20:48.801296 IP 192.168.15.128.7019 > 192.168.15.129.38159: Flags [R.], seq 0, ack 3053123928, win 0, length 0
13:20:48.806622 IP 192.168.15.129.38159 > 192.168.15.128.1067: Flags [S], seq 3053123927, win 1024, options [mss 1460], length 0
13:20:48.807304 IP 192.168.15.128.1067 > 192.168.15.129.38159: Flags [R.], seq 0, ack 3053123928, win 0, length 0
13:20:48.812624 IP 192.168.15.129.38159 > 192.168.15.128.1036: Flags [S], seq 3053123927, win 1024, options [mss 1460], length 0
13:20:48.813306 IP 192.168.15.128.1036 > 192.168.15.129.38159: Flags [R.], seq 0, ack 3053123928, win 0, length 0
