13:22:28.543217 ARP, Request who-has 192.168.15.2 tell 192.168.15.1, length 46
13:22:29.226596 ARP, Request who-has 192.168.15.2 tell 192.168.15.1, length 46
13:22:30.226377 ARP, Request who-has 192.168.15.2 tell 192.168.15.1, length 46
13:22:31.504714 ARP, Request who-has 192.168.15.128 (Broadcast) tell 192.168.15.129, length 46
13:22:31.505232 ARP, Reply 192.168.15.128 is-at 00:0c:29:a1:c5:30 (oui Unknown), length 46
13:22:31.544216 ARP, Request who-has 192.168.15.2 tell 192.168.15.1, length 46
13:22:31.706143 ARP, Request who-has 192.168.15.2 tell 192.168.15.129, length 46
13:22:31.706589 ARP, Reply 192.168.15.2 is-at 00:50:56:e8:23:fc (oui Unknown), length 46
13:22:31.707094 IP 192.168.15.129.38907 > 192.168.15.2.domain: 38410+ PTR? 128.15.168.192.in-addr.arpa. (45)
13:22:31.713492 IP 192.168.15.2.domain > 192.168.15.129.38907: 38410 NXDomain 0/0/0 (45)
13:22:31.714583 IP 192.168.15.129.37168 > 192.168.15.128.1720: Flags [S], seq 2896477616, win 1024, options [mss 1460], length 0
13:22:31.714601 IP 192.168.15.129.37168 > 192.168.15.128.https: Flags [S], seq 2896477616, win 1024, options [mss 1460], length 0
13:22:31.714658 IP 192.168.15.129.37168 > 192.168.15.128.ssh: Flags [S], seq 2896477616, win 1024, options [mss 1460], length 0
13:22:31.714774 IP 192.168.15.129.37168 > 192.168.15.128.3389: Flags [S], seq 2896477616, win 1024, options [mss 1460], length 0
13:22:31.714780 IP 192.168.15.129.37168 > 192.168.15.128.5900: Flags [S], seq 2896477616, win 1024, options [mss 1460], length 0
13:22:31.714930 IP 192.168.15.129.37168 > 192.168.15.128.http-alt: Flags [S], seq 2896477616, win 1024, options [mss 1460], length 0
13:22:31.714999 IP 192.168.15.129.37168 > 192.168.15.128.256: Flags [S], seq 2896477616, win 1024, options [mss 1460], length 0
13:22:31.715093 IP 192.168.15.129.37168 > 192.168.15.128.rtsp: Flags [S], seq 2896477616, win 1024, options [mss 1460], length 0
13:22:31.715149 IP 192.168.15.129.37168 > 192.168.15.128.1025: Flags [S], seq 2896477616, win 1024, options [mss 1460], length 0
13:22:31.715191 IP 192.168.15.129.37168 > 192.168.15.128.sunrpc: Flags [S], seq 2896477616, win 1024, options [mss 1460], length 0
13:22:31.715286 IP 192.168.15.128.1720 > 192.168.15.129.37168: Flags [R.], seq 0, ack 2896477617, win 0, length 0
13:22:31.715380 IP 192.168.15.128.http-alt > 192.168.15.129.37168: Flags [R.], seq 0, ack 2896477617, win 0, length 0
13:22:31.715480 IP 192.168.15.128.256 > 192.168.15.129.37168: Flags [R.], seq 0, ack 2896477617, win 0, length 0
13:22:31.715649 IP 192.168.15.128.rtsp > 192.168.15.129.37168: Flags [R.], seq 0, ack 2896477617, win 0, length 0
13:22:31.715655 IP 192.168.15.128.1025 > 192.168.15.129.37168: Flags [R.], seq 0, ack 2896477617, win 0, length 0
13:22:31.715676 IP 192.168.15.128.sunrpc > 192.168.15.129.37168: Flags [S.], seq 3594799730, ack 2896477617, win 5840, options [mss 1460], length 0
13:22:31.715850 IP 192.168.15.128.https > 192.168.15.129.37168: Flags [R.], seq 0, ack 2896477617, win 0, length 0
13:22:31.715951 IP 192.168.15.128.ssh > 192.168.15.129.37168: Flags [S.], seq 3597101125, ack 2896477617, win 5840, options [mss 1460], length 0
13:22:31.716012 IP 192.168.15.128.3389 > 192.168.15.129.37168: Flags [R.], seq 0, ack 2896477617, win 0, length 0
13:22:31.716056 IP 192.168.15.128.5900 > 192.168.15.129.37168: Flags [S.], seq 3594430478, ack 2896477617, win 5840, options [mss 1460], length 0
13:22:31.716229 IP 192.168.15.129.37168 > 192.168.15.128.ssh: Flags [R], seq 2896477617, win 0, length 0
13:22:31.716282 IP 192.168.15.129.37168 > 192.168.15.128.5900: Flags [R], seq 2896477617, win 0, length 0
13:22:31.716971 IP 192.168.15.129.37168 > 192.168.15.128.sunrpc: Flags [R], seq 2896477617, win 0, length 0
13:22:32.226658 ARP, Request who-has 192.168.15.2 tell 192.168.15.1, length 46
13:22:32.815704 IP 192.168.15.129.37168 > 192.168.15.128.pop3s: Flags [S], seq 2896477616, win 1024, options [mss 1460], length 0
13:22:32.815756 IP 192.168.15.129.37168 > 192.168.15.128.netbios-ssn: Flags [S], seq 2896477616, win 1024, options [mss 1460], length 0
13:22:32.815788 IP 192.168.15.129.37168 > 192.168.15.128.imap2: Flags [S], seq 2896477616, win 1024, options [mss 1460], length 0
13:22:32.815809 IP 192.168.15.129.37168 > 192.168.15.128.auth: Flags [S], seq 2896477616, win 1024, options [mss 1460], length 0
13:22:32.815831 IP 192.168.15.129.37168 > 192.168.15.128.imaps: Flags [S], seq 2896477616, win 1024, options [mss 1460], length 0
13:22:32.815925 IP 192.168.15.128.pop3s > 192.168.15.129.37168: Flags [R.], seq 0, ack 2896477617, win 0, length 0
13:22:32.815959 IP 192.168.15.129.37168 > 192.168.15.128.1723: Flags [S], seq 2896477616, win 1024, options [mss 1460], length 0
13:22:32.816006 IP 192.168.15.129.37168 > 192.168.15.128.loc-srv: Flags [S], seq 2896477616, win 1024, options [mss 1460], length 0
13:22:32.816043 IP 192.168.15.128.netbios-ssn > 192.168.15.129.37168: Flags [S.], seq 3617470995, ack 2896477617, win 5840, options [mss 1460], length 0
13:22:32.816066 IP 192.168.15.128.imap2 > 192.168.15.129.37168: Flags [R.], seq 0, ack 2896477617, win 0, length 0
13:22:32.816087 IP 192.168.15.128.auth > 192.168.15.129.37168: Flags [R.], seq 0, ack 2896477617, win 0, length 0
13:22:32.816108 IP 192.168.15.128.imaps > 192.168.15.129.37168: Flags [R.], seq 0, ack 2896477617, win 0, length 0
13:22:32.816135 IP 192.168.15.128.1723 > 192.168.15.129.37168: Flags [R.], seq 0, ack 2896477617, win 0, length 0
13:22:32.816157 IP 192.168.15.128.loc-srv > 192.168.15.129.37168: Flags [R.], seq 0, ack 2896477617, win 0, length 0
13:22:32.816209 IP 192.168.15.129.37168 > 192.168.15.128.netbios-ssn: Flags [R], seq 2896477617, win 0, length 0
13:22:32.816290 IP 192.168.15.129.37168 > 192.168.15.128.microsoft-ds: Flags [S], seq 2896477616, win 1024, options [mss 1460], length 0
13:22:32.816322 IP 192.168.15.129.37168 > 192.168.15.128.ftp: Flags [S], seq 2896477616, win 1024, options [mss 1460], length 0
13:22:32.816423 IP 192.168.15.129.37168 > 192.168.15.128.smux: Flags [S], seq 2896477616, win 1024, options [mss 1460], length 0
13:22:32.816451 IP 192.168.15.129.37168 > 192.168.15.128.http: Flags [S], seq 2896477616, win 1024, options [mss 1460], length 0
13:22:32.816486 IP 192.168.15.128.microsoft-ds > 192.168.15.129.37168: Flags [S.], seq 3612449576, ack 2896477617, win 5840, options [mss 1460], length 0
13:22:32.816511 IP 192.168.15.128.ftp > 192.168.15.129.37168: Flags [S.], seq 3606928435, ack 2896477617, win 5840, options [mss 1460], length 0
13:22:32.816532 IP 192.168.15.128.smux > 192.168.15.129.37168: Flags [R.], seq 0, ack 2896477617, win 0, length 0
13:22:32.816553 IP 192.168.15.128.http > 192.168.15.129.37168: Flags [S.], seq 3609292892, ack 2896477617, win 5840, options [mss 1460], length 0
13:22:32.816587 IP 192.168.15.129.37168 > 192.168.15.128.8888: Flags [S], seq 2896477616, win 1024, options [mss 1460], length 0
13:22:32.816668 IP 192.168.15.129.37168 > 192.168.15.128.microsoft-ds: Flags [R], seq 2896477617, win 0, length 0
13:22:32.816707 IP 192.168.15.129.37168 > 192.168.15.128.ftp: Flags [R], seq 2896477617, win 0, length 0
13:22:32.816730 IP 192.168.15.129.37168 > 192.168.15.128.http: Flags [R], seq 2896477617, win 0, length 0
13:22:32.816764 IP 192.168.15.128.8888 > 192.168.15.129.37168: Flags [R.], seq 0, ack 2896477617, win 0, length 0
13:22:32.816814 IP 192.168.15.129.37168 > 192.168.15.128.smtp: Flags [S], seq 2896477616, win 1024, options [mss 1460], length 0
13:22:32.816915 IP 192.168.15.129.37168 > 192.168.15.128.telnet: Flags [S], seq 2896477616, win 1024, options [mss 1460], length 0
13:22:32.816962 IP 192.168.15.129.37168 > 192.168.15.128.submission: Flags [S], seq 2896477616, win 1024, options [mss 1460], length 0
13:22:32.816985 IP 192.168.15.129.37168 > 192.168.15.128.mysql: Flags [S], seq 2896477616, win 1024, options [mss 1460], length 0
13:22:32.817020 IP 192.168.15.128.smtp > 192.168.15.129.37168: Flags [S.], seq 3614563836, ack 2896477617, win 5840, options [mss 1460], length 0
13:22:32.817060 IP 192.168.15.129.37168 > 192.168.15.128.pop3: Flags [S], seq 2896477616, win 1024, options [mss 1460], length 0
13:22:32.817099 IP 192.168.15.128.telnet > 192.168.15.129.37168: Flags [S.], seq 3619248724, ack 2896477617, win 5840, options [mss 1460], length 0
13:22:32.817124 IP 192.168.15.128.submission > 192.168.15.129.37168: Flags [R.], seq 0, ack 2896477617, win 0, length 0
13:22:32.817149 IP 192.168.15.128.mysql > 192.168.15.129.37168: Flags [S.], seq 3617225628, ack 2896477617, win 5840, options [mss 1460], length 0
13:22:32.817169 IP 192.168.15.128.pop3 > 192.168.15.129.37168: Flags [R.], seq 0, ack 2896477617, win 0, length 0
13:22:32.817201 IP 192.168.15.129.37168 > 192.168.15.128.smtp: Flags [R], seq 2896477617, win 0, length 0
13:22:32.817257 IP 192.168.15.129.37168 > 192.168.15.128.telnet: Flags [R], seq 2896477617, win 0, length 0
13:22:32.817307 IP 192.168.15.129.37168 > 192.168.15.128.mysql: Flags [R], seq 2896477617, win 0, length 0
13:22:32.817396 IP 192.168.15.129.37168 > 192.168.15.128.domain: Flags [S], seq 2896477616, win 1024, options [mss 1460], length 0
13:22:32.817468 IP 192.168.15.129.37168 > 192.168.15.128.6565: Flags [S], seq 2896477616, win 1024, options [mss 1460], length 0
13:22:32.817500 IP 192.168.15.129.37168 > 192.168.15.128.rootd: Flags [S], seq 2896477616, win 1024, options [mss 1460], length 0
13:22:32.817528 IP 192.168.15.128.domain > 192.168.15.129.37168: Flags [S.], seq 3608138346, ack 2896477617, win 5840, options [mss 1460], length 0
13:22:32.817558 IP 192.168.15.128.6565 > 192.168.15.129.37168: Flags [R.], seq 0, ack 2896477617, win 0, length 0
13:22:32.817596 IP 192.168.15.129.37168 > 192.168.15.128.5226: Flags [S], seq 2896477616, win 1024, options [mss 1460], length 0
13:22:32.817632 IP 192.168.15.128.rootd > 192.168.15.129.37168: Flags [R.], seq 0, ack 2896477617, win 0, length 0
13:22:32.817744 IP 192.168.15.128.5226 > 192.168.15.129.37168: Flags [R.], seq 0, ack 2896477617, win 0, length 0
13:22:32.817783 IP 192.168.15.129.37168 > 192.168.15.128.domain: Flags [R], seq 2896477617, win 0, length 0
13:22:32.817814 IP 192.168.15.129.37168 > 192.168.15.128.1047: Flags [S], seq 2896477616, win 1024, options [mss 1460], length 0
13:22:32.817835 IP 192.168.15.129.37168 > 192.168.15.128.9968: Flags [S], seq 2896477616, win 1024, options [mss 1460], length 0
13:22:32.817953 IP 192.168.15.128.1047 > 192.168.15.129.37168: Flags [R.], seq 0, ack 2896477617, win 0, length 0
13:22:32.817987 IP 192.168.15.128.9968 > 192.168.15.129.37168: Flags [R.], seq 0, ack 2896477617, win 0, length 0
13:22:32.818022 IP 192.168.15.129.37168 > 192.168.15.128.8010: Flags [S], seq 2896477616, win 1024, options [mss 1460], length 0
13:22:32.818044 IP 192.168.15.129.37168 > 192.168.15.128.7937: Flags [S], seq 2896477616, win 1024, options [mss 1460], length 0
13:22:32.818064 IP 192.168.15.129.37168 > 192.168.15.128.x11-5: Flags [S], seq 2896477616, win 1024, options [mss 1460], length 0
13:22:32.818111 IP 192.168.15.129.37168 > 192.168.15.128.8193: Flags [S], seq 2896477616, win 1024, options [mss 1460], length 0
13:22:32.818208 IP 192.168.15.129.37168 > 192.168.15.128.49154: Flags [S], seq 2896477616, win 1024, options [mss 1460], length 0
13:22:32.818235 IP 192.168.15.129.37168 > 192.168.15.128.3323: Flags [S], seq 2896477616, win 1024, options [mss 1460], length 0
13:22:32.818273 IP 192.168.15.128.8010 > 192.168.15.129.37168: Flags [R.], seq 0, ack 2896477617, win 0, length 0
13:22:32.818295 IP 192.168.15.128.7937 > 192.168.15.129.37168: Flags [R.], seq 0, ack 2896477617, win 0, length 0
13:22:32.818322 IP 192.168.15.128.x11-5 > 192.168.15.129.37168: Flags [R.], seq 0, ack 2896477617, win 0, length 0
13:22:32.818344 IP 192.168.15.128.8193 > 192.168.15.129.37168: Flags [R.], seq 0, ack 2896477617, win 0, length 0
13:22:32.818365 IP 192.168.15.128.49154 > 192.168.15.129.37168: Flags [R.], seq 0, ack 2896477617, win 0, length 0
13:22:32.818390 IP 192.168.15.128.3323 > 192.168.15.129.37168: Flags [R.], seq 0, ack 2896477617, win 0, length 0
13:22:32.818424 IP 192.168.15.129.37168 > 192.168.15.128.16018: Flags [S], seq 2896477616, win 1024, options [mss 1460], length 0
13:22:32.818484 IP 192.168.15.129.37168 > 192.168.15.128.2007: Flags [S], seq 2896477616, win 1024, options [mss 1460], length 0
13:22:32.818595 IP 192.168.15.128.16018 > 192.168.15.129.37168: Flags [R.], seq 0, ack 2896477617, win 0, length 0
13:22:32.818627 IP 192.168.15.128.2007 > 192.168.15.129.37168: Flags [R.], seq 0, ack 2896477617, win 0, length 0
13:22:32.818665 IP 192.168.15.129.37168 > 192.168.15.128.lotusnote: Flags [S], seq 2896477616, win 1024, options [mss 1460], length 0
13:22:32.818687 IP 192.168.15.129.37168 > 192.168.15.128.kpasswd: Flags [S], seq 2896477616, win 1024, options [mss 1460], length 0
13:22:32.818707 IP 192.168.15.129.37168 > 192.168.15.128.8649: Flags [S], seq 2896477616, win 1024, options [mss 1460], length 0
13:22:32.818727 IP 192.168.15.129.37168 > 192.168.15.128.6100: Flags [S], seq 2896477616, win 1024, options [mss 1460], length 0
13:22:32.818749 IP 192.168.15.129.37168 > 192.168.15.128.imsp: Flags [S], seq 2896477616, win 1024, options [mss 1460], length 0
13:22:32.818836 IP 192.168.15.128.lotusnote > 192.168.15.129.37168: Flags [R.], seq 0, ack 2896477617, win 0, length 0
13:22:32.818863 IP 192.168.15.128.kpasswd > 192.168.15.129.37168: Flags [R.], seq 0, ack 2896477617, win 0, length 0
13:22:32.818899 IP 192.168.15.129.37168 > 192.168.15.128.5414: Flags [S], seq 2896477616, win 1024, options [mss 1460], length 0
13:22:32.818924 IP 192.168.15.129.37168 > 192.168.15.128.3889: Flags [S], seq 2896477616, win 1024, options [mss 1460], length 0
13:22:32.818960 IP 192.168.15.128.8649 > 192.168.15.129.37168: Flags [R.], seq 0, ack 2896477617, win 0, length 0
13:22:32.818983 IP 192.168.15.128.6100 > 192.168.15.129.37168: Flags [R.], seq 0, ack 2896477617, win 0, length 0
13:22:32.819003 IP 192.168.15.128.imsp > 192.168.15.129.37168: Flags [R.], seq 0, ack 2896477617, win 0, length 0
13:22:32.819034 IP 192.168.15.129.37168 > 192.168.15.128.1187: Flags [S], seq 2896477616, win 1024, options [mss 1460], length 0
13:22:32.819109 IP 192.168.15.128.5414 > 192.168.15.129.37168: Flags [R.], seq 0, ack 2896477617, win 0, length 0
13:22:32.819137 IP 192.168.15.128.3889 > 192.168.15.129.37168: Flags [R.], seq 0, ack 2896477617, win 0, length 0
13:22:32.819158 IP 192.168.15.128.1187 > 192.168.15.129.37168: Flags [R.], seq 0, ack 2896477617, win 0, length 0
13:22:32.819206 IP 192.168.15.129.37168 > 192.168.15.128.888: Flags [S], seq 2896477616, win 1024, options [mss 1460], length 0
13:22:32.819285 IP 192.168.15.129.37168 > 192.168.15.128.2068: Flags [S], seq 2896477616, win 1024, options [mss 1460], length 0
13:22:32.819320 IP 192.168.15.129.37168 > 192.168.15.128.8994: Flags [S], seq 2896477616, win 1024, options [mss 1460], length 0
13:22:32.819357 IP 192.168.15.128.888 > 192.168.15.129.37168: Flags [R.], seq 0, ack 2896477617, win 0, length 0
13:22:32.819379 IP 192.168.15.128.2068 > 192.168.15.129.37168: Flags [R.], seq 0, ack 2896477617, win 0, length 0
13:22:32.819418 IP 192.168.15.129.37168 > 192.168.15.128.2869: Flags [S], seq 2896477616, win 1024, options [mss 1460], length 0
13:22:32.819454 IP 192.168.15.128.8994 > 192.168.15.129.37168: Flags [R.], seq 0, ack 2896477617, win 0, length 0
13:22:32.819504 IP 192.168.15.129.37168 > 192.168.15.128.666: Flags [S], seq 2896477616, win 1024, options [mss 1460], length 0
13:22:32.819573 IP 192.168.15.128.2869 > 192.168.15.129.37168: Flags [R.], seq 0, ack 2896477617, win 0, length 0
13:22:32.819607 IP 192.168.15.128.666 > 192.168.15.129.37168: Flags [R.], seq 0, ack 2896477617, win 0, length 0
13:22:32.819690 IP 192.168.15.129.37168 > 192.168.15.128.10004: Flags [S], seq 2896477616, win 1024, options [mss 1460], length 0
13:22:32.819764 IP 192.168.15.129.37168 > 192.168.15.128.x11-4: Flags [S], seq 2896477616, win 1024, options [mss 1460], length 0
13:22:32.819795 IP 192.168.15.129.37168 > 192.168.15.128.311: Flags [S], seq 2896477616, win 1024, options [mss 1460], length 0
13:22:32.819837 IP 192.168.15.128.10004 > 192.168.15.129.37168: Flags [R.], seq 0, ack 2896477617, win 0, length 0
13:22:32.819860 IP 192.168.15.128.x11-4 > 192.168.15.129.37168: Flags [R.], seq 0, ack 2896477617, win 0, length 0
13:22:32.819880 IP 192.168.15.128.311 > 192.168.15.129.37168: Flags [R.], seq 0, ack 2896477617, win 0, length 0
13:22:32.820052 IP 192.168.15.129.37168 > 192.168.15.128.4126: Flags [S], seq 2896477616, win 1024, options [mss 1460], length 0
13:22:32.820112 IP 192.168.15.129.37168 > 192.168.15.128.shell: Flags [S], seq 2896477616, win 1024, options [mss 1460], length 0
13:22:32.820133 IP 192.168.15.129.37168 > 192.168.15.128.8222: Flags [S], seq 2896477616, win 1024, options [mss 1460], length 0
13:22:32.820221 IP 192.168.15.128.4126 > 192.168.15.129.37168: Flags [R.], seq 0, ack 2896477617, win 0, length 0
13:22:32.820285 IP 192.168.15.128.shell > 192.168.15.129.37168: Flags [S.], seq 3618151268, ack 2896477617, win 5840, options [mss 1460], length 0
13:22:32.820313 IP 192.168.15.128.8222 > 192.168.15.129.37168: Flags [R.], seq 0, ack 2896477617, win 0, length 0
13:22:32.820541 IP 192.168.15.129.37168 > 192.168.15.128.shell: Flags [R], seq 2896477617, win 0, length 0
13:22:32.822579 IP 192.168.15.129.37168 > 192.168.15.128.1840: Flags [S], seq 2896477616, win 1024, options [mss 1460], length 0
13:22:32.822617 IP 192.168.15.129.37168 > 192.168.15.128.svrloc: Flags [S], seq 2896477616, win 1024, options [mss 1460], length 0
13:22:32.822636 IP 192.168.15.129.37168 > 192.168.15.128.aol: Flags [S], seq 2896477616, win 1024, options [mss 1460], length 0
13:22:32.822654 IP 192.168.15.129.37168 > 192.168.15.128.1022: Flags [S], seq 2896477616, win 1024, options [mss 1460], length 0
13:22:32.822674 IP 192.168.15.129.37168 > 192.168.15.128.9593: Flags [S], seq 2896477616, win 1024, options [mss 1460], length 0
13:22:32.822693 IP 192.168.15.129.37168 > 192.168.15.128.9071: Flags [S], seq 2896477616, win 1024, options [mss 1460], length 0
13:22:32.822711 IP 192.168.15.129.37168 > 192.168.15.128.4000: Flags [S], seq 2896477616, win 1024, options [mss 1460], length 0
13:22:32.822730 IP 192.168.15.129.37168 > 192.168.15.128.55056: Flags [S], seq 2896477616, win 1024, options [mss 1460], length 0
13:22:32.822750 IP 192.168.15.129.37168 > 192.168.15.128.4343: Flags [S], seq 2896477616, win 1024, options [mss 1460], length 0
13:22:32.822791 IP 192.168.15.129.37168 > 192.168.15.128.49158: Flags [S], seq 2896477616, win 1024, options [mss 1460], length 0
13:22:32.822811 IP 192.168.15.129.37168 > 192.168.15.128.8400: Flags [S], seq 2896477616, win 1024, options [mss 1460], length 0
13:22:32.822850 IP 192.168.15.129.37168 > 192.168.15.128.1079: Flags [S], seq 2896477616, win 1024, options [mss 1460], length 0
13:22:32.822870 IP 192.168.15.129.37168 > 192.168.15.128.1119: Flags [S], seq 2896477616, win 1024, options [mss 1460], length 0
13:22:32.822908 IP 192.168.15.129.37168 > 192.168.15.128.8083: Flags [S], seq 2896477616, win 1024, options [mss 1460], length 0
13:22:32.822927 IP 192.168.15.129.37168 > 192.168.15.128.1148: Flags [S], seq 2896477616, win 1024, options [mss 1460], length 0
13:22:32.822965 IP 192.168.15.129.37168 > 192.168.15.128.34571: Flags [S], seq 2896477616, win 1024, options [mss 1460], length 0
13:22:32.823004 IP 192.168.15.129.37168 > 192.168.15.128.50001: Flags [S], seq 2896477616, win 1024, options [mss 1460], length 0
13:22:32.823024 IP 192.168.15.129.37168 > 192.168.15.128.16080: Flags [S], seq 2896477616, win 1024, options [mss 1460], length 0
13:22:32.823062 IP 192.168.15.129.37168 > 192.168.15.128.2222: Flags [S], seq 2896477616, win 1024, options [mss 1460], length 0
13:22:32.823081 IP 192.168.15.129.37168 > 192.168.15.128.3007: Flags [S], seq 2896477616, win 1024, options [mss 1460], length 0
13:22:32.823122 IP 192.168.15.129.37168 > 192.168.15.128.1082: Flags [S], seq 2896477616, win 1024, options [mss 1460], length 0
13:22:32.823141 IP 192.168.15.129.37168 > 192.168.15.128.10180: Flags [S], seq 2896477616, win 1024, options [mss 1460], length 0
13:22:32.823171 IP 192.168.15.128.1840 > 192.168.15.129.37168: Flags [R.], seq 0, ack 2896477617, win 0, length 0
13:22:32.823227 IP 192.168.15.129.37168 > 192.168.15.128.668: Flags [S], seq 2896477616, win 1024, options [mss 1460], length 0
13:22:32.823248 IP 192.168.15.129.37168 > 192.168.15.128.8008: Flags [S], seq 2896477616, win 1024, options [mss 1460], length 0
13:22:32.823271 IP 192.168.15.129.37168 > 192.168.15.128.6543: Flags [S], seq 2896477616, win 1024, options [mss 1460], length 0
13:22:32.823291 IP 192.168.15.129.37168 > 192.168.15.128.finger: Flags [S], seq 2896477616, win 1024, options [mss 1460], length 0
13:22:32.823330 IP 192.168.15.129.37168 > 192.168.15.128.2160: Flags [S], seq 2896477616, win 1024, options [mss 1460], length 0
13:22:32.823363 IP 192.168.15.129.37168 > 192.168.15.128.1862: Flags [S], seq 2896477616, win 1024, options [mss 1460], length 0
13:22:32.823420 IP 192.168.15.129.37168 > 192.168.15.128.login: Flags [S], seq 2896477616, win 1024, options [mss 1460], length 0
13:22:32.823440 IP 192.168.15.129.37168 > 192.168.15.128.5811: Flags [S], seq 2896477616, win 1024, options [mss 1460], length 0
13:22:32.823477 IP 192.168.15.129.37168 > 192.168.15.128.6: Flags [S], seq 2896477616, win 1024, options [mss 1460], length 0
13:22:32.823497 IP 192.168.15.129.37168 > 192.168.15.128.2179: Flags [S], seq 2896477616, win 1024, options [mss 1460], length 0
13:22:32.823535 IP 192.168.15.129.37168 > 192.168.15.128.15000: Flags [S], seq 2896477616, win 1024, options [mss 1460], length 0
13:22:32.823568 IP 192.168.15.128.svrloc > 192.168.15.129.37168: Flags [R.], seq 0, ack 2896477617, win 0, length 0
13:22:32.823647 IP 192.168.15.129.37168 > 192.168.15.128.541: Flags [S], seq 2896477616, win 1024, options [mss 1460], length 0
13:22:32.823700 IP 192.168.15.129.37168 > 192.168.15.128.snpp: Flags [S], seq 2896477616, win 1024, options [mss 1460], length 0
13:22:32.823751 IP 192.168.15.129.37168 > 192.168.15.128.5906: Flags [S], seq 2896477616, win 1024, options [mss 1460], length 0
13:22:32.823800 IP 192.168.15.129.37168 > 192.168.15.128.1137: Flags [S], seq 2896477616, win 1024, options [mss 1460], length 0
13:22:32.823850 IP 192.168.15.129.37168 > 192.168.15.128.1102: Flags [S], seq 2896477616, win 1024, options [mss 1460], length 0
13:22:32.823899 IP 192.168.15.129.37168 > 192.168.15.128.ircd: Flags [S], seq 2896477616, win 1024, options [mss 1460], length 0
13:22:32.823949 IP 192.168.15.129.37168 > 192.168.15.128.16016: Flags [S], seq 2896477616, win 1024, options [mss 1460], length 0
13:22:32.823998 IP 192.168.15.129.37168 > 192.168.15.128.nntps: Flags [S], seq 2896477616, win 1024, options [mss 1460], length 0
13:22:32.824048 IP 192.168.15.129.37168 > 192.168.15.128.x11-2: Flags [S], seq 2896477616, win 1024, options [mss 1460], length 0
13:22:32.824098 IP 192.168.15.129.37168 > 192.168.15.128.omirr: Flags [S], seq 2896477616, win 1024, options [mss 1460], length 0
13:22:32.824123 IP 192.168.15.129.37168 > 192.168.15.128.9917: Flags [S], seq 2896477616, win 1024, options [mss 1460], length 0
13:22:32.824142 IP 192.168.15.129.37168 > 192.168.15.128.999: Flags [S], seq 2896477616, win 1024, options [mss 1460], length 0
13:22:32.824163 IP 192.168.15.129.37168 > 192.168.15.128.49156: Flags [S], seq 2896477616, win 1024, options [mss 1460], length 0
13:22:32.824182 IP 192.168.15.129.37168 > 192.168.15.128.44443: Flags [S], seq 2896477616, win 1024, options [mss 1460], length 0
13:22:32.824201 IP 192.168.15.129.37168 > 192.168.15.128.16993: Flags [S], seq 2896477616, win 1024, options [mss 1460], length 0
13:22:32.824219 IP 192.168.15.129.37168 > 192.168.15.128.981: Flags [S], seq 2896477616, win 1024, options [mss 1460], length 0
13:22:32.824241 IP 192.168.15.129.37168 > 192.168.15.128.4242: Flags [S], seq 2896477616, win 1024, options [mss 1460], length 0
13:22:32.824286 IP 192.168.15.128.aol > 192.168.15.129.37168: Flags [R.], seq 0, ack 2896477617, win 0, length 0
13:22:32.824317 IP 192.168.15.128.1022 > 192.168.15.129.37168: Flags [R.], seq 0, ack 2896477617, win 0, length 0
13:22:32.824376 IP 192.168.15.128.9593 > 192.168.15.129.37168: Flags [R.], seq 0, ack 2896477617, win 0, length 0
13:22:32.824402 IP 192.168.15.128.9071 > 192.168.15.129.37168: Flags [R.], seq 0, ack 2896477617, win 0, length 0
13:22:32.824479 IP 192.168.15.128.4000 > 192.168.15.129.37168: Flags [R.], seq 0, ack 2896477617, win 0, length 0
13:22:32.824541 IP 192.168.15.128.55056 > 192.168.15.129.37168: Flags [R.], seq 0, ack 2896477617, win 0, length 0
13:22:32.824601 IP 192.168.15.128.4343 > 192.168.15.129.37168: Flags [R.], seq 0, ack 2896477617, win 0, length 0
13:22:32.824658 IP 192.168.15.128.49158 > 192.168.15.129.37168: Flags [R.], seq 0, ack 2896477617, win 0, length 0
13:22:32.824715 IP 192.168.15.128.8400 > 192.168.15.129.37168: Flags [R.], seq 0, ack 2896477617, win 0, length 0
13:22:32.824769 IP 192.168.15.128.1079 > 192.168.15.129.37168: Flags [R.], seq 0, ack 2896477617, win 0, length 0
13:22:32.824804 IP 192.168.15.128.1119 > 192.168.15.129.37168: Flags [R.], seq 0, ack 2896477617, win 0, length 0
13:22:32.824844 IP 192.168.15.128.8083 > 192.168.15.129.37168: Flags [R.], seq 0, ack 2896477617, win 0, length 0
13:22:32.824864 IP 192.168.15.128.1148 > 192.168.15.129.37168: Flags [R.], seq 0, ack 2896477617, win 0, length 0
13:22:32.824883 IP 192.168.15.128.34571 > 192.168.15.129.37168: Flags [R.], seq 0, ack 2896477617, win 0, length 0
13:22:32.824902 IP 192.168.15.128.50001 > 192.168.15.129.37168: Flags [R.], seq 0, ack 2896477617, win 0, length 0
13:22:32.824923 IP 192.168.15.128.16080 > 192.168.15.129.37168: Flags [R.], seq 0, ack 2896477617, win 0, length 0
13:22:32.824945 IP 192.168.15.128.2222 > 192.168.15.129.37168: Flags [R.], seq 0, ack 2896477617, win 0, length 0
13:22:32.824964 IP 192.168.15.128.3007 > 192.168.15.129.37168: Flags [R.], seq 0, ack 2896477617, win 0, length 0
13:22:32.824984 IP 192.168.15.128.1082 > 192.168.15.129.37168: Flags [R.], seq 0, ack 2896477617, win 0, length 0
13:22:32.825005 IP 192.168.15.128.10180 > 192.168.15.129.37168: Flags [R.], seq 0, ack 2896477617, win 0, length 0
13:22:32.825037 IP 192.168.15.128.668 > 192.168.15.129.37168: Flags [R.], seq 0, ack 2896477617, win 0, length 0
13:22:32.825056 IP 192.168.15.128.8008 > 192.168.15.129.37168: Flags [R.], seq 0, ack 2896477617, win 0, length 0
13:22:32.825074 IP 192.168.15.128.6543 > 192.168.15.129.37168: Flags [R.], seq 0, ack 2896477617, win 0, length 0
13:22:32.825091 IP 192.168.15.128.finger > 192.168.15.129.37168: Flags [R.], seq 0, ack 2896477617, win 0, length 0
13:22:32.825109 IP 192.168.15.128.2160 > 192.168.15.129.37168: Flags [R.], seq 0, ack 2896477617, win 0, length 0
13:22:32.825128 IP 192.168.15.128.1862 > 192.168.15.129.37168: Flags [R.], seq 0, ack 2896477617, win 0, length 0
13:22:32.825147 IP 192.168.15.128.login > 192.168.15.129.37168: Flags [S.], seq 3607078891, ack 2896477617, win 5840, options [mss 1460], length 0
13:22:32.825165 IP 192.168.15.128.5811 > 192.168.15.129.37168: Flags [R.], seq 0, ack 2896477617, win 0, length 0
13:22:32.825185 IP 192.168.15.128.6 > 192.168.15.129.37168: Flags [R.], seq 0, ack 2896477617, win 0, length 0
13:22:32.825207 IP 192.168.15.128.2179 > 192.168.15.129.37168: Flags [R.], seq 0, ack 2896477617, win 0, length 0
13:22:32.825226 IP 192.168.15.128.15000 > 192.168.15.129.37168: Flags [R.], seq 0, ack 2896477617, win 0, length 0
13:22:32.825244 IP 192.168.15.128.541 > 192.168.15.129.37168: Flags [R.], seq 0, ack 2896477617, win 0, length 0
13:22:32.825276 IP 192.168.15.128.snpp > 192.168.15.129.37168: Flags [R.], seq 0, ack 2896477617, win 0, length 0
13:22:32.825295 IP 192.168.15.128.5906 > 192.168.15.129.37168: Flags [R.], seq 0, ack 2896477617, win 0, length 0
13:22:32.825312 IP 192.168.15.128.1137 > 192.168.15.129.37168: Flags [R.], seq 0, ack 2896477617, win 0, length 0
13:22:32.825330 IP 192.168.15.128.1102 > 192.168.15.129.37168: Flags [R.], seq 0, ack 2896477617, win 0, length 0
13:22:32.825350 IP 192.168.15.128.ircd > 192.168.15.129.37168: Flags [S.], seq 3619205022, ack 2896477617, win 5840, options [mss 1460], length 0
13:22:32.825369 IP 192.168.15.128.16016 > 192.168.15.129.37168: Flags [R.], seq 0, ack 2896477617, win 0, length 0
13:22:32.825386 IP 192.168.15.128.nntps > 192.168.15.129.37168: Flags [R.], seq 0, ack 2896477617, win 0, length 0
13:22:32.825406 IP 192.168.15.128.x11-2 > 192.168.15.129.37168: Flags [R.], seq 0, ack 2896477617, win 0, length 0
13:22:32.825425 IP 192.168.15.128.omirr > 192.168.15.129.37168: Flags [R.], seq 0, ack 2896477617, win 0, length 0
13:22:32.825442 IP 192.168.15.128.9917 > 192.168.15.129.37168: Flags [R.], seq 0, ack 2896477617, win 0, length 0
13:22:32.825458 IP 192.168.15.128.999 > 192.168.15.129.37168: Flags [R.], seq 0, ack 2896477617, win 0, length 0
13:22:32.825476 IP 192.168.15.128.49156 > 192.168.15.129.37168: Flags [R.], seq 0, ack 2896477617, win 0, length 0
13:22:32.825492 IP 192.168.15.128.44443 > 192.168.15.129.37168: Flags [R.], seq 0, ack 2896477617, win 0, length 0
13:22:32.825509 IP 192.168.15.128.16993 > 192.168.15.129.37168: Flags [R.], seq 0, ack 2896477617, win 0, length 0
13:22:32.825526 IP 192.168.15.128.981 > 192.168.15.129.37168: Flags [R.], seq 0, ack 2896477617, win 0, length 0
13:22:32.825543 IP 192.168.15.128.4242 > 192.168.15.129.37168: Flags [R.], seq 0, ack 2896477617, win 0, length 0
13:22:32.825597 IP 192.168.15.129.37168 > 192.168.15.128.login: Flags [R], seq 2896477617, win 0, length 0
13:22:32.825631 IP 192.168.15.129.37168 > 192.168.15.128.ircd: Flags [R], seq 2896477617, win 0, length 0
13:22:32.826522 IP 192.168.15.129.37168 > 192.168.15.128.ms-sql-m: Flags [S], seq 2896477616, win 1024, options [mss 1460], length 0
13:22:32.826560 IP 192.168.15.129.37168 > 192.168.15.128.9595: Flags [S], seq 2896477616, win 1024, options [mss 1460], length 0
13:22:32.826615 IP 192.168.15.129.37168 > 192.168.15.128.9003: Flags [S], seq 2896477616, win 1024, options [mss 1460], length 0
13:22:32.826659 IP 192.168.15.129.37168 > 192.168.15.128.1533: Flags [S], seq 2896477616, win 1024, options [mss 1460], length 0
13:22:32.826721 IP 192.168.15.129.37168 > 192.168.15.128.2106: Flags [S], seq 2896477616, win 1024, options [mss 1460], length 0
13:22:32.826744 IP 192.168.15.129.37168 > 192.168.15.128.1494: Flags [S], seq 2896477616, win 1024, options [mss 1460], length 0
13:22:32.826782 IP 192.168.15.129.37168 > 192.168.15.128.407: Flags [S], seq 2896477616, win 1024, options [mss 1460], length 0
13:22:32.826844 IP 192.168.15.129.37168 > 192.168.15.128.1183: Flags [S], seq 2896477616, win 1024, options [mss 1460], length 0
13:22:32.826866 IP 192.168.15.129.37168 > 192.168.15.128.sip: Flags [S], seq 2896477616, win 1024, options [mss 1460], length 0
13:22:32.826899 IP 192.168.15.129.37168 > 192.168.15.128.1060: Flags [S], seq 2896477616, win 1024, options [mss 1460], length 0
13:22:32.826975 IP 192.168.15.129.37168 > 192.168.15.128.65129: Flags [S], seq 2896477616, win 1024, options [mss 1460], length 0
13:22:32.826998 IP 192.168.15.129.37168 > 192.168.15.128.afs3-fileserver: Flags [S], seq 2896477616, win 1024, options [mss 1460], length 0
13:22:32.827038 IP 192.168.15.129.37168 > 192.168.15.128.5987: Flags [S], seq 2896477616, win 1024, options [mss 1460], length 0
13:22:32.827079 IP 192.168.15.129.37168 > 192.168.15.128.2170: Flags [S], seq 2896477616, win 1024, options [mss 1460], length 0
13:22:32.827104 IP 192.168.15.129.37168 > 192.168.15.128.1417: Flags [S], seq 2896477616, win 1024, options [mss 1460], length 0
13:22:32.827127 IP 192.168.15.129.37168 > 192.168.15.128.5915: Flags [S], seq 2896477616, win 1024, options [mss 1460], length 0
13:22:32.827149 IP 192.168.15.129.37168 > 192.168.15.128.1053: Flags [S], seq 2896477616, win 1024, options [mss 1460], length 0
13:22:32.827168 IP 192.168.15.129.37168 > 192.168.15.128.7201: Flags [S], seq 2896477616, win 1024, options [mss 1460], length 0
13:22:32.827186 IP 192.168.15.129.37168 > 192.168.15.128.x11-1: Flags [S], seq 2896477616, win 1024, options [mss 1460], length 0
13:22:32.827205 IP 192.168.15.129.37168 > 192.168.15.128.691: Flags [S], seq 2896477616, win 1024, options [mss 1460], length 0
13:22:32.827223 IP 192.168.15.129.37168 > 192.168.15.128.32775: Flags [S], seq 2896477616, win 1024, options [mss 1460], length 0
13:22:32.827242 IP 192.168.15.129.37168 > 192.168.15.128.16113: Flags [S], seq 2896477616, win 1024, options [mss 1460], length 0
13:22:32.827260 IP 192.168.15.129.37168 > 192.168.15.128.kx: Flags [S], seq 2896477616, win 1024, options [mss 1460], length 0
13:22:32.827305 IP 192.168.15.129.37168 > 192.168.15.128.63331: Flags [S], seq 2896477616, win 1024, options [mss 1460], length 0
13:22:32.827483 IP 192.168.15.129.37168 > 192.168.15.128.50800: Flags [S], seq 2896477616, win 1024, options [mss 1460], length 0
13:22:32.827507 IP 192.168.15.129.37168 > 192.168.15.128.1152: Flags [S], seq 2896477616, win 1024, options [mss 1460], length 0
13:22:32.827526 IP 192.168.15.129.37168 > 192.168.15.128.10009: Flags [S], seq 2896477616, win 1024, options [mss 1460], length 0
13:22:32.827547 IP 192.168.15.129.37168 > 192.168.15.128.3801: Flags [S], seq 2896477616, win 1024, options [mss 1460], length 0
13:22:32.827566 IP 192.168.15.129.37168 > 192.168.15.128.1935: Flags [S], seq 2896477616, win 1024, options [mss 1460], length 0
13:22:32.827598 IP 192.168.15.129.37168 > 192.168.15.128.1032: Flags [S], seq 2896477616, win 1024, options [mss 1460], length 0
13:22:32.827632 IP 192.168.15.129.37168 > 192.168.15.128.425: Flags [S], seq 2896477616, win 1024, options [mss 1460], length 0
13:22:32.827651 IP 192.168.15.129.37168 > 192.168.15.128.4443: Flags [S], seq 2896477616, win 1024, options [mss 1460], length 0
13:22:32.827672 IP 192.168.15.129.37168 > 192.168.15.128.2002: Flags [S], seq 2896477616, win 1024, options [mss 1460], length 0
13:22:32.827690 IP 192.168.15.129.37168 > 192.168.15.128.1033: Flags [S], seq 2896477616, win 1024, options [mss 1460], length 0
13:22:32.827709 IP 192.168.15.129.37168 > 192.168.15.128.2099: Flags [S], seq 2896477616, win 1024, options [mss 1460], length 0
13:22:32.827728 IP 192.168.15.129.37168 > 192.168.15.128.xmpp-server: Flags [S], seq 2896477616, win 1024, options [mss 1460], length 0
13:22:32.827747 IP 192.168.15.129.37168 > 192.168.15.128.19842: Flags [S], seq 2896477616, win 1024, options [mss 1460], length 0
13:22:32.827766 IP 192.168.15.129.37168 > 192.168.15.128.49160: Flags [S], seq 2896477616, win 1024, options [mss 1460], length 0
13:22:32.827785 IP 192.168.15.129.37168 > 192.168.15.128.9944: Flags [S], seq 2896477616, win 1024, options [mss 1460], length 0
13:22:32.827803 IP 192.168.15.129.37168 > 192.168.15.128.4900: Flags [S], seq 2896477616, win 1024, options [mss 1460], length 0
13:22:32.827822 IP 192.168.15.129.37168 > 192.168.15.128.1147: Flags [S], seq 2896477616, win 1024, options [mss 1460], length 0
13:22:32.827841 IP 192.168.15.129.37168 > 192.168.15.128.17877: Flags [S], seq 2896477616, win 1024, options [mss 1460], length 0
13:22:32.827860 IP 192.168.15.129.37168 > 192.168.15.128.4004: Flags [S], seq 2896477616, win 1024, options [mss 1460], length 0
13:22:32.827880 IP 192.168.15.129.37168 > 192.168.15.128.1234: Flags [S], seq 2896477616, win 1024, options [mss 1460], length 0
13:22:32.827899 IP 192.168.15.129.37168 > 192.168.15.128.1029: Flags [S], seq 2896477616, win 1024, options [mss 1460], length 0
13:22:32.827918 IP 192.168.15.129.37168 > 192.168.15.128.4449: Flags [S], seq 2896477616, win 1024, options [mss 1460], length 0
13:22:32.827935 IP 192.168.15.129.37168 > 192.168.15.128.ldap: Flags [S], seq 2896477616, win 1024, options [mss 1460], length 0
13:22:32.827952 IP 192.168.15.129.37168 > 192.168.15.128.ldaps: Flags [S], seq 2896477616, win 1024, options [mss 1460], length 0
13:22:32.827973 IP 192.168.15.129.37168 > 192.168.15.128.1050: Flags [S], seq 2896477616, win 1024, options [mss 1460], length 0
13:22:32.827992 IP 192.168.15.129.37168 > 192.168.15.128.1063: Flags [S], seq 2896477616, win 1024, options [mss 1460], length 0
13:22:32.828030 IP 192.168.15.128.ms-sql-m > 192.168.15.129.37168: Flags [R.], seq 0, ack 2896477617, win 0, length 0
13:22:32.828050 IP 192.168.15.128.9595 > 192.168.15.129.37168: Flags [R.], seq 0, ack 2896477617, win 0, length 0
13:22:32.828067 IP 192.168.15.128.9003 > 192.168.15.129.37168: Flags [R.], seq 0, ack 2896477617, win 0, length 0
13:22:32.828101 IP 192.168.15.128.1533 > 192.168.15.129.37168: Flags [R.], seq 0, ack 2896477617, win 0, length 0
13:22:32.828133 IP 192.168.15.128.2106 > 192.168.15.129.37168: Flags [R.], seq 0, ack 2896477617, win 0, length 0
13:22:32.828151 IP 192.168.15.128.1494 > 192.168.15.129.37168: Flags [R.], seq 0, ack 2896477617, win 0, length 0
13:22:32.828182 IP 192.168.15.128.407 > 192.168.15.129.37168: Flags [R.], seq 0, ack 2896477617, win 0, length 0
13:22:32.828199 IP 192.168.15.128.1183 > 192.168.15.129.37168: Flags [R.], seq 0, ack 2896477617, win 0, length 0
13:22:32.828218 IP 192.168.15.128.sip > 192.168.15.129.37168: Flags [R.], seq 0, ack 2896477617, win 0, length 0
13:22:32.828235 IP 192.168.15.128.1060 > 192.168.15.129.37168: Flags [R.], seq 0, ack 2896477617, win 0, length 0
13:22:32.828253 IP 192.168.15.128.65129 > 192.168.15.129.37168: Flags [R.], seq 0, ack 2896477617, win 0, length 0
13:22:32.828284 IP 192.168.15.128.afs3-fileserver > 192.168.15.129.37168: Flags [R.], seq 0, ack 2896477617, win 0, length 0
13:22:32.828314 IP 192.168.15.128.5987 > 192.168.15.129.37168: Flags [R.], seq 0, ack 2896477617, win 0, length 0
13:22:32.828331 IP 192.168.15.128.2170 > 192.168.15.129.37168: Flags [R.], seq 0, ack 2896477617, win 0, length 0
13:22:32.828349 IP 192.168.15.128.1417 > 192.168.15.129.37168: Flags [R.], seq 0, ack 2896477617, win 0, length 0
13:22:32.828368 IP 192.168.15.128.5915 > 192.168.15.129.37168: Flags [R.], seq 0, ack 2896477617, win 0, length 0
13:22:32.828389 IP 192.168.15.128.1053 > 192.168.15.129.37168: Flags [R.], seq 0, ack 2896477617, win 0, length 0
13:22:32.828407 IP 192.168.15.128.7201 > 192.168.15.129.37168: Flags [R.], seq 0, ack 2896477617, win 0, length 0
13:22:32.828428 IP 192.168.15.128.x11-1 > 192.168.15.129.37168: Flags [R.], seq 0, ack 2896477617, win 0, length 0
13:22:32.828446 IP 192.168.15.128.691 > 192.168.15.129.37168: Flags [R.], seq 0, ack 2896477617, win 0, length 0
13:22:32.828463 IP 192.168.15.128.32775 > 192.168.15.129.37168: Flags [R.], seq 0, ack 2896477617, win 0, length 0
13:22:32.828483 IP 192.168.15.128.16113 > 192.168.15.129.37168: Flags [R.], seq 0, ack 2896477617, win 0, length 0
13:22:32.828500 IP 192.168.15.128.kx > 192.168.15.129.37168: Flags [R.], seq 0, ack 2896477617, win 0, length 0
13:22:32.828518 IP 192.168.15.128.63331 > 192.168.15.129.37168: Flags [R.], seq 0, ack 2896477617, win 0, length 0
13:22:32.828534 IP 192.168.15.128.50800 > 192.168.15.129.37168: Flags [R.], seq 0, ack 2896477617, win 0, length 0
13:22:32.828551 IP 192.168.15.128.1152 > 192.168.15.129.37168: Flags [R.], seq 0, ack 2896477617, win 0, length 0
13:22:32.828567 IP 192.168.15.128.10009 > 192.168.15.129.37168: Flags [R.], seq 0, ack 2896477617, win 0, length 0
13:22:32.828605 IP 192.168.15.128.3801 > 192.168.15.129.37168: Flags [R.], seq 0, ack 2896477617, win 0, length 0
13:22:32.828624 IP 192.168.15.128.1935 > 192.168.15.129.37168: Flags [R.], seq 0, ack 2896477617, win 0, length 0
13:22:32.828656 IP 192.168.15.128.1032 > 192.168.15.129.37168: Flags [R.], seq 0, ack 2896477617, win 0, length 0
13:22:32.828674 IP 192.168.15.128.425 > 192.168.15.129.37168: Flags [R.], seq 0, ack 2896477617, win 0, length 0
13:22:32.828709 IP 192.168.15.128.4443 > 192.168.15.129.37168: Flags [R.], seq 0, ack 2896477617, win 0, length 0
