15:38:49.780047 IP 192.168.15.128 > 8.8.8.8: ICMP echo request, id 13086, seq 7482, length 64
15:38:49.819983 IP 8.8.8.8 > 192.168.15.128: ICMP echo reply, id 13086, seq 7482, length 64
15:38:50.789855 IP 192.168.15.128 > 8.8.8.8: ICMP echo request, id 13086, seq 7483, length 64
15:38:50.824984 IP 8.8.8.8 > 192.168.15.128: ICMP echo reply, id 13086, seq 7483, length 64
15:38:51.799892 IP 192.168.15.128 > 8.8.8.8: ICMP echo request, id 13086, seq 7484, length 64
15:38:51.942806 IP 8.8.8.8 > 192.168.15.128: ICMP echo reply, id 13086, seq 7484, length 64
15:38:52.809865 IP 192.168.15.128 > 8.8.8.8: ICMP echo request, id 13086, seq 7485, length 64
15:38:52.845300 IP 8.8.8.8 > 192.168.15.128: ICMP echo reply, id 13086, seq 7485, length 64
15:38:53.828556 IP 192.168.15.128 > 8.8.8.8: ICMP echo request, id 13086, seq 7486, length 64
15:38:53.971490 IP 8.8.8.8 > 192.168.15.128: ICMP echo reply, id 13086, seq 7486, length 64
15:38:54.838499 IP 192.168.15.128 > 8.8.8.8: ICMP echo request, id 13086, seq 7487, length 64
15:38:54.936992 IP 8.8.8.8 > 192.168.15.128: ICMP echo reply, id 13086, seq 7487, length 64
15:38:55.848134 IP 192.168.15.128 > 8.8.8.8: ICMP echo request, id 13086, seq 7488, length 64
15:38:55.879843 IP 8.8.8.8 > 192.168.15.128: ICMP echo reply, id 13086, seq 7488, length 64
15:38:56.858277 IP 192.168.15.128 > 8.8.8.8: ICMP echo request, id 13086, seq 7489, length 64
15:38:56.891936 IP 8.8.8.8 > 192.168.15.128: ICMP echo reply, id 13086, seq 7489, length 64
15:38:57.867251 IP 192.168.15.128 > 8.8.8.8: ICMP echo request, id 13086, seq 7490, length 64
15:38:57.899762 IP 8.8.8.8 > 192.168.15.128: ICMP echo reply, id 13086, seq 7490, length 64
15:38:58.877256 IP 192.168.15.128 > 8.8.8.8: ICMP echo request, id 13086, seq 7491, length 64
15:38:58.908763 IP 8.8.8.8 > 192.168.15.128: ICMP echo reply, id 13086, seq 7491, length 64
15:38:59.887071 IP 192.168.15.128 > 8.8.8.8: ICMP echo request, id 13086, seq 7492, length 64
15:38:59.918912 IP 8.8.8.8 > 192.168.15.128: ICMP echo reply, id 13086, seq 7492, length 64
15:39:00.896291 IP 192.168.15.128 > 8.8.8.8: ICMP echo request, id 13086, seq 7493, length 64
15:39:00.974399 IP 8.8.8.8 > 192.168.15.128: ICMP echo reply, id 13086, seq 7493, length 64
15:39:01.906824 IP 192.168.15.128 > 8.8.8.8: ICMP echo request, id 13086, seq 7494, length 64
15:39:01.942421 IP 8.8.8.8 > 192.168.15.128: ICMP echo reply, id 13086, seq 7494, length 64
15:39:02.915750 IP 192.168.15.128 > 8.8.8.8: ICMP echo request, id 13086, seq 7495, length 64
15:39:03.043670 IP 8.8.8.8 > 192.168.15.128: ICMP echo reply, id 13086, seq 7495, length 64
15:39:03.925490 IP 192.168.15.128 > 8.8.8.8: ICMP echo request, id 13086, seq 7496, length 64
15:39:03.956459 IP 8.8.8.8 > 192.168.15.128: ICMP echo reply, id 13086, seq 7496, length 64
15:39:04.935151 IP 192.168.15.128 > 8.8.8.8: ICMP echo request, id 13086, seq 7497, length 64
15:39:04.968287 IP 8.8.8.8 > 192.168.15.128: ICMP echo reply, id 13086, seq 7497, length 64
15:39:05.955138 IP 192.168.15.128 > 8.8.8.8: ICMP echo request, id 13086, seq 7498, length 64
15:39:05.990481 IP 8.8.8.8 > 192.168.15.128: ICMP echo reply, id 13086, seq 7498, length 64
15:39:06.964969 IP 192.168.15.128 > 8.8.8.8: ICMP echo request, id 13086, seq 7499, length 64
15:39:07.000937 IP 8.8.8.8 > 192.168.15.128: ICMP echo reply, id 13086, seq 7499, length 64
15:39:07.974684 IP 192.168.15.128 > 8.8.8.8: ICMP echo request, id 13086, seq 7500, length 64
15:39:08.006854 IP 8.8.8.8 > 192.168.15.128: ICMP echo reply, id 13086, seq 7500, length 64
15:39:08.994408 IP 192.168.15.128 > 8.8.8.8: ICMP echo request, id 13086, seq 7501, length 64
15:39:09.037520 IP 8.8.8.8 > 192.168.15.128: ICMP echo reply, id 13086, seq 7501, length 64
15:39:09.086274 IP6 fe80::f927:acb3:aacd:2901.63766 > ff02::1:3.hostmon: UDP, length 22
15:39:09.086313 IP 192.168.15.1.63766 > 224.0.0.252.hostmon: UDP, length 22
15:39:09.086638 IP6 fe80::f927:acb3:aacd:2901.54968 > ff02::1:3.hostmon: UDP, length 22
15:39:09.086729 IP 192.168.15.1.54968 > 224.0.0.252.hostmon: UDP, length 22
15:39:09.227856 ARP, Request who-has 192.168.15.2 tell 192.168.15.1, length 46
15:39:09.496250 IP6 fe80::f927:acb3:aacd:2901.63766 > ff02::1:3.hostmon: UDP, length 22
15:39:09.496353 IP 192.168.15.1.63766 > 224.0.0.252.hostmon: UDP, length 22
15:39:09.497383 IP6 fe80::f927:acb3:aacd:2901.54968 > ff02::1:3.hostmon: UDP, length 22
15:39:09.497468 IP 192.168.15.1.54968 > 224.0.0.252.hostmon: UDP, length 22
15:39:10.004047 IP 192.168.15.128 > 8.8.8.8: ICMP echo request, id 13086, seq 7502, length 64
15:39:10.078585 IP 8.8.8.8 > 192.168.15.128: ICMP echo reply, id 13086, seq 7502, length 64
15:39:10.585834 ARP, Request who-has 192.168.15.2 tell 192.168.15.1, length 46
15:39:11.014058 IP 192.168.15.128 > 8.8.8.8: ICMP echo request, id 13086, seq 7503, length 64
15:39:11.045890 IP 8.8.8.8 > 192.168.15.128: ICMP echo reply, id 13086, seq 7503, length 64
15:39:11.227936 ARP, Request who-has 192.168.15.2 tell 192.168.15.1, length 46
15:39:11.586678 IP 192.168.15.130.1026 > 192.168.15.2.domain: 13+ A? www.microsoft.com. (35)
15:39:11.694871 ARP, Request who-has 192.168.15.130 tell 192.168.15.2, length 46
15:39:11.695344 ARP, Reply 192.168.15.130 is-at 00:0c:29:66:2d:38 (oui Unknown), length 46
15:39:11.695649 IP 192.168.15.2.domain > 192.168.15.130.1026: 13 4/0/0 CNAME www.microsoft.com-c-3.edgekey.net., CNAME www.microsoft.com-c-3.edgekey.net.globalredir.akadns.net., CNAME e13678.dspb.akamaiedge.net., A 23.202.232.226 (202)
15:39:11.699990 IP 192.168.15.130.1103 > 23.202.232.226.http: Flags [S], seq 4005826155, win 16384, options [mss 1460,nop,nop,sackOK], length 0
15:39:11.731780 IP 23.202.232.226.http > 192.168.15.130.1103: Flags [S.], seq 1737519963, ack 4005826156, win 64240, options [mss 1460], length 0
15:39:11.732621 IP 192.168.15.130.1103 > 23.202.232.226.http: Flags [.], ack 1, win 17520, length 0
15:39:11.734224 IP 192.168.15.130.1103 > 23.202.232.226.http: Flags [P.], seq 1:241, ack 1, win 17520, length 240
15:39:11.734485 IP 23.202.232.226.http > 192.168.15.130.1103: Flags [.], ack 241, win 64240, length 0
15:39:11.815189 IP 23.202.232.226.http > 192.168.15.130.1103: Flags [P.], seq 1:638, ack 241, win 64240, length 637
15:39:11.819832 IP 192.168.15.130.1026 > 192.168.15.2.domain: 14+ A? home.microsoft.com. (36)
15:39:11.858031 IP 192.168.15.2.domain > 192.168.15.130.1026: 14 4/0/0 CNAME redirection.prod.cms.msn.com., CNAME redirection.prod.cms.msn.com.akadns.net., CNAME legacy-redirection-eastus-prod-hp.cloudapp.net., A 13.82.28.61 (201)
15:39:11.860363 IP 192.168.15.130.1104 > 13.82.28.61.http: Flags [S], seq 4005907939, win 16384, options [mss 1460,nop,nop,sackOK], length 0
15:39:11.901669 IP 13.82.28.61.http > 192.168.15.130.1104: Flags [S.], seq 670590934, ack 4005907940, win 64240, options [mss 1460], length 0
15:39:11.902599 IP 192.168.15.130.1104 > 13.82.28.61.http: Flags [.], ack 1, win 17520, length 0
15:39:11.904799 IP 192.168.15.130.1104 > 13.82.28.61.http: Flags [P.], seq 1:202, ack 1, win 17520, length 201
15:39:11.905416 IP 13.82.28.61.http > 192.168.15.130.1104: Flags [.], ack 202, win 64240, length 0
15:39:11.914950 IP 23.202.232.226.http > 192.168.15.130.1103: Flags [P.], seq 1:638, ack 241, win 64240, length 637
15:39:11.915464 IP 192.168.15.130.1103 > 23.202.232.226.http: Flags [.], ack 638, win 16883, length 0
15:39:11.948641 IP 13.82.28.61.http > 192.168.15.130.1104: Flags [P.], seq 1:460, ack 202, win 64240, length 459
15:39:11.957148 IP 192.168.15.130.1026 > 192.168.15.2.domain: 15+ A? www.msn.com. (29)
15:39:11.992278 IP 192.168.15.2.domain > 192.168.15.130.1026: 15 3/0/0 CNAME www-msn-com.a-0003.a-msedge.net., CNAME a-0003.a-msedge.net., A 204.79.197.203 (123)
15:39:11.994648 IP 192.168.15.130.1105 > 204.79.197.203.http: Flags [S], seq 4005990156, win 16384, options [mss 1460,nop,nop,sackOK], length 0
15:39:12.023362 IP 192.168.15.128 > 8.8.8.8: ICMP echo request, id 13086, seq 7504, length 64
15:39:12.037337 IP 204.79.197.203.http > 192.168.15.130.1105: Flags [S.], seq 503786819, ack 4005990157, win 64240, options [mss 1460], length 0
15:39:12.037735 IP 192.168.15.130.1105 > 204.79.197.203.http: Flags [.], ack 1, win 17520, length 0
15:39:12.038354 IP 192.168.15.130.1105 > 204.79.197.203.http: Flags [P.], seq 1:354, ack 1, win 17520, length 353
15:39:12.038580 IP 204.79.197.203.http > 192.168.15.130.1105: Flags [.], ack 354, win 64240, length 0
15:39:12.048221 IP 13.82.28.61.http > 192.168.15.130.1104: Flags [P.], seq 1:460, ack 202, win 64240, length 459
15:39:12.048423 IP 192.168.15.130.1104 > 13.82.28.61.http: Flags [.], ack 460, win 17061, length 0
15:39:12.057545 IP 8.8.8.8 > 192.168.15.128: ICMP echo reply, id 13086, seq 7504, length 64
15:39:12.227479 ARP, Request who-has 192.168.15.2 tell 192.168.15.1, length 46
15:39:12.700948 IP 204.79.197.203.http > 192.168.15.130.1105: Flags [P.], seq 1:7313, ack 354, win 64240, length 7312
15:39:12.701145 IP 204.79.197.203.http > 192.168.15.130.1105: Flags [P.], seq 7313:8773, ack 354, win 64240, length 1460
15:39:12.701205 IP 204.79.197.203.http > 192.168.15.130.1105: Flags [P.], seq 8773:14045, ack 354, win 64240, length 5272
15:39:12.701924 IP 192.168.15.130.1105 > 204.79.197.203.http: Flags [.], ack 2921, win 17520, length 0
15:39:12.702059 IP 204.79.197.203.http > 192.168.15.130.1105: Flags [P.], seq 14045:15912, ack 354, win 64240, length 1867
15:39:12.702215 IP 192.168.15.130.1105 > 204.79.197.203.http: Flags [.], ack 4381, win 17520, length 0
15:39:12.702406 IP 192.168.15.130.1105 > 204.79.197.203.http: Flags [.], ack 7301, win 17520, length 0
15:39:12.702636 IP 192.168.15.130.1105 > 204.79.197.203.http: Flags [.], ack 8773, win 17520, length 0
15:39:12.702907 IP 192.168.15.130.1105 > 204.79.197.203.http: Flags [.], ack 11693, win 14600, length 0
15:39:12.703066 IP 192.168.15.130.1105 > 204.79.197.203.http: Flags [.], ack 14045, win 12248, length 0
15:39:12.703485 IP 192.168.15.130.1105 > 204.79.197.203.http: Flags [.], ack 15912, win 10381, length 0
15:39:12.704037 IP 192.168.15.130.1105 > 204.79.197.203.http: Flags [.], ack 15912, win 14141, length 0
15:39:12.980486 IP 192.168.15.130.1105 > 204.79.197.203.http: Flags [.], ack 15912, win 17520, length 0
15:39:13.043486 IP 192.168.15.128 > 8.8.8.8: ICMP echo request, id 13086, seq 7505, length 64
15:39:13.076542 IP 8.8.8.8 > 192.168.15.128: ICMP echo reply, id 13086, seq 7505, length 64
15:39:13.152781 IP 192.168.15.130.1026 > 192.168.15.2.domain: 16+ A? static-global-s-msn-com.akamaized.net. (55)
15:39:13.187801 IP 192.168.15.2.domain > 192.168.15.130.1026: 16 3/0/0 CNAME a1999.dscg2.akamai.net., A 23.215.105.9, A 23.215.105.11 (120)
15:39:13.189159 IP 192.168.15.130.1106 > 23.215.105.9.http: Flags [S], seq 4006312769, win 16384, options [mss 1460,nop,nop,sackOK], length 0
15:39:13.221788 IP 23.215.105.9.http > 192.168.15.130.1106: Flags [S.], seq 1888682056, ack 4006312770, win 64240, options [mss 1460], length 0
15:39:13.222255 IP 192.168.15.130.1106 > 23.215.105.9.http: Flags [.], ack 1, win 17520, length 0
15:39:13.222650 IP 192.168.15.130.1106 > 23.215.105.9.http: Flags [P.], seq 1:677, ack 1, win 17520, length 676
15:39:13.222958 IP 23.215.105.9.http > 192.168.15.130.1106: Flags [.], ack 677, win 64240, length 0
15:39:13.258583 IP 23.215.105.9.http > 192.168.15.130.1106: Flags [P.], seq 1:5741, ack 677, win 64240, length 5740
15:39:13.259744 IP 192.168.15.130.1106 > 23.215.105.9.http: Flags [.], ack 2921, win 17520, length 0
15:39:13.259871 IP 192.168.15.130.1106 > 23.215.105.9.http: Flags [.], ack 4381, win 17520, length 0
15:39:13.330768 IP 192.168.15.130.1106 > 23.215.105.9.http: Flags [P.], seq 677:1049, ack 5741, win 16160, length 372
15:39:13.331011 IP 23.215.105.9.http > 192.168.15.130.1106: Flags [.], ack 1049, win 64240, length 0
15:39:13.364424 IP 23.215.105.9.http > 192.168.15.130.1106: Flags [P.], seq 5741:7201, ack 1049, win 64240, length 1460
15:39:13.364588 IP 23.215.105.9.http > 192.168.15.130.1106: Flags [P.], seq 7201:10121, ack 1049, win 64240, length 2920
15:39:13.364698 IP 23.215.105.9.http > 192.168.15.130.1106: Flags [P.], seq 10121:13041, ack 1049, win 64240, length 2920
15:39:13.365003 IP 192.168.15.130.1106 > 23.215.105.9.http: Flags [.], ack 8661, win 17520, length 0
15:39:13.365073 IP 192.168.15.130.1106 > 23.215.105.9.http: Flags [.], ack 11581, win 17520, length 0
15:39:13.366021 IP 23.215.105.9.http > 192.168.15.130.1106: Flags [P.], seq 13041:21801, ack 1049, win 64240, length 8760
15:39:13.366142 IP 23.215.105.9.http > 192.168.15.130.1106: Flags [P.], seq 21801:24721, ack 1049, win 64240, length 2920
15:39:13.366439 IP 192.168.15.130.1106 > 23.215.105.9.http: Flags [.], ack 14501, win 17520, length 0
15:39:13.366550 IP 192.168.15.130.1106 > 23.215.105.9.http: Flags [.], ack 17421, win 17520, length 0
15:39:13.366593 IP 192.168.15.130.1106 > 23.215.105.9.http: Flags [.], ack 20341, win 17520, length 0
15:39:13.366706 IP 192.168.15.130.1106 > 23.215.105.9.http: Flags [.], ack 21801, win 17520, length 0
15:39:13.366832 IP 192.168.15.130.1106 > 23.215.105.9.http: Flags [.], ack 24721, win 14600, length 0
15:39:13.367692 IP 23.215.105.9.http > 192.168.15.130.1106: Flags [P.], seq 24721:37861, ack 1049, win 64240, length 13140
15:39:13.368130 IP 192.168.15.130.1106 > 23.215.105.9.http: Flags [.], ack 27641, win 11680, length 0
15:39:13.368214 IP 192.168.15.130.1106 > 23.215.105.9.http: Flags [.], ack 30561, win 8760, length 0
15:39:13.368245 IP 192.168.15.130.1106 > 23.215.105.9.http: Flags [.], ack 33481, win 5840, length 0
15:39:13.368289 IP 23.215.105.9.http > 192.168.15.130.1106: Flags [P.], seq 37861:39321, ack 1049, win 64240, length 1460
15:39:13.368373 IP 192.168.15.130.1106 > 23.215.105.9.http: Flags [.], ack 36401, win 2920, length 0
15:39:13.368602 IP 192.168.15.130.1106 > 23.215.105.9.http: Flags [.], ack 39321, win 0, length 0
15:39:13.368992 IP 23.215.105.9.http > 192.168.15.130.1106: Flags [.], seq 39321:39322, ack 1049, win 64240, length 1
15:39:13.369354 IP 192.168.15.130.1106 > 23.215.105.9.http: Flags [.], ack 39321, win 0, length 0
15:39:13.405827 IP 192.168.15.130.1106 > 23.215.105.9.http: Flags [.], ack 39321, win 17520, length 0
15:39:13.406249 IP 23.215.105.9.http > 192.168.15.130.1106: Flags [P.], seq 39321:39843, ack 1049, win 64240, length 522
15:39:13.506137 IP 23.215.105.9.http > 192.168.15.130.1106: Flags [P.], seq 39321:39843, ack 1049, win 64240, length 522
15:39:13.507233 IP 192.168.15.130.1106 > 23.215.105.9.http: Flags [.], ack 39843, win 16998, length 0
15:39:13.607251 IP 192.168.15.1.netbios-ns > 192.168.15.255.netbios-ns: NBT UDP PACKET(137): QUERY; REQUEST; BROADCAST
15:39:13.723631 IP 192.168.15.130.1106 > 23.215.105.9.http: Flags [P.], seq 1049:1374, ack 39843, win 16998, length 325
15:39:13.723917 IP 23.215.105.9.http > 192.168.15.130.1106: Flags [.], ack 1374, win 64240, length 0
15:39:13.725755 IP 192.168.15.130.1107 > 23.215.105.9.http: Flags [S], seq 4006491756, win 16384, options [mss 1460,nop,nop,sackOK], length 0
15:39:13.730490 IP 192.168.15.130.1026 > 192.168.15.2.domain: 17+ A? img-s-msn-com.akamaized.net. (45)
15:39:13.756613 IP 23.215.105.9.http > 192.168.15.130.1106: Flags [P.], seq 39843:41423, ack 1374, win 64240, length 1580
15:39:13.758889 IP 192.168.15.130.1106 > 23.215.105.9.http: Flags [.], ack 41423, win 17520, length 0
15:39:13.760679 IP 23.215.105.9.http > 192.168.15.130.1107: Flags [S.], seq 2116620218, ack 4006491757, win 64240, options [mss 1460], length 0
15:39:13.761006 IP 192.168.15.130.1107 > 23.215.105.9.http: Flags [.], ack 1, win 17520, length 0
15:39:13.764208 IP 192.168.15.130.1108 > 192.168.15.2.domain: 18+ A? c.msn.com. (27)
15:39:13.768110 IP 192.168.15.2.domain > 192.168.15.130.1026: 17 3/0/0 CNAME a1834.dspg2.akamai.net., A 23.215.105.18, A 23.215.105.41 (110)
15:39:13.769511 IP 192.168.15.130.kpop > 23.215.105.18.http: Flags [S], seq 4006553990, win 16384, options [mss 1460,nop,nop,sackOK], length 0
15:39:13.770648 IP 192.168.15.130.1026 > 192.168.15.2.domain: 19+ A? sb.scorecardresearch.com. (42)
15:39:13.806518 IP 192.168.15.2.domain > 192.168.15.130.1108: 18 2/0/0 CNAME c.msn.com.nsatc.net., A 131.253.14.192 (76)
15:39:13.807565 IP 192.168.15.130.1110 > 131.253.14.192.http: Flags [S], seq 4006621548, win 16384, options [mss 1460,nop,nop,sackOK], length 0
15:39:13.808425 IP 23.215.105.18.http > 192.168.15.130.kpop: Flags [S.], seq 1121588651, ack 4006553991, win 64240, options [mss 1460], length 0
15:39:13.808741 IP 192.168.15.130.kpop > 23.215.105.18.http: Flags [.], ack 1, win 17520, length 0
15:39:13.809132 IP 192.168.15.130.1108 > 192.168.15.2.domain: 20+ A? otf.msn.com. (29)
15:39:13.816050 IP 192.168.15.2.domain > 192.168.15.130.1026: 19 3/0/0 CNAME sb.scorecardresearch.com.edgekey.net., CNAME e1879.e7.akamaiedge.net., A 72.246.108.224 (142)
15:39:13.816959 IP 192.168.15.130.1111 > 72.246.108.224.https: Flags [S], seq 4006661472, win 16384, options [mss 1460,nop,nop,sackOK], length 0
15:39:13.821075 IP 192.168.15.130.1107 > 23.215.105.9.http: Flags [P.], seq 1:326, ack 1, win 17520, length 325
15:39:13.821452 IP 192.168.15.130.kpop > 23.215.105.18.http: Flags [P.], seq 1:359, ack 1, win 17520, length 358
15:39:13.821488 IP 23.215.105.9.http > 192.168.15.130.1107: Flags [.], ack 326, win 64240, length 0
15:39:13.821607 IP 23.215.105.18.http > 192.168.15.130.kpop: Flags [.], ack 359, win 64240, length 0
15:39:13.821899 IP 192.168.15.130.1106 > 23.215.105.9.http: Flags [P.], seq 1374:1699, ack 41423, win 17520, length 325
15:39:13.822206 IP 23.215.105.9.http > 192.168.15.130.1106: Flags [.], ack 1699, win 64240, length 0
15:39:13.858286 IP 23.215.105.9.http > 192.168.15.130.1106: Flags [P.], seq 41423:42953, ack 1699, win 64240, length 1530
15:39:13.858371 IP 23.215.105.9.http > 192.168.15.130.1107: Flags [P.], seq 1:1664, ack 326, win 64240, length 1663
15:39:13.858396 IP 23.215.105.18.http > 192.168.15.130.kpop: Flags [P.], seq 1:1461, ack 359, win 64240, length 1460
15:39:13.859715 IP 23.215.105.18.http > 192.168.15.130.kpop: Flags [P.], seq 1461:1708, ack 359, win 64240, length 247
15:39:13.859771 IP 72.246.108.224.https > 192.168.15.130.1111: Flags [S.], seq 1764717929, ack 4006661473, win 64240, options [mss 1460], length 0
15:39:13.862009 IP 192.168.15.2.domain > 192.168.15.130.1108: 20 3/0/0 CNAME iceotf-prod-fe-tm.trafficmanager.net., CNAME iceotf-prod-fe-eastus.cloudapp.net., A 40.114.54.223 (140)
15:39:13.870479 IP 192.168.15.130.1106 > 23.215.105.9.http: Flags [.], ack 42953, win 17520, length 0
15:39:13.870531 IP 192.168.15.130.1107 > 23.215.105.9.http: Flags [.], ack 1664, win 17520, length 0
15:39:13.870552 IP 192.168.15.130.kpop > 23.215.105.18.http: Flags [.], ack 1708, win 17520, length 0
15:39:13.870593 IP 192.168.15.130.1111 > 72.246.108.224.https: Flags [.], ack 1, win 17520, length 0
15:39:13.888563 IP 192.168.15.130.1112 > 40.114.54.223.http: Flags [S], seq 4006748265, win 16384, options [mss 1460,nop,nop,sackOK], length 0
15:39:13.913852 IP 131.253.14.192.http > 192.168.15.130.1110: Flags [S.], seq 764966374, ack 4006621549, win 64240, options [mss 1460], length 0
15:39:13.920312 IP 192.168.15.130.1110 > 131.253.14.192.http: Flags [.], ack 1, win 17520, length 0
15:39:13.936377 IP 40.114.54.223.http > 192.168.15.130.1112: Flags [S.], seq 2120645281, ack 4006748266, win 64240, options [mss 1460], length 0
15:39:13.936654 IP 192.168.15.130.1112 > 40.114.54.223.http: Flags [.], ack 1, win 17520, length 0
15:39:14.003082 IP 192.168.15.130.1111 > 72.246.108.224.https: Flags [P.], seq 1:79, ack 1, win 17520, length 78
15:39:14.003367 IP 72.246.108.224.https > 192.168.15.130.1111: Flags [.], ack 79, win 64240, length 0
15:39:14.003846 IP 192.168.15.130.1106 > 23.215.105.9.http: Flags [P.], seq 1699:2090, ack 42953, win 17520, length 391
15:39:14.004049 IP 23.215.105.9.http > 192.168.15.130.1106: Flags [.], ack 2090, win 64240, length 0
15:39:14.004112 IP 192.168.15.130.1110 > 131.253.14.192.http: Flags [P.], seq 1:1118, ack 1, win 17520, length 1117
15:39:14.004277 IP 131.253.14.192.http > 192.168.15.130.1110: Flags [.], ack 1118, win 64240, length 0
15:39:14.004378 IP 192.168.15.130.1112 > 40.114.54.223.http: Flags [P.], seq 1:1312, ack 1, win 17520, length 1311
15:39:14.004498 IP 40.114.54.223.http > 192.168.15.130.1112: Flags [.], ack 1312, win 64240, length 0
15:39:14.004728 IP 192.168.15.130.1107 > 23.215.105.9.http: Flags [P.], seq 326:716, ack 1664, win 17520, length 390
15:39:14.004882 IP 23.215.105.9.http > 192.168.15.130.1107: Flags [.], ack 716, win 64240, length 0
15:39:14.037321 IP 23.215.105.9.http > 192.168.15.130.1106: Flags [P.], seq 42953:44413, ack 2090, win 64240, length 1460
15:39:14.037569 IP 23.215.105.9.http > 192.168.15.130.1106: Flags [P.], seq 44413:45873, ack 2090, win 64240, length 1460
15:39:14.037812 IP 23.215.105.9.http > 192.168.15.130.1106: Flags [P.], seq 45873:47333, ack 2090, win 64240, length 1460
15:39:14.038659 IP 23.215.105.9.http > 192.168.15.130.1106: Flags [P.], seq 47333:48793, ack 2090, win 64240, length 1460
15:39:14.039723 IP 23.215.105.9.http > 192.168.15.130.1106: Flags [P.], seq 48793:54293, ack 2090, win 64240, length 5500
15:39:14.039770 IP 72.246.108.224.https > 192.168.15.130.1111: Flags [P.], seq 1:8, ack 79, win 64240, length 7
15:39:14.040148 IP 72.246.108.224.https > 192.168.15.130.1111: Flags [FP.], seq 8, ack 79, win 64240, length 0
15:39:14.041231 IP 192.168.15.130.1106 > 23.215.105.9.http: Flags [.], ack 45873, win 17520, length 0
15:39:14.041395 IP 192.168.15.130.1106 > 23.215.105.9.http: Flags [.], ack 48793, win 17520, length 0
15:39:14.041421 IP 192.168.15.130.1106 > 23.215.105.9.http: Flags [.], ack 51713, win 17520, length 0
15:39:14.041458 IP 192.168.15.130.1106 > 23.215.105.9.http: Flags [.], ack 53173, win 16060, length 0
15:39:14.041483 IP 192.168.15.130.1111 > 72.246.108.224.https: Flags [.], ack 9, win 17513, length 0
15:39:14.044654 IP 23.215.105.9.http > 192.168.15.130.1107: Flags [P.], seq 1664:3124, ack 716, win 64240, length 1460
15:39:14.044767 IP 23.215.105.9.http > 192.168.15.130.1107: Flags [P.], seq 3124:4584, ack 716, win 64240, length 1460
15:39:14.045062 IP 192.168.15.130.1107 > 23.215.105.9.http: Flags [.], ack 4584, win 17520, length 0
15:39:14.045201 IP 23.215.105.9.http > 192.168.15.130.1107: Flags [P.], seq 4584:8964, ack 716, win 64240, length 4380
15:39:14.045565 IP 192.168.15.130.1107 > 23.215.105.9.http: Flags [.], ack 7504, win 17520, length 0
15:39:14.045679 IP 192.168.15.130.1107 > 23.215.105.9.http: Flags [.], ack 8964, win 17520, length 0
15:39:14.046428 IP 192.168.15.130.1106 > 23.215.105.9.http: Flags [.], ack 54293, win 17520, length 0
15:39:14.048512 IP 23.215.105.9.http > 192.168.15.130.1107: Flags [P.], seq 8964:10520, ack 716, win 64240, length 1556
15:39:14.048800 IP 192.168.15.130.1107 > 23.215.105.9.http: Flags [.], ack 10520, win 17520, length 0
15:39:14.056979 IP 40.114.54.223.http > 192.168.15.130.1112: Flags [P.], seq 1:530, ack 1312, win 64240, length 529
15:39:14.063300 IP 192.168.15.128 > 8.8.8.8: ICMP echo request, id 13086, seq 7506, length 64
15:39:14.068233 IP 192.168.15.130.1111 > 72.246.108.224.https: Flags [F.], seq 79, ack 9, win 17513, length 0
15:39:14.068428 IP 72.246.108.224.https > 192.168.15.130.1111: Flags [.], ack 80, win 64239, length 0
15:39:14.069425 IP 192.168.15.130.1113 > 72.246.108.224.https: Flags [S], seq 4006829371, win 16384, options [mss 1460,nop,nop,sackOK], length 0
15:39:14.089026 IP 192.168.15.130.1106 > 23.215.105.9.http: Flags [P.], seq 2090:2480, ack 54293, win 17520, length 390
15:39:14.089211 IP 23.215.105.9.http > 192.168.15.130.1106: Flags [.], ack 2480, win 64240, length 0
15:39:14.090032 IP 192.168.15.130.1107 > 23.215.105.9.http: Flags [P.], seq 716:1107, ack 10520, win 17520, length 391
15:39:14.090166 IP 23.215.105.9.http > 192.168.15.130.1107: Flags [.], ack 1107, win 64240, length 0
15:39:14.093705 IP 8.8.8.8 > 192.168.15.128: ICMP echo reply, id 13086, seq 7506, length 64
15:39:14.104398 IP 131.253.14.192.http > 192.168.15.130.1110: Flags [P.], seq 1:924, ack 1118, win 64240, length 923
15:39:14.105466 IP 72.246.108.224.https > 192.168.15.130.1113: Flags [S.], seq 533398632, ack 4006829372, win 64240, options [mss 1460], length 0
15:39:14.105831 IP 192.168.15.130.1113 > 72.246.108.224.https: Flags [.], ack 1, win 17520, length 0
15:39:14.111348 IP 192.168.15.130.1113 > 72.246.108.224.https: Flags [P.], seq 1:46, ack 1, win 17520, length 45
15:39:14.111562 IP 72.246.108.224.https > 192.168.15.130.1113: Flags [.], ack 46, win 64240, length 0
15:39:14.119958 IP 23.215.105.9.http > 192.168.15.130.1106: Flags [P.], seq 54293:55753, ack 2480, win 64240, length 1460
15:39:14.120210 IP 23.215.105.9.http > 192.168.15.130.1106: Flags [P.], seq 55753:57213, ack 2480, win 64240, length 1460
15:39:14.120519 IP 23.215.105.9.http > 192.168.15.130.1106: Flags [P.], seq 57213:58673, ack 2480, win 64240, length 1460
15:39:14.120829 IP 192.168.15.130.1106 > 23.215.105.9.http: Flags [.], ack 57213, win 17520, length 0
15:39:14.121586 IP 23.215.105.9.http > 192.168.15.130.1106: Flags [P.], seq 58673:60133, ack 2480, win 64240, length 1460
15:39:14.121750 IP 23.215.105.9.http > 192.168.15.130.1106: Flags [P.], seq 60133:63053, ack 2480, win 64240, length 2920
15:39:14.121924 IP 23.215.105.9.http > 192.168.15.130.1106: Flags [P.], seq 63053:66127, ack 2480, win 64240, length 3074
15:39:14.122564 IP 192.168.15.130.1106 > 23.215.105.9.http: Flags [.], ack 60133, win 17520, length 0
15:39:14.122618 IP 192.168.15.130.1106 > 23.215.105.9.http: Flags [.], ack 63053, win 17520, length 0
15:39:14.122698 IP 192.168.15.130.1106 > 23.215.105.9.http: Flags [.], ack 65973, win 14600, length 0
15:39:14.128525 IP 192.168.15.130.1026 > 192.168.15.2.domain: 21+ A? c.bing.com. (28)
15:39:14.128564 IP 192.168.15.130.1106 > 23.215.105.9.http: Flags [.], ack 66127, win 17520, length 0
15:39:14.128590 IP 23.215.105.9.http > 192.168.15.130.1107: Flags [P.], seq 10520:11980, ack 1107, win 64240, length 1460
15:39:14.128616 IP 23.215.105.9.http > 192.168.15.130.1107: Flags [P.], seq 11980:13440, ack 1107, win 64240, length 1460
15:39:14.128638 IP 23.215.105.9.http > 192.168.15.130.1107: Flags [P.], seq 13440:16360, ack 1107, win 64240, length 2920
15:39:14.128691 IP 23.215.105.9.http > 192.168.15.130.1107: Flags [P.], seq 16360:18948, ack 1107, win 64240, length 2588
15:39:14.136914 IP 192.168.15.130.1107 > 23.215.105.9.http: Flags [.], ack 13440, win 17520, length 0
15:39:14.136991 IP 192.168.15.130.1107 > 23.215.105.9.http: Flags [.], ack 16360, win 17520, length 0
15:39:14.137014 IP 192.168.15.130.1107 > 23.215.105.9.http: Flags [.], ack 18948, win 17520, length 0
15:39:14.147417 IP 72.246.108.224.https > 192.168.15.130.1113: Flags [P.], seq 1:8, ack 46, win 64240, length 7
15:39:14.147756 IP 192.168.15.130.1106 > 23.215.105.9.http: Flags [P.], seq 2480:2872, ack 66127, win 17520, length 392
15:39:14.147949 IP 23.215.105.9.http > 192.168.15.130.1106: Flags [.], ack 2872, win 64240, length 0
15:39:14.151198 IP 72.246.108.224.https > 192.168.15.130.1113: Flags [FP.], seq 8, ack 46, win 64240, length 0
15:39:14.151485 IP 192.168.15.130.1113 > 72.246.108.224.https: Flags [.], ack 9, win 17513, length 0
15:39:14.156534 IP 40.114.54.223.http > 192.168.15.130.1112: Flags [P.], seq 1:530, ack 1312, win 64240, length 529
15:39:14.156761 IP 192.168.15.130.1112 > 40.114.54.223.http: Flags [.], ack 530, win 16991, length 0
15:39:14.163105 IP 192.168.15.2.domain > 192.168.15.130.1026: 21 4/0/0 CNAME c-bing-com.a-0001.a-msedge.net., CNAME a-0001.a-msedge.net., A 13.107.21.200, A 204.79.197.200 (137)
15:39:14.181749 IP 23.215.105.9.http > 192.168.15.130.1106: Flags [P.], seq 66127:67587, ack 2872, win 64240, length 1460
15:39:14.182256 IP 23.215.105.9.http > 192.168.15.130.1106: Flags [P.], seq 67587:69047, ack 2872, win 64240, length 1460
15:39:14.182744 IP 23.215.105.9.http > 192.168.15.130.1106: Flags [P.], seq 69047:71967, ack 2872, win 64240, length 2920
15:39:14.182963 IP 23.215.105.9.http > 192.168.15.130.1106: Flags [P.], seq 71967:75028, ack 2872, win 64240, length 3061
15:39:14.193225 IP 192.168.15.130.1106 > 23.215.105.9.http: Flags [.], ack 69047, win 17520, length 0
15:39:14.193349 IP 192.168.15.130.1106 > 23.215.105.9.http: Flags [.], ack 71967, win 17520, length 0
15:39:14.193481 IP 192.168.15.130.1106 > 23.215.105.9.http: Flags [.], ack 74887, win 17520, length 0
15:39:14.209294 IP 192.168.15.130.1114 > 13.107.21.200.http: Flags [S], seq 4006891617, win 16384, options [mss 1460,nop,nop,sackOK], length 0
15:39:14.209343 IP 131.253.14.192.http > 192.168.15.130.1110: Flags [P.], seq 1:924, ack 1118, win 64240, length 923
15:39:14.224541 IP 192.168.15.130.1110 > 131.253.14.192.http: Flags [.], ack 924, win 16597, length 0
15:39:14.226315 IP 192.168.15.130.1113 > 72.246.108.224.https: Flags [F.], seq 46, ack 9, win 17513, length 0
15:39:14.226529 IP 72.246.108.224.https > 192.168.15.130.1113: Flags [.], ack 47, win 64239, length 0
15:39:14.227278 IP 192.168.15.130.1107 > 23.215.105.9.http: Flags [P.], seq 1107:1498, ack 18948, win 17520, length 391
15:39:14.227429 IP 23.215.105.9.http > 192.168.15.130.1107: Flags [.], ack 1498, win 64240, length 0
15:39:14.244951 IP 13.107.21.200.http > 192.168.15.130.1114: Flags [S.], seq 892679703, ack 4006891618, win 64240, options [mss 1460], length 0
15:39:14.245834 IP 192.168.15.130.1114 > 13.107.21.200.http: Flags [.], ack 1, win 17520, length 0
15:39:14.262585 IP 23.215.105.9.http > 192.168.15.130.1107: Flags [P.], seq 18948:20408, ack 1498, win 64240, length 1460
15:39:14.262644 IP 23.215.105.9.http > 192.168.15.130.1107: Flags [P.], seq 20408:26248, ack 1498, win 64240, length 5840
15:39:14.262688 IP 23.215.105.9.http > 192.168.15.130.1107: Flags [P.], seq 26248:27688, ack 1498, win 64240, length 1440
15:39:14.269180 IP 192.168.15.130.1107 > 23.215.105.9.http: Flags [.], ack 21868, win 17520, length 0
15:39:14.269241 IP 192.168.15.130.1107 > 23.215.105.9.http: Flags [.], ack 24788, win 17520, length 0
15:39:14.269293 IP 192.168.15.130.1107 > 23.215.105.9.http: Flags [.], ack 27688, win 17520, length 0
15:39:14.279482 IP 192.168.15.130.1106 > 23.215.105.9.http: Flags [P.], seq 2872:3262, ack 75028, win 17379, length 390
15:39:14.279833 IP 192.168.15.130.1114 > 13.107.21.200.http: Flags [P.], seq 1:933, ack 1, win 17520, length 932
15:39:14.279964 IP 23.215.105.9.http > 192.168.15.130.1106: Flags [.], ack 3262, win 64240, length 0
15:39:14.280016 IP 13.107.21.200.http > 192.168.15.130.1114: Flags [.], ack 933, win 64240, length 0
15:39:14.292448 IP 192.168.15.130.1107 > 23.215.105.9.http: Flags [P.], seq 1498:1889, ack 27688, win 17520, length 391
15:39:14.292686 IP 23.215.105.9.http > 192.168.15.130.1107: Flags [.], ack 1889, win 64240, length 0
15:39:14.314457 IP 23.215.105.9.http > 192.168.15.130.1106: Flags [P.], seq 75028:76488, ack 3262, win 64240, length 1460
15:39:14.314758 IP 23.215.105.9.http > 192.168.15.130.1106: Flags [P.], seq 76488:79408, ack 3262, win 64240, length 2920
15:39:14.314927 IP 23.215.105.9.http > 192.168.15.130.1106: Flags [P.], seq 79408:82328, ack 3262, win 64240, length 2920
15:39:14.314966 IP 23.215.105.9.http > 192.168.15.130.1106: Flags [P.], seq 82328:83788, ack 3262, win 64240, length 1460
15:39:14.315028 IP 192.168.15.130.1106 > 23.215.105.9.http: Flags [.], ack 77948, win 17520, length 0
15:39:14.315258 IP 192.168.15.130.1106 > 23.215.105.9.http: Flags [.], ack 80868, win 17520, length 0
15:39:14.315306 IP 192.168.15.130.1106 > 23.215.105.9.http: Flags [.], ack 83788, win 17520, length 0
15:39:14.315867 IP 23.215.105.9.http > 192.168.15.130.1106: Flags [P.], seq 83788:88168, ack 3262, win 64240, length 4380
15:39:14.316123 IP 23.215.105.9.http > 192.168.15.130.1106: Flags [P.], seq 88168:92548, ack 3262, win 64240, length 4380
15:39:14.316522 IP 192.168.15.130.1106 > 23.215.105.9.http: Flags [.], ack 86708, win 17520, length 0
15:39:14.316593 IP 192.168.15.130.1106 > 23.215.105.9.http: Flags [.], ack 88168, win 16060, length 0
15:39:14.316627 IP 192.168.15.130.1106 > 23.215.105.9.http: Flags [.], ack 91088, win 13140, length 0
15:39:14.316989 IP 23.215.105.9.http > 192.168.15.130.1106: Flags [P.], seq 92548:94008, ack 3262, win 64240, length 1460
15:39:14.317539 IP 192.168.15.130.1106 > 23.215.105.9.http: Flags [.], ack 94008, win 10220, length 0
15:39:14.317759 IP 23.215.105.9.http > 192.168.15.130.1106: Flags [P.], seq 94008:95468, ack 3262, win 64240, length 1460
15:39:14.317805 IP 23.215.105.9.http > 192.168.15.130.1106: Flags [P.], seq 95468:98388, ack 3262, win 64240, length 2920
15:39:14.317839 IP 23.215.105.9.http > 192.168.15.130.1106: Flags [P.], seq 98388:99848, ack 3262, win 64240, length 1460
15:39:14.318188 IP 192.168.15.130.1106 > 23.215.105.9.http: Flags [.], ack 96928, win 7300, length 0
15:39:14.318233 IP 192.168.15.130.1106 > 23.215.105.9.http: Flags [.], ack 99848, win 4380, length 0
15:39:14.318722 IP 23.215.105.9.http > 192.168.15.130.1106: Flags [P.], seq 99848:101308, ack 3262, win 64240, length 1460
15:39:14.318881 IP 23.215.105.9.http > 192.168.15.130.1106: Flags [P.], seq 101308:102768, ack 3262, win 64240, length 1460
15:39:14.318905 IP 23.215.105.9.http > 192.168.15.130.1106: Flags [P.], seq 102768:104228, ack 3262, win 64240, length 1460
15:39:14.319070 IP 192.168.15.130.1106 > 23.215.105.9.http: Flags [.], ack 102768, win 1460, length 0
15:39:14.320083 IP 192.168.15.130.1106 > 23.215.105.9.http: Flags [.], ack 104228, win 17520, length 0
15:39:14.320413 IP 23.215.105.9.http > 192.168.15.130.1106: Flags [P.], seq 104228:105688, ack 3262, win 64240, length 1460
15:39:14.320541 IP 23.215.105.9.http > 192.168.15.130.1106: Flags [P.], seq 105688:107148, ack 3262, win 64240, length 1460
15:39:14.320624 IP 13.107.21.200.http > 192.168.15.130.1114: Flags [P.], seq 1:1370, ack 933, win 64240, length 1369
15:39:14.320768 IP 23.215.105.9.http > 192.168.15.130.1106: Flags [P.], seq 107148:114448, ack 3262, win 64240, length 7300
15:39:14.320921 IP 192.168.15.130.1106 > 23.215.105.9.http: Flags [.], ack 107148, win 14600, length 0
15:39:14.321146 IP 192.168.15.130.1106 > 23.215.105.9.http: Flags [.], ack 110068, win 11680, length 0
15:39:14.321257 IP 192.168.15.130.1106 > 23.215.105.9.http: Flags [.], ack 112988, win 8760, length 0
15:39:14.321959 IP 23.215.105.9.http > 192.168.15.130.1106: Flags [P.], seq 114448:115908, ack 3262, win 64240, length 1460
15:39:14.322220 IP 192.168.15.130.1106 > 23.215.105.9.http: Flags [.], ack 115908, win 5840, length 0
15:39:14.322262 IP 23.215.105.9.http > 192.168.15.130.1106: Flags [P.], seq 115908:118828, ack 3262, win 64240, length 2920
15:39:14.322585 IP 192.168.15.130.1106 > 23.215.105.9.http: Flags [.], ack 118828, win 2920, length 0
15:39:14.322711 IP 23.215.105.9.http > 192.168.15.130.1106: Flags [P.], seq 118828:120288, ack 3262, win 64240, length 1460
15:39:14.323296 IP 23.215.105.9.http > 192.168.15.130.1106: Flags [P.], seq 120288:121748, ack 3262, win 64240, length 1460
15:39:14.367535 IP 23.215.105.9.http > 192.168.15.130.1107: Flags [P.], seq 27688:32068, ack 1889, win 64240, length 4380
15:39:14.367588 IP 23.215.105.9.http > 192.168.15.130.1107: Flags [P.], seq 32068:33528, ack 1889, win 64240, length 1460
15:39:14.367613 IP 23.215.105.9.http > 192.168.15.130.1107: Flags [P.], seq 33528:34961, ack 1889, win 64240, length 1433
15:39:14.367635 IP 192.168.15.1.netbios-ns > 192.168.15.255.netbios-ns: NBT UDP PACKET(137): QUERY; REQUEST; BROADCAST
15:39:14.367736 IP 192.168.15.130.1106 > 23.215.105.9.http: Flags [.], ack 121748, win 0, length 0
15:39:14.367775 IP 192.168.15.130.1106 > 23.215.105.9.http: Flags [.], ack 121748, win 17520, length 0
15:39:14.368014 IP 192.168.15.128.netbios-dgm > 192.168.15.255.netbios-dgm: NBT UDP PACKET(138)
15:39:14.368075 IP 192.168.15.128.netbios-dgm > 192.168.15.255.netbios-dgm: NBT UDP PACKET(138)
15:39:14.368128 IP 23.215.105.9.http > 192.168.15.130.1106: Flags [P.], seq 121748:139268, ack 3262, win 64240, length 17520
15:39:14.383439 IP 192.168.15.130.1107 > 23.215.105.9.http: Flags [.], ack 30608, win 17520, length 0
15:39:14.383499 IP 192.168.15.130.1107 > 23.215.105.9.http: Flags [.], ack 32068, win 17520, length 0
15:39:14.383588 IP 192.168.15.130.1107 > 23.215.105.9.http: Flags [.], ack 34961, win 17520, length 0
15:39:14.383614 IP 192.168.15.130.1106 > 23.215.105.9.http: Flags [.], ack 124668, win 17520, length 0
15:39:14.383763 IP 192.168.15.130.1106 > 23.215.105.9.http: Flags [.], ack 126128, win 16060, length 0
15:39:14.383860 IP 23.215.105.9.http > 192.168.15.130.1106: Flags [P.], seq 139268:142188, ack 3262, win 64240, length 2920
15:39:14.389728 IP 192.168.15.130.1106 > 23.215.105.9.http: Flags [.], ack 129048, win 13140, length 0
15:39:14.389760 IP 192.168.15.130.1106 > 23.215.105.9.http: Flags [.], ack 131968, win 10220, length 0
15:39:14.389796 IP 192.168.15.130.1106 > 23.215.105.9.http: Flags [.], ack 134888, win 7300, length 0
15:39:14.389814 IP 192.168.15.130.1106 > 23.215.105.9.http: Flags [.], ack 137808, win 4380, length 0
15:39:14.389865 IP 192.168.15.130.1106 > 23.215.105.9.http: Flags [.], ack 140728, win 1460, length 0
15:39:14.389884 IP 192.168.15.130.1106 > 23.215.105.9.http: Flags [.], ack 142188, win 17520, length 0
15:39:14.390246 IP 23.215.105.9.http > 192.168.15.130.1106: Flags [P.], seq 142188:159708, ack 3262, win 64240, length 17520
15:39:14.390588 IP 192.168.15.130.1106 > 23.215.105.9.http: Flags [.], ack 145108, win 17520, length 0
15:39:14.390683 IP 192.168.15.130.1106 > 23.215.105.9.http: Flags [.], ack 146568, win 17520, length 0
15:39:14.390702 IP 192.168.15.130.1106 > 23.215.105.9.http: Flags [.], ack 149488, win 17520, length 0
15:39:14.390840 IP 192.168.15.130.1106 > 23.215.105.9.http: Flags [.], ack 150948, win 17520, length 0
15:39:14.390881 IP 192.168.15.130.1106 > 23.215.105.9.http: Flags [.], ack 153868, win 14600, length 0
15:39:14.390927 IP 23.215.105.9.http > 192.168.15.130.1106: Flags [P.], seq 159708:162628, ack 3262, win 64240, length 2920
15:39:14.390958 IP 23.215.105.9.http > 192.168.15.130.1106: Flags [P.], seq 162628:167008, ack 3262, win 64240, length 4380
15:39:14.391000 IP 23.215.105.9.http > 192.168.15.130.1106: Flags [P.], seq 167008:168468, ack 3262, win 64240, length 1460
15:39:14.391038 IP 192.168.15.130.1106 > 23.215.105.9.http: Flags [.], ack 156788, win 11680, length 0
15:39:14.391078 IP 192.168.15.130.1106 > 23.215.105.9.http: Flags [.], ack 159708, win 8760, length 0
15:39:14.391293 IP 192.168.15.130.1106 > 23.215.105.9.http: Flags [.], ack 162628, win 5840, length 0
15:39:14.391386 IP 192.168.15.130.1106 > 23.215.105.9.http: Flags [.], ack 165548, win 2920, length 0
15:39:14.391407 IP 192.168.15.130.1106 > 23.215.105.9.http: Flags [.], ack 168468, win 0, length 0
15:39:14.391661 IP 23.215.105.9.http > 192.168.15.130.1106: Flags [.], seq 168468:168469, ack 3262, win 64240, length 1
15:39:14.392008 IP 192.168.15.130.1106 > 23.215.105.9.http: Flags [.], ack 168468, win 0, length 0
15:39:14.420499 IP 13.107.21.200.http > 192.168.15.130.1114: Flags [P.], seq 1:1370, ack 933, win 64240, length 1369
15:39:14.439869 IP 192.168.15.130.1114 > 13.107.21.200.http: Flags [.], ack 1370, win 16151, length 0
15:39:14.513948 IP 192.168.15.130.1106 > 23.215.105.9.http: Flags [.], ack 168468, win 17520, length 0
15:39:14.514345 IP 23.215.105.9.http > 192.168.15.130.1106: Flags [P.], seq 168468:185988, ack 3262, win 64240, length 17520
15:39:14.514648 IP 192.168.15.130.1106 > 23.215.105.9.http: Flags [.], ack 171388, win 14600, length 0
15:39:14.514729 IP 192.168.15.130.1106 > 23.215.105.9.http: Flags [.], ack 174308, win 11680, length 0
15:39:14.514764 IP 192.168.15.130.1106 > 23.215.105.9.http: Flags [.], ack 177228, win 8760, length 0
15:39:14.514816 IP 192.168.15.130.1106 > 23.215.105.9.http: Flags [.], ack 180148, win 5840, length 0
15:39:14.514887 IP 192.168.15.130.1106 > 23.215.105.9.http: Flags [.], ack 183068, win 2920, length 0
15:39:14.514936 IP 192.168.15.130.1106 > 23.215.105.9.http: Flags [.], ack 185988, win 0, length 0
