13:56:55.648881 IP 192.168.15.128 > 8.8.8.8: ICMP echo request, id 13086, seq 1597, length 64
13:56:55.731572 IP 8.8.8.8 > 192.168.15.128: ICMP echo reply, id 13086, seq 1597, length 64
13:56:56.658223 IP 192.168.15.128 > 8.8.8.8: ICMP echo request, id 13086, seq 1598, length 64
13:56:56.811808 IP 8.8.8.8 > 192.168.15.128: ICMP echo reply, id 13086, seq 1598, length 64
13:56:57.667706 IP 192.168.15.128 > 8.8.8.8: ICMP echo request, id 13086, seq 1599, length 64
13:56:57.939268 IP 8.8.8.8 > 192.168.15.128: ICMP echo reply, id 13086, seq 1599, length 64
13:56:58.677487 IP 192.168.15.128 > 8.8.8.8: ICMP echo request, id 13086, seq 1600, length 64
13:56:58.907756 IP 8.8.8.8 > 192.168.15.128: ICMP echo reply, id 13086, seq 1600, length 64
13:56:59.686995 IP 192.168.15.128 > 8.8.8.8: ICMP echo request, id 13086, seq 1601, length 64
13:56:59.786606 IP 8.8.8.8 > 192.168.15.128: ICMP echo reply, id 13086, seq 1601, length 64
13:57:00.696416 IP 192.168.15.128 > 8.8.8.8: ICMP echo request, id 13086, seq 1602, length 64
13:57:00.738961 IP 8.8.8.8 > 192.168.15.128: ICMP echo reply, id 13086, seq 1602, length 64
13:57:01.706718 IP 192.168.15.128 > 8.8.8.8: ICMP echo request, id 13086, seq 1603, length 64
13:57:01.857094 IP 8.8.8.8 > 192.168.15.128: ICMP echo reply, id 13086, seq 1603, length 64
13:57:02.251791 IP 192.168.15.130.netbios-ns > 192.168.15.2.netbios-ns: NBT UDP PACKET(137): REFRESH(8); REQUEST; UNICAST
13:57:02.716424 IP 192.168.15.128 > 8.8.8.8: ICMP echo request, id 13086, seq 1604, length 64
13:57:02.808966 IP 8.8.8.8 > 192.168.15.128: ICMP echo reply, id 13086, seq 1604, length 64
13:57:03.725657 IP 192.168.15.128 > 8.8.8.8: ICMP echo request, id 13086, seq 1605, length 64
13:57:03.752074 IP 192.168.15.130.netbios-ns > 192.168.15.2.netbios-ns: NBT UDP PACKET(137): REFRESH(8); REQUEST; UNICAST
13:57:03.809046 IP 8.8.8.8 > 192.168.15.128: ICMP echo reply, id 13086, seq 1605, length 64
13:57:04.735403 IP 192.168.15.128 > 8.8.8.8: ICMP echo request, id 13086, seq 1606, length 64
13:57:04.784950 IP 8.8.8.8 > 192.168.15.128: ICMP echo reply, id 13086, seq 1606, length 64
13:57:05.252208 IP 192.168.15.130.netbios-ns > 192.168.15.2.netbios-ns: NBT UDP PACKET(137): REFRESH(8); REQUEST; UNICAST
13:57:05.745012 IP 192.168.15.128 > 8.8.8.8: ICMP echo request, id 13086, seq 1607, length 64
13:57:05.916001 IP 8.8.8.8 > 192.168.15.128: ICMP echo reply, id 13086, seq 1607, length 64
13:57:06.210332 ARP, Request who-has 192.168.15.130 (Broadcast) tell 192.168.15.129, length 46
13:57:06.210800 ARP, Reply 192.168.15.130 is-at 00:0c:29:66:2d:38 (oui Unknown), length 46
13:57:06.411450 IP 192.168.15.129.39610 > 192.168.15.2.domain: 52926+ PTR? 130.15.168.192.in-addr.arpa. (45)
13:57:06.415896 IP 192.168.15.2.domain > 192.168.15.129.39610: 52926 NXDomain 0/0/0 (45)
13:57:06.416662 ARP, Request who-has 192.168.15.130 tell 192.168.15.129, length 46
13:57:06.416977 ARP, Reply 192.168.15.130 is-at 00:0c:29:66:2d:38 (oui Unknown), length 46
13:57:06.417246 IP 192.168.15.129.64613 > 192.168.15.130.1720: Flags [S], seq 425237050, win 1024, options [mss 1460], length 0
13:57:06.417257 IP 192.168.15.129.64613 > 192.168.15.130.8888: Flags [S], seq 425237050, win 1024, options [mss 1460], length 0
13:57:06.417259 IP 192.168.15.129.64613 > 192.168.15.130.auth: Flags [S], seq 425237050, win 1024, options [mss 1460], length 0
13:57:06.417261 IP 192.168.15.129.64613 > 192.168.15.130.1723: Flags [S], seq 425237050, win 1024, options [mss 1460], length 0
13:57:06.417262 IP 192.168.15.129.64613 > 192.168.15.130.ftp: Flags [S], seq 425237050, win 1024, options [mss 1460], length 0
13:57:06.417264 IP 192.168.15.129.64613 > 192.168.15.130.http-alt: Flags [S], seq 425237050, win 1024, options [mss 1460], length 0
13:57:06.417266 IP 192.168.15.129.64613 > 192.168.15.130.ssh: Flags [S], seq 425237050, win 1024, options [mss 1460], length 0
13:57:06.417354 IP 192.168.15.129.64613 > 192.168.15.130.rtsp: Flags [S], seq 425237050, win 1024, options [mss 1460], length 0
13:57:06.417358 IP 192.168.15.129.64613 > 192.168.15.130.http: Flags [S], seq 425237050, win 1024, options [mss 1460], length 0
13:57:06.417360 IP 192.168.15.129.64613 > 192.168.15.130.smux: Flags [S], seq 425237050, win 1024, options [mss 1460], length 0
13:57:06.417666 IP 192.168.15.130.1720 > 192.168.15.129.64613: Flags [R.], seq 0, ack 425237051, win 0, length 0
13:57:06.417765 IP 192.168.15.130.8888 > 192.168.15.129.64613: Flags [R.], seq 0, ack 425237051, win 0, length 0
13:57:06.417771 IP 192.168.15.130.auth > 192.168.15.129.64613: Flags [R.], seq 0, ack 425237051, win 0, length 0
13:57:06.417840 IP 192.168.15.130.1723 > 192.168.15.129.64613: Flags [R.], seq 0, ack 425237051, win 0, length 0
13:57:06.417974 IP 192.168.15.130.ftp > 192.168.15.129.64613: Flags [R.], seq 0, ack 425237051, win 0, length 0
13:57:06.418042 IP 192.168.15.130.http-alt > 192.168.15.129.64613: Flags [R.], seq 0, ack 425237051, win 0, length 0
13:57:06.418083 IP 192.168.15.130.ssh > 192.168.15.129.64613: Flags [R.], seq 0, ack 425237051, win 0, length 0
13:57:06.418135 IP 192.168.15.130.rtsp > 192.168.15.129.64613: Flags [R.], seq 0, ack 425237051, win 0, length 0
13:57:06.418254 IP 192.168.15.130.http > 192.168.15.129.64613: Flags [R.], seq 0, ack 425237051, win 0, length 0
13:57:06.418360 IP 192.168.15.130.smux > 192.168.15.129.64613: Flags [R.], seq 0, ack 425237051, win 0, length 0
13:57:06.754985 IP 192.168.15.128 > 8.8.8.8: ICMP echo request, id 13086, seq 1608, length 64
13:57:06.886993 IP 8.8.8.8 > 192.168.15.128: ICMP echo reply, id 13086, seq 1608, length 64
13:57:07.518972 IP 192.168.15.129.64614 > 192.168.15.130.smux: Flags [S], seq 425302587, win 1024, options [mss 1460], length 0
13:57:07.519037 IP 192.168.15.129.64614 > 192.168.15.130.http: Flags [S], seq 425302587, win 1024, options [mss 1460], length 0
13:57:07.519065 IP 192.168.15.129.64614 > 192.168.15.130.rtsp: Flags [S], seq 425302587, win 1024, options [mss 1460], length 0
13:57:07.519093 IP 192.168.15.129.64614 > 192.168.15.130.ssh: Flags [S], seq 425302587, win 1024, options [mss 1460], length 0
13:57:07.519325 IP 192.168.15.130.smux > 192.168.15.129.64614: Flags [R.], seq 0, ack 425302588, win 0, length 0
13:57:07.519374 IP 192.168.15.130.http > 192.168.15.129.64614: Flags [R.], seq 0, ack 425302588, win 0, length 0
13:57:07.519417 IP 192.168.15.129.64614 > 192.168.15.130.http-alt: Flags [S], seq 425302587, win 1024, options [mss 1460], length 0
13:57:07.519451 IP 192.168.15.129.64614 > 192.168.15.130.ftp: Flags [S], seq 425302587, win 1024, options [mss 1460], length 0
13:57:07.519492 IP 192.168.15.130.rtsp > 192.168.15.129.64614: Flags [R.], seq 0, ack 425302588, win 0, length 0
13:57:07.519521 IP 192.168.15.130.ssh > 192.168.15.129.64614: Flags [R.], seq 0, ack 425302588, win 0, length 0
13:57:07.519785 IP 192.168.15.130.http-alt > 192.168.15.129.64614: Flags [R.], seq 0, ack 425302588, win 0, length 0
13:57:07.519840 IP 192.168.15.130.ftp > 192.168.15.129.64614: Flags [R.], seq 0, ack 425302588, win 0, length 0
13:57:07.519888 IP 192.168.15.129.64614 > 192.168.15.130.1723: Flags [S], seq 425302587, win 1024, options [mss 1460], length 0
13:57:07.519916 IP 192.168.15.129.64614 > 192.168.15.130.auth: Flags [S], seq 425302587, win 1024, options [mss 1460], length 0
13:57:07.519941 IP 192.168.15.129.64614 > 192.168.15.130.8888: Flags [S], seq 425302587, win 1024, options [mss 1460], length 0
13:57:07.519965 IP 192.168.15.129.64613 > 192.168.15.130.telnet: Flags [S], seq 425237050, win 1024, options [mss 1460], length 0
13:57:07.519999 IP 192.168.15.129.64613 > 192.168.15.130.imaps: Flags [S], seq 425237050, win 1024, options [mss 1460], length 0
13:57:07.520023 IP 192.168.15.129.64613 > 192.168.15.130.imap2: Flags [S], seq 425237050, win 1024, options [mss 1460], length 0
13:57:07.520049 IP 192.168.15.129.64613 > 192.168.15.130.netbios-ssn: Flags [S], seq 425237050, win 1024, options [mss 1460], length 0
13:57:07.520156 IP 192.168.15.130.1723 > 192.168.15.129.64614: Flags [R.], seq 0, ack 425302588, win 0, length 0
13:57:07.520195 IP 192.168.15.129.64613 > 192.168.15.130.3389: Flags [S], seq 425237050, win 1024, options [mss 1460], length 0
13:57:07.520239 IP 192.168.15.129.64613 > 192.168.15.130.submission: Flags [S], seq 425237050, win 1024, options [mss 1460], length 0
13:57:07.520290 IP 192.168.15.130.auth > 192.168.15.129.64614: Flags [R.], seq 0, ack 425302588, win 0, length 0
13:57:07.520321 IP 192.168.15.130.8888 > 192.168.15.129.64614: Flags [R.], seq 0, ack 425302588, win 0, length 0
13:57:07.520349 IP 192.168.15.130.telnet > 192.168.15.129.64613: Flags [R.], seq 0, ack 425237051, win 0, length 0
13:57:07.520445 IP 192.168.15.130.imaps > 192.168.15.129.64613: Flags [R.], seq 0, ack 425237051, win 0, length 0
13:57:07.520537 IP 192.168.15.129.64613 > 192.168.15.130.256: Flags [S], seq 425237050, win 1024, options [mss 1460], length 0
13:57:07.520596 IP 192.168.15.130.imap2 > 192.168.15.129.64613: Flags [R.], seq 0, ack 425237051, win 0, length 0
13:57:07.520690 IP 192.168.15.130.netbios-ssn > 192.168.15.129.64613: Flags [S.], seq 3770257321, ack 425237051, win 17520, options [mss 1460], length 0
13:57:07.520752 IP 192.168.15.129.64613 > 192.168.15.130.https: Flags [S], seq 425237050, win 1024, options [mss 1460], length 0
13:57:07.520788 IP 192.168.15.130.3389 > 192.168.15.129.64613: Flags [R.], seq 0, ack 425237051, win 0, length 0
13:57:07.520848 IP 192.168.15.130.submission > 192.168.15.129.64613: Flags [R.], seq 0, ack 425237051, win 0, length 0
13:57:07.520889 IP 192.168.15.129.64613 > 192.168.15.130.netbios-ssn: Flags [R], seq 425237051, win 0, length 0
13:57:07.520952 IP 192.168.15.130.256 > 192.168.15.129.64613: Flags [R.], seq 0, ack 425237051, win 0, length 0
13:57:07.521051 IP 192.168.15.130.https > 192.168.15.129.64613: Flags [R.], seq 0, ack 425237051, win 0, length 0
13:57:07.521085 IP 192.168.15.129.64613 > 192.168.15.130.mysql: Flags [S], seq 425237050, win 1024, options [mss 1460], length 0
13:57:07.521143 IP 192.168.15.129.64613 > 192.168.15.130.pop3: Flags [S], seq 425237050, win 1024, options [mss 1460], length 0
13:57:07.521318 IP 192.168.15.130.mysql > 192.168.15.129.64613: Flags [R.], seq 0, ack 425237051, win 0, length 0
13:57:07.521370 IP 192.168.15.129.64613 > 192.168.15.130.5900: Flags [S], seq 425237050, win 1024, options [mss 1460], length 0
13:57:07.521455 IP 192.168.15.129.64613 > 192.168.15.130.domain: Flags [S], seq 425237050, win 1024, options [mss 1460], length 0
13:57:07.521509 IP 192.168.15.130.pop3 > 192.168.15.129.64613: Flags [R.], seq 0, ack 425237051, win 0, length 0
13:57:07.521538 IP 192.168.15.130.5900 > 192.168.15.129.64613: Flags [R.], seq 0, ack 425237051, win 0, length 0
13:57:07.521696 IP 192.168.15.130.domain > 192.168.15.129.64613: Flags [R.], seq 0, ack 425237051, win 0, length 0
13:57:07.524114 IP 192.168.15.129.64613 > 192.168.15.130.1025: Flags [S], seq 425237050, win 1024, options [mss 1460], length 0
13:57:07.524185 IP 192.168.15.129.64613 > 192.168.15.130.sunrpc: Flags [S], seq 425237050, win 1024, options [mss 1460], length 0
13:57:07.524216 IP 192.168.15.129.64613 > 192.168.15.130.smtp: Flags [S], seq 425237050, win 1024, options [mss 1460], length 0
13:57:07.524248 IP 192.168.15.129.64613 > 192.168.15.130.loc-srv: Flags [S], seq 425237050, win 1024, options [mss 1460], length 0
13:57:07.524306 IP 192.168.15.129.64613 > 192.168.15.130.microsoft-ds: Flags [S], seq 425237050, win 1024, options [mss 1460], length 0
13:57:07.524339 IP 192.168.15.129.64613 > 192.168.15.130.pop3s: Flags [S], seq 425237050, win 1024, options [mss 1460], length 0
13:57:07.524371 IP 192.168.15.129.64613 > 192.168.15.130.683: Flags [S], seq 425237050, win 1024, options [mss 1460], length 0
13:57:07.524400 IP 192.168.15.129.64613 > 192.168.15.130.3011: Flags [S], seq 425237050, win 1024, options [mss 1460], length 0
13:57:07.524428 IP 192.168.15.129.64613 > 192.168.15.130.9968: Flags [S], seq 425237050, win 1024, options [mss 1460], length 0
13:57:07.524457 IP 192.168.15.129.64613 > 192.168.15.130.49165: Flags [S], seq 425237050, win 1024, options [mss 1460], length 0
13:57:07.524487 IP 192.168.15.129.64613 > 192.168.15.130.264: Flags [S], seq 425237050, win 1024, options [mss 1460], length 0
13:57:07.524557 IP 192.168.15.129.64613 > 192.168.15.130.pop2: Flags [S], seq 425237050, win 1024, options [mss 1460], length 0
13:57:07.524665 IP 192.168.15.129.64613 > 192.168.15.130.60443: Flags [S], seq 425237050, win 1024, options [mss 1460], length 0
13:57:07.524711 IP 192.168.15.129.64613 > 192.168.15.130.6692: Flags [S], seq 425237050, win 1024, options [mss 1460], length 0
13:57:07.524745 IP 192.168.15.129.64613 > 192.168.15.130.5962: Flags [S], seq 425237050, win 1024, options [mss 1460], length 0
13:57:07.524772 IP 192.168.15.129.64613 > 192.168.15.130.3323: Flags [S], seq 425237050, win 1024, options [mss 1460], length 0
13:57:07.524833 IP 192.168.15.130.1025 > 192.168.15.129.64613: Flags [S.], seq 3770317634, ack 425237051, win 17520, options [mss 1460], length 0
13:57:07.524938 IP 192.168.15.129.64613 > 192.168.15.130.5560: Flags [S], seq 425237050, win 1024, options [mss 1460], length 0
13:57:07.524971 IP 192.168.15.129.64613 > 192.168.15.130.1046: Flags [S], seq 425237050, win 1024, options [mss 1460], length 0
13:57:07.524999 IP 192.168.15.129.64613 > 192.168.15.130.1213: Flags [S], seq 425237050, win 1024, options [mss 1460], length 0
13:57:07.525025 IP 192.168.15.129.64613 > 192.168.15.130.1025: Flags [R], seq 425237051, win 0, length 0
13:57:07.525051 IP 192.168.15.129.64613 > 192.168.15.130.9999: Flags [S], seq 425237050, win 1024, options [mss 1460], length 0
13:57:07.525075 IP 192.168.15.129.64613 > 192.168.15.130.3737: Flags [S], seq 425237050, win 1024, options [mss 1460], length 0
13:57:07.525132 IP 192.168.15.129.64613 > 192.168.15.130.7200: Flags [S], seq 425237050, win 1024, options [mss 1460], length 0
13:57:07.525221 IP 192.168.15.129.64613 > 192.168.15.130.1494: Flags [S], seq 425237050, win 1024, options [mss 1460], length 0
13:57:07.525270 IP 192.168.15.129.64613 > 192.168.15.130.3703: Flags [S], seq 425237050, win 1024, options [mss 1460], length 0
13:57:07.525299 IP 192.168.15.129.64613 > 192.168.15.130.9111: Flags [S], seq 425237050, win 1024, options [mss 1460], length 0
13:57:07.525323 IP 192.168.15.129.64613 > 192.168.15.130.27715: Flags [S], seq 425237050, win 1024, options [mss 1460], length 0
13:57:07.525347 IP 192.168.15.129.64613 > 192.168.15.130.7676: Flags [S], seq 425237050, win 1024, options [mss 1460], length 0
13:57:07.525380 IP 192.168.15.129.64613 > 192.168.15.130.1104: Flags [S], seq 425237050, win 1024, options [mss 1460], length 0
13:57:07.525427 IP 192.168.15.130.sunrpc > 192.168.15.129.64613: Flags [R.], seq 0, ack 425237051, win 0, length 0
13:57:07.525510 IP 192.168.15.130.smtp > 192.168.15.129.64613: Flags [R.], seq 0, ack 425237051, win 0, length 0
13:57:07.525588 IP 192.168.15.130.loc-srv > 192.168.15.129.64613: Flags [S.], seq 3770379585, ack 425237051, win 17520, options [mss 1460], length 0
13:57:07.525844 IP 192.168.15.129.64613 > 192.168.15.130.loc-srv: Flags [R], seq 425237051, win 0, length 0
13:57:07.525924 IP 192.168.15.130.microsoft-ds > 192.168.15.129.64613: Flags [S.], seq 3770431490, ack 425237051, win 17520, options [mss 1460], length 0
13:57:07.525995 IP 192.168.15.130.pop3s > 192.168.15.129.64613: Flags [R.], seq 0, ack 425237051, win 0, length 0
13:57:07.526073 IP 192.168.15.130.683 > 192.168.15.129.64613: Flags [R.], seq 0, ack 425237051, win 0, length 0
13:57:07.526126 IP 192.168.15.129.64613 > 192.168.15.130.microsoft-ds: Flags [R], seq 425237051, win 0, length 0
13:57:07.526180 IP 192.168.15.130.3011 > 192.168.15.129.64613: Flags [R.], seq 0, ack 425237051, win 0, length 0
13:57:07.526210 IP 192.168.15.130.9968 > 192.168.15.129.64613: Flags [R.], seq 0, ack 425237051, win 0, length 0
13:57:07.526321 IP 192.168.15.130.49165 > 192.168.15.129.64613: Flags [R.], seq 0, ack 425237051, win 0, length 0
13:57:07.526363 IP 192.168.15.130.264 > 192.168.15.129.64613: Flags [R.], seq 0, ack 425237051, win 0, length 0
13:57:07.526510 IP 192.168.15.130.pop2 > 192.168.15.129.64613: Flags [R.], seq 0, ack 425237051, win 0, length 0
13:57:07.526566 IP 192.168.15.130.60443 > 192.168.15.129.64613: Flags [R.], seq 0, ack 425237051, win 0, length 0
13:57:07.526651 IP 192.168.15.130.6692 > 192.168.15.129.64613: Flags [R.], seq 0, ack 425237051, win 0, length 0
13:57:07.526686 IP 192.168.15.130.5962 > 192.168.15.129.64613: Flags [R.], seq 0, ack 425237051, win 0, length 0
13:57:07.526791 IP 192.168.15.130.3323 > 192.168.15.129.64613: Flags [R.], seq 0, ack 425237051, win 0, length 0
13:57:07.526834 IP 192.168.15.130.5560 > 192.168.15.129.64613: Flags [R.], seq 0, ack 425237051, win 0, length 0
13:57:07.526929 IP 192.168.15.130.1046 > 192.168.15.129.64613: Flags [R.], seq 0, ack 425237051, win 0, length 0
13:57:07.526973 IP 192.168.15.130.1213 > 192.168.15.129.64613: Flags [R.], seq 0, ack 425237051, win 0, length 0
13:57:07.527105 IP 192.168.15.130.9999 > 192.168.15.129.64613: Flags [R.], seq 0, ack 425237051, win 0, length 0
13:57:07.527191 IP 192.168.15.130.3737 > 192.168.15.129.64613: Flags [R.], seq 0, ack 425237051, win 0, length 0
13:57:07.527237 IP 192.168.15.130.7200 > 192.168.15.129.64613: Flags [R.], seq 0, ack 425237051, win 0, length 0
13:57:07.527304 IP 192.168.15.130.1494 > 192.168.15.129.64613: Flags [R.], seq 0, ack 425237051, win 0, length 0
13:57:07.527358 IP 192.168.15.130.3703 > 192.168.15.129.64613: Flags [R.], seq 0, ack 425237051, win 0, length 0
13:57:07.527546 IP 192.168.15.130.9111 > 192.168.15.129.64613: Flags [R.], seq 0, ack 425237051, win 0, length 0
13:57:07.527603 IP 192.168.15.130.27715 > 192.168.15.129.64613: Flags [R.], seq 0, ack 425237051, win 0, length 0
13:57:07.527640 IP 192.168.15.130.7676 > 192.168.15.129.64613: Flags [R.], seq 0, ack 425237051, win 0, length 0
13:57:07.527671 IP 192.168.15.130.1104 > 192.168.15.129.64613: Flags [R.], seq 0, ack 425237051, win 0, length 0
13:57:07.620622 IP 192.168.15.129.64613 > 192.168.15.130.9003: Flags [S], seq 425237050, win 1024, options [mss 1460], length 0
13:57:07.620841 IP 192.168.15.129.64613 > 192.168.15.130.3880: Flags [S], seq 425237050, win 1024, options [mss 1460], length 0
13:57:07.621245 IP 192.168.15.129.64613 > 192.168.15.130.5033: Flags [S], seq 425237050, win 1024, options [mss 1460], length 0
13:57:07.621331 IP 192.168.15.129.64613 > 192.168.15.130.login: Flags [S], seq 425237050, win 1024, options [mss 1460], length 0
13:57:07.621386 IP 192.168.15.129.64613 > 192.168.15.130.17988: Flags [S], seq 425237050, win 1024, options [mss 1460], length 0
13:57:07.621437 IP 192.168.15.129.64613 > 192.168.15.130.eklogin: Flags [S], seq 425237050, win 1024, options [mss 1460], length 0
13:57:07.621495 IP 192.168.15.129.64613 > 192.168.15.130.1152: Flags [S], seq 425237050, win 1024, options [mss 1460], length 0
13:57:07.621614 IP 192.168.15.129.64613 > 192.168.15.130.7070: Flags [S], seq 425237050, win 1024, options [mss 1460], length 0
13:57:07.621675 IP 192.168.15.129.64613 > 192.168.15.130.11110: Flags [S], seq 425237050, win 1024, options [mss 1460], length 0
13:57:07.621728 IP 192.168.15.129.64613 > 192.168.15.130.666: Flags [S], seq 425237050, win 1024, options [mss 1460], length 0
13:57:07.621807 IP 192.168.15.129.64613 > 192.168.15.130.1091: Flags [S], seq 425237050, win 1024, options [mss 1460], length 0
13:57:07.621939 IP 192.168.15.130.9003 > 192.168.15.129.64613: Flags [R.], seq 0, ack 425237051, win 0, length 0
13:57:07.622018 IP 192.168.15.130.3880 > 192.168.15.129.64613: Flags [R.], seq 0, ack 425237051, win 0, length 0
13:57:07.622126 IP 192.168.15.129.64613 > 192.168.15.130.8011: Flags [S], seq 425237050, win 1024, options [mss 1460], length 0
13:57:07.622322 IP 192.168.15.130.5033 > 192.168.15.129.64613: Flags [R.], seq 0, ack 425237051, win 0, length 0
13:57:07.622539 IP 192.168.15.130.login > 192.168.15.129.64613: Flags [R.], seq 0, ack 425237051, win 0, length 0
13:57:07.622924 IP 192.168.15.130.17988 > 192.168.15.129.64613: Flags [R.], seq 0, ack 425237051, win 0, length 0
13:57:07.623080 IP 192.168.15.130.eklogin > 192.168.15.129.64613: Flags [R.], seq 0, ack 425237051, win 0, length 0
13:57:07.623258 IP 192.168.15.130.1152 > 192.168.15.129.64613: Flags [R.], seq 0, ack 425237051, win 0, length 0
13:57:07.623401 IP 192.168.15.130.7070 > 192.168.15.129.64613: Flags [R.], seq 0, ack 425237051, win 0, length 0
13:57:07.623590 IP 192.168.15.130.11110 > 192.168.15.129.64613: Flags [R.], seq 0, ack 425237051, win 0, length 0
13:57:07.623805 IP 192.168.15.130.666 > 192.168.15.129.64613: Flags [R.], seq 0, ack 425237051, win 0, length 0
13:57:07.623931 IP 192.168.15.130.1091 > 192.168.15.129.64613: Flags [R.], seq 0, ack 425237051, win 0, length 0
13:57:07.624009 IP 192.168.15.130.8011 > 192.168.15.129.64613: Flags [R.], seq 0, ack 425237051, win 0, length 0
13:57:07.624125 IP 192.168.15.129.64613 > 192.168.15.130.20005: Flags [S], seq 425237050, win 1024, options [mss 1460], length 0
13:57:07.624185 IP 192.168.15.129.64613 > 192.168.15.130.4242: Flags [S], seq 425237050, win 1024, options [mss 1460], length 0
13:57:07.624242 IP 192.168.15.129.64613 > 192.168.15.130.212: Flags [S], seq 425237050, win 1024, options [mss 1460], length 0
13:57:07.624299 IP 192.168.15.129.64613 > 192.168.15.130.7103: Flags [S], seq 425237050, win 1024, options [mss 1460], length 0
13:57:07.624356 IP 192.168.15.129.64613 > 192.168.15.130.9009: Flags [S], seq 425237050, win 1024, options [mss 1460], length 0
13:57:07.624412 IP 192.168.15.129.64613 > 192.168.15.130.8007: Flags [S], seq 425237050, win 1024, options [mss 1460], length 0
13:57:07.624468 IP 192.168.15.129.64613 > 192.168.15.130.90: Flags [S], seq 425237050, win 1024, options [mss 1460], length 0
13:57:07.624582 IP 192.168.15.129.64613 > 192.168.15.130.2702: Flags [S], seq 425237050, win 1024, options [mss 1460], length 0
13:57:07.624643 IP 192.168.15.129.64613 > 192.168.15.130.3001: Flags [S], seq 425237050, win 1024, options [mss 1460], length 0
13:57:07.624702 IP 192.168.15.129.64613 > 192.168.15.130.1060: Flags [S], seq 425237050, win 1024, options [mss 1460], length 0
13:57:07.624764 IP 192.168.15.129.64613 > 192.168.15.130.1100: Flags [S], seq 425237050, win 1024, options [mss 1460], length 0
13:57:07.624821 IP 192.168.15.129.64613 > 192.168.15.130.8701: Flags [S], seq 425237050, win 1024, options [mss 1460], length 0
13:57:07.624877 IP 192.168.15.129.64613 > 192.168.15.130.1247: Flags [S], seq 425237050, win 1024, options [mss 1460], length 0
13:57:07.624942 IP 192.168.15.129.64613 > 192.168.15.130.1272: Flags [S], seq 425237050, win 1024, options [mss 1460], length 0
13:57:07.625000 IP 192.168.15.129.64613 > 192.168.15.130.50006: Flags [S], seq 425237050, win 1024, options [mss 1460], length 0
13:57:07.625056 IP 192.168.15.129.64613 > 192.168.15.130.2366: Flags [S], seq 425237050, win 1024, options [mss 1460], length 0
13:57:07.625119 IP 192.168.15.129.64613 > 192.168.15.130.x11-5: Flags [S], seq 425237050, win 1024, options [mss 1460], length 0
13:57:07.625239 IP 192.168.15.130.20005 > 192.168.15.129.64613: Flags [R.], seq 0, ack 425237051, win 0, length 0
13:57:07.625306 IP 192.168.15.130.4242 > 192.168.15.129.64613: Flags [R.], seq 0, ack 425237051, win 0, length 0
13:57:07.625362 IP 192.168.15.130.212 > 192.168.15.129.64613: Flags [R.], seq 0, ack 425237051, win 0, length 0
13:57:07.625426 IP 192.168.15.130.7103 > 192.168.15.129.64613: Flags [R.], seq 0, ack 425237051, win 0, length 0
13:57:07.625479 IP 192.168.15.130.9009 > 192.168.15.129.64613: Flags [R.], seq 0, ack 425237051, win 0, length 0
13:57:07.625530 IP 192.168.15.130.8007 > 192.168.15.129.64613: Flags [R.], seq 0, ack 425237051, win 0, length 0
13:57:07.625875 IP 192.168.15.129.64613 > 192.168.15.130.1034: Flags [S], seq 425237050, win 1024, options [mss 1460], length 0
13:57:07.626048 IP 192.168.15.129.64613 > 192.168.15.130.8193: Flags [S], seq 425237050, win 1024, options [mss 1460], length 0
13:57:07.626221 IP 192.168.15.129.64613 > 192.168.15.130.11967: Flags [S], seq 425237050, win 1024, options [mss 1460], length 0
13:57:07.626291 IP 192.168.15.129.64613 > 192.168.15.130.65000: Flags [S], seq 425237050, win 1024, options [mss 1460], length 0
13:57:07.626418 IP 192.168.15.130.90 > 192.168.15.129.64613: Flags [R.], seq 0, ack 425237051, win 0, length 0
13:57:07.626480 IP 192.168.15.130.2702 > 192.168.15.129.64613: Flags [R.], seq 0, ack 425237051, win 0, length 0
13:57:07.626538 IP 192.168.15.130.3001 > 192.168.15.129.64613: Flags [R.], seq 0, ack 425237051, win 0, length 0
13:57:07.626720 IP 192.168.15.130.1060 > 192.168.15.129.64613: Flags [R.], seq 0, ack 425237051, win 0, length 0
13:57:07.626792 IP 192.168.15.130.1100 > 192.168.15.129.64613: Flags [R.], seq 0, ack 425237051, win 0, length 0
13:57:07.626852 IP 192.168.15.130.8701 > 192.168.15.129.64613: Flags [R.], seq 0, ack 425237051, win 0, length 0
13:57:07.627288 IP 192.168.15.130.1247 > 192.168.15.129.64613: Flags [R.], seq 0, ack 425237051, win 0, length 0
13:57:07.627410 IP 192.168.15.130.1272 > 192.168.15.129.64613: Flags [R.], seq 0, ack 425237051, win 0, length 0
13:57:07.627754 IP 192.168.15.130.50006 > 192.168.15.129.64613: Flags [R.], seq 0, ack 425237051, win 0, length 0
13:57:07.627871 IP 192.168.15.130.2366 > 192.168.15.129.64613: Flags [R.], seq 0, ack 425237051, win 0, length 0
13:57:07.627936 IP 192.168.15.130.x11-5 > 192.168.15.129.64613: Flags [R.], seq 0, ack 425237051, win 0, length 0
13:57:07.628062 IP 192.168.15.130.1034 > 192.168.15.129.64613: Flags [R.], seq 0, ack 425237051, win 0, length 0
13:57:07.628406 IP 192.168.15.130.8193 > 192.168.15.129.64613: Flags [R.], seq 0, ack 425237051, win 0, length 0
13:57:07.628504 IP 192.168.15.130.11967 > 192.168.15.129.64613: Flags [R.], seq 0, ack 425237051, win 0, length 0
13:57:07.628745 IP 192.168.15.130.65000 > 192.168.15.129.64613: Flags [R.], seq 0, ack 425237051, win 0, length 0
13:57:07.721730 IP 192.168.15.129.64614 > 192.168.15.130.666: Flags [S], seq 425302587, win 1024, options [mss 1460], length 0
13:57:07.721861 IP 192.168.15.129.64614 > 192.168.15.130.11110: Flags [S], seq 425302587, win 1024, options [mss 1460], length 0
13:57:07.722036 IP 192.168.15.129.64614 > 192.168.15.130.7070: Flags [S], seq 425302587, win 1024, options [mss 1460], length 0
13:57:07.722187 IP 192.168.15.129.64614 > 192.168.15.130.1152: Flags [S], seq 425302587, win 1024, options [mss 1460], length 0
13:57:07.722347 IP 192.168.15.129.64614 > 192.168.15.130.eklogin: Flags [S], seq 425302587, win 1024, options [mss 1460], length 0
13:57:07.722502 IP 192.168.15.129.64614 > 192.168.15.130.17988: Flags [S], seq 425302587, win 1024, options [mss 1460], length 0
13:57:07.722569 IP 192.168.15.129.64614 > 192.168.15.130.login: Flags [S], seq 425302587, win 1024, options [mss 1460], length 0
13:57:07.722622 IP 192.168.15.129.64614 > 192.168.15.130.5033: Flags [S], seq 425302587, win 1024, options [mss 1460], length 0
13:57:07.722677 IP 192.168.15.129.64614 > 192.168.15.130.3880: Flags [S], seq 425302587, win 1024, options [mss 1460], length 0
13:57:07.722736 IP 192.168.15.129.64614 > 192.168.15.130.9003: Flags [S], seq 425302587, win 1024, options [mss 1460], length 0
13:57:07.722862 IP 192.168.15.130.666 > 192.168.15.129.64614: Flags [R.], seq 0, ack 425302588, win 0, length 0
13:57:07.722931 IP 192.168.15.130.11110 > 192.168.15.129.64614: Flags [R.], seq 0, ack 425302588, win 0, length 0
13:57:07.722996 IP 192.168.15.130.7070 > 192.168.15.129.64614: Flags [R.], seq 0, ack 425302588, win 0, length 0
13:57:07.723128 IP 192.168.15.130.1152 > 192.168.15.129.64614: Flags [R.], seq 0, ack 425302588, win 0, length 0
13:57:07.723191 IP 192.168.15.130.eklogin > 192.168.15.129.64614: Flags [R.], seq 0, ack 425302588, win 0, length 0
13:57:07.723434 IP 192.168.15.130.17988 > 192.168.15.129.64614: Flags [R.], seq 0, ack 425302588, win 0, length 0
13:57:07.723587 IP 192.168.15.130.login > 192.168.15.129.64614: Flags [R.], seq 0, ack 425302588, win 0, length 0
13:57:07.723740 IP 192.168.15.130.5033 > 192.168.15.129.64614: Flags [R.], seq 0, ack 425302588, win 0, length 0
13:57:07.723873 IP 192.168.15.130.3880 > 192.168.15.129.64614: Flags [R.], seq 0, ack 425302588, win 0, length 0
13:57:07.724044 IP 192.168.15.130.9003 > 192.168.15.129.64614: Flags [R.], seq 0, ack 425302588, win 0, length 0
13:57:07.725739 IP 192.168.15.129.64614 > 192.168.15.130.1034: Flags [S], seq 425302587, win 1024, options [mss 1460], length 0
13:57:07.725871 IP 192.168.15.129.64614 > 192.168.15.130.x11-5: Flags [S], seq 425302587, win 1024, options [mss 1460], length 0
13:57:07.726037 IP 192.168.15.129.64614 > 192.168.15.130.2366: Flags [S], seq 425302587, win 1024, options [mss 1460], length 0
13:57:07.726190 IP 192.168.15.129.64614 > 192.168.15.130.50006: Flags [S], seq 425302587, win 1024, options [mss 1460], length 0
13:57:07.726334 IP 192.168.15.129.64614 > 192.168.15.130.1272: Flags [S], seq 425302587, win 1024, options [mss 1460], length 0
13:57:07.726498 IP 192.168.15.129.64614 > 192.168.15.130.1247: Flags [S], seq 425302587, win 1024, options [mss 1460], length 0
13:57:07.726596 IP 192.168.15.129.64614 > 192.168.15.130.8701: Flags [S], seq 425302587, win 1024, options [mss 1460], length 0
13:57:07.726665 IP 192.168.15.129.64614 > 192.168.15.130.1100: Flags [S], seq 425302587, win 1024, options [mss 1460], length 0
13:57:07.726724 IP 192.168.15.129.64614 > 192.168.15.130.1060: Flags [S], seq 425302587, win 1024, options [mss 1460], length 0
13:57:07.726777 IP 192.168.15.129.64614 > 192.168.15.130.3001: Flags [S], seq 425302587, win 1024, options [mss 1460], length 0
13:57:07.726835 IP 192.168.15.129.64614 > 192.168.15.130.2702: Flags [S], seq 425302587, win 1024, options [mss 1460], length 0
13:57:07.726893 IP 192.168.15.129.64614 > 192.168.15.130.90: Flags [S], seq 425302587, win 1024, options [mss 1460], length 0
13:57:07.726945 IP 192.168.15.129.64614 > 192.168.15.130.8007: Flags [S], seq 425302587, win 1024, options [mss 1460], length 0
13:57:07.727009 IP 192.168.15.129.64614 > 192.168.15.130.9009: Flags [S], seq 425302587, win 1024, options [mss 1460], length 0
13:57:07.727066 IP 192.168.15.129.64614 > 192.168.15.130.7103: Flags [S], seq 425302587, win 1024, options [mss 1460], length 0
13:57:07.727127 IP 192.168.15.129.64614 > 192.168.15.130.212: Flags [S], seq 425302587, win 1024, options [mss 1460], length 0
13:57:07.727195 IP 192.168.15.129.64614 > 192.168.15.130.4242: Flags [S], seq 425302587, win 1024, options [mss 1460], length 0
13:57:07.727319 IP 192.168.15.130.1034 > 192.168.15.129.64614: Flags [R.], seq 0, ack 425302588, win 0, length 0
13:57:07.727488 IP 192.168.15.130.x11-5 > 192.168.15.129.64614: Flags [R.], seq 0, ack 425302588, win 0, length 0
13:57:07.727656 IP 192.168.15.130.2366 > 192.168.15.129.64614: Flags [R.], seq 0, ack 425302588, win 0, length 0
13:57:07.727768 IP 192.168.15.129.64614 > 192.168.15.130.20005: Flags [S], seq 425302587, win 1024, options [mss 1460], length 0
13:57:07.727828 IP 192.168.15.129.64614 > 192.168.15.130.8011: Flags [S], seq 425302587, win 1024, options [mss 1460], length 0
13:57:07.727881 IP 192.168.15.129.64614 > 192.168.15.130.1091: Flags [S], seq 425302587, win 1024, options [mss 1460], length 0
13:57:07.728013 IP 192.168.15.130.50006 > 192.168.15.129.64614: Flags [R.], seq 0, ack 425302588, win 0, length 0
13:57:07.728260 IP 192.168.15.130.1272 > 192.168.15.129.64614: Flags [R.], seq 0, ack 425302588, win 0, length 0
13:57:07.728622 IP 192.168.15.130.1247 > 192.168.15.129.64614: Flags [R.], seq 0, ack 425302588, win 0, length 0
13:57:07.728743 IP 192.168.15.130.8701 > 192.168.15.129.64614: Flags [R.], seq 0, ack 425302588, win 0, length 0
13:57:07.728866 IP 192.168.15.130.1100 > 192.168.15.129.64614: Flags [R.], seq 0, ack 425302588, win 0, length 0
13:57:07.729027 IP 192.168.15.130.1060 > 192.168.15.129.64614: Flags [R.], seq 0, ack 425302588, win 0, length 0
13:57:07.729194 IP 192.168.15.130.3001 > 192.168.15.129.64614: Flags [R.], seq 0, ack 425302588, win 0, length 0
13:57:07.729283 IP 192.168.15.130.2702 > 192.168.15.129.64614: Flags [R.], seq 0, ack 425302588, win 0, length 0
13:57:07.729406 IP 192.168.15.130.90 > 192.168.15.129.64614: Flags [R.], seq 0, ack 425302588, win 0, length 0
13:57:07.729621 IP 192.168.15.130.8007 > 192.168.15.129.64614: Flags [R.], seq 0, ack 425302588, win 0, length 0
13:57:07.729741 IP 192.168.15.130.9009 > 192.168.15.129.64614: Flags [R.], seq 0, ack 425302588, win 0, length 0
13:57:07.729881 IP 192.168.15.130.7103 > 192.168.15.129.64614: Flags [R.], seq 0, ack 425302588, win 0, length 0
13:57:07.730041 IP 192.168.15.130.212 > 192.168.15.129.64614: Flags [R.], seq 0, ack 425302588, win 0, length 0
13:57:07.730396 IP 192.168.15.130.4242 > 192.168.15.129.64614: Flags [R.], seq 0, ack 425302588, win 0, length 0
13:57:07.730509 IP 192.168.15.130.20005 > 192.168.15.129.64614: Flags [R.], seq 0, ack 425302588, win 0, length 0
13:57:07.730573 IP 192.168.15.130.8011 > 192.168.15.129.64614: Flags [R.], seq 0, ack 425302588, win 0, length 0
13:57:07.730675 IP 192.168.15.129.64614 > 192.168.15.130.65000: Flags [S], seq 425302587, win 1024, options [mss 1460], length 0
13:57:07.730733 IP 192.168.15.129.64614 > 192.168.15.130.11967: Flags [S], seq 425302587, win 1024, options [mss 1460], length 0
13:57:07.730785 IP 192.168.15.129.64614 > 192.168.15.130.8193: Flags [S], seq 425302587, win 1024, options [mss 1460], length 0
13:57:07.730883 IP 192.168.15.130.1091 > 192.168.15.129.64614: Flags [R.], seq 0, ack 425302588, win 0, length 0
13:57:07.731287 IP 192.168.15.130.65000 > 192.168.15.129.64614: Flags [R.], seq 0, ack 425302588, win 0, length 0
13:57:07.731415 IP 192.168.15.130.11967 > 192.168.15.129.64614: Flags [R.], seq 0, ack 425302588, win 0, length 0
13:57:07.731823 IP 192.168.15.130.8193 > 192.168.15.129.64614: Flags [R.], seq 0, ack 425302588, win 0, length 0
13:57:07.765022 IP 192.168.15.128 > 8.8.8.8: ICMP echo request, id 13086, seq 1609, length 64
13:57:07.822866 IP 192.168.15.129.64613 > 192.168.15.130.10002: Flags [S], seq 425237050, win 1024, options [mss 1460], length 0
13:57:07.823637 IP 192.168.15.130.10002 > 192.168.15.129.64613: Flags [R.], seq 0, ack 425237051, win 0, length 0
13:57:07.828105 IP 192.168.15.129.64613 > 192.168.15.130.3300: Flags [S], seq 425237050, win 1024, options [mss 1460], length 0
13:57:07.828913 IP 192.168.15.130.3300 > 192.168.15.129.64613: Flags [R.], seq 0, ack 425237051, win 0, length 0
13:57:07.833302 IP 192.168.15.129.64613 > 192.168.15.130.1023: Flags [S], seq 425237050, win 1024, options [mss 1460], length 0
13:57:07.834071 IP 192.168.15.130.1023 > 192.168.15.129.64613: Flags [R.], seq 0, ack 425237051, win 0, length 0
13:57:07.839194 IP 192.168.15.129.64613 > 192.168.15.130.3000: Flags [S], seq 425237050, win 1024, options [mss 1460], length 0
13:57:07.839959 IP 192.168.15.130.3000 > 192.168.15.129.64613: Flags [R.], seq 0, ack 425237051, win 0, length 0
13:57:07.845246 IP 192.168.15.129.64613 > 192.168.15.130.1068: Flags [S], seq 425237050, win 1024, options [mss 1460], length 0
13:57:07.846081 IP 192.168.15.130.1068 > 192.168.15.129.64613: Flags [R.], seq 0, ack 425237051, win 0, length 0
13:57:07.851230 IP 192.168.15.129.64613 > 192.168.15.130.3827: Flags [S], seq 425237050, win 1024, options [mss 1460], length 0
13:57:07.851982 IP 192.168.15.130.3827 > 192.168.15.129.64613: Flags [R.], seq 0, ack 425237051, win 0, length 0
13:57:07.856472 IP 192.168.15.129.64613 > 192.168.15.130.10778: Flags [S], seq 425237050, win 1024, options [mss 1460], length 0
13:57:07.857248 IP 192.168.15.130.10778 > 192.168.15.129.64613: Flags [R.], seq 0, ack 425237051, win 0, length 0
13:57:07.862614 IP 192.168.15.129.64613 > 192.168.15.130.2222: Flags [S], seq 425237050, win 1024, options [mss 1460], length 0
13:57:07.863399 IP 192.168.15.130.2222 > 192.168.15.129.64613: Flags [R.], seq 0, ack 425237051, win 0, length 0
13:57:07.868809 IP 192.168.15.129.64613 > 192.168.15.130.1089: Flags [S], seq 425237050, win 1024, options [mss 1460], length 0
13:57:07.869564 IP 192.168.15.130.1089 > 192.168.15.129.64613: Flags [R.], seq 0, ack 425237051, win 0, length 0
13:57:07.874461 IP 192.168.15.129.64613 > 192.168.15.130.5678: Flags [S], seq 425237050, win 1024, options [mss 1460], length 0
13:57:07.875222 IP 192.168.15.130.5678 > 192.168.15.129.64613: Flags [R.], seq 0, ack 425237051, win 0, length 0
13:57:07.880255 IP 192.168.15.129.64613 > 192.168.15.130.6646: Flags [S], seq 425237050, win 1024, options [mss 1460], length 0
13:57:07.881020 IP 192.168.15.130.6646 > 192.168.15.129.64613: Flags [R.], seq 0, ack 425237051, win 0, length 0
13:57:07.886432 IP 192.168.15.129.64613 > 192.168.15.130.16000: Flags [S], seq 425237050, win 1024, options [mss 1460], length 0
13:57:07.887191 IP 192.168.15.130.16000 > 192.168.15.129.64613: Flags [R.], seq 0, ack 425237051, win 0, length 0
13:57:07.892001 IP 192.168.15.129.64613 > 192.168.15.130.9011: Flags [S], seq 425237050, win 1024, options [mss 1460], length 0
13:57:07.892774 IP 192.168.15.130.9011 > 192.168.15.129.64613: Flags [R.], seq 0, ack 425237051, win 0, length 0
13:57:07.897989 IP 192.168.15.129.64613 > 192.168.15.130.x11-6: Flags [S], seq 425237050, win 1024, options [mss 1460], length 0
13:57:07.898757 IP 192.168.15.130.x11-6 > 192.168.15.129.64613: Flags [R.], seq 0, ack 425237051, win 0, length 0
13:57:07.903781 IP 192.168.15.129.64613 > 192.168.15.130.10012: Flags [S], seq 425237050, win 1024, options [mss 1460], length 0
13:57:07.904481 IP 192.168.15.130.10012 > 192.168.15.129.64613: Flags [R.], seq 0, ack 425237051, win 0, length 0
13:57:07.905791 IP 8.8.8.8 > 192.168.15.128: ICMP echo reply, id 13086, seq 1609, length 64
13:57:07.909806 IP 192.168.15.129.64613 > 192.168.15.130.gnutella-svc: Flags [S], seq 425237050, win 1024, options [mss 1460], length 0
13:57:07.910595 IP 192.168.15.130.gnutella-svc > 192.168.15.129.64613: Flags [R.], seq 0, ack 425237051, win 0, length 0
13:57:07.915596 IP 192.168.15.129.64613 > 192.168.15.130.1130: Flags [S], seq 425237050, win 1024, options [mss 1460], length 0
13:57:07.916426 IP 192.168.15.130.1130 > 192.168.15.129.64613: Flags [R.], seq 0, ack 425237051, win 0, length 0
13:57:07.921594 IP 192.168.15.129.64613 > 192.168.15.130.6: Flags [S], seq 425237050, win 1024, options [mss 1460], length 0
13:57:07.922384 IP 192.168.15.130.6 > 192.168.15.129.64613: Flags [R.], seq 0, ack 425237051, win 0, length 0
13:57:07.927606 IP 192.168.15.129.64614 > 192.168.15.130.10002: Flags [S], seq 425302587, win 1024, options [mss 1460], length 0
13:57:07.928357 IP 192.168.15.130.10002 > 192.168.15.129.64614: Flags [R.], seq 0, ack 425302588, win 0, length 0
13:57:07.933356 IP 192.168.15.129.64614 > 192.168.15.130.1023: Flags [S], seq 425302587, win 1024, options [mss 1460], length 0
13:57:07.934144 IP 192.168.15.130.1023 > 192.168.15.129.64614: Flags [R.], seq 0, ack 425302588, win 0, length 0
13:57:07.939347 IP 192.168.15.129.64614 > 192.168.15.130.3000: Flags [S], seq 425302587, win 1024, options [mss 1460], length 0
13:57:07.940164 IP 192.168.15.130.3000 > 192.168.15.129.64614: Flags [R.], seq 0, ack 425302588, win 0, length 0
13:57:07.944761 IP 192.168.15.129.64614 > 192.168.15.130.3300: Flags [S], seq 425302587, win 1024, options [mss 1460], length 0
13:57:07.945516 IP 192.168.15.130.3300 > 192.168.15.129.64614: Flags [R.], seq 0, ack 425302588, win 0, length 0
13:57:07.950640 IP 192.168.15.129.64614 > 192.168.15.130.1068: Flags [S], seq 425302587, win 1024, options [mss 1460], length 0
13:57:07.951405 IP 192.168.15.130.1068 > 192.168.15.129.64614: Flags [R.], seq 0, ack 425302588, win 0, length 0
13:57:07.956709 IP 192.168.15.129.64614 > 192.168.15.130.10778: Flags [S], seq 425302587, win 1024, options [mss 1460], length 0
13:57:07.957468 IP 192.168.15.130.10778 > 192.168.15.129.64614: Flags [R.], seq 0, ack 425302588, win 0, length 0
