15:45:26.187981 IP 192.168.15.128 > 8.8.8.8: ICMP echo request, id 13086, seq 7874, length 64
15:45:26.219345 IP 8.8.8.8 > 192.168.15.128: ICMP echo reply, id 13086, seq 7874, length 64
15:45:27.198553 IP 192.168.15.128 > 8.8.8.8: ICMP echo request, id 13086, seq 7875, length 64
15:45:27.233551 IP 8.8.8.8 > 192.168.15.128: ICMP echo reply, id 13086, seq 7875, length 64
15:45:28.217701 IP 192.168.15.128 > 8.8.8.8: ICMP echo request, id 13086, seq 7876, length 64
15:45:28.250189 IP 8.8.8.8 > 192.168.15.128: ICMP echo reply, id 13086, seq 7876, length 64
15:45:29.227197 IP 192.168.15.128 > 8.8.8.8: ICMP echo request, id 13086, seq 7877, length 64
15:45:29.264623 IP 8.8.8.8 > 192.168.15.128: ICMP echo reply, id 13086, seq 7877, length 64
15:45:30.237643 IP 192.168.15.128 > 8.8.8.8: ICMP echo request, id 13086, seq 7878, length 64
15:45:30.269417 IP 8.8.8.8 > 192.168.15.128: ICMP echo reply, id 13086, seq 7878, length 64
15:45:31.246720 IP 192.168.15.128 > 8.8.8.8: ICMP echo request, id 13086, seq 7879, length 64
15:45:31.279630 IP 8.8.8.8 > 192.168.15.128: ICMP echo reply, id 13086, seq 7879, length 64
15:45:31.914680 ARP, Request who-has 192.168.15.1 (Broadcast) tell 192.168.15.129, length 46
15:45:31.914750 ARP, Request who-has 192.168.15.2 (Broadcast) tell 192.168.15.129, length 46
15:45:31.914754 ARP, Request who-has 192.168.15.3 (Broadcast) tell 192.168.15.129, length 46
15:45:31.914808 ARP, Request who-has 192.168.15.4 (Broadcast) tell 192.168.15.129, length 46
15:45:31.914810 ARP, Request who-has 192.168.15.5 (Broadcast) tell 192.168.15.129, length 46
15:45:31.914812 ARP, Request who-has 192.168.15.6 (Broadcast) tell 192.168.15.129, length 46
15:45:31.914888 ARP, Request who-has 192.168.15.7 (Broadcast) tell 192.168.15.129, length 46
15:45:31.914891 ARP, Request who-has 192.168.15.8 (Broadcast) tell 192.168.15.129, length 46
15:45:31.915115 ARP, Request who-has 192.168.15.9 (Broadcast) tell 192.168.15.129, length 46
15:45:31.915121 ARP, Request who-has 192.168.15.10 (Broadcast) tell 192.168.15.129, length 46
15:45:31.915129 ARP, Reply 192.168.15.1 is-at 00:50:56:c0:00:08 (oui Unknown), length 46
15:45:31.915254 ARP, Reply 192.168.15.2 is-at 00:50:56:e8:23:fc (oui Unknown), length 46
15:45:32.119215 ARP, Request who-has 192.168.15.3 (Broadcast) tell 192.168.15.129, length 46
15:45:32.119701 ARP, Request who-has 192.168.15.4 (Broadcast) tell 192.168.15.129, length 46
15:45:32.119889 ARP, Request who-has 192.168.15.5 (Broadcast) tell 192.168.15.129, length 46
15:45:32.120132 ARP, Request who-has 192.168.15.6 (Broadcast) tell 192.168.15.129, length 46
15:45:32.120323 ARP, Request who-has 192.168.15.7 (Broadcast) tell 192.168.15.129, length 46
15:45:32.120503 ARP, Request who-has 192.168.15.8 (Broadcast) tell 192.168.15.129, length 46
15:45:32.120819 ARP, Request who-has 192.168.15.9 (Broadcast) tell 192.168.15.129, length 46
15:45:32.121134 ARP, Request who-has 192.168.15.10 (Broadcast) tell 192.168.15.129, length 46
15:45:32.121514 ARP, Request who-has 192.168.15.13 (Broadcast) tell 192.168.15.129, length 46
15:45:32.121732 ARP, Request who-has 192.168.15.14 (Broadcast) tell 192.168.15.129, length 46
15:45:32.121833 ARP, Request who-has 192.168.15.15 (Broadcast) tell 192.168.15.129, length 46
15:45:32.121841 ARP, Request who-has 192.168.15.16 (Broadcast) tell 192.168.15.129, length 46
15:45:32.220014 ARP, Request who-has 192.168.15.19 (Broadcast) tell 192.168.15.129, length 46
15:45:32.220051 ARP, Request who-has 192.168.15.20 (Broadcast) tell 192.168.15.129, length 46
15:45:32.220056 ARP, Request who-has 192.168.15.21 (Broadcast) tell 192.168.15.129, length 46
15:45:32.220240 ARP, Request who-has 192.168.15.22 (Broadcast) tell 192.168.15.129, length 46
15:45:32.220315 ARP, Request who-has 192.168.15.23 (Broadcast) tell 192.168.15.129, length 46
15:45:32.222818 ARP, Request who-has 192.168.15.13 (Broadcast) tell 192.168.15.129, length 46
15:45:32.223103 ARP, Request who-has 192.168.15.14 (Broadcast) tell 192.168.15.129, length 46
15:45:32.223343 ARP, Request who-has 192.168.15.15 (Broadcast) tell 192.168.15.129, length 46
15:45:32.223518 ARP, Request who-has 192.168.15.16 (Broadcast) tell 192.168.15.129, length 46
15:45:32.223692 ARP, Request who-has 192.168.15.26 (Broadcast) tell 192.168.15.129, length 46
15:45:32.223709 ARP, Request who-has 192.168.15.27 (Broadcast) tell 192.168.15.129, length 46
15:45:32.223840 ARP, Request who-has 192.168.15.28 (Broadcast) tell 192.168.15.129, length 46
15:45:32.258910 IP 192.168.15.128 > 8.8.8.8: ICMP echo request, id 13086, seq 7880, length 64
15:45:32.320996 ARP, Request who-has 192.168.15.19 (Broadcast) tell 192.168.15.129, length 46
15:45:32.321427 ARP, Request who-has 192.168.15.20 (Broadcast) tell 192.168.15.129, length 46
15:45:32.321628 ARP, Request who-has 192.168.15.21 (Broadcast) tell 192.168.15.129, length 46
15:45:32.321893 ARP, Request who-has 192.168.15.22 (Broadcast) tell 192.168.15.129, length 46
15:45:32.322152 ARP, Request who-has 192.168.15.23 (Broadcast) tell 192.168.15.129, length 46
15:45:32.324019 ARP, Request who-has 192.168.15.26 (Broadcast) tell 192.168.15.129, length 46
15:45:32.324661 ARP, Request who-has 192.168.15.27 (Broadcast) tell 192.168.15.129, length 46
15:45:32.324885 ARP, Request who-has 192.168.15.33 (Broadcast) tell 192.168.15.129, length 46
15:45:32.324909 ARP, Request who-has 192.168.15.34 (Broadcast) tell 192.168.15.129, length 46
15:45:32.324914 ARP, Request who-has 192.168.15.35 (Broadcast) tell 192.168.15.129, length 46
15:45:32.324919 ARP, Request who-has 192.168.15.36 (Broadcast) tell 192.168.15.129, length 46
15:45:32.328012 ARP, Request who-has 192.168.15.28 (Broadcast) tell 192.168.15.129, length 46
15:45:32.363889 IP6 fe80::f927:acb3:aacd:2901.59581 > ff02::c.3702: UDP, length 656
15:45:32.364498 IP 192.168.15.1.59580 > 239.255.255.250.3702: UDP, length 656
15:45:32.399876 IP 8.8.8.8 > 192.168.15.128: ICMP echo reply, id 13086, seq 7880, length 64
15:45:32.422067 ARP, Request who-has 192.168.15.41 (Broadcast) tell 192.168.15.129, length 46
15:45:32.422104 ARP, Request who-has 192.168.15.42 (Broadcast) tell 192.168.15.129, length 46
15:45:32.422109 ARP, Request who-has 192.168.15.43 (Broadcast) tell 192.168.15.129, length 46
15:45:32.422154 ARP, Request who-has 192.168.15.44 (Broadcast) tell 192.168.15.129, length 46
15:45:32.422354 ARP, Request who-has 192.168.15.45 (Broadcast) tell 192.168.15.129, length 46
15:45:32.424790 ARP, Request who-has 192.168.15.33 (Broadcast) tell 192.168.15.129, length 46
15:45:32.425078 ARP, Request who-has 192.168.15.34 (Broadcast) tell 192.168.15.129, length 46
15:45:32.425256 ARP, Request who-has 192.168.15.35 (Broadcast) tell 192.168.15.129, length 46
15:45:32.425437 ARP, Request who-has 192.168.15.36 (Broadcast) tell 192.168.15.129, length 46
15:45:32.425722 ARP, Request who-has 192.168.15.48 (Broadcast) tell 192.168.15.129, length 46
15:45:32.425987 ARP, Request who-has 192.168.15.49 (Broadcast) tell 192.168.15.129, length 46
15:45:32.428975 ARP, Request who-has 192.168.15.52 (Broadcast) tell 192.168.15.129, length 46
15:45:32.522393 ARP, Request who-has 192.168.15.41 (Broadcast) tell 192.168.15.129, length 46
15:45:32.522701 ARP, Request who-has 192.168.15.42 (Broadcast) tell 192.168.15.129, length 46
15:45:32.525358 ARP, Request who-has 192.168.15.43 (Broadcast) tell 192.168.15.129, length 46
15:45:32.525745 ARP, Request who-has 192.168.15.44 (Broadcast) tell 192.168.15.129, length 46
15:45:32.526172 ARP, Request who-has 192.168.15.45 (Broadcast) tell 192.168.15.129, length 46
15:45:32.526384 ARP, Request who-has 192.168.15.57 (Broadcast) tell 192.168.15.129, length 46
15:45:32.526408 ARP, Request who-has 192.168.15.58 (Broadcast) tell 192.168.15.129, length 46
15:45:32.526413 ARP, Request who-has 192.168.15.59 (Broadcast) tell 192.168.15.129, length 46
15:45:32.526417 ARP, Request who-has 192.168.15.60 (Broadcast) tell 192.168.15.129, length 46
15:45:32.529352 ARP, Request who-has 192.168.15.48 (Broadcast) tell 192.168.15.129, length 46
15:45:32.529685 ARP, Request who-has 192.168.15.49 (Broadcast) tell 192.168.15.129, length 46
15:45:32.529933 ARP, Request who-has 192.168.15.52 (Broadcast) tell 192.168.15.129, length 46
15:45:32.532395 IP6 fe80::f927:acb3:aacd:2901.59581 > ff02::c.3702: UDP, length 656
15:45:32.543359 IP 192.168.15.1.59580 > 239.255.255.250.3702: UDP, length 656
15:45:32.623474 ARP, Request who-has 192.168.15.65 (Broadcast) tell 192.168.15.129, length 46
15:45:32.623511 ARP, Request who-has 192.168.15.66 (Broadcast) tell 192.168.15.129, length 46
15:45:32.626698 ARP, Request who-has 192.168.15.57 (Broadcast) tell 192.168.15.129, length 46
15:45:32.627186 ARP, Request who-has 192.168.15.58 (Broadcast) tell 192.168.15.129, length 46
15:45:32.627369 ARP, Request who-has 192.168.15.59 (Broadcast) tell 192.168.15.129, length 46
15:45:32.627543 ARP, Request who-has 192.168.15.60 (Broadcast) tell 192.168.15.129, length 46
15:45:32.627759 ARP, Request who-has 192.168.15.69 (Broadcast) tell 192.168.15.129, length 46
15:45:32.627783 ARP, Request who-has 192.168.15.70 (Broadcast) tell 192.168.15.129, length 46
15:45:32.627905 ARP, Request who-has 192.168.15.71 (Broadcast) tell 192.168.15.129, length 46
15:45:32.631535 ARP, Request who-has 192.168.15.74 (Broadcast) tell 192.168.15.129, length 46
15:45:32.631572 ARP, Request who-has 192.168.15.75 (Broadcast) tell 192.168.15.129, length 46
15:45:32.631578 ARP, Request who-has 192.168.15.76 (Broadcast) tell 192.168.15.129, length 46
15:45:32.724628 ARP, Request who-has 192.168.15.65 (Broadcast) tell 192.168.15.129, length 46
15:45:32.724996 ARP, Request who-has 192.168.15.66 (Broadcast) tell 192.168.15.129, length 46
15:45:32.727629 ARP, Request who-has 192.168.15.69 (Broadcast) tell 192.168.15.129, length 46
15:45:32.728106 ARP, Request who-has 192.168.15.81 (Broadcast) tell 192.168.15.129, length 46
15:45:32.728134 ARP, Request who-has 192.168.15.82 (Broadcast) tell 192.168.15.129, length 46
15:45:32.728292 ARP, Request who-has 192.168.15.83 (Broadcast) tell 192.168.15.129, length 46
15:45:32.728302 ARP, Request who-has 192.168.15.84 (Broadcast) tell 192.168.15.129, length 46
15:45:32.731674 ARP, Request who-has 192.168.15.70 (Broadcast) tell 192.168.15.129, length 46
15:45:32.732073 ARP, Request who-has 192.168.15.71 (Broadcast) tell 192.168.15.129, length 46
15:45:32.732327 ARP, Request who-has 192.168.15.74 (Broadcast) tell 192.168.15.129, length 46
15:45:32.734794 ARP, Request who-has 192.168.15.75 (Broadcast) tell 192.168.15.129, length 46
15:45:32.735177 ARP, Request who-has 192.168.15.76 (Broadcast) tell 192.168.15.129, length 46
15:45:32.825934 ARP, Request who-has 192.168.15.91 (Broadcast) tell 192.168.15.129, length 46
15:45:32.825971 ARP, Request who-has 192.168.15.92 (Broadcast) tell 192.168.15.129, length 46
15:45:32.828956 ARP, Request who-has 192.168.15.81 (Broadcast) tell 192.168.15.129, length 46
15:45:32.829389 ARP, Request who-has 192.168.15.82 (Broadcast) tell 192.168.15.129, length 46
15:45:32.829579 ARP, Request who-has 192.168.15.83 (Broadcast) tell 192.168.15.129, length 46
15:45:32.829752 ARP, Request who-has 192.168.15.84 (Broadcast) tell 192.168.15.129, length 46
15:45:32.829939 ARP, Request who-has 192.168.15.95 (Broadcast) tell 192.168.15.129, length 46
15:45:32.832952 ARP, Request who-has 192.168.15.98 (Broadcast) tell 192.168.15.129, length 46
15:45:32.832989 ARP, Request who-has 192.168.15.99 (Broadcast) tell 192.168.15.129, length 46
15:45:32.832994 ARP, Request who-has 192.168.15.100 (Broadcast) tell 192.168.15.129, length 46
15:45:32.835976 ARP, Request who-has 192.168.15.103 (Broadcast) tell 192.168.15.129, length 46
15:45:32.836013 ARP, Request who-has 192.168.15.104 (Broadcast) tell 192.168.15.129, length 46
15:45:32.867089 IP6 fe80::f927:acb3:aacd:2901.59581 > ff02::c.3702: UDP, length 656
15:45:32.900105 IP 192.168.15.1.59580 > 239.255.255.250.3702: UDP, length 656
15:45:32.926229 ARP, Request who-has 192.168.15.91 (Broadcast) tell 192.168.15.129, length 46
15:45:32.926667 ARP, Request who-has 192.168.15.92 (Broadcast) tell 192.168.15.129, length 46
15:45:32.929256 ARP, Request who-has 192.168.15.109 (Broadcast) tell 192.168.15.129, length 46
15:45:32.932285 ARP, Request who-has 192.168.15.95 (Broadcast) tell 192.168.15.129, length 46
15:45:32.932706 ARP, Request who-has 192.168.15.112 (Broadcast) tell 192.168.15.129, length 46
15:45:32.932735 ARP, Request who-has 192.168.15.113 (Broadcast) tell 192.168.15.129, length 46
15:45:32.932739 ARP, Request who-has 192.168.15.114 (Broadcast) tell 192.168.15.129, length 46
15:45:32.935235 ARP, Request who-has 192.168.15.98 (Broadcast) tell 192.168.15.129, length 46
15:45:32.935664 ARP, Request who-has 192.168.15.99 (Broadcast) tell 192.168.15.129, length 46
15:45:32.935887 ARP, Request who-has 192.168.15.100 (Broadcast) tell 192.168.15.129, length 46
15:45:32.938261 ARP, Request who-has 192.168.15.103 (Broadcast) tell 192.168.15.129, length 46
15:45:32.938645 ARP, Request who-has 192.168.15.104 (Broadcast) tell 192.168.15.129, length 46
15:45:33.027023 ARP, Request who-has 192.168.15.121 (Broadcast) tell 192.168.15.129, length 46
15:45:33.027061 ARP, Request who-has 192.168.15.122 (Broadcast) tell 192.168.15.129, length 46
15:45:33.030096 ARP, Request who-has 192.168.15.109 (Broadcast) tell 192.168.15.129, length 46
15:45:33.033089 ARP, Request who-has 192.168.15.112 (Broadcast) tell 192.168.15.129, length 46
15:45:33.033486 ARP, Request who-has 192.168.15.113 (Broadcast) tell 192.168.15.129, length 46
15:45:33.033691 ARP, Request who-has 192.168.15.114 (Broadcast) tell 192.168.15.129, length 46
15:45:33.033867 ARP, Request who-has 192.168.15.127 (Broadcast) tell 192.168.15.129, length 46
15:45:33.036057 ARP, Request who-has 192.168.15.131 (Broadcast) tell 192.168.15.129, length 46
15:45:33.036094 ARP, Request who-has 192.168.15.132 (Broadcast) tell 192.168.15.129, length 46
15:45:33.036100 ARP, Request who-has 192.168.15.133 (Broadcast) tell 192.168.15.129, length 46
15:45:33.039070 ARP, Request who-has 192.168.15.136 (Broadcast) tell 192.168.15.129, length 46
15:45:33.039106 ARP, Request who-has 192.168.15.137 (Broadcast) tell 192.168.15.129, length 46
15:45:33.127463 ARP, Request who-has 192.168.15.121 (Broadcast) tell 192.168.15.129, length 46
15:45:33.127848 ARP, Request who-has 192.168.15.122 (Broadcast) tell 192.168.15.129, length 46
15:45:33.130521 ARP, Request who-has 192.168.15.142 (Broadcast) tell 192.168.15.129, length 46
15:45:33.133480 ARP, Request who-has 192.168.15.145 (Broadcast) tell 192.168.15.129, length 46
15:45:33.133517 ARP, Request who-has 192.168.15.146 (Broadcast) tell 192.168.15.129, length 46
15:45:33.133522 ARP, Request who-has 192.168.15.147 (Broadcast) tell 192.168.15.129, length 46
15:45:33.136500 ARP, Request who-has 192.168.15.127 (Broadcast) tell 192.168.15.129, length 46
15:45:33.136854 ARP, Request who-has 192.168.15.131 (Broadcast) tell 192.168.15.129, length 46
15:45:33.137062 ARP, Request who-has 192.168.15.132 (Broadcast) tell 192.168.15.129, length 46
15:45:33.137238 ARP, Request who-has 192.168.15.133 (Broadcast) tell 192.168.15.129, length 46
15:45:33.139274 ARP, Request who-has 192.168.15.136 (Broadcast) tell 192.168.15.129, length 46
15:45:33.139554 ARP, Request who-has 192.168.15.137 (Broadcast) tell 192.168.15.129, length 46
15:45:33.228196 ARP, Request who-has 192.168.15.2 (Broadcast) tell 192.168.15.129, length 46
15:45:33.228644 ARP, Request who-has 192.168.15.154 (Broadcast) tell 192.168.15.129, length 46
15:45:33.228706 ARP, Reply 192.168.15.2 is-at 00:50:56:e8:23:fc (oui Unknown), length 46
15:45:33.231090 ARP, Request who-has 192.168.15.142 (Broadcast) tell 192.168.15.129, length 46
15:45:33.234178 ARP, Request who-has 192.168.15.145 (Broadcast) tell 192.168.15.129, length 46
15:45:33.234607 ARP, Request who-has 192.168.15.146 (Broadcast) tell 192.168.15.129, length 46
15:45:33.234879 ARP, Request who-has 192.168.15.147 (Broadcast) tell 192.168.15.129, length 46
15:45:33.237236 ARP, Request who-has 192.168.15.161 (Broadcast) tell 192.168.15.129, length 46
15:45:33.237274 ARP, Request who-has 192.168.15.162 (Broadcast) tell 192.168.15.129, length 46
15:45:33.237280 ARP, Request who-has 192.168.15.163 (Broadcast) tell 192.168.15.129, length 46
15:45:33.237451 ARP, Request who-has 192.168.15.164 (Broadcast) tell 192.168.15.129, length 46
15:45:33.240205 ARP, Request who-has 192.168.15.167 (Broadcast) tell 192.168.15.129, length 46
15:45:33.240242 ARP, Request who-has 192.168.15.168 (Broadcast) tell 192.168.15.129, length 46
15:45:33.267960 IP 192.168.15.128 > 8.8.8.8: ICMP echo request, id 13086, seq 7881, length 64
15:45:33.332466 ARP, Request who-has 192.168.15.154 (Broadcast) tell 192.168.15.129, length 46
15:45:33.332898 ARP, Request who-has 192.168.15.171 (Broadcast) tell 192.168.15.129, length 46
15:45:33.332923 ARP, Request who-has 192.168.15.172 (Broadcast) tell 192.168.15.129, length 46
15:45:33.332928 ARP, Request who-has 192.168.15.173 (Broadcast) tell 192.168.15.129, length 46
15:45:33.332932 ARP, Request who-has 192.168.15.174 (Broadcast) tell 192.168.15.129, length 46
15:45:33.332936 ARP, Request who-has 192.168.15.175 (Broadcast) tell 192.168.15.129, length 46
15:45:33.333172 ARP, Request who-has 192.168.15.176 (Broadcast) tell 192.168.15.129, length 46
15:45:33.333182 ARP, Request who-has 192.168.15.177 (Broadcast) tell 192.168.15.129, length 46
15:45:33.333329 ARP, Request who-has 192.168.15.178 (Broadcast) tell 192.168.15.129, length 46
15:45:33.333338 ARP, Request who-has 192.168.15.179 (Broadcast) tell 192.168.15.129, length 46
15:45:33.333844 ARP, Request who-has 192.168.15.180 (Broadcast) tell 192.168.15.129, length 46
15:45:33.333858 ARP, Request who-has 192.168.15.181 (Broadcast) tell 192.168.15.129, length 46
15:45:33.333862 ARP, Request who-has 192.168.15.182 (Broadcast) tell 192.168.15.129, length 46
15:45:33.333865 ARP, Request who-has 192.168.15.183 (Broadcast) tell 192.168.15.129, length 46
15:45:33.333869 ARP, Request who-has 192.168.15.184 (Broadcast) tell 192.168.15.129, length 46
15:45:33.334279 ARP, Request who-has 192.168.15.185 (Broadcast) tell 192.168.15.129, length 46
15:45:33.334293 ARP, Request who-has 192.168.15.186 (Broadcast) tell 192.168.15.129, length 46
15:45:33.334297 ARP, Request who-has 192.168.15.187 (Broadcast) tell 192.168.15.129, length 46
15:45:33.334300 ARP, Request who-has 192.168.15.188 (Broadcast) tell 192.168.15.129, length 46
15:45:33.334782 ARP, Request who-has 192.168.15.189 (Broadcast) tell 192.168.15.129, length 46
15:45:33.334802 ARP, Request who-has 192.168.15.190 (Broadcast) tell 192.168.15.129, length 46
15:45:33.334807 ARP, Request who-has 192.168.15.191 (Broadcast) tell 192.168.15.129, length 46
15:45:33.335215 ARP, Request who-has 192.168.15.192 (Broadcast) tell 192.168.15.129, length 46
15:45:33.335234 ARP, Request who-has 192.168.15.193 (Broadcast) tell 192.168.15.129, length 46
15:45:33.335238 ARP, Request who-has 192.168.15.194 (Broadcast) tell 192.168.15.129, length 46
15:45:33.335242 ARP, Request who-has 192.168.15.195 (Broadcast) tell 192.168.15.129, length 46
15:45:33.335750 ARP, Request who-has 192.168.15.196 (Broadcast) tell 192.168.15.129, length 46
15:45:33.335768 ARP, Request who-has 192.168.15.197 (Broadcast) tell 192.168.15.129, length 46
15:45:33.335773 ARP, Request who-has 192.168.15.198 (Broadcast) tell 192.168.15.129, length 46
15:45:33.335776 ARP, Request who-has 192.168.15.199 (Broadcast) tell 192.168.15.129, length 46
15:45:33.335845 ARP, Request who-has 192.168.15.200 (Broadcast) tell 192.168.15.129, length 46
15:45:33.336269 ARP, Request who-has 192.168.15.201 (Broadcast) tell 192.168.15.129, length 46
15:45:33.336288 ARP, Request who-has 192.168.15.202 (Broadcast) tell 192.168.15.129, length 46
15:45:33.336292 ARP, Request who-has 192.168.15.203 (Broadcast) tell 192.168.15.129, length 46
15:45:33.336296 ARP, Request who-has 192.168.15.204 (Broadcast) tell 192.168.15.129, length 46
15:45:33.336946 ARP, Request who-has 192.168.15.205 (Broadcast) tell 192.168.15.129, length 46
15:45:33.336963 ARP, Request who-has 192.168.15.206 (Broadcast) tell 192.168.15.129, length 46
15:45:33.336967 ARP, Request who-has 192.168.15.207 (Broadcast) tell 192.168.15.129, length 46
15:45:33.336971 ARP, Request who-has 192.168.15.208 (Broadcast) tell 192.168.15.129, length 46
15:45:33.336975 ARP, Request who-has 192.168.15.209 (Broadcast) tell 192.168.15.129, length 46
15:45:33.336978 ARP, Request who-has 192.168.15.210 (Broadcast) tell 192.168.15.129, length 46
15:45:33.337150 ARP, Request who-has 192.168.15.211 (Broadcast) tell 192.168.15.129, length 46
15:45:33.337159 ARP, Request who-has 192.168.15.212 (Broadcast) tell 192.168.15.129, length 46
15:45:33.337305 ARP, Request who-has 192.168.15.213 (Broadcast) tell 192.168.15.129, length 46
15:45:33.337313 ARP, Request who-has 192.168.15.214 (Broadcast) tell 192.168.15.129, length 46
15:45:33.337467 ARP, Request who-has 192.168.15.215 (Broadcast) tell 192.168.15.129, length 46
15:45:33.337587 ARP, Request who-has 192.168.15.216 (Broadcast) tell 192.168.15.129, length 46
15:45:33.337595 ARP, Request who-has 192.168.15.217 (Broadcast) tell 192.168.15.129, length 46
15:45:33.337778 ARP, Request who-has 192.168.15.218 (Broadcast) tell 192.168.15.129, length 46
15:45:33.337787 ARP, Request who-has 192.168.15.219 (Broadcast) tell 192.168.15.129, length 46
15:45:33.341156 ARP, Request who-has 192.168.15.161 (Broadcast) tell 192.168.15.129, length 46
15:45:33.341574 ARP, Request who-has 192.168.15.162 (Broadcast) tell 192.168.15.129, length 46
15:45:33.341923 ARP, Request who-has 192.168.15.163 (Broadcast) tell 192.168.15.129, length 46
15:45:33.342172 ARP, Request who-has 192.168.15.164 (Broadcast) tell 192.168.15.129, length 46
15:45:33.342557 ARP, Request who-has 192.168.15.167 (Broadcast) tell 192.168.15.129, length 46
15:45:33.342889 ARP, Request who-has 192.168.15.168 (Broadcast) tell 192.168.15.129, length 46
15:45:33.343244 ARP, Request who-has 192.168.15.222 (Broadcast) tell 192.168.15.129, length 46
15:45:33.343261 ARP, Request who-has 192.168.15.223 (Broadcast) tell 192.168.15.129, length 46
15:45:33.343266 ARP, Request who-has 192.168.15.224 (Broadcast) tell 192.168.15.129, length 46
15:45:33.343269 ARP, Request who-has 192.168.15.225 (Broadcast) tell 192.168.15.129, length 46
15:45:33.343274 ARP, Request who-has 192.168.15.226 (Broadcast) tell 192.168.15.129, length 46
15:45:33.343278 ARP, Request who-has 192.168.15.227 (Broadcast) tell 192.168.15.129, length 46
15:45:33.343282 ARP, Request who-has 192.168.15.228 (Broadcast) tell 192.168.15.129, length 46
15:45:33.343286 ARP, Request who-has 192.168.15.229 (Broadcast) tell 192.168.15.129, length 46
15:45:33.343289 ARP, Request who-has 192.168.15.230 (Broadcast) tell 192.168.15.129, length 46
15:45:33.343293 ARP, Request who-has 192.168.15.231 (Broadcast) tell 192.168.15.129, length 46
15:45:33.343304 ARP, Request who-has 192.168.15.232 (Broadcast) tell 192.168.15.129, length 46
15:45:33.343309 ARP, Request who-has 192.168.15.233 (Broadcast) tell 192.168.15.129, length 46
15:45:33.343313 ARP, Request who-has 192.168.15.234 (Broadcast) tell 192.168.15.129, length 46
15:45:33.343316 ARP, Request who-has 192.168.15.235 (Broadcast) tell 192.168.15.129, length 46
15:45:33.343320 ARP, Request who-has 192.168.15.236 (Broadcast) tell 192.168.15.129, length 46
15:45:33.343323 ARP, Request who-has 192.168.15.237 (Broadcast) tell 192.168.15.129, length 46
15:45:33.343327 ARP, Request who-has 192.168.15.238 (Broadcast) tell 192.168.15.129, length 46
15:45:33.343330 ARP, Request who-has 192.168.15.239 (Broadcast) tell 192.168.15.129, length 46
15:45:33.343461 ARP, Request who-has 192.168.15.240 (Broadcast) tell 192.168.15.129, length 46
15:45:33.364598 IP 8.8.8.8 > 192.168.15.128: ICMP echo reply, id 13086, seq 7881, length 64
15:45:33.433131 ARP, Request who-has 192.168.15.171 (Broadcast) tell 192.168.15.129, length 46
15:45:33.433484 ARP, Request who-has 192.168.15.172 (Broadcast) tell 192.168.15.129, length 46
15:45:33.433715 ARP, Request who-has 192.168.15.173 (Broadcast) tell 192.168.15.129, length 46
15:45:33.433928 ARP, Request who-has 192.168.15.174 (Broadcast) tell 192.168.15.129, length 46
15:45:33.434103 ARP, Request who-has 192.168.15.243 (Broadcast) tell 192.168.15.129, length 46
15:45:33.437255 ARP, Request who-has 192.168.15.175 (Broadcast) tell 192.168.15.129, length 46
15:45:33.437592 ARP, Request who-has 192.168.15.176 (Broadcast) tell 192.168.15.129, length 46
15:45:33.437796 ARP, Request who-has 192.168.15.177 (Broadcast) tell 192.168.15.129, length 46
15:45:33.437972 ARP, Request who-has 192.168.15.178 (Broadcast) tell 192.168.15.129, length 46
15:45:33.438145 ARP, Request who-has 192.168.15.179 (Broadcast) tell 192.168.15.129, length 46
15:45:33.438327 ARP, Request who-has 192.168.15.180 (Broadcast) tell 192.168.15.129, length 46
15:45:33.438845 ARP, Request who-has 192.168.15.181 (Broadcast) tell 192.168.15.129, length 46
15:45:33.439093 ARP, Request who-has 192.168.15.182 (Broadcast) tell 192.168.15.129, length 46
15:45:33.439267 ARP, Request who-has 192.168.15.183 (Broadcast) tell 192.168.15.129, length 46
15:45:33.439511 ARP, Request who-has 192.168.15.184 (Broadcast) tell 192.168.15.129, length 46
15:45:33.439799 ARP, Request who-has 192.168.15.185 (Broadcast) tell 192.168.15.129, length 46
15:45:33.440049 ARP, Request who-has 192.168.15.186 (Broadcast) tell 192.168.15.129, length 46
15:45:33.440305 ARP, Request who-has 192.168.15.187 (Broadcast) tell 192.168.15.129, length 46
15:45:33.440536 ARP, Request who-has 192.168.15.188 (Broadcast) tell 192.168.15.129, length 46
15:45:33.440798 ARP, Request who-has 192.168.15.189 (Broadcast) tell 192.168.15.129, length 46
15:45:33.441055 ARP, Request who-has 192.168.15.190 (Broadcast) tell 192.168.15.129, length 46
15:45:33.441243 ARP, Request who-has 192.168.15.191 (Broadcast) tell 192.168.15.129, length 46
15:45:33.441449 ARP, Request who-has 192.168.15.192 (Broadcast) tell 192.168.15.129, length 46
15:45:33.441709 ARP, Request who-has 192.168.15.193 (Broadcast) tell 192.168.15.129, length 46
15:45:33.441957 ARP, Request who-has 192.168.15.194 (Broadcast) tell 192.168.15.129, length 46
15:45:33.442176 ARP, Request who-has 192.168.15.195 (Broadcast) tell 192.168.15.129, length 46
15:45:33.442367 ARP, Request who-has 192.168.15.196 (Broadcast) tell 192.168.15.129, length 46
15:45:33.442792 ARP, Request who-has 192.168.15.197 (Broadcast) tell 192.168.15.129, length 46
15:45:33.443002 ARP, Request who-has 192.168.15.198 (Broadcast) tell 192.168.15.129, length 46
15:45:33.443178 ARP, Request who-has 192.168.15.199 (Broadcast) tell 192.168.15.129, length 46
15:45:33.443460 ARP, Request who-has 192.168.15.200 (Broadcast) tell 192.168.15.129, length 46
15:45:33.443676 ARP, Request who-has 192.168.15.201 (Broadcast) tell 192.168.15.129, length 46
15:45:33.443936 ARP, Request who-has 192.168.15.202 (Broadcast) tell 192.168.15.129, length 46
15:45:33.444161 ARP, Request who-has 192.168.15.203 (Broadcast) tell 192.168.15.129, length 46
15:45:33.444412 ARP, Request who-has 192.168.15.204 (Broadcast) tell 192.168.15.129, length 46
15:45:33.444669 ARP, Request who-has 192.168.15.205 (Broadcast) tell 192.168.15.129, length 46
15:45:33.444921 ARP, Request who-has 192.168.15.206 (Broadcast) tell 192.168.15.129, length 46
15:45:33.445125 ARP, Request who-has 192.168.15.207 (Broadcast) tell 192.168.15.129, length 46
15:45:33.445552 ARP, Request who-has 192.168.15.208 (Broadcast) tell 192.168.15.129, length 46
15:45:33.445899 ARP, Request who-has 192.168.15.209 (Broadcast) tell 192.168.15.129, length 46
15:45:33.448297 ARP, Request who-has 192.168.15.210 (Broadcast) tell 192.168.15.129, length 46
15:45:33.448754 ARP, Request who-has 192.168.15.211 (Broadcast) tell 192.168.15.129, length 46
15:45:33.448938 ARP, Request who-has 192.168.15.212 (Broadcast) tell 192.168.15.129, length 46
15:45:33.449113 ARP, Request who-has 192.168.15.213 (Broadcast) tell 192.168.15.129, length 46
15:45:33.449286 ARP, Request who-has 192.168.15.214 (Broadcast) tell 192.168.15.129, length 46
15:45:33.449592 ARP, Request who-has 192.168.15.215 (Broadcast) tell 192.168.15.129, length 46
15:45:33.449870 ARP, Request who-has 192.168.15.216 (Broadcast) tell 192.168.15.129, length 46
15:45:33.450115 ARP, Request who-has 192.168.15.217 (Broadcast) tell 192.168.15.129, length 46
15:45:33.450397 ARP, Request who-has 192.168.15.218 (Broadcast) tell 192.168.15.129, length 46
15:45:33.450577 ARP, Request who-has 192.168.15.219 (Broadcast) tell 192.168.15.129, length 46
15:45:33.450899 ARP, Request who-has 192.168.15.222 (Broadcast) tell 192.168.15.129, length 46
15:45:33.451147 ARP, Request who-has 192.168.15.223 (Broadcast) tell 192.168.15.129, length 46
15:45:33.451354 ARP, Request who-has 192.168.15.224 (Broadcast) tell 192.168.15.129, length 46
15:45:33.451549 ARP, Request who-has 192.168.15.225 (Broadcast) tell 192.168.15.129, length 46
15:45:33.451859 ARP, Request who-has 192.168.15.226 (Broadcast) tell 192.168.15.129, length 46
15:45:33.452144 ARP, Request who-has 192.168.15.227 (Broadcast) tell 192.168.15.129, length 46
15:45:33.452414 ARP, Request who-has 192.168.15.228 (Broadcast) tell 192.168.15.129, length 46
15:45:33.452727 ARP, Request who-has 192.168.15.229 (Broadcast) tell 192.168.15.129, length 46
15:45:33.452965 ARP, Request who-has 192.168.15.230 (Broadcast) tell 192.168.15.129, length 46
15:45:33.453199 ARP, Request who-has 192.168.15.231 (Broadcast) tell 192.168.15.129, length 46
15:45:33.453441 ARP, Request who-has 192.168.15.232 (Broadcast) tell 192.168.15.129, length 46
15:45:33.453943 ARP, Request who-has 192.168.15.233 (Broadcast) tell 192.168.15.129, length 46
15:45:33.454213 ARP, Request who-has 192.168.15.234 (Broadcast) tell 192.168.15.129, length 46
15:45:33.454504 ARP, Request who-has 192.168.15.235 (Broadcast) tell 192.168.15.129, length 46
15:45:33.454813 ARP, Request who-has 192.168.15.236 (Broadcast) tell 192.168.15.129, length 46
15:45:33.455133 ARP, Request who-has 192.168.15.237 (Broadcast) tell 192.168.15.129, length 46
15:45:33.455395 ARP, Request who-has 192.168.15.238 (Broadcast) tell 192.168.15.129, length 46
15:45:33.455664 ARP, Request who-has 192.168.15.239 (Broadcast) tell 192.168.15.129, length 46
15:45:33.455944 ARP, Request who-has 192.168.15.240 (Broadcast) tell 192.168.15.129, length 46
15:45:33.456217 ARP, Request who-has 192.168.15.248 (Broadcast) tell 192.168.15.129, length 46
15:45:33.456244 ARP, Request who-has 192.168.15.249 (Broadcast) tell 192.168.15.129, length 46
15:45:33.456249 ARP, Request who-has 192.168.15.250 (Broadcast) tell 192.168.15.129, length 46
15:45:33.456253 ARP, Request who-has 192.168.15.251 (Broadcast) tell 192.168.15.129, length 46
15:45:33.456257 ARP, Request who-has 192.168.15.252 (Broadcast) tell 192.168.15.129, length 46
15:45:33.456261 ARP, Request who-has 192.168.15.253 (Broadcast) tell 192.168.15.129, length 46
15:45:33.533676 ARP, Request who-has 192.168.15.0 (Broadcast) tell 192.168.15.129, length 46
15:45:33.533712 ARP, Request who-has 192.168.15.11 (Broadcast) tell 192.168.15.129, length 46
15:45:33.533754 ARP, Request who-has 192.168.15.12 (Broadcast) tell 192.168.15.129, length 46
15:45:33.533939 ARP, Request who-has 192.168.15.17 (Broadcast) tell 192.168.15.129, length 46
15:45:33.536108 IP6 fe80::f927:acb3:aacd:2901.59581 > ff02::c.3702: UDP, length 656
15:45:33.536498 ARP, Request who-has 192.168.15.243 (Broadcast) tell 192.168.15.129, length 46
15:45:33.539554 ARP, Request who-has 192.168.15.30 (Broadcast) tell 192.168.15.129, length 46
15:45:33.539581 ARP, Request who-has 192.168.15.31 (Broadcast) tell 192.168.15.129, length 46
15:45:33.539770 ARP, Request who-has 192.168.15.32 (Broadcast) tell 192.168.15.129, length 46
15:45:33.540786 ARP, Request who-has 192.168.15.37 (Broadcast) tell 192.168.15.129, length 46
15:45:33.540805 ARP, Request who-has 192.168.15.38 (Broadcast) tell 192.168.15.129, length 46
15:45:33.540811 ARP, Request who-has 192.168.15.39 (Broadcast) tell 192.168.15.129, length 46
15:45:33.540877 ARP, Request who-has 192.168.15.40 (Broadcast) tell 192.168.15.129, length 46
15:45:33.541053 ARP, Request who-has 192.168.15.46 (Broadcast) tell 192.168.15.129, length 46
15:45:33.541098 ARP, Request who-has 192.168.15.47 (Broadcast) tell 192.168.15.129, length 46
15:45:33.541197 ARP, Request who-has 192.168.15.50 (Broadcast) tell 192.168.15.129, length 46
15:45:33.544297 ARP, Request who-has 192.168.15.54 (Broadcast) tell 192.168.15.129, length 46
15:45:33.544310 ARP, Request who-has 192.168.15.55 (Broadcast) tell 192.168.15.129, length 46
15:45:33.544370 ARP, Request who-has 192.168.15.56 (Broadcast) tell 192.168.15.129, length 46
15:45:33.544374 ARP, Request who-has 192.168.15.61 (Broadcast) tell 192.168.15.129, length 46
15:45:33.544441 ARP, Request who-has 192.168.15.62 (Broadcast) tell 192.168.15.129, length 46
15:45:33.544462 ARP, Request who-has 192.168.15.63 (Broadcast) tell 192.168.15.129, length 46
15:45:33.544518 ARP, Request who-has 192.168.15.64 (Broadcast) tell 192.168.15.129, length 46
15:45:33.544539 ARP, Request who-has 192.168.15.67 (Broadcast) tell 192.168.15.129, length 46
15:45:33.544810 ARP, Request who-has 192.168.15.68 (Broadcast) tell 192.168.15.129, length 46
15:45:33.544817 ARP, Request who-has 192.168.15.72 (Broadcast) tell 192.168.15.129, length 46
15:45:33.544819 ARP, Request who-has 192.168.15.73 (Broadcast) tell 192.168.15.129, length 46
15:45:33.544821 ARP, Request who-has 192.168.15.77 (Broadcast) tell 192.168.15.129, length 46
15:45:33.544860 ARP, Request who-has 192.168.15.78 (Broadcast) tell 192.168.15.129, length 46
15:45:33.545231 ARP, Request who-has 192.168.15.79 (Broadcast) tell 192.168.15.129, length 46
15:45:33.545237 ARP, Request who-has 192.168.15.80 (Broadcast) tell 192.168.15.129, length 46
15:45:33.545239 ARP, Request who-has 192.168.15.85 (Broadcast) tell 192.168.15.129, length 46
15:45:33.545241 ARP, Request who-has 192.168.15.86 (Broadcast) tell 192.168.15.129, length 46
15:45:33.545243 ARP, Request who-has 192.168.15.87 (Broadcast) tell 192.168.15.129, length 46
15:45:33.545271 ARP, Request who-has 192.168.15.88 (Broadcast) tell 192.168.15.129, length 46
15:45:33.548337 ARP, Request who-has 192.168.15.93 (Broadcast) tell 192.168.15.129, length 46
15:45:33.548348 ARP, Request who-has 192.168.15.94 (Broadcast) tell 192.168.15.129, length 46
15:45:33.548350 ARP, Request who-has 192.168.15.96 (Broadcast) tell 192.168.15.129, length 46
15:45:33.548351 ARP, Request who-has 192.168.15.97 (Broadcast) tell 192.168.15.129, length 46
15:45:33.548440 ARP, Request who-has 192.168.15.101 (Broadcast) tell 192.168.15.129, length 46
15:45:33.548444 ARP, Request who-has 192.168.15.102 (Broadcast) tell 192.168.15.129, length 46
15:45:33.548509 ARP, Request who-has 192.168.15.105 (Broadcast) tell 192.168.15.129, length 46
15:45:33.548513 ARP, Request who-has 192.168.15.106 (Broadcast) tell 192.168.15.129, length 46
15:45:33.551376 ARP, Request who-has 192.168.15.110 (Broadcast) tell 192.168.15.129, length 46
15:45:33.551387 ARP, Request who-has 192.168.15.111 (Broadcast) tell 192.168.15.129, length 46
15:45:33.551408 ARP, Request who-has 192.168.15.115 (Broadcast) tell 192.168.15.129, length 46
15:45:33.551410 ARP, Request who-has 192.168.15.116 (Broadcast) tell 192.168.15.129, length 46
15:45:33.551499 ARP, Request who-has 192.168.15.117 (Broadcast) tell 192.168.15.129, length 46
15:45:33.551503 ARP, Request who-has 192.168.15.118 (Broadcast) tell 192.168.15.129, length 46
15:45:33.551697 ARP, Request who-has 192.168.15.119 (Broadcast) tell 192.168.15.129, length 46
15:45:33.551704 ARP, Request who-has 192.168.15.120 (Broadcast) tell 192.168.15.129, length 46
15:45:33.551706 ARP, Request who-has 192.168.15.123 (Broadcast) tell 192.168.15.129, length 46
15:45:33.551865 ARP, Request who-has 192.168.15.124 (Broadcast) tell 192.168.15.129, length 46
15:45:33.551869 ARP, Request who-has 192.168.15.125 (Broadcast) tell 192.168.15.129, length 46
15:45:33.554404 ARP, Request who-has 192.168.15.130 (Broadcast) tell 192.168.15.129, length 46
15:45:33.554414 ARP, Request who-has 192.168.15.134 (Broadcast) tell 192.168.15.129, length 46
15:45:33.554416 ARP, Request who-has 192.168.15.135 (Broadcast) tell 192.168.15.129, length 46
15:45:33.554435 ARP, Request who-has 192.168.15.138 (Broadcast) tell 192.168.15.129, length 46
15:45:33.554534 ARP, Request who-has 192.168.15.139 (Broadcast) tell 192.168.15.129, length 46
15:45:33.554539 ARP, Request who-has 192.168.15.140 (Broadcast) tell 192.168.15.129, length 46
15:45:33.554687 ARP, Request who-has 192.168.15.141 (Broadcast) tell 192.168.15.129, length 46
15:45:33.554691 ARP, Request who-has 192.168.15.143 (Broadcast) tell 192.168.15.129, length 46
15:45:33.554693 ARP, Request who-has 192.168.15.144 (Broadcast) tell 192.168.15.129, length 46
15:45:33.554865 ARP, Request who-has 192.168.15.148 (Broadcast) tell 192.168.15.129, length 46
15:45:33.554869 ARP, Request who-has 192.168.15.149 (Broadcast) tell 192.168.15.129, length 46
15:45:33.554871 ARP, Request who-has 192.168.15.150 (Broadcast) tell 192.168.15.129, length 46
15:45:33.555015 ARP, Request who-has 192.168.15.151 (Broadcast) tell 192.168.15.129, length 46
15:45:33.555019 ARP, Request who-has 192.168.15.152 (Broadcast) tell 192.168.15.129, length 46
15:45:33.555184 ARP, Request who-has 192.168.15.153 (Broadcast) tell 192.168.15.129, length 46
15:45:33.555188 ARP, Request who-has 192.168.15.155 (Broadcast) tell 192.168.15.129, length 46
15:45:33.555410 ARP, Reply 192.168.15.130 is-at 00:0c:29:66:2d:38 (oui Unknown), length 46
15:45:33.558329 ARP, Request who-has 192.168.15.248 (Broadcast) tell 192.168.15.129, length 46
15:45:33.558457 ARP, Request who-has 192.168.15.249 (Broadcast) tell 192.168.15.129, length 46
15:45:33.558539 ARP, Request who-has 192.168.15.250 (Broadcast) tell 192.168.15.129, length 46
15:45:33.558618 ARP, Request who-has 192.168.15.251 (Broadcast) tell 192.168.15.129, length 46
15:45:33.558697 ARP, Request who-has 192.168.15.252 (Broadcast) tell 192.168.15.129, length 46
15:45:33.558833 ARP, Request who-has 192.168.15.253 (Broadcast) tell 192.168.15.129, length 46
15:45:33.612699 IP 192.168.15.1.59580 > 239.255.255.250.3702: UDP, length 656
15:45:33.633785 ARP, Request who-has 192.168.15.0 (Broadcast) tell 192.168.15.129, length 46
15:45:33.636598 ARP, Request who-has 192.168.15.11 (Broadcast) tell 192.168.15.129, length 46
15:45:33.636837 ARP, Request who-has 192.168.15.12 (Broadcast) tell 192.168.15.129, length 46
15:45:33.636984 ARP, Request who-has 192.168.15.17 (Broadcast) tell 192.168.15.129, length 46
15:45:33.637055 ARP, Request who-has 192.168.15.166 (Broadcast) tell 192.168.15.129, length 46
15:45:33.639596 ARP, Request who-has 192.168.15.30 (Broadcast) tell 192.168.15.129, length 46
15:45:33.639820 ARP, Request who-has 192.168.15.31 (Broadcast) tell 192.168.15.129, length 46
15:45:33.642949 ARP, Request who-has 192.168.15.32 (Broadcast) tell 192.168.15.129, length 46
15:45:33.643162 ARP, Request who-has 192.168.15.37 (Broadcast) tell 192.168.15.129, length 46
15:45:33.643256 ARP, Request who-has 192.168.15.38 (Broadcast) tell 192.168.15.129, length 46
15:45:33.643339 ARP, Request who-has 192.168.15.39 (Broadcast) tell 192.168.15.129, length 46
15:45:33.643471 ARP, Request who-has 192.168.15.40 (Broadcast) tell 192.168.15.129, length 46
15:45:33.643596 ARP, Request who-has 192.168.15.46 (Broadcast) tell 192.168.15.129, length 46
15:45:33.643689 ARP, Request who-has 192.168.15.47 (Broadcast) tell 192.168.15.129, length 46
15:45:33.643791 ARP, Request who-has 192.168.15.50 (Broadcast) tell 192.168.15.129, length 46
15:45:33.645927 ARP, Request who-has 192.168.15.54 (Broadcast) tell 192.168.15.129, length 46
15:45:33.646322 ARP, Request who-has 192.168.15.55 (Broadcast) tell 192.168.15.129, length 46
